{"patient_id": "PID000000", "study_date": "2023-08-19", "timepoint": 0, "recist": {"baseline_sld_mm": 59, "current_sld_mm": null, "nadir_sld_mm": null, "overall_response": "Baseline (no category)"}, "lesions": [{"lesion_id": "primary:colon", "kind": "primary", "organ": "colon", "location": "transverse colon", "rule": "longest", "baseline_mm": 18, "follow_mm": null, "size_mm_current": 18, "margin": "irregular", "enhancement": "hyperenhancing", "suspicious": true, "target": true}, {"lesion_id": "ln:right hilar", "kind": "ln", "organ": "lymph", "station": "right hilar", "rule": "short_axis", "baseline_mm": 26, "follow_mm": null, "size_mm_current": 26, "necrosis": false, "suspicious": true, "target": true}, {"lesion_id": "ln:celiac", "kind": "ln", "organ": "lymph", "station": "celiac", "rule": "short_axis", "baseline_mm": 15, "follow_mm": null, "size_mm_current": 15, "necrosis": false, "suspicious": true, "target": true}, {"lesion_id": "ln:internal iliac", "kind": "ln", "organ": "lymph", "station": "internal iliac", "rule": "short_axis", "baseline_mm": null, "follow_mm": null, "size_mm_current": 30, "necrosis": false, "suspicious": true, "target": false}], "complexity_profile": {"level": 2, "level_name": "C2", "artifact": {"key": "motion_mild", "impact": 1, "report_phrase": "Respiratory motion artifact partially limits assessment.", "severity_rank": 2}}, "staging_relevance": -1.0, "incidentals": [{"organ": "gi.small_bowel", "text": "nonspecific fluid levels"}], "negatives": [{"organ": "spleen", "text": "spleen normal size"}, {"organ": "liver", "text": "liver is normal"}, {"organ": "pleura", "text": "no pleural nodularity"}, {"organ": "aorta_great_vessels", "text": "aorta normal caliber"}, {"organ": "bones", "text": "no destructive osseous lesion"}], "post_treatment": [], "report_text": "FINDINGS:\nRespiratory motion artifact partially limits assessment.\nLungs: Clear lungs without focal mass. No suspicious nodules identified.\nMediastinum: Enlarged right hilar lymph node, short axis 26 mm. Cardiomediastinal contours within normal limits.\nPleura/Pleural spaces: No pleural effusion or pleural thickening. no pleural nodularity.\nGreat vessels/Aorta: No thoracic aortic aneurysm or dissection. aorta normal caliber.\nLiver: No focal hepatic lesions. Normal attenuation. liver is normal.\nSpleen: Normal in size and attenuation. No focal splenic lesion. spleen normal size.\nPancreas: Normal pancreatic contour and enhancement. No focal mass.\nAdrenal glands: Adrenal glands are normal without nodules.\nKidneys: No hydronephrosis. No enhancing renal mass.\nGI tract/Bowel: 18 mm irregular mass involving the transverse colon with focal wall thickening (hyperenhancing). No obstructive process. No focal bowel wall mass identified. nonspecific fluid levels.\nMesentery/Omentum: No ascites. No omental caking.\nMesenteric vessels (SMA/SMV): SMA/SMV are patent without thrombosis.\nUrinary bladder: Unremarkable.\nReproductive organs: No adnexal mass. Uterus/prostate within expected size for age.\nLymph nodes: Enlarged celiac lymph node, short axis 1.5 cm. Enlarged internal iliac lymph node, short axis 3.0 cm. No pathologically enlarged lymph nodes by size criteria.\nBones/Osseous structures: No aggressive osseous lesion. No acute fracture. no destructive osseous lesion.\n\nIMPRESSION:\n- Colon primary malignancy at transverse colon measuring approximately 18 mm.\n- Findings concerning for nodal involvement.\n- No definite distant metastases identified.\n- RECIST 1.1 Summary:\n- Target lesions (n=3; ≤2 per organ rule applied).\n  • T1: Primary — 18 mm (longest diameter) at baseline.\n  • T2: Lymph node — 26 mm (short axis) at baseline.\n  • T3: Lymph node — 15 mm (short axis) at baseline.\n- SLD baseline: 59 mm.\n- New lesions: absent (unequivocal).\n- - RECIST 1.1 overall response category: Baseline (no category).\n"}
{"patient_id": "PID000000", "study_date": "2023-10-08", "timepoint": 1, "recist": {"baseline_sld_mm": 59, "current_sld_mm": 34, "nadir_sld_mm": 34, "overall_response": "PR"}, "lesions": [{"lesion_id": "primary:colon", "kind": "primary", "organ": "colon", "location": "transverse colon", "rule": "longest", "baseline_mm": 18, "follow_mm": 10, "size_mm_current": 10, "margin": "irregular", "enhancement": "hyperenhancing", "suspicious": true, "target": true}, {"lesion_id": "ln:right hilar", "kind": "ln", "organ": "lymph", "station": "right hilar", "rule": "short_axis", "baseline_mm": 26, "follow_mm": 15, "size_mm_current": 15, "necrosis": false, "suspicious": true, "target": true}, {"lesion_id": "ln:celiac", "kind": "ln", "organ": "lymph", "station": "celiac", "rule": "short_axis", "baseline_mm": 15, "follow_mm": 9, "size_mm_current": 9, "necrosis": false, "suspicious": false, "target": true}, {"lesion_id": "ln:internal iliac", "kind": "ln", "organ": "lymph", "station": "internal iliac", "rule": "short_axis", "baseline_mm": null, "follow_mm": null, "size_mm_current": 30, "necrosis": false, "suspicious": true, "target": false}], "complexity_profile": {"level": 2, "level_name": "C2", "artifact": null}, "staging_relevance": 6.0, "incidentals": [{"organ": "kidneys", "text": "Bosniak I cyst"}], "negatives": [{"organ": "aorta_great_vessels", "text": "aorta normal caliber"}, {"organ": "gi", "text": "no colonic mass"}, {"organ": "adrenals", "text": "adrenal glands normal"}, {"organ": "pancreas", "text": "pancreas is normal"}, {"organ": "mesentery_peritoneum", "text": "no peritoneal nodularity"}], "post_treatment": [], "report_text": "FINDINGS:\nComparison: 2023-08-19.\nPulmonary parenchyma: No focal consolidation or suspicious pulmonary nodules. No pneumothorax.\nMediastinum: Enlarged right hilar lymph node, short axis 15 mm. Cardiomediastinal contours within normal limits.\nPleura/Pleural spaces: No pleural effusion or pleural thickening.\nGreat vessels/Aorta: No thoracic aortic aneurysm or dissection. aorta normal caliber.\nLiver: No focal hepatic lesions. Normal attenuation.\nSpleen: Normal in size and attenuation. No focal splenic lesion.\nPancreas: Normal pancreatic contour and enhancement. No focal mass. pancreas is normal.\nAdrenal glands: Adrenal glands are normal without nodules. adrenal glands normal.\nKidneys: No hydronephrosis. No enhancing renal mass. Bosniak I cyst.\nGI tract/Bowel: 10 mm irregular mass involving the transverse colon with focal wall thickening (hyperenhancing). No obstructive process. No focal bowel wall mass identified. no colonic mass.\nMesentery/Omentum: No ascites. No omental caking. no peritoneal nodularity.\nMesenteric vessels (SMA/SMV): SMA/SMV are patent without thrombosis.\nUrinary bladder: Unremarkable.\nReproductive organs: No adnexal mass. Uterus/prostate within expected size for age.\nLymph nodes: Enlarged celiac lymph node, short axis 9 mm. Enlarged internal iliac lymph node, short axis 30 mm. No pathologically enlarged lymph nodes by size criteria.\nBones/Osseous structures: No aggressive osseous lesion. No acute fracture.\n\nIMPRESSION:\n- Colon primary malignancy at transverse colon measuring approximately 10 mm.\n- Findings concerning for nodal involvement.\n- No definite distant metastases identified.\n- RECIST 1.1 Summary:\n- Target lesions (n=3; ≤2 per organ rule applied).\n  • T1: Primary — 18→10 mm (longest diameter).\n  • T2: Lymph node — 26→15 mm (short axis).\n  • T3: Lymph node — 15→9 mm (short axis).\n- SLD baseline: 59 mm.\n- SLD current: 34 mm (-42.4% change).\n- New lesions: absent (unequivocal).\n- - RECIST 1.1 overall response category: PR.\n"}
{"patient_id": "PID000000", "study_date": "2023-12-14", "timepoint": 2, "recist": {"baseline_sld_mm": 59, "current_sld_mm": 36, "nadir_sld_mm": 34, "overall_response": "PR"}, "lesions": [{"lesion_id": "primary:colon", "kind": "primary", "organ": "colon", "location": "transverse colon", "rule": "longest", "baseline_mm": 18, "follow_mm": 11, "size_mm_current": 11, "margin": "irregular", "enhancement": "hyperenhancing", "suspicious": true, "target": true}, {"lesion_id": "ln:right hilar", "kind": "ln", "organ": "lymph", "station": "right hilar", "rule": "short_axis", "baseline_mm": 26, "follow_mm": 16, "size_mm_current": 16, "necrosis": false, "suspicious": true, "target": true}, {"lesion_id": "ln:celiac", "kind": "ln", "organ": "lymph", "station": "celiac", "rule": "short_axis", "baseline_mm": 15, "follow_mm": 9, "size_mm_current": 9, "necrosis": false, "suspicious": false, "target": true}, {"lesion_id": "ln:internal iliac", "kind": "ln", "organ": "lymph", "station": "internal iliac", "rule": "short_axis", "baseline_mm": null, "follow_mm": null, "size_mm_current": 30, "necrosis": false, "suspicious": true, "target": false}], "complexity_profile": {"level": 2, "level_name": "C2", "artifact": {"key": "beam_hardening", "impact": 2, "report_phrase": "Beam-hardening streak artifact from dense structures limits evaluation.", "severity_rank": 3}}, "staging_relevance": 4.0, "incidentals": [{"organ": "lung", "text": "dependent atelectasis"}], "negatives": [{"organ": "mesentery_peritoneum", "text": "no ascites"}, {"organ": "adrenals", "text": "no adrenal nodule"}, {"organ": "mediastinum", "text": "no mediastinal mass"}, {"organ": "kidneys", "text": "no renal mass"}, {"organ": "pleura", "text": "no pleural nodularity"}], "post_treatment": [], "report_text": "FINDINGS:\nBeam-hardening streak artifact from dense structures limits evaluation.\nComparison: 2023-10-08.\nLungs: No focal consolidation or suspicious pulmonary nodules. No pneumothorax. dependent atelectasis.\nMediastinum: Enlarged right hilar lymph node, short axis 16 mm. Cardiomediastinal contours within normal limits. no mediastinal mass.\nPleura/Pleural spaces: No pleural effusion or pleural thickening. no pleural nodularity.\nGreat vessels/Aorta: No thoracic aortic aneurysm or dissection.\nLiver: No focal hepatic lesions. Normal attenuation.\nSpleen: Normal in size and attenuation. No focal splenic lesion.\nPancreas: Normal pancreatic contour and enhancement. No focal mass.\nAdrenal glands: Adrenal glands are normal without nodules. no adrenal nodule.\nKidneys: No hydronephrosis. No enhancing renal mass. no renal mass.\nGI tract/Bowel: 1.1 cm irregular mass involving the transverse colon with focal wall thickening (hyperenhancing). No obstructive process. No focal bowel wall mass identified.\nMesentery/Omentum: No ascites. No omental caking.\nMesenteric vessels (SMA/SMV): SMA/SMV are patent without thrombosis.\nUrinary bladder: Unremarkable.\nReproductive organs: No adnexal mass. Uterus/prostate within expected size for age.\nLymph nodes: Enlarged celiac lymph node, short axis 9 mm. Enlarged internal iliac lymph node, short axis 3.0 cm. No pathologically enlarged lymph nodes by size criteria.\nBones/Osseous structures: No aggressive osseous lesion. No acute fracture.\n\nIMPRESSION:\n- Colon primary malignancy at transverse colon measuring approximately 11 mm.\n- Findings concerning for nodal involvement.\n- No definite distant metastases identified.\n- RECIST 1.1 Summary:\n- Target lesions (n=3; ≤2 per organ rule applied).\n  • T1: Primary — 18→11 mm (longest diameter).\n  • T2: Lymph node — 26→16 mm (short axis).\n  • T3: Lymph node — 15→9 mm (short axis).\n- SLD baseline: 59 mm.\n- SLD current: 36 mm (-39.0% change).\n- New lesions: absent (unequivocal).\n- - RECIST 1.1 overall response category: PR.\n"}
{"patient_id": "PID000000", "study_date": "2024-02-21", "timepoint": 3, "recist": {"baseline_sld_mm": 59, "current_sld_mm": 52, "nadir_sld_mm": 34, "overall_response": "PD"}, "lesions": [{"lesion_id": "primary:colon", "kind": "primary", "organ": "colon", "location": "transverse colon", "rule": "longest", "baseline_mm": 18, "follow_mm": 16, "size_mm_current": 16, "margin": "irregular", "enhancement": "hyperenhancing", "suspicious": true, "target": true}, {"lesion_id": "ln:right hilar", "kind": "ln", "organ": "lymph", "station": "right hilar", "rule": "short_axis", "baseline_mm": 26, "follow_mm": 23, "size_mm_current": 23, "necrosis": false, "suspicious": true, "target": true}, {"lesion_id": "ln:celiac", "kind": "ln", "organ": "lymph", "station": "celiac", "rule": "short_axis", "baseline_mm": 15, "follow_mm": 13, "size_mm_current": 13, "necrosis": false, "suspicious": true, "target": true}, {"lesion_id": "ln:internal iliac", "kind": "ln", "organ": "lymph", "station": "internal iliac", "rule": "short_axis", "baseline_mm": null, "follow_mm": null, "size_mm_current": 30, "necrosis": false, "suspicious": true, "target": false}], "complexity_profile": {"level": 2, "level_name": "C2", "artifact": {"key": "motion_mild", "impact": 1, "report_phrase": "Respiratory motion artifact partially limits assessment.", "severity_rank": 2}}, "staging_relevance": 17.0, "incidentals": [{"organ": "spleen", "text": "accessory spleen"}], "negatives": [{"organ": "aorta_great_vessels", "text": "no aneurysm or dissection"}, {"organ": "bones", "text": "no destructive osseous lesion"}, {"organ": "kidneys", "text": "no renal mass"}, {"organ": "adrenals", "text": "no adrenal nodule"}, {"organ": "pleura", "text": "no pleural effusion"}], "post_treatment": ["Radiation change: wall thickening and submucosal edema in irradiated bowel"], "report_text": "FINDINGS:\nRespiratory motion artifact partially limits assessment.\nComparison: 2023-12-14.\nLungs: Clear lungs without focal mass. No suspicious nodules identified. Post-treatment change: wall thickening and submucosal edema in irradiated bowel.\nMediastinum: Enlarged right hilar lymph node, short axis 2.3 cm. Cardiomediastinal contours within normal limits.\nPleura/Pleural spaces: No pleural effusion or pleural thickening.\nGreat vessels/Aorta: No thoracic aortic aneurysm or dissection. no aneurysm or dissection.\nLiver: No focal hepatic lesions. Normal attenuation.\nSpleen: Normal in size and attenuation. No focal splenic lesion. accessory spleen.\nPancreas: Normal pancreatic contour and enhancement. No focal mass.\nAdrenal glands: Adrenal glands are normal without nodules. no adrenal nodule.\nKidneys: No hydronephrosis. No enhancing renal mass. no renal mass.\nGI tract/Bowel: 16 mm irregular mass involving the transverse colon with focal wall thickening (hyperenhancing). No obstructive process. No focal bowel wall mass identified.\nMesentery/Omentum: No ascites. No omental caking.\nMesenteric vessels (SMA/SMV): SMA/SMV are patent without thrombosis.\nUrinary bladder: Unremarkable.\nReproductive organs: No adnexal mass. Uterus/prostate within expected size for age.\nLymph nodes: Enlarged celiac lymph node, short axis 13 mm. Enlarged internal iliac lymph node, short axis 30 mm. No pathologically enlarged lymph nodes by size criteria.\nBones/Osseous structures: No aggressive osseous lesion. No acute fracture. no destructive osseous lesion.\n\nIMPRESSION:\n- Colon primary neoplasm (indeterminate) at transverse colon measuring approximately 16 mm.\n- Findings concerning for nodal involvement.\n- No definite distant metastases identified.\n- RECIST 1.1 Summary:\n- Target lesions (n=3; ≤2 per organ rule applied).\n  • T1: Primary — 18→16 mm (longest diameter).\n  • T2: Lymph node — 26→23 mm (short axis).\n  • T3: Lymph node — 15→13 mm (short axis).\n- SLD baseline: 59 mm.\n- SLD current: 52 mm (-11.9% change).\n- New lesions: absent (unequivocal).\n- - RECIST 1.1 overall response category: PD.\n\nComment: Some features are unlikely; short-interval follow-up or problem-solving imaging may be considered.\n"}
{"patient_id": "PID000001", "study_date": "2023-06-03", "timepoint": 0, "recist": {"baseline_sld_mm": 96, "current_sld_mm": null, "nadir_sld_mm": null, "overall_response": "Baseline (no category)"}, "lesions": [{"lesion_id": "primary:kidney", "kind": "primary", "organ": "kidney", "location": "left kidney, interpolar", "rule": "longest", "baseline_mm": 48, "follow_mm": null, "size_mm_current": 48, "margin": "spiculated", "enhancement": "hyperenhancing", "suspicious": true, "target": true}, {"lesion_id": "ln:mesenteric", "kind": "ln", "organ": "lymph", "station": "mesenteric", "rule": "short_axis", "baseline_mm": 27, "follow_mm": null, "size_mm_current": 27, "necrosis": false, "suspicious": true, "target": true}, {"lesion_id": "met:peritoneum", "kind": "met", "organ": "peritoneum", "rule": "longest", "baseline_mm": 21, "follow_mm": null, "size_mm_current": 21, "suspicious": true, "target": true}], "complexity_profile": {"level": 2, "level_name": "C2", "artifact": null}, "staging_relevance": 0.0, "incidentals": [{"organ": "adrenals", "text": "lipid-rich adenoma"}, {"organ": "lung", "text": "<6 mm well-circumscribed nodule"}, {"organ": "adrenals", "text": "lipid-rich adenoma"}], "negatives": [{"organ": "gi", "text": "stomach is normal"}, {"organ": "mediastinum", "text": "no mediastinal mass"}, {"organ": "pleura", "text": "no pleural nodularity"}, {"organ": "liver", "text": "no hepatic mass"}, {"organ": "reproductive", "text": "ovaries are normal / no adnexal abnormality"}], "post_treatment": [], "report_text": "FINDINGS:\nLungs: No focal consolidation or suspicious pulmonary nodules. No pneumothorax. <6 mm well-circumscribed nodule.\nMediastinum: Cardiomediastinal contours within normal limits. no mediastinal mass.\nPleura/Pleural spaces: No pleural effusion or pleural thickening. no pleural nodularity.\nGreat vessels/Aorta: No thoracic aortic aneurysm or dissection.\nLiver: No focal hepatic lesions. Normal attenuation. no hepatic mass.\nSpleen: Normal in size and attenuation. No focal splenic lesion.\nPancreas: Normal pancreatic contour and enhancement. No focal mass.\nAdrenal glands: Adrenal glands are normal without nodules. lipid-rich adenoma.\nKidneys: 48 mm spiculated enhancing renal mass in the left kidney, interpolar. No hydronephrosis. No enhancing renal mass.\nGI tract/Bowel: No obstructive process. No focal bowel wall mass identified. stomach is normal.\nMesentery/Omentum: 21 mm lesion in the peritoneum, suspicious for metastasis. No ascites. No omental caking.\nMesenteric vessels (SMA/SMV): SMA/SMV are patent without thrombosis.\nUrinary bladder: Unremarkable.\nReproductive organs: No adnexal mass. Uterus/prostate within expected size for age. ovaries are normal / no adnexal abnormality.\nLymph nodes: Enlarged mesenteric lymph node, short axis 2.7 cm. No pathologically enlarged lymph nodes by size criteria.\nBones/Osseous structures: No aggressive osseous lesion. No acute fracture.\n\nIMPRESSION:\n- Kidney primary malignancy at left kidney, interpolar measuring approximately 48 mm.\n- Findings concerning for nodal involvement.\n- Findings compatible with distant metastases involving: peritoneum.\n- RECIST 1.1 Summary:\n- Target lesions (n=3; ≤2 per organ rule applied).\n  • T1: Primary — 48 mm (longest diameter) at baseline.\n  • T2: Metastasis — 21 mm (longest diameter) at baseline.\n  • T3: Lymph node — 27 mm (short axis) at baseline.\n- SLD baseline: 96 mm.\n- New lesions: absent (unequivocal).\n- - RECIST 1.1 overall response category: Baseline (no category).\n"}
{"patient_id": "PID000001", "study_date": "2023-08-12", "timepoint": 1, "recist": {"baseline_sld_mm": 96, "current_sld_mm": 61, "nadir_sld_mm": 61, "overall_response": "PR"}, "lesions": [{"lesion_id": "primary:kidney", "kind": "primary", "organ": "kidney", "location": "left kidney, interpolar", "rule": "longest", "baseline_mm": 48, "follow_mm": 31, "size_mm_current": 31, "margin": "spiculated", "enhancement": "hyperenhancing", "suspicious": true, "target": true}, {"lesion_id": "ln:mesenteric", "kind": "ln", "organ": "lymph", "station": "mesenteric", "rule": "short_axis", "baseline_mm": 27, "follow_mm": 17, "size_mm_current": 17, "necrosis": false, "suspicious": true, "target": true}, {"lesion_id": "met:peritoneum", "kind": "met", "organ": "peritoneum", "rule": "longest", "baseline_mm": 21, "follow_mm": 13, "size_mm_current": 13, "suspicious": true, "target": true}], "complexity_profile": {"level": 2, "level_name": "C2", "artifact": {"key": "beam_hardening", "impact": 2, "report_phrase": "Beam-hardening streak artifact from dense structures limits evaluation.", "severity_rank": 3}}, "staging_relevance": 4.0, "incidentals": [{"organ": "aorta_great_vessels", "text": "tortuosity"}], "negatives": [{"organ": "mesentery_peritoneum", "text": "no peritoneal nodularity"}, {"organ": "spleen", "text": "spleen normal size"}, {"organ": "pancreas", "text": "pancreas is normal"}, {"organ": "gi", "text": "no colonic mass"}, {"organ": "aorta_great_vessels", "text": "aorta normal caliber"}], "post_treatment": [], "report_text": "FINDINGS:\nBeam-hardening streak artifact from dense structures limits evaluation.\nComparison: 2023-06-03.\nPulmonary parenchyma: No focal consolidation or suspicious pulmonary nodules. No pneumothorax.\nMediastinum: Cardiomediastinal contours within normal limits.\nPleura/Pleural spaces: No pleural effusion or pleural thickening.\nGreat vessels/Aorta: No thoracic aortic aneurysm or dissection. tortuosity. aorta normal caliber.\nLiver: No focal hepatic lesions. Normal attenuation.\nSpleen: Normal in size and attenuation. No focal splenic lesion. spleen normal size.\nPancreas: Normal pancreatic contour and enhancement. No focal mass. pancreas is normal.\nAdrenal glands: Adrenal glands are normal without nodules.\nKidneys: 31 mm spiculated enhancing renal mass in the left kidney, interpolar. No hydronephrosis. No enhancing renal mass.\nGI tract/Bowel: No obstructive process. No focal bowel wall mass identified. no colonic mass.\nMesentery/Omentum: 13 mm lesion in the peritoneum, suspicious for metastasis. No ascites. No omental caking. no peritoneal nodularity.\nMesenteric vessels (SMA/SMV): SMA/SMV are patent without thrombosis.\nUrinary bladder: Unremarkable.\nReproductive organs: No adnexal mass. Uterus/prostate within expected size for age.\nLymph nodes: Enlarged mesenteric lymph node, short axis 17 mm. No pathologically enlarged lymph nodes by size criteria.\nBones/Osseous structures: No aggressive osseous lesion. No acute fracture.\n\nIMPRESSION:\n- Kidney primary malignancy at left kidney, interpolar measuring approximately 31 mm.\n- Findings concerning for nodal involvement.\n- Findings compatible with distant metastases involving: peritoneum.\n- RECIST 1.1 Summary:\n- Target lesions (n=3; ≤2 per organ rule applied).\n  • T1: Primary — 48→31 mm (longest diameter).\n  • T2: Metastasis — 21→13 mm (longest diameter).\n  • T3: Lymph node — 27→17 mm (short axis).\n- SLD baseline: 96 mm.\n- SLD current: 61 mm (-36.5% change).\n- New lesions: absent (unequivocal).\n- - RECIST 1.1 overall response category: PR.\n"}
{"patient_id": "PID000001", "study_date": "2023-09-30", "timepoint": 2, "recist": {"baseline_sld_mm": 96, "current_sld_mm": 104, "nadir_sld_mm": 61, "overall_response": "PD"}, "lesions": [{"lesion_id": "primary:kidney", "kind": "primary", "organ": "kidney", "location": "left kidney, interpolar", "rule": "longest", "baseline_mm": 48, "follow_mm": 51, "size_mm_current": 51, "margin": "spiculated", "enhancement": "hyperenhancing", "suspicious": true, "target": true}, {"lesion_id": "ln:mesenteric", "kind": "ln", "organ": "lymph", "station": "mesenteric", "rule": "short_axis", "baseline_mm": 27, "follow_mm": 30, "size_mm_current": 30, "necrosis": false, "suspicious": true, "target": true}, {"lesion_id": "met:peritoneum", "kind": "met", "organ": "peritoneum", "rule": "longest", "baseline_mm": 21, "follow_mm": 23, "size_mm_current": 23, "suspicious": true, "target": true}], "complexity_profile": {"level": 2, "level_name": "C2", "artifact": null}, "staging_relevance": 19.0, "incidentals": [{"organ": "pancreas", "text": "serous cystadenoma"}, {"organ": "pleura", "text": "trace effusion"}, {"organ": "liver", "text": "simple cyst"}], "negatives": [{"organ": "pancreas", "text": "no pancreatic mass"}, {"organ": "gi", "text": "no colonic mass"}, {"organ": "bones", "text": "no destructive osseous lesion"}, {"organ": "reproductive", "text": "prostate is normal / no prostatic mass"}, {"organ": "pleura", "text": "no pleural nodularity"}], "post_treatment": [], "report_text": "FINDINGS:\nComparison: 2023-08-12.\nPulmonary parenchyma: No focal consolidation or suspicious pulmonary nodules. No pneumothorax.\nMediastinum: Cardiomediastinal contours within normal limits.\nPleura/Pleural spaces: No pleural effusion or pleural thickening. trace effusion. no pleural nodularity.\nGreat vessels/Aorta: No thoracic aortic aneurysm or dissection.\nLiver: No focal hepatic lesions. Normal attenuation. simple cyst.\nSpleen: Normal in size and attenuation. No focal splenic lesion.\nPancreas: Normal pancreatic contour and enhancement. No focal mass. serous cystadenoma. no pancreatic mass.\nAdrenal glands: Adrenal glands are normal without nodules.\nKidneys: 5.1 cm spiculated enhancing renal mass in the left kidney, interpolar. No hydronephrosis. No enhancing renal mass.\nGI tract/Bowel: No obstructive process. No focal bowel wall mass identified. no colonic mass.\nMesentery/Omentum: 23 mm lesion in the peritoneum, suspicious for metastasis. No ascites. No omental caking.\nMesenteric vessels (SMA/SMV): SMA/SMV are patent without thrombosis.\nUrinary bladder: Unremarkable.\nReproductive organs: No adnexal mass. Uterus/prostate within expected size for age. prostate is normal / no prostatic mass.\nLymph nodes: Enlarged mesenteric lymph node, short axis 3.0 cm. No pathologically enlarged lymph nodes by size criteria.\nBones/Osseous structures: No aggressive osseous lesion. No acute fracture. no destructive osseous lesion.\n\nIMPRESSION:\n- Kidney primary malignancy at left kidney, interpolar measuring approximately 51 mm.\n- Findings concerning for nodal involvement.\n- Findings compatible with distant metastases involving: peritoneum.\n- RECIST 1.1 Summary:\n- Target lesions (n=3; ≤2 per organ rule applied).\n  • T1: Primary — 48→51 mm (longest diameter).\n  • T2: Metastasis — 21→23 mm (longest diameter).\n  • T3: Lymph node — 27→30 mm (short axis).\n- SLD baseline: 96 mm.\n- SLD current: 104 mm (+8.3% change).\n- New lesions: absent (unequivocal).\n- - RECIST 1.1 overall response category: PD.\n"}
{"patient_id": "PID000001", "study_date": "2023-11-22", "timepoint": 3, "recist": {"baseline_sld_mm": 96, "current_sld_mm": 124, "nadir_sld_mm": 61, "overall_response": "PD"}, "lesions": [{"lesion_id": "primary:kidney", "kind": "primary", "organ": "kidney", "location": "left kidney, interpolar", "rule": "longest", "baseline_mm": 48, "follow_mm": 61, "size_mm_current": 61, "margin": "spiculated", "enhancement": "hyperenhancing", "suspicious": true, "target": true}, {"lesion_id": "ln:mesenteric", "kind": "ln", "organ": "lymph", "station": "mesenteric", "rule": "short_axis", "baseline_mm": 27, "follow_mm": 36, "size_mm_current": 36, "necrosis": false, "suspicious": true, "target": true}, {"lesion_id": "met:peritoneum", "kind": "met", "organ": "peritoneum", "rule": "longest", "baseline_mm": 21, "follow_mm": 27, "size_mm_current": 27, "suspicious": true, "target": true}], "complexity_profile": {"level": 2, "level_name": "C2", "artifact": null}, "staging_relevance": 19.0, "incidentals": [{"organ": "kidneys", "text": "Bosniak I cyst"}, {"organ": "bones", "text": "bone islands"}, {"organ": "reproductive.prostate", "text": "calcifications"}], "negatives": [{"organ": "pancreas", "text": "no pancreatic mass"}, {"organ": "kidneys", "text": "no renal mass"}, {"organ": "adrenals", "text": "adrenal glands normal"}, {"organ": "pleura", "text": "no pleural nodularity"}, {"organ": "mesentery_peritoneum", "text": "no peritoneal nodularity"}], "post_treatment": ["Postsurgical change: resection margin changes"], "report_text": "FINDINGS:\nComparison: 2023-09-30.\nPulmonary parenchyma: Clear lungs without focal mass. No suspicious nodules identified.\nMediastinum: Cardiomediastinal contours within normal limits.\nPleura/Pleural spaces: No pleural effusion or pleural thickening. no pleural nodularity.\nGreat vessels/Aorta: No thoracic aortic aneurysm or dissection.\nLiver: No focal hepatic lesions. Normal attenuation.\nSpleen: Normal in size and attenuation. No focal splenic lesion.\nPancreas: Normal pancreatic contour and enhancement. No focal mass. no pancreatic mass.\nAdrenal glands: Adrenal glands are normal without nodules. adrenal glands normal.\nKidneys: 61 mm spiculated enhancing renal mass in the left kidney, interpolar. No hydronephrosis. No enhancing renal mass. Bosniak I cyst. no renal mass. Postsurgical change: resection margin changes.\nGI tract/Bowel: No obstructive process. No focal bowel wall mass identified.\nMesentery/Omentum: 27 mm lesion in the peritoneum, suspicious for metastasis. No ascites. No omental caking. no peritoneal nodularity.\nMesenteric vessels (SMA/SMV): SMA/SMV are patent without thrombosis.\nUrinary bladder: Unremarkable.\nReproductive organs: No adnexal mass. Uterus/prostate within expected size for age. calcifications.\nLymph nodes: Enlarged mesenteric lymph node, short axis 3.6 cm. No pathologically enlarged lymph nodes by size criteria.\nBones/Osseous structures: No aggressive osseous lesion. No acute fracture. bone islands.\n\nIMPRESSION:\n- Kidney primary malignancy at left kidney, interpolar measuring approximately 61 mm.\n- Findings concerning for nodal involvement.\n- Findings compatible with distant metastases involving: peritoneum.\n- RECIST 1.1 Summary:\n- Target lesions (n=3; ≤2 per organ rule applied).\n  • T1: Primary — 48→61 mm (longest diameter).\n  • T2: Metastasis — 21→27 mm (longest diameter).\n  • T3: Lymph node — 27→36 mm (short axis).\n- SLD baseline: 96 mm.\n- SLD current: 124 mm (+29.2% change).\n- New lesions: absent (unequivocal).\n- - RECIST 1.1 overall response category: PD.\n"}
{"patient_id": "PID000002", "study_date": "2023-01-24", "timepoint": 0, "recist": {"baseline_sld_mm": 58, "current_sld_mm": null, "nadir_sld_mm": null, "overall_response": "Baseline (no category)"}, "lesions": [{"lesion_id": "primary:stomach", "kind": "primary", "organ": "stomach", "location": "lesser curvature of the stomach", "rule": "longest", "baseline_mm": 38, "follow_mm": null, "size_mm_current": 38, "margin": "smooth", "enhancement": "isoenhancing", "suspicious": true, "target": true}, {"lesion_id": "ln:subcarinal", "kind": "ln", "organ": "lymph", "station": "subcarinal", "rule": "short_axis", "baseline_mm": 20, "follow_mm": null, "size_mm_current": 20, "necrosis": false, "suspicious": true, "target": true}], "complexity_profile": {"level": 2, "level_name": "C2", "artifact": {"key": "motion_mild", "impact": 1, "report_phrase": "Respiratory motion artifact partially limits assessment.", "severity_rank": 2}}, "staging_relevance": -1.0, "incidentals": [{"organ": "lung", "text": "bronchial wall thickening"}, {"organ": "lung", "text": "calcified granuloma"}, {"organ": "spleen", "text": "accessory spleen"}], "negatives": [{"organ": "aorta_great_vessels", "text": "aorta normal caliber"}, {"organ": "lung", "text": "no suspicious pulmonary nodule"}, {"organ": "bladder", "text": "urinary bladder normal"}, {"organ": "pleura", "text": "no pleural effusion"}, {"organ": "bones", "text": "no destructive osseous lesion"}], "post_treatment": [], "report_text": "FINDINGS:\nRespiratory motion artifact partially limits assessment.\nLungs: No focal consolidation or suspicious pulmonary nodules. No pneumothorax. bronchial wall thickening. calcified granuloma. no suspicious pulmonary nodule.\nMediastinum: Enlarged subcarinal lymph node, short axis 2.0 cm. Cardiomediastinal contours within normal limits.\nPleura/Pleural spaces: No pleural effusion or pleural thickening.\nGreat vessels/Aorta: No thoracic aortic aneurysm or dissection. aorta normal caliber.\nLiver: No focal hepatic lesions. Normal attenuation.\nSpleen: Normal in size and attenuation. No focal splenic lesion. accessory spleen.\nPancreas: Normal pancreatic contour and enhancement. No focal mass.\nAdrenal glands: Adrenal glands are normal without nodules.\nKidneys: No hydronephrosis. No enhancing renal mass.\nGI tract/Bowel: 38 mm smooth gastric mass at the lesser curvature of the stomach (isoenhancing). No obstructive process. No focal bowel wall mass identified.\nMesentery/Omentum: No ascites. No omental caking.\nMesenteric vessels (SMA/SMV): SMA/SMV are patent without thrombosis.\nUrinary bladder: Unremarkable. urinary bladder normal.\nReproductive organs: No adnexal mass. Uterus/prostate within expected size for age.\nLymph nodes: No pathologically enlarged lymph nodes by size criteria.\nBones/Osseous structures: No aggressive osseous lesion. No acute fracture. no destructive osseous lesion.\n\nIMPRESSION:\n- Stomach primary malignancy at lesser curvature of the stomach measuring approximately 38 mm.\n- Findings concerning for nodal involvement.\n- No definite distant metastases identified.\n- RECIST 1.1 Summary:\n- Target lesions (n=2; ≤2 per organ rule applied).\n  • T1: Primary — 38 mm (longest diameter) at baseline.\n  • T2: Lymph node — 20 mm (short axis) at baseline.\n- SLD baseline: 58 mm.\n- New lesions: absent (unequivocal).\n- - RECIST 1.1 overall response category: Baseline (no category).\n"}
{"patient_id": "PID000002", "study_date": "2023-03-24", "timepoint": 1, "recist": {"baseline_sld_mm": 58, "current_sld_mm": 39, "nadir_sld_mm": 39, "overall_response": "PD"}, "lesions": [{"lesion_id": "primary:stomach", "kind": "primary", "organ": "stomach", "location": "lesser curvature of the stomach", "rule": "longest", "baseline_mm": 38, "follow_mm": 26, "size_mm_current": 26, "margin": "smooth", "enhancement": "isoenhancing", "suspicious": true, "target": true}, {"lesion_id": "ln:subcarinal", "kind": "ln", "organ": "lymph", "station": "subcarinal", "rule": "short_axis", "baseline_mm": 20, "follow_mm": 13, "size_mm_current": 13, "necrosis": false, "suspicious": true, "target": true}], "complexity_profile": {"level": 2, "level_name": "C2", "artifact": null}, "staging_relevance": 18.0, "incidentals": [{"organ": "pancreas", "text": "side-branch IPMN (no worrisome features)"}, {"organ": "kidneys", "text": "Bosniak I cyst"}, {"organ": "spleen", "text": "accessory spleen"}], "negatives": [{"organ": "bones", "text": "no destructive osseous lesion"}, {"organ": "mediastinum", "text": "no pathologic mediastinal lymphadenopathy"}, {"organ": "liver", "text": "no hepatic mass"}, {"organ": "adrenals", "text": "adrenal glands normal"}, {"organ": "aorta_great_vessels", "text": "no aneurysm or dissection"}], "post_treatment": [], "report_text": "FINDINGS:\nComparison: 2023-01-24.\nLungs: No focal consolidation or suspicious pulmonary nodules. No pneumothorax.\nMediastinum: Enlarged subcarinal lymph node, short axis 13 mm. Cardiomediastinal contours within normal limits. no pathologic mediastinal lymphadenopathy.\nPleura/Pleural spaces: No pleural effusion or pleural thickening.\nGreat vessels/Aorta: No thoracic aortic aneurysm or dissection. no aneurysm or dissection.\nLiver: No focal hepatic lesions. Normal attenuation. no hepatic mass.\nSpleen: Normal in size and attenuation. No focal splenic lesion. accessory spleen.\nPancreas: Normal pancreatic contour and enhancement. No focal mass. side-branch IPMN (no worrisome features).\nAdrenal glands: Adrenal glands are normal without nodules. adrenal glands normal.\nKidneys: No hydronephrosis. No enhancing renal mass. Bosniak I cyst.\nGI tract/Bowel: 26 mm smooth gastric mass at the lesser curvature of the stomach (isoenhancing). No obstructive process. No focal bowel wall mass identified.\nMesentery/Omentum: No ascites. No omental caking.\nMesenteric vessels (SMA/SMV): SMA/SMV are patent without thrombosis.\nUrinary bladder: Unremarkable.\nReproductive organs: No adnexal mass. Uterus/prostate within expected size for age.\nLymph nodes: No pathologically enlarged lymph nodes by size criteria.\nBones/Osseous structures: No aggressive osseous lesion. No acute fracture. no destructive osseous lesion.\n\nIMPRESSION:\n- Stomach primary malignancy at lesser curvature of the stomach measuring approximately 26 mm.\n- Findings concerning for nodal involvement.\n- No definite distant metastases identified.\n- RECIST 1.1 Summary:\n- Target lesions (n=2; ≤2 per organ rule applied).\n  • T1: Primary — 38→26 mm (longest diameter).\n  • T2: Lymph node — 20→13 mm (short axis).\n- SLD baseline: 58 mm.\n- SLD current: 39 mm (-32.8% change).\n- New lesions: present (unequivocal).\n- - RECIST 1.1 overall response category: PD.\n"}
{"patient_id": "PID000002", "study_date": "2023-05-06", "timepoint": 2, "recist": {"baseline_sld_mm": 58, "current_sld_mm": 39, "nadir_sld_mm": 39, "overall_response": "PR"}, "lesions": [{"lesion_id": "primary:stomach", "kind": "primary", "organ": "stomach", "location": "lesser curvature of the stomach", "rule": "longest", "baseline_mm": 38, "follow_mm": 26, "size_mm_current": 26, "margin": "smooth", "enhancement": "isoenhancing", "suspicious": true, "target": true}, {"lesion_id": "ln:subcarinal", "kind": "ln", "organ": "lymph", "station": "subcarinal", "rule": "short_axis", "baseline_mm": 20, "follow_mm": 13, "size_mm_current": 13, "necrosis": false, "suspicious": true, "target": true}], "complexity_profile": {"level": 2, "level_name": "C2", "artifact": {"key": "motion_mild", "impact": 1, "report_phrase": "Respiratory motion artifact partially limits assessment.", "severity_rank": 2}}, "staging_relevance": -1.0, "incidentals": [{"organ": "pancreas", "text": "serous cystadenoma"}, {"organ": "mediastinum", "text": "small thymic remnant"}], "negatives": [{"organ": "bones", "text": "no destructive osseous lesion"}, {"organ": "aorta_great_vessels", "text": "no aneurysm or dissection"}, {"organ": "liver", "text": "liver is normal"}, {"organ": "reproductive", "text": "ovaries are normal / no adnexal abnormality"}, {"organ": "spleen", "text": "no focal splenic lesion"}], "post_treatment": ["Radiation change: consolidation conforming to beam path"], "report_text": "FINDINGS:\nRespiratory motion artifact partially limits assessment.\nComparison: 2023-03-24.\nLungs: No focal consolidation or suspicious pulmonary nodules. No pneumothorax. Post-treatment change: consolidation conforming to beam path.\nMediastinum: Enlarged subcarinal lymph node, short axis 13 mm. Cardiomediastinal contours within normal limits. small thymic remnant.\nPleura/Pleural spaces: No pleural effusion or pleural thickening.\nGreat vessels/Aorta: No thoracic aortic aneurysm or dissection. no aneurysm or dissection.\nLiver: No focal hepatic lesions. Normal attenuation. liver is normal.\nSpleen: Normal in size and attenuation. No focal splenic lesion.\nPancreas: Normal pancreatic contour and enhancement. No focal mass. serous cystadenoma.\nAdrenal glands: Adrenal glands are normal without nodules.\nKidneys: No hydronephrosis. No enhancing renal mass.\nGI tract/Bowel: 26 mm smooth gastric mass at the lesser curvature of the stomach (isoenhancing). No obstructive process. No focal bowel wall mass identified.\nMesentery/Omentum: No ascites. No omental caking.\nMesenteric vessels (SMA/SMV): SMA/SMV are patent without thrombosis.\nUrinary bladder: Unremarkable.\nReproductive organs: No adnexal mass. Uterus/prostate within expected size for age. ovaries are normal / no adnexal abnormality.\nLymph nodes: No pathologically enlarged lymph nodes by size criteria.\nBones/Osseous structures: No aggressive osseous lesion. No acute fracture. no destructive osseous lesion.\n\nIMPRESSION:\n- Stomach primary malignancy at lesser curvature of the stomach measuring approximately 26 mm.\n- Findings concerning for nodal involvement.\n- No definite distant metastases identified.\n- RECIST 1.1 Summary:\n- Target lesions (n=2; ≤2 per organ rule applied).\n  • T1: Primary — 38→26 mm (longest diameter).\n  • T2: Lymph node — 20→13 mm (short axis).\n- SLD baseline: 58 mm.\n- SLD current: 39 mm (-32.8% change).\n- New lesions: absent (unequivocal).\n- - RECIST 1.1 overall response category: PR.\n"}
{"patient_id": "PID000002", "study_date": "2023-06-28", "timepoint": 3, "recist": {"baseline_sld_mm": 58, "current_sld_mm": 50, "nadir_sld_mm": 39, "overall_response": "PD"}, "lesions": [{"lesion_id": "primary:stomach", "kind": "primary", "organ": "stomach", "location": "lesser curvature of the stomach", "rule": "longest", "baseline_mm": 38, "follow_mm": 33, "size_mm_current": 33, "margin": "smooth", "enhancement": "isoenhancing", "suspicious": true, "target": true}, {"lesion_id": "ln:subcarinal", "kind": "ln", "organ": "lymph", "station": "subcarinal", "rule": "short_axis", "baseline_mm": 20, "follow_mm": 17, "size_mm_current": 17, "necrosis": false, "suspicious": true, "target": true}], "complexity_profile": {"level": 2, "level_name": "C2", "artifact": null}, "staging_relevance": 19.0, "incidentals": [{"organ": "bones", "text": "bone islands"}, {"organ": "reproductive.ovary", "text": "simple physiologic cyst"}], "negatives": [{"organ": "liver", "text": "no hepatic mass"}, {"organ": "lung", "text": "lungs are normal"}, {"organ": "aorta_great_vessels", "text": "aorta normal caliber"}, {"organ": "bones", "text": "no destructive osseous lesion"}, {"organ": "gi", "text": "no bowel obstruction"}], "post_treatment": [], "report_text": "FINDINGS:\nComparison: 2023-05-06.\nPulmonary parenchyma: Clear lungs without focal mass. No suspicious nodules identified.\nMediastinum: Enlarged subcarinal lymph node, short axis 17 mm. Cardiomediastinal contours within normal limits.\nPleura/Pleural spaces: No pleural effusion or pleural thickening.\nGreat vessels/Aorta: No thoracic aortic aneurysm or dissection. aorta normal caliber.\nLiver: No focal hepatic lesions. Normal attenuation. no hepatic mass.\nSpleen: Normal in size and attenuation. No focal splenic lesion.\nPancreas: Normal pancreatic contour and enhancement. No focal mass.\nAdrenal glands: Adrenal glands are normal without nodules.\nKidneys: No hydronephrosis. No enhancing renal mass.\nGI tract/Bowel: 33 mm smooth gastric mass at the lesser curvature of the stomach (isoenhancing). No obstructive process. No focal bowel wall mass identified. no bowel obstruction.\nMesentery/Omentum: No ascites. No omental caking.\nMesenteric vessels (SMA/SMV): SMA/SMV are patent without thrombosis.\nUrinary bladder: Unremarkable.\nReproductive organs: No adnexal mass. Uterus/prostate within expected size for age. simple physiologic cyst.\nLymph nodes: No pathologically enlarged lymph nodes by size criteria.\nBones/Osseous structures: No aggressive osseous lesion. No acute fracture. bone islands. no destructive osseous lesion.\n\nIMPRESSION:\n- Stomach primary malignancy at lesser curvature of the stomach measuring approximately 33 mm.\n- Findings concerning for nodal involvement.\n- No definite distant metastases identified.\n- RECIST 1.1 Summary:\n- Target lesions (n=2; ≤2 per organ rule applied).\n  • T1: Primary — 38→33 mm (longest diameter).\n  • T2: Lymph node — 20→17 mm (short axis).\n- SLD baseline: 58 mm.\n- SLD current: 50 mm (-13.8% change).\n- New lesions: absent (unequivocal).\n- - RECIST 1.1 overall response category: PD.\n"}
{"patient_id": "PID000002", "study_date": "2023-08-16", "timepoint": 4, "recist": {"baseline_sld_mm": 58, "current_sld_mm": 51, "nadir_sld_mm": 39, "overall_response": "PD"}, "lesions": [{"lesion_id": "primary:stomach", "kind": "primary", "organ": "stomach", "location": "lesser curvature of the stomach", "rule": "longest", "baseline_mm": 38, "follow_mm": 33, "size_mm_current": 33, "margin": "smooth", "enhancement": "isoenhancing", "suspicious": true, "target": true}, {"lesion_id": "ln:subcarinal", "kind": "ln", "organ": "lymph", "station": "subcarinal", "rule": "short_axis", "baseline_mm": 20, "follow_mm": 18, "size_mm_current": 18, "necrosis": false, "suspicious": true, "target": true}], "complexity_profile": {"level": 2, "level_name": "C2", "artifact": {"key": "beam_hardening", "impact": 2, "report_phrase": "Beam-hardening streak artifact from dense structures limits evaluation.", "severity_rank": 3}}, "staging_relevance": 16.0, "incidentals": [{"organ": "gi.colon", "text": "small benign polyp"}, {"organ": "reproductive.prostate", "text": "BPH"}], "negatives": [{"organ": "liver", "text": "no hepatic mass"}, {"organ": "gi", "text": "stomach is normal"}, {"organ": "pancreas", "text": "no pancreatic mass"}, {"organ": "kidneys", "text": "no renal mass"}, {"organ": "lung", "text": "no pleural effusion"}], "post_treatment": [], "report_text": "FINDINGS:\nBeam-hardening streak artifact from dense structures limits evaluation.\nComparison: 2023-06-28.\nLungs: Clear lungs without focal mass. No suspicious nodules identified. no pleural effusion.\nMediastinum: Enlarged subcarinal lymph node, short axis 18 mm. Cardiomediastinal contours within normal limits.\nPleura/Pleural spaces: No pleural effusion or pleural thickening.\nGreat vessels/Aorta: No thoracic aortic aneurysm or dissection.\nLiver: No focal hepatic lesions. Normal attenuation. no hepatic mass.\nSpleen: Normal in size and attenuation. No focal splenic lesion.\nPancreas: Normal pancreatic contour and enhancement. No focal mass. no pancreatic mass.\nAdrenal glands: Adrenal glands are normal without nodules.\nKidneys: No hydronephrosis. No enhancing renal mass. no renal mass.\nGI tract/Bowel: 33 mm smooth gastric mass at the lesser curvature of the stomach (isoenhancing). No obstructive process. No focal bowel wall mass identified. small benign polyp. stomach is normal.\nMesentery/Omentum: No ascites. No omental caking.\nMesenteric vessels (SMA/SMV): SMA/SMV are patent without thrombosis.\nUrinary bladder: Unremarkable.\nReproductive organs: No adnexal mass. Uterus/prostate within expected size for age. BPH.\nLymph nodes: No pathologically enlarged lymph nodes by size criteria.\nBones/Osseous structures: No aggressive osseous lesion. No acute fracture.\n\nIMPRESSION:\n- Stomach primary neoplasm (indeterminate) at lesser curvature of the stomach measuring approximately 33 mm.\n- Findings concerning for nodal involvement.\n- No definite distant metastases identified.\n- RECIST 1.1 Summary:\n- Target lesions (n=2; ≤2 per organ rule applied).\n  • T1: Primary — 38→33 mm (longest diameter).\n  • T2: Lymph node — 20→18 mm (short axis).\n- SLD baseline: 58 mm.\n- SLD current: 51 mm (-12.1% change).\n- New lesions: absent (unequivocal).\n- - RECIST 1.1 overall response category: PD.\n\nComment: Some features are classic for; short-interval follow-up or problem-solving imaging may be considered.\n"}
{"patient_id": "PID000002", "study_date": "2023-10-17", "timepoint": 5, "recist": {"baseline_sld_mm": 58, "current_sld_mm": 65, "nadir_sld_mm": 39, "overall_response": "PD"}, "lesions": [{"lesion_id": "primary:stomach", "kind": "primary", "organ": "stomach", "location": "lesser curvature of the stomach", "rule": "longest", "baseline_mm": 38, "follow_mm": 42, "size_mm_current": 42, "margin": "smooth", "enhancement": "isoenhancing", "suspicious": true, "target": true}, {"lesion_id": "ln:subcarinal", "kind": "ln", "organ": "lymph", "station": "subcarinal", "rule": "short_axis", "baseline_mm": 20, "follow_mm": 23, "size_mm_current": 23, "necrosis": false, "suspicious": true, "target": true}], "complexity_profile": {"level": 2, "level_name": "C2", "artifact": null}, "staging_relevance": 19.0, "incidentals": [{"organ": "kidneys", "text": "angiomyolipoma (macroscopic fat)"}, {"organ": "reproductive.prostate", "text": "calcifications"}], "negatives": [{"organ": "liver", "text": "no hepatic mass"}, {"organ": "lung", "text": "no pulmonary abnormality"}, {"organ": "bones", "text": "no destructive osseous lesion"}, {"organ": "mesentery_peritoneum", "text": "no peritoneal nodularity"}, {"organ": "bladder", "text": "no focal bladder wall thickening"}], "post_treatment": [], "report_text": "FINDINGS:\nComparison: 2023-08-16.\nLungs: Clear lungs without focal mass. No suspicious nodules identified. no pulmonary abnormality.\nMediastinum: Enlarged subcarinal lymph node, short axis 23 mm. Cardiomediastinal contours within normal limits.\nPleura/Pleural spaces: No pleural effusion or pleural thickening.\nGreat vessels/Aorta: No thoracic aortic aneurysm or dissection.\nLiver: No focal hepatic lesions. Normal attenuation. no hepatic mass.\nSpleen: Normal in size and attenuation. No focal splenic lesion.\nPancreas: Normal pancreatic contour and enhancement. No focal mass.\nAdrenal glands: Adrenal glands are normal without nodules.\nKidneys: No hydronephrosis. No enhancing renal mass. angiomyolipoma (macroscopic fat).\nGI tract/Bowel: 42 mm smooth gastric mass at the lesser curvature of the stomach (isoenhancing). No obstructive process. No focal bowel wall mass identified.\nMesentery/Omentum: No ascites. No omental caking. no peritoneal nodularity.\nMesenteric vessels (SMA/SMV): SMA/SMV are patent without thrombosis.\nUrinary bladder: Unremarkable. no focal bladder wall thickening.\nReproductive organs: No adnexal mass. Uterus/prostate within expected size for age. calcifications.\nLymph nodes: No pathologically enlarged lymph nodes by size criteria.\nBones/Osseous structures: No aggressive osseous lesion. No acute fracture. no destructive osseous lesion.\n\nIMPRESSION:\n- Stomach primary malignancy at lesser curvature of the stomach measuring approximately 42 mm.\n- Findings concerning for nodal involvement.\n- No definite distant metastases identified.\n- RECIST 1.1 Summary:\n- Target lesions (n=2; ≤2 per organ rule applied).\n  • T1: Primary — 38→42 mm (longest diameter).\n  • T2: Lymph node — 20→23 mm (short axis).\n- SLD baseline: 58 mm.\n- SLD current: 65 mm (+12.1% change).\n- New lesions: absent (unequivocal).\n- - RECIST 1.1 overall response category: PD.\n"}
{"patient_id": "PID000003", "study_date": "2023-08-19", "timepoint": 0, "recist": {"baseline_sld_mm": 101, "current_sld_mm": null, "nadir_sld_mm": null, "overall_response": "Baseline (no category)"}, "lesions": [{"lesion_id": "primary:prostate", "kind": "primary", "organ": "prostate", "location": "prostate gland, peripheral zone", "rule": "longest", "baseline_mm": 27, "follow_mm": null, "size_mm_current": 27, "margin": "smooth", "enhancement": "isoenhancing", "suspicious": true, "target": true}, {"lesion_id": "ln:right hilar", "kind": "ln", "organ": "lymph", "station": "right hilar", "rule": "short_axis", "baseline_mm": null, "follow_mm": null, "size_mm_current": 9, "necrosis": false, "suspicious": false, "target": false}, {"lesion_id": "ln:retroperitoneal", "kind": "ln", "organ": "lymph", "station": "retroperitoneal", "rule": "short_axis", "baseline_mm": 19, "follow_mm": null, "size_mm_current": 19, "necrosis": false, "suspicious": true, "target": true}, {"lesion_id": "ln:inguinal", "kind": "ln", "organ": "lymph", "station": "inguinal", "rule": "short_axis", "baseline_mm": 26, "follow_mm": null, "size_mm_current": 26, "necrosis": false, "suspicious": true, "target": true}, {"lesion_id": "met:liver", "kind": "met", "organ": "liver", "rule": "longest", "baseline_mm": 29, "follow_mm": null, "size_mm_current": 29, "suspicious": true, "target": true}], "complexity_profile": {"level": 2, "level_name": "C2", "artifact": null}, "staging_relevance": 0.0, "incidentals": [{"organ": "lung", "text": "<6 mm well-circumscribed nodule"}, {"organ": "bones", "text": "degenerative changes"}, {"organ": "pancreas", "text": "serous cystadenoma"}], "negatives": [{"organ": "gi", "text": "no colonic mass"}, {"organ": "kidneys", "text": "no renal mass"}, {"organ": "pleura", "text": "no pleural nodularity"}, {"organ": "mediastinum", "text": "no pathologic mediastinal lymphadenopathy"}, {"organ": "adrenals", "text": "no adrenal nodule"}], "post_treatment": [], "report_text": "FINDINGS:\nPulmonary parenchyma: Clear lungs without focal mass. No suspicious nodules identified.\nMediastinum: Enlarged right hilar lymph node, short axis 0.9 cm. Cardiomediastinal contours within normal limits. no pathologic mediastinal lymphadenopathy.\nPleura/Pleural spaces: No pleural effusion or pleural thickening. no pleural nodularity.\nGreat vessels/Aorta: No thoracic aortic aneurysm or dissection.\nLiver: 2.9 cm lesion in the liver, suspicious for metastasis. No focal hepatic lesions. Normal attenuation.\nSpleen: Normal in size and attenuation. No focal splenic lesion.\nPancreas: Normal pancreatic contour and enhancement. No focal mass. serous cystadenoma.\nAdrenal glands: Adrenal glands are normal without nodules. no adrenal nodule.\nKidneys: No hydronephrosis. No enhancing renal mass. no renal mass.\nGI tract/Bowel: No obstructive process. No focal bowel wall mass identified. no colonic mass.\nMesentery/Omentum: No ascites. No omental caking.\nMesenteric vessels (SMA/SMV): SMA/SMV are patent without thrombosis.\nUrinary bladder: Unremarkable.\nReproductive organs: 2.7 cm smooth mass within the prostate gland, peripheral zone. No adnexal mass. Uterus/prostate within expected size for age.\nLymph nodes: Enlarged retroperitoneal lymph node, short axis 19 mm. Enlarged inguinal lymph node, short axis 26 mm. No pathologically enlarged lymph nodes by size criteria.\nBones/Osseous structures: No aggressive osseous lesion. No acute fracture. degenerative changes.\n\nIMPRESSION:\n- Prostate primary malignancy at prostate gland, peripheral zone measuring approximately 27 mm.\n- Findings concerning for nodal involvement.\n- Findings compatible with distant metastases involving: liver.\n- RECIST 1.1 Summary:\n- Target lesions (n=4; ≤2 per organ rule applied).\n  • T1: Primary — 27 mm (longest diameter) at baseline.\n  • T2: Metastasis — 29 mm (longest diameter) at baseline.\n  • T3: Lymph node — 19 mm (short axis) at baseline.\n  • T4: Lymph node — 26 mm (short axis) at baseline.\n- SLD baseline: 101 mm.\n- New lesions: absent (unequivocal).\n- - RECIST 1.1 overall response category: Baseline (no category).\n"}
{"patient_id": "PID000003", "study_date": "2023-10-04", "timepoint": 1, "recist": {"baseline_sld_mm": 101, "current_sld_mm": 65, "nadir_sld_mm": 65, "overall_response": "PR"}, "lesions": [{"lesion_id": "primary:prostate", "kind": "primary", "organ": "prostate", "location": "prostate gland, peripheral zone", "rule": "longest", "baseline_mm": 27, "follow_mm": 17, "size_mm_current": 17, "margin": "smooth", "enhancement": "isoenhancing", "suspicious": true, "target": true}, {"lesion_id": "ln:right hilar", "kind": "ln", "organ": "lymph", "station": "right hilar", "rule": "short_axis", "baseline_mm": null, "follow_mm": null, "size_mm_current": 9, "necrosis": false, "suspicious": false, "target": false}, {"lesion_id": "ln:retroperitoneal", "kind": "ln", "organ": "lymph", "station": "retroperitoneal", "rule": "short_axis", "baseline_mm": 19, "follow_mm": 12, "size_mm_current": 12, "necrosis": false, "suspicious": true, "target": true}, {"lesion_id": "ln:inguinal", "kind": "ln", "organ": "lymph", "station": "inguinal", "rule": "short_axis", "baseline_mm": 26, "follow_mm": 17, "size_mm_current": 17, "necrosis": false, "suspicious": true, "target": true}, {"lesion_id": "met:liver", "kind": "met", "organ": "liver", "rule": "longest", "baseline_mm": 29, "follow_mm": 19, "size_mm_current": 19, "suspicious": true, "target": true}], "complexity_profile": {"level": 2, "level_name": "C2", "artifact": {"key": "beam_hardening", "impact": 2, "report_phrase": "Beam-hardening streak artifact from dense structures limits evaluation.", "severity_rank": 3}}, "staging_relevance": 4.0, "incidentals": [{"organ": "pancreas", "text": "serous cystadenoma"}, {"organ": "kidneys", "text": "angiomyolipoma (macroscopic fat)"}], "negatives": [{"organ": "reproductive", "text": "ovaries are normal / no adnexal abnormality"}, {"organ": "mediastinum", "text": "no pathologic mediastinal lymphadenopathy"}, {"organ": "adrenals", "text": "no adrenal nodule"}, {"organ": "bones", "text": "no destructive osseous lesion"}, {"organ": "pleura", "text": "no pleural nodularity"}], "post_treatment": ["Radiation change: consolidation conforming to beam path"], "report_text": "FINDINGS:\nBeam-hardening streak artifact from dense structures limits evaluation.\nComparison: 2023-08-19.\nLungs: Clear lungs without focal mass. No suspicious nodules identified. Post-treatment change: consolidation conforming to beam path.\nMediastinum: Enlarged right hilar lymph node, short axis 9 mm. Cardiomediastinal contours within normal limits. no pathologic mediastinal lymphadenopathy.\nPleura/Pleural spaces: No pleural effusion or pleural thickening. no pleural nodularity.\nGreat vessels/Aorta: No thoracic aortic aneurysm or dissection.\nLiver: 1.9 cm lesion in the liver, suspicious for metastasis. No focal hepatic lesions. Normal attenuation.\nSpleen: Normal in size and attenuation. No focal splenic lesion.\nPancreas: Normal pancreatic contour and enhancement. No focal mass. serous cystadenoma.\nAdrenal glands: Adrenal glands are normal without nodules. no adrenal nodule.\nKidneys: No hydronephrosis. No enhancing renal mass. angiomyolipoma (macroscopic fat).\nGI tract/Bowel: No obstructive process. No focal bowel wall mass identified.\nMesentery/Omentum: No ascites. No omental caking.\nMesenteric vessels (SMA/SMV): SMA/SMV are patent without thrombosis.\nUrinary bladder: Unremarkable.\nReproductive organs: 17 mm smooth mass within the prostate gland, peripheral zone. No adnexal mass. Uterus/prostate within expected size for age. ovaries are normal / no adnexal abnormality.\nLymph nodes: Enlarged retroperitoneal lymph node, short axis 1.2 cm. Enlarged inguinal lymph node, short axis 17 mm. No pathologically enlarged lymph nodes by size criteria.\nBones/Osseous structures: No aggressive osseous lesion. No acute fracture. no destructive osseous lesion.\n\nIMPRESSION:\n- Prostate primary malignancy at prostate gland, peripheral zone measuring approximately 17 mm.\n- Findings concerning for nodal involvement.\n- Findings compatible with distant metastases involving: liver.\n- RECIST 1.1 Summary:\n- Target lesions (n=4; ≤2 per organ rule applied).\n  • T1: Primary — 27→17 mm (longest diameter).\n  • T2: Metastasis — 29→19 mm (longest diameter).\n  • T3: Lymph node — 19→12 mm (short axis).\n  • T4: Lymph node — 26→17 mm (short axis).\n- SLD baseline: 101 mm.\n- SLD current: 65 mm (-35.6% change).\n- New lesions: absent (unequivocal).\n- - RECIST 1.1 overall response category: PR.\n"}
{"patient_id": "PID000003", "study_date": "2023-11-22", "timepoint": 2, "recist": {"baseline_sld_mm": 101, "current_sld_mm": 112, "nadir_sld_mm": 65, "overall_response": "PD"}, "lesions": [{"lesion_id": "primary:prostate", "kind": "primary", "organ": "prostate", "location": "prostate gland, peripheral zone", "rule": "longest", "baseline_mm": 27, "follow_mm": 29, "size_mm_current": 29, "margin": "smooth", "enhancement": "isoenhancing", "suspicious": true, "target": true}, {"lesion_id": "ln:right hilar", "kind": "ln", "organ": "lymph", "station": "right hilar", "rule": "short_axis", "baseline_mm": null, "follow_mm": null, "size_mm_current": 9, "necrosis": false, "suspicious": false, "target": false}, {"lesion_id": "ln:retroperitoneal", "kind": "ln", "organ": "lymph", "station": "retroperitoneal", "rule": "short_axis", "baseline_mm": 19, "follow_mm": 21, "size_mm_current": 21, "necrosis": false, "suspicious": true, "target": true}, {"lesion_id": "ln:inguinal", "kind": "ln", "organ": "lymph", "station": "inguinal", "rule": "short_axis", "baseline_mm": 26, "follow_mm": 29, "size_mm_current": 29, "necrosis": false, "suspicious": true, "target": true}, {"lesion_id": "met:liver", "kind": "met", "organ": "liver", "rule": "longest", "baseline_mm": 29, "follow_mm": 33, "size_mm_current": 33, "suspicious": true, "target": true}], "complexity_profile": {"level": 2, "level_name": "C2", "artifact": null}, "staging_relevance": 19.0, "incidentals": [{"organ": "bones", "text": "degenerative changes"}], "negatives": [{"organ": "mediastinum", "text": "no mediastinal mass"}, {"organ": "gi", "text": "stomach is normal"}, {"organ": "aorta_great_vessels", "text": "no aneurysm or dissection"}, {"organ": "reproductive", "text": "ovaries are normal / no adnexal abnormality"}, {"organ": "bladder", "text": "urinary bladder normal"}], "post_treatment": [], "report_text": "FINDINGS:\nComparison: 2023-10-04.\nLungs: No focal consolidation or suspicious pulmonary nodules. No pneumothorax.\nMediastinum: Enlarged right hilar lymph node, short axis 9 mm. Cardiomediastinal contours within normal limits. no mediastinal mass.\nPleura/Pleural spaces: No pleural effusion or pleural thickening.\nGreat vessels/Aorta: No thoracic aortic aneurysm or dissection. no aneurysm or dissection.\nLiver: 3.3 cm lesion in the liver, suspicious for metastasis. No focal hepatic lesions. Normal attenuation.\nSpleen: Normal in size and attenuation. No focal splenic lesion.\nPancreas: Normal pancreatic contour and enhancement. No focal mass.\nAdrenal glands: Adrenal glands are normal without nodules.\nKidneys: No hydronephrosis. No enhancing renal mass.\nGI tract/Bowel: No obstructive process. No focal bowel wall mass identified. stomach is normal.\nMesentery/Omentum: No ascites. No omental caking.\nMesenteric vessels (SMA/SMV): SMA/SMV are patent without thrombosis.\nUrinary bladder: Unremarkable. urinary bladder normal.\nReproductive organs: 29 mm smooth mass within the prostate gland, peripheral zone. No adnexal mass. Uterus/prostate within expected size for age. ovaries are normal / no adnexal abnormality.\nLymph nodes: Enlarged retroperitoneal lymph node, short axis 2.1 cm. Enlarged inguinal lymph node, short axis 2.9 cm. No pathologically enlarged lymph nodes by size criteria.\nBones/Osseous structures: No aggressive osseous lesion. No acute fracture. degenerative changes.\n\nIMPRESSION:\n- Prostate primary malignancy at prostate gland, peripheral zone measuring approximately 29 mm.\n- Findings concerning for nodal involvement.\n- Findings compatible with distant metastases involving: liver.\n- RECIST 1.1 Summary:\n- Target lesions (n=4; ≤2 per organ rule applied).\n  • T1: Primary — 27→29 mm (longest diameter).\n  • T2: Metastasis — 29→33 mm (longest diameter).\n  • T3: Lymph node — 19→21 mm (short axis).\n  • T4: Lymph node — 26→29 mm (short axis).\n- SLD baseline: 101 mm.\n- SLD current: 112 mm (+10.9% change).\n- New lesions: absent (unequivocal).\n- - RECIST 1.1 overall response category: PD.\n"}
{"patient_id": "PID000003", "study_date": "2024-01-17", "timepoint": 3, "recist": {"baseline_sld_mm": 101, "current_sld_mm": 130, "nadir_sld_mm": 65, "overall_response": "PD"}, "lesions": [{"lesion_id": "primary:prostate", "kind": "primary", "organ": "prostate", "location": "prostate gland, peripheral zone", "rule": "longest", "baseline_mm": 27, "follow_mm": 36, "size_mm_current": 36, "margin": "smooth", "enhancement": "isoenhancing", "suspicious": true, "target": true}, {"lesion_id": "ln:right hilar", "kind": "ln", "organ": "lymph", "station": "right hilar", "rule": "short_axis", "baseline_mm": null, "follow_mm": null, "size_mm_current": 9, "necrosis": false, "suspicious": false, "target": false}, {"lesion_id": "ln:retroperitoneal", "kind": "ln", "organ": "lymph", "station": "retroperitoneal", "rule": "short_axis", "baseline_mm": 19, "follow_mm": 24, "size_mm_current": 24, "necrosis": false, "suspicious": true, "target": true}, {"lesion_id": "ln:inguinal", "kind": "ln", "organ": "lymph", "station": "inguinal", "rule": "short_axis", "baseline_mm": 26, "follow_mm": 33, "size_mm_current": 33, "necrosis": false, "suspicious": true, "target": true}, {"lesion_id": "met:liver", "kind": "met", "organ": "liver", "rule": "longest", "baseline_mm": 29, "follow_mm": 37, "size_mm_current": 37, "suspicious": true, "target": true}], "complexity_profile": {"level": 2, "level_name": "C2", "artifact": null}, "staging_relevance": 19.0, "incidentals": [{"organ": "kidneys", "text": "Bosniak I cyst"}], "negatives": [{"organ": "bladder", "text": "no focal bladder wall thickening"}, {"organ": "pleura", "text": "no pleural nodularity"}, {"organ": "mediastinum", "text": "no pathologic mediastinal lymphadenopathy"}, {"organ": "reproductive", "text": "prostate is normal / no prostatic mass"}, {"organ": "liver", "text": "no hepatic mass"}], "post_treatment": ["Radiation change: ground-glass opacities within field"], "report_text": "FINDINGS:\nComparison: 2023-11-22.\nLungs: Clear lungs without focal mass. No suspicious nodules identified. Post-treatment change: ground-glass opacities within field.\nMediastinum: Enlarged right hilar lymph node, short axis 9 mm. Cardiomediastinal contours within normal limits. no pathologic mediastinal lymphadenopathy.\nPleura/Pleural spaces: No pleural effusion or pleural thickening. no pleural nodularity.\nGreat vessels/Aorta: No thoracic aortic aneurysm or dissection.\nLiver: 37 mm lesion in the liver, suspicious for metastasis. No focal hepatic lesions. Normal attenuation. no hepatic mass.\nSpleen: Normal in size and attenuation. No focal splenic lesion.\nPancreas: Normal pancreatic contour and enhancement. No focal mass.\nAdrenal glands: Adrenal glands are normal without nodules.\nKidneys: No hydronephrosis. No enhancing renal mass. Bosniak I cyst.\nGI tract/Bowel: No obstructive process. No focal bowel wall mass identified.\nMesentery/Omentum: No ascites. No omental caking.\nMesenteric vessels (SMA/SMV): SMA/SMV are patent without thrombosis.\nUrinary bladder: Unremarkable. no focal bladder wall thickening.\nReproductive organs: 3.6 cm smooth mass within the prostate gland, peripheral zone. No adnexal mass. Uterus/prostate within expected size for age. prostate is normal / no prostatic mass.\nLymph nodes: Enlarged retroperitoneal lymph node, short axis 2.4 cm. Enlarged inguinal lymph node, short axis 3.3 cm. No pathologically enlarged lymph nodes by size criteria.\nBones/Osseous structures: No aggressive osseous lesion. No acute fracture.\n\nIMPRESSION:\n- Prostate primary malignancy at prostate gland, peripheral zone measuring approximately 36 mm.\n- Findings concerning for nodal involvement.\n- Findings compatible with distant metastases involving: liver.\n- RECIST 1.1 Summary:\n- Target lesions (n=4; ≤2 per organ rule applied).\n  • T1: Primary — 27→36 mm (longest diameter).\n  • T2: Metastasis — 29→37 mm (longest diameter).\n  • T3: Lymph node — 19→24 mm (short axis).\n  • T4: Lymph node — 26→33 mm (short axis).\n- SLD baseline: 101 mm.\n- SLD current: 130 mm (+28.7% change).\n- New lesions: absent (unequivocal).\n- - RECIST 1.1 overall response category: PD.\n"}
{"patient_id": "PID000004", "study_date": "2023-03-06", "timepoint": 0, "recist": {"baseline_sld_mm": 109, "current_sld_mm": null, "nadir_sld_mm": null, "overall_response": "Baseline (no category)"}, "lesions": [{"lesion_id": "primary:liver", "kind": "primary", "organ": "liver", "location": "segment 2 of the liver", "rule": "longest", "baseline_mm": 54, "follow_mm": null, "size_mm_current": 54, "margin": "irregular", "enhancement": "isoenhancing", "suspicious": true, "target": true}, {"lesion_id": "ln:paratracheal", "kind": "ln", "organ": "lymph", "station": "paratracheal", "rule": "short_axis", "baseline_mm": null, "follow_mm": null, "size_mm_current": 10, "necrosis": true, "suspicious": true, "target": false}, {"lesion_id": "ln:internal iliac", "kind": "ln", "organ": "lymph", "station": "internal iliac", "rule": "short_axis", "baseline_mm": 20, "follow_mm": null, "size_mm_current": 20, "necrosis": false, "suspicious": true, "target": true}, {"lesion_id": "met:bone", "kind": "met", "organ": "bone", "rule": "longest", "baseline_mm": 25, "follow_mm": null, "size_mm_current": 25, "suspicious": true, "target": true}, {"lesion_id": "met:peritoneum", "kind": "met", "organ": "peritoneum", "rule": "longest", "baseline_mm": 10, "follow_mm": null, "size_mm_current": 10, "suspicious": true, "target": true}], "complexity_profile": {"level": 2, "level_name": "C2", "artifact": null}, "staging_relevance": -1.0, "incidentals": [{"organ": "bones", "text": "bone islands"}, {"organ": "gi.small_bowel", "text": "nonspecific fluid levels"}], "negatives": [{"organ": "adrenals", "text": "adrenal glands normal"}, {"organ": "bladder", "text": "urinary bladder normal"}, {"organ": "bones", "text": "no destructive osseous lesion"}, {"organ": "pancreas", "text": "no pancreatic mass"}, {"organ": "liver", "text": "liver is normal"}], "post_treatment": [], "report_text": "FINDINGS:\nLungs: No focal consolidation or suspicious pulmonary nodules. No pneumothorax.\nMediastinum: Enlarged paratracheal lymph node, short axis 10 mm with central necrosis. Cardiomediastinal contours within normal limits.\nPleura/Pleural spaces: No pleural effusion or pleural thickening.\nGreat vessels/Aorta: No thoracic aortic aneurysm or dissection.\nLiver: 54 mm irregular hepatic mass in segment 2 of the liver (isoenhancing). No focal hepatic lesions. Normal attenuation. liver is normal.\nSpleen: Normal in size and attenuation. No focal splenic lesion.\nPancreas: Normal pancreatic contour and enhancement. No focal mass. no pancreatic mass.\nAdrenal glands: Adrenal glands are normal without nodules. adrenal glands normal.\nKidneys: No hydronephrosis. No enhancing renal mass.\nGI tract/Bowel: No obstructive process. No focal bowel wall mass identified. nonspecific fluid levels.\nMesentery/Omentum: 1.0 cm lesion in the peritoneum, suspicious for metastasis. No ascites. No omental caking.\nMesenteric vessels (SMA/SMV): SMA/SMV are patent without thrombosis.\nUrinary bladder: Unremarkable. urinary bladder normal.\nReproductive organs: No adnexal mass. Uterus/prostate within expected size for age.\nLymph nodes: Enlarged internal iliac lymph node, short axis 2.0 cm. No pathologically enlarged lymph nodes by size criteria.\nBones/Osseous structures: 2.5 cm lesion in the bone, suspicious for metastasis. No aggressive osseous lesion. No acute fracture. bone islands. no destructive osseous lesion.\n\nIMPRESSION:\n- Liver primary neoplasm (indeterminate) at segment 2 of the liver measuring approximately 54 mm.\n- Findings concerning for nodal involvement.\n- Findings compatible with distant metastases involving: bone, peritoneum.\n- RECIST 1.1 Summary:\n- Target lesions (n=4; ≤2 per organ rule applied).\n  • T1: Primary — 54 mm (longest diameter) at baseline.\n  • T2: Metastasis — 25 mm (longest diameter) at baseline.\n  • T3: Metastasis — 10 mm (longest diameter) at baseline.\n  • T4: Lymph node — 20 mm (short axis) at baseline.\n- SLD baseline: 109 mm.\n- New lesions: absent (unequivocal).\n- - RECIST 1.1 overall response category: Baseline (no category).\n\nComment: Some features are virtually diagnostic of; short-interval follow-up or problem-solving imaging may be considered.\n"}
{"patient_id": "PID000004", "study_date": "2023-05-11", "timepoint": 1, "recist": {"baseline_sld_mm": 109, "current_sld_mm": 70, "nadir_sld_mm": 70, "overall_response": "PR"}, "lesions": [{"lesion_id": "primary:liver", "kind": "primary", "organ": "liver", "location": "segment 2 of the liver", "rule": "longest", "baseline_mm": 54, "follow_mm": 35, "size_mm_current": 35, "margin": "irregular", "enhancement": "isoenhancing", "suspicious": true, "target": true}, {"lesion_id": "ln:paratracheal", "kind": "ln", "organ": "lymph", "station": "paratracheal", "rule": "short_axis", "baseline_mm": null, "follow_mm": null, "size_mm_current": 10, "necrosis": true, "suspicious": true, "target": false}, {"lesion_id": "ln:internal iliac", "kind": "ln", "organ": "lymph", "station": "internal iliac", "rule": "short_axis", "baseline_mm": 20, "follow_mm": 13, "size_mm_current": 13, "necrosis": false, "suspicious": true, "target": true}, {"lesion_id": "met:bone", "kind": "met", "organ": "bone", "rule": "longest", "baseline_mm": 25, "follow_mm": 16, "size_mm_current": 16, "suspicious": true, "target": true}, {"lesion_id": "met:peritoneum", "kind": "met", "organ": "peritoneum", "rule": "longest", "baseline_mm": 10, "follow_mm": 6, "size_mm_current": 6, "suspicious": true, "target": true}], "complexity_profile": {"level": 2, "level_name": "C2", "artifact": {"key": "motion_mild", "impact": 1, "report_phrase": "Respiratory motion artifact partially limits assessment.", "severity_rank": 2}}, "staging_relevance": -1.0, "incidentals": [{"organ": "gi.small_bowel", "text": "nonspecific fluid levels"}], "negatives": [{"organ": "bladder", "text": "no focal bladder wall thickening"}, {"organ": "pancreas", "text": "no pancreatic mass"}, {"organ": "kidneys", "text": "kidneys are normal"}, {"organ": "mediastinum", "text": "no pathologic mediastinal lymphadenopathy"}, {"organ": "reproductive", "text": "ovaries are normal / no adnexal abnormality"}], "post_treatment": ["Radiation change: ground-glass opacities within field"], "report_text": "FINDINGS:\nRespiratory motion artifact partially limits assessment.\nComparison: 2023-03-06.\nLungs: No focal consolidation or suspicious pulmonary nodules. No pneumothorax. Post-treatment change: ground-glass opacities within field.\nMediastinum: Enlarged paratracheal lymph node, short axis 1.0 cm with central necrosis. Cardiomediastinal contours within normal limits. no pathologic mediastinal lymphadenopathy.\nPleura/Pleural spaces: No pleural effusion or pleural thickening.\nGreat vessels/Aorta: No thoracic aortic aneurysm or dissection.\nLiver: 35 mm irregular hepatic mass in segment 2 of the liver (isoenhancing). No focal hepatic lesions. Normal attenuation.\nSpleen: Normal in size and attenuation. No focal splenic lesion.\nPancreas: Normal pancreatic contour and enhancement. No focal mass. no pancreatic mass.\nAdrenal glands: Adrenal glands are normal without nodules.\nKidneys: No hydronephrosis. No enhancing renal mass. kidneys are normal.\nGI tract/Bowel: No obstructive process. No focal bowel wall mass identified. nonspecific fluid levels.\nMesentery/Omentum: 6 mm lesion in the peritoneum, suspicious for metastasis. No ascites. No omental caking.\nMesenteric vessels (SMA/SMV): SMA/SMV are patent without thrombosis.\nUrinary bladder: Unremarkable. no focal bladder wall thickening.\nReproductive organs: No adnexal mass. Uterus/prostate within expected size for age. ovaries are normal / no adnexal abnormality.\nLymph nodes: Enlarged internal iliac lymph node, short axis 13 mm. No pathologically enlarged lymph nodes by size criteria.\nBones/Osseous structures: 16 mm lesion in the bone, suspicious for metastasis. No aggressive osseous lesion. No acute fracture.\n\nIMPRESSION:\n- Liver primary malignancy at segment 2 of the liver measuring approximately 35 mm.\n- Findings concerning for nodal involvement.\n- Findings compatible with distant metastases involving: bone, peritoneum.\n- RECIST 1.1 Summary:\n- Target lesions (n=4; ≤2 per organ rule applied).\n  • T1: Primary — 54→35 mm (longest diameter).\n  • T2: Metastasis — 25→16 mm (longest diameter).\n  • T3: Metastasis — 10→6 mm (longest diameter).\n  • T4: Lymph node — 20→13 mm (short axis).\n- SLD baseline: 109 mm.\n- SLD current: 70 mm (-35.8% change).\n- New lesions: absent (unequivocal).\n- - RECIST 1.1 overall response category: PR.\n"}
{"patient_id": "PID000004", "study_date": "2023-07-11", "timepoint": 2, "recist": {"baseline_sld_mm": 109, "current_sld_mm": 59, "nadir_sld_mm": 59, "overall_response": "PR"}, "lesions": [{"lesion_id": "primary:liver", "kind": "primary", "organ": "liver", "location": "segment 2 of the liver", "rule": "longest", "baseline_mm": 54, "follow_mm": 29, "size_mm_current": 29, "margin": "irregular", "enhancement": "isoenhancing", "suspicious": true, "target": true}, {"lesion_id": "ln:paratracheal", "kind": "ln", "organ": "lymph", "station": "paratracheal", "rule": "short_axis", "baseline_mm": null, "follow_mm": null, "size_mm_current": 10, "necrosis": true, "suspicious": true, "target": false}, {"lesion_id": "ln:internal iliac", "kind": "ln", "organ": "lymph", "station": "internal iliac", "rule": "short_axis", "baseline_mm": 20, "follow_mm": 11, "size_mm_current": 11, "necrosis": false, "suspicious": true, "target": true}, {"lesion_id": "met:bone", "kind": "met", "organ": "bone", "rule": "longest", "baseline_mm": 25, "follow_mm": 14, "size_mm_current": 14, "suspicious": true, "target": true}, {"lesion_id": "met:peritoneum", "kind": "met", "organ": "peritoneum", "rule": "longest", "baseline_mm": 10, "follow_mm": 5, "size_mm_current": 5, "suspicious": true, "target": true}], "complexity_profile": {"level": 2, "level_name": "C2", "artifact": null}, "staging_relevance": 0.0, "incidentals": [{"organ": "lung", "text": "bronchial wall thickening"}], "negatives": [{"organ": "aorta_great_vessels", "text": "aorta normal caliber"}, {"organ": "mesentery_peritoneum", "text": "no peritoneal nodularity"}, {"organ": "adrenals", "text": "no adrenal nodule"}, {"organ": "reproductive", "text": "prostate is normal / no prostatic mass"}, {"organ": "kidneys", "text": "no renal mass"}], "post_treatment": [], "report_text": "FINDINGS:\nComparison: 2023-05-11.\nPulmonary parenchyma: No focal consolidation or suspicious pulmonary nodules. No pneumothorax.\nMediastinum: Enlarged paratracheal lymph node, short axis 10 mm with central necrosis. Cardiomediastinal contours within normal limits.\nPleura/Pleural spaces: No pleural effusion or pleural thickening.\nGreat vessels/Aorta: No thoracic aortic aneurysm or dissection. aorta normal caliber.\nLiver: 29 mm irregular hepatic mass in segment 2 of the liver (isoenhancing). No focal hepatic lesions. Normal attenuation.\nSpleen: Normal in size and attenuation. No focal splenic lesion.\nPancreas: Normal pancreatic contour and enhancement. No focal mass.\nAdrenal glands: Adrenal glands are normal without nodules. no adrenal nodule.\nKidneys: No hydronephrosis. No enhancing renal mass. no renal mass.\nGI tract/Bowel: No obstructive process. No focal bowel wall mass identified.\nMesentery/Omentum: 0.5 cm lesion in the peritoneum, suspicious for metastasis. No ascites. No omental caking. no peritoneal nodularity.\nMesenteric vessels (SMA/SMV): SMA/SMV are patent without thrombosis.\nUrinary bladder: Unremarkable.\nReproductive organs: No adnexal mass. Uterus/prostate within expected size for age. prostate is normal / no prostatic mass.\nLymph nodes: Enlarged internal iliac lymph node, short axis 11 mm. No pathologically enlarged lymph nodes by size criteria.\nBones/Osseous structures: 14 mm lesion in the bone, suspicious for metastasis. No aggressive osseous lesion. No acute fracture.\n\nIMPRESSION:\n- Liver primary malignancy at segment 2 of the liver measuring approximately 29 mm.\n- Findings concerning for nodal involvement.\n- Findings compatible with distant metastases involving: bone, peritoneum.\n- RECIST 1.1 Summary:\n- Target lesions (n=4; ≤2 per organ rule applied).\n  • T1: Primary — 54→29 mm (longest diameter).\n  • T2: Metastasis — 25→14 mm (longest diameter).\n  • T3: Metastasis — 10→5 mm (longest diameter).\n  • T4: Lymph node — 20→11 mm (short axis).\n- SLD baseline: 109 mm.\n- SLD current: 59 mm (-45.9% change).\n- New lesions: absent (unequivocal).\n- - RECIST 1.1 overall response category: PR.\n"}
{"patient_id": "PID000005", "study_date": "2023-06-22", "timepoint": 0, "recist": {"baseline_sld_mm": 95, "current_sld_mm": null, "nadir_sld_mm": null, "overall_response": "Baseline (no category)"}, "lesions": [{"lesion_id": "primary:pancreas", "kind": "primary", "organ": "pancreas", "location": "tail of the pancreas", "rule": "longest", "baseline_mm": 38, "follow_mm": null, "size_mm_current": 38, "margin": "lobulated", "enhancement": "hypoenhancing", "suspicious": true, "target": true}, {"lesion_id": "ln:left hilar", "kind": "ln", "organ": "lymph", "station": "left hilar", "rule": "short_axis", "baseline_mm": 22, "follow_mm": null, "size_mm_current": 22, "necrosis": false, "suspicious": true, "target": true}, {"lesion_id": "met:bone", "kind": "met", "organ": "bone", "rule": "longest", "baseline_mm": 35, "follow_mm": null, "size_mm_current": 35, "suspicious": true, "target": true}], "complexity_profile": {"level": 2, "level_name": "C2", "artifact": {"key": "motion_mild", "impact": 1, "report_phrase": "Respiratory motion artifact partially limits assessment.", "severity_rank": 2}}, "staging_relevance": -2.0, "incidentals": [{"organ": "gi.colon", "text": "small benign polyp"}, {"organ": "aorta_great_vessels", "text": "mild aortic atherosclerosis"}, {"organ": "liver", "text": "simple cyst"}], "negatives": [{"organ": "reproductive", "text": "prostate is normal / no prostatic mass"}, {"organ": "bladder", "text": "no focal bladder wall thickening"}, {"organ": "pleura", "text": "no pleural effusion"}, {"organ": "liver", "text": "liver is normal"}, {"organ": "lung", "text": "no pleural effusion"}], "post_treatment": ["Radiation change: consolidation conforming to beam path"], "report_text": "FINDINGS:\nRespiratory motion artifact partially limits assessment.\nLungs: Clear lungs without focal mass. No suspicious nodules identified. no pleural effusion. Post-treatment change: consolidation conforming to beam path.\nMediastinum: Enlarged left hilar lymph node, short axis 22 mm. Cardiomediastinal contours within normal limits.\nPleura/Pleural spaces: No pleural effusion or pleural thickening.\nGreat vessels/Aorta: No thoracic aortic aneurysm or dissection. mild aortic atherosclerosis.\nLiver: No focal hepatic lesions. Normal attenuation. simple cyst. liver is normal.\nSpleen: Normal in size and attenuation. No focal splenic lesion.\nPancreas: 3.8 cm lobulated pancreatic mass in the tail of the pancreas (hypoenhancing). Normal pancreatic contour and enhancement. No focal mass.\nAdrenal glands: Adrenal glands are normal without nodules.\nKidneys: No hydronephrosis. No enhancing renal mass.\nGI tract/Bowel: No obstructive process. No focal bowel wall mass identified. small benign polyp.\nMesentery/Omentum: No ascites. No omental caking.\nMesenteric vessels (SMA/SMV): SMA/SMV are patent without thrombosis.\nUrinary bladder: Unremarkable. no focal bladder wall thickening.\nReproductive organs: No adnexal mass. Uterus/prostate within expected size for age. prostate is normal / no prostatic mass.\nLymph nodes: No pathologically enlarged lymph nodes by size criteria.\nBones/Osseous structures: Sclerotic osseous metastasis—nonmeasurable by RECIST (blastic). No aggressive osseous lesion. No acute fracture.\n\nIMPRESSION:\n- Pancreas primary neoplasm (indeterminate) at tail of the pancreas measuring approximately 38 mm.\n- Findings concerning for nodal involvement.\n- Findings compatible with distant metastases involving: bone.\n- RECIST 1.1 Summary:\n- Target lesions (n=3; ≤2 per organ rule applied).\n  • T1: Primary — 38 mm (longest diameter) at baseline.\n  • T2: Metastasis — 35 mm (longest diameter) at baseline.\n  • T3: Lymph node — 22 mm (short axis) at baseline.\n- SLD baseline: 95 mm.\n- New lesions: absent (unequivocal).\n- - RECIST 1.1 overall response category: Baseline (no category).\n\nComment: Some features are indeterminate for; short-interval follow-up or problem-solving imaging may be considered.\n"}
{"patient_id": "PID000005", "study_date": "2023-08-21", "timepoint": 1, "recist": {"baseline_sld_mm": 95, "current_sld_mm": 66, "nadir_sld_mm": 66, "overall_response": "PD"}, "lesions": [{"lesion_id": "primary:pancreas", "kind": "primary", "organ": "pancreas", "location": "tail of the pancreas", "rule": "longest", "baseline_mm": 38, "follow_mm": 26, "size_mm_current": 26, "margin": "lobulated", "enhancement": "hypoenhancing", "suspicious": true, "target": true}, {"lesion_id": "ln:left hilar", "kind": "ln", "organ": "lymph", "station": "left hilar", "rule": "short_axis", "baseline_mm": 22, "follow_mm": 15, "size_mm_current": 15, "necrosis": false, "suspicious": true, "target": true}, {"lesion_id": "met:bone", "kind": "met", "organ": "bone", "rule": "longest", "baseline_mm": 35, "follow_mm": 25, "size_mm_current": 25, "suspicious": true, "target": true}], "complexity_profile": {"level": 2, "level_name": "C2", "artifact": null}, "staging_relevance": 23.0, "incidentals": [{"organ": "bones", "text": "degenerative changes"}, {"organ": "lung", "text": "subpleural reticulation"}, {"organ": "mediastinum", "text": "prominent but subthreshold lymph nodes"}], "negatives": [{"organ": "bones", "text": "no destructive osseous lesion"}, {"organ": "adrenals", "text": "adrenal glands normal"}, {"organ": "bladder", "text": "no focal bladder wall thickening"}, {"organ": "kidneys", "text": "no renal mass"}, {"organ": "lung", "text": "lungs are normal"}], "post_treatment": [], "report_text": "FINDINGS:\nComparison: 2023-06-22.\nLungs: Clear lungs without focal mass. No suspicious nodules identified. subpleural reticulation. lungs are normal.\nMediastinum: Enlarged left hilar lymph node, short axis 15 mm. Cardiomediastinal contours within normal limits. prominent but subthreshold lymph nodes.\nPleura/Pleural spaces: No pleural effusion or pleural thickening.\nGreat vessels/Aorta: No thoracic aortic aneurysm or dissection.\nLiver: No focal hepatic lesions. Normal attenuation.\nSpleen: Normal in size and attenuation. No focal splenic lesion.\nPancreas: 26 mm lobulated pancreatic mass in the tail of the pancreas (hypoenhancing). Normal pancreatic contour and enhancement. No focal mass.\nAdrenal glands: Adrenal glands are normal without nodules. adrenal glands normal.\nKidneys: No hydronephrosis. No enhancing renal mass. no renal mass.\nGI tract/Bowel: No obstructive process. No focal bowel wall mass identified.\nMesentery/Omentum: No ascites. No omental caking.\nMesenteric vessels (SMA/SMV): SMA/SMV are patent without thrombosis.\nUrinary bladder: Unremarkable. no focal bladder wall thickening.\nReproductive organs: No adnexal mass. Uterus/prostate within expected size for age.\nLymph nodes: No pathologically enlarged lymph nodes by size criteria.\nBones/Osseous structures: Sclerotic osseous metastasis—nonmeasurable by RECIST (blastic). No aggressive osseous lesion. No acute fracture. degenerative changes. no destructive osseous lesion.\n\nIMPRESSION:\n- Pancreas primary neoplasm (indeterminate) at tail of the pancreas measuring approximately 26 mm.\n- Findings concerning for nodal involvement.\n- Findings compatible with distant metastases involving: bone.\n- RECIST 1.1 Summary:\n- Target lesions (n=3; ≤2 per organ rule applied).\n  • T1: Primary — 38→26 mm (longest diameter).\n  • T2: Metastasis — 35→25 mm (longest diameter).\n  • T3: Lymph node — 22→15 mm (short axis).\n- SLD baseline: 95 mm.\n- SLD current: 66 mm (-30.5% change).\n- New lesions: present (unequivocal).\n- - RECIST 1.1 overall response category: PD.\n\nComment: Some features are probable; short-interval follow-up or problem-solving imaging may be considered.\n"}
{"patient_id": "PID000005", "study_date": "2023-10-16", "timepoint": 2, "recist": {"baseline_sld_mm": 95, "current_sld_mm": 93, "nadir_sld_mm": 66, "overall_response": "PD"}, "lesions": [{"lesion_id": "primary:pancreas", "kind": "primary", "organ": "pancreas", "location": "tail of the pancreas", "rule": "longest", "baseline_mm": 38, "follow_mm": 39, "size_mm_current": 39, "margin": "lobulated", "enhancement": "hypoenhancing", "suspicious": true, "target": true}, {"lesion_id": "ln:left hilar", "kind": "ln", "organ": "lymph", "station": "left hilar", "rule": "short_axis", "baseline_mm": 22, "follow_mm": 21, "size_mm_current": 21, "necrosis": false, "suspicious": true, "target": true}, {"lesion_id": "met:bone", "kind": "met", "organ": "bone", "rule": "longest", "baseline_mm": 35, "follow_mm": 33, "size_mm_current": 33, "suspicious": true, "target": true}], "complexity_profile": {"level": 2, "level_name": "C2", "artifact": null}, "staging_relevance": 18.0, "incidentals": [{"organ": "kidneys", "text": "angiomyolipoma (macroscopic fat)"}], "negatives": [{"organ": "liver", "text": "no hepatic mass"}, {"organ": "mediastinum", "text": "no pathologic mediastinal lymphadenopathy"}, {"organ": "spleen", "text": "no focal splenic lesion"}, {"organ": "pancreas", "text": "pancreas is normal"}, {"organ": "gi", "text": "no colonic mass"}], "post_treatment": [], "report_text": "FINDINGS:\nComparison: 2023-08-21.\nPulmonary parenchyma: Clear lungs without focal mass. No suspicious nodules identified.\nMediastinum: Enlarged left hilar lymph node, short axis 21 mm. Cardiomediastinal contours within normal limits. no pathologic mediastinal lymphadenopathy.\nPleura/Pleural spaces: No pleural effusion or pleural thickening.\nGreat vessels/Aorta: No thoracic aortic aneurysm or dissection.\nLiver: No focal hepatic lesions. Normal attenuation. no hepatic mass.\nSpleen: Normal in size and attenuation. No focal splenic lesion.\nPancreas: 39 mm lobulated pancreatic mass in the tail of the pancreas (hypoenhancing). Normal pancreatic contour and enhancement. No focal mass. pancreas is normal.\nAdrenal glands: Adrenal glands are normal without nodules.\nKidneys: No hydronephrosis. No enhancing renal mass. angiomyolipoma (macroscopic fat).\nGI tract/Bowel: No obstructive process. No focal bowel wall mass identified. no colonic mass.\nMesentery/Omentum: No ascites. No omental caking.\nMesenteric vessels (SMA/SMV): SMA/SMV are patent without thrombosis.\nUrinary bladder: Unremarkable.\nReproductive organs: No adnexal mass. Uterus/prostate within expected size for age.\nLymph nodes: No pathologically enlarged lymph nodes by size criteria.\nBones/Osseous structures: Sclerotic osseous metastasis—nonmeasurable by RECIST (blastic). No aggressive osseous lesion. No acute fracture.\n\nIMPRESSION:\n- Pancreas primary neoplasm (indeterminate) at tail of the pancreas measuring approximately 39 mm.\n- Findings concerning for nodal involvement.\n- Findings compatible with distant metastases involving: bone.\n- RECIST 1.1 Summary:\n- Target lesions (n=3; ≤2 per organ rule applied).\n  • T1: Primary — 38→39 mm (longest diameter).\n  • T2: Metastasis — 35→33 mm (longest diameter).\n  • T3: Lymph node — 22→21 mm (short axis).\n- SLD baseline: 95 mm.\n- SLD current: 93 mm (-2.1% change).\n- New lesions: absent (unequivocal).\n- - RECIST 1.1 overall response category: PD.\n\nComment: Some features are diagnostic of; short-interval follow-up or problem-solving imaging may be considered.\n"}
{"patient_id": "PID000005", "study_date": "2023-12-11", "timepoint": 3, "recist": {"baseline_sld_mm": 95, "current_sld_mm": 119, "nadir_sld_mm": 66, "overall_response": "PD"}, "lesions": [{"lesion_id": "primary:pancreas", "kind": "primary", "organ": "pancreas", "location": "tail of the pancreas", "rule": "longest", "baseline_mm": 38, "follow_mm": 49, "size_mm_current": 49, "margin": "lobulated", "enhancement": "hypoenhancing", "suspicious": true, "target": true}, {"lesion_id": "ln:left hilar", "kind": "ln", "organ": "lymph", "station": "left hilar", "rule": "short_axis", "baseline_mm": 22, "follow_mm": 28, "size_mm_current": 28, "necrosis": false, "suspicious": true, "target": true}, {"lesion_id": "met:bone", "kind": "met", "organ": "bone", "rule": "longest", "baseline_mm": 35, "follow_mm": 42, "size_mm_current": 42, "suspicious": true, "target": true}], "complexity_profile": {"level": 2, "level_name": "C2", "artifact": null}, "staging_relevance": 19.0, "incidentals": [{"organ": "kidneys", "text": "Bosniak I cyst"}, {"organ": "pancreas", "text": "side-branch IPMN (no worrisome features)"}], "negatives": [{"organ": "aorta_great_vessels", "text": "no aneurysm or dissection"}, {"organ": "mediastinum", "text": "no mediastinal mass"}, {"organ": "lung", "text": "no pleural effusion"}, {"organ": "pleura", "text": "no pleural nodularity"}, {"organ": "adrenals", "text": "no adrenal nodule"}], "post_treatment": [], "report_text": "FINDINGS:\nComparison: 2023-10-16.\nPulmonary parenchyma: Clear lungs without focal mass. No suspicious nodules identified.\nMediastinum: Enlarged left hilar lymph node, short axis 2.8 cm. Cardiomediastinal contours within normal limits. no mediastinal mass.\nPleura/Pleural spaces: No pleural effusion or pleural thickening. no pleural nodularity.\nGreat vessels/Aorta: No thoracic aortic aneurysm or dissection. no aneurysm or dissection.\nLiver: No focal hepatic lesions. Normal attenuation.\nSpleen: Normal in size and attenuation. No focal splenic lesion.\nPancreas: 4.9 cm lobulated pancreatic mass in the tail of the pancreas (hypoenhancing). Normal pancreatic contour and enhancement. No focal mass. side-branch IPMN (no worrisome features).\nAdrenal glands: Adrenal glands are normal without nodules. no adrenal nodule.\nKidneys: No hydronephrosis. No enhancing renal mass. Bosniak I cyst.\nGI tract/Bowel: No obstructive process. No focal bowel wall mass identified.\nMesentery/Omentum: No ascites. No omental caking.\nMesenteric vessels (SMA/SMV): SMA/SMV are patent without thrombosis.\nUrinary bladder: Unremarkable.\nReproductive organs: No adnexal mass. Uterus/prostate within expected size for age.\nLymph nodes: No pathologically enlarged lymph nodes by size criteria.\nBones/Osseous structures: 42 mm lesion in the bone, suspicious for metastasis. No aggressive osseous lesion. No acute fracture.\n\nIMPRESSION:\n- Pancreas primary malignancy at tail of the pancreas measuring approximately 49 mm.\n- Findings concerning for nodal involvement.\n- Findings compatible with distant metastases involving: bone.\n- RECIST 1.1 Summary:\n- Target lesions (n=3; ≤2 per organ rule applied).\n  • T1: Primary — 38→49 mm (longest diameter).\n  • T2: Metastasis — 35→42 mm (longest diameter).\n  • T3: Lymph node — 22→28 mm (short axis).\n- SLD baseline: 95 mm.\n- SLD current: 119 mm (+25.3% change).\n- New lesions: absent (unequivocal).\n- - RECIST 1.1 overall response category: PD.\n"}
{"patient_id": "PID000006", "study_date": "2023-03-21", "timepoint": 0, "recist": {"baseline_sld_mm": 97, "current_sld_mm": null, "nadir_sld_mm": null, "overall_response": "Baseline (no category)"}, "lesions": [{"lesion_id": "primary:prostate", "kind": "primary", "organ": "prostate", "location": "prostate gland, peripheral zone", "rule": "longest", "baseline_mm": 79, "follow_mm": null, "size_mm_current": 79, "margin": "smooth", "enhancement": "hyperenhancing", "suspicious": true, "target": true}, {"lesion_id": "ln:celiac", "kind": "ln", "organ": "lymph", "station": "celiac", "rule": "short_axis", "baseline_mm": 18, "follow_mm": null, "size_mm_current": 18, "necrosis": false, "suspicious": true, "target": true}, {"lesion_id": "ln:obturator", "kind": "ln", "organ": "lymph", "station": "obturator", "rule": "short_axis", "baseline_mm": null, "follow_mm": null, "size_mm_current": 10, "necrosis": false, "suspicious": true, "target": false}], "complexity_profile": {"level": 2, "level_name": "C2", "artifact": null}, "staging_relevance": 0.0, "incidentals": [{"organ": "pleura", "text": "pleural calcifications"}, {"organ": "aorta_great_vessels", "text": "mild aortic atherosclerosis"}, {"organ": "kidneys", "text": "angiomyolipoma (macroscopic fat)"}], "negatives": [{"organ": "bones", "text": "no destructive osseous lesion"}, {"organ": "bladder", "text": "no focal bladder wall thickening"}, {"organ": "lung", "text": "no pulmonary abnormality"}, {"organ": "mesentery_peritoneum", "text": "no peritoneal nodularity"}, {"organ": "mediastinum", "text": "no mediastinal mass"}], "post_treatment": [], "report_text": "FINDINGS:\nPulmonary parenchyma: Clear lungs without focal mass. No suspicious nodules identified.\nMediastinum: Cardiomediastinal contours within normal limits. no mediastinal mass.\nPleura/Pleural spaces: No pleural effusion or pleural thickening. pleural calcifications.\nGreat vessels/Aorta: No thoracic aortic aneurysm or dissection. mild aortic atherosclerosis.\nLiver: No focal hepatic lesions. Normal attenuation.\nSpleen: Normal in size and attenuation. No focal splenic lesion.\nPancreas: Normal pancreatic contour and enhancement. No focal mass.\nAdrenal glands: Adrenal glands are normal without nodules.\nKidneys: No hydronephrosis. No enhancing renal mass. angiomyolipoma (macroscopic fat).\nGI tract/Bowel: No obstructive process. No focal bowel wall mass identified.\nMesentery/Omentum: No ascites. No omental caking. no peritoneal nodularity.\nMesenteric vessels (SMA/SMV): SMA/SMV are patent without thrombosis.\nUrinary bladder: Unremarkable. no focal bladder wall thickening.\nReproductive organs: 79 mm smooth mass within the prostate gland, peripheral zone. No adnexal mass. Uterus/prostate within expected size for age.\nLymph nodes: Enlarged celiac lymph node, short axis 18 mm. Enlarged obturator lymph node, short axis 10 mm. No pathologically enlarged lymph nodes by size criteria.\nBones/Osseous structures: No aggressive osseous lesion. No acute fracture. no destructive osseous lesion.\n\nIMPRESSION:\n- Prostate primary malignancy at prostate gland, peripheral zone measuring approximately 79 mm.\n- Findings concerning for nodal involvement.\n- No definite distant metastases identified.\n- RECIST 1.1 Summary:\n- Target lesions (n=2; ≤2 per organ rule applied).\n  • T1: Primary — 79 mm (longest diameter) at baseline.\n  • T2: Lymph node — 18 mm (short axis) at baseline.\n- SLD baseline: 97 mm.\n- New lesions: absent (unequivocal).\n- - RECIST 1.1 overall response category: Baseline (no category).\n"}
{"patient_id": "PID000006", "study_date": "2023-05-11", "timepoint": 1, "recist": {"baseline_sld_mm": 97, "current_sld_mm": 109, "nadir_sld_mm": 97, "overall_response": "SD"}, "lesions": [{"lesion_id": "primary:prostate", "kind": "primary", "organ": "prostate", "location": "prostate gland, peripheral zone", "rule": "longest", "baseline_mm": 79, "follow_mm": 89, "size_mm_current": 89, "margin": "smooth", "enhancement": "hyperenhancing", "suspicious": true, "target": true}, {"lesion_id": "ln:celiac", "kind": "ln", "organ": "lymph", "station": "celiac", "rule": "short_axis", "baseline_mm": 18, "follow_mm": 20, "size_mm_current": 20, "necrosis": false, "suspicious": true, "target": true}, {"lesion_id": "ln:obturator", "kind": "ln", "organ": "lymph", "station": "obturator", "rule": "short_axis", "baseline_mm": null, "follow_mm": null, "size_mm_current": 10, "necrosis": false, "suspicious": true, "target": false}], "complexity_profile": {"level": 2, "level_name": "C2", "artifact": {"key": "beam_hardening", "impact": 2, "report_phrase": "Beam-hardening streak artifact from dense structures limits evaluation.", "severity_rank": 3}}, "staging_relevance": 4.0, "incidentals": [{"organ": "kidneys", "text": "Bosniak I cyst"}, {"organ": "liver", "text": "simple cyst"}, {"organ": "aorta_great_vessels", "text": "mild aortic atherosclerosis"}], "negatives": [{"organ": "adrenals", "text": "no adrenal nodule"}, {"organ": "kidneys", "text": "kidneys are normal"}, {"organ": "bones", "text": "no destructive osseous lesion"}, {"organ": "mesentery_peritoneum", "text": "no peritoneal nodularity"}, {"organ": "liver", "text": "no hepatic mass"}], "post_treatment": [], "report_text": "FINDINGS:\nBeam-hardening streak artifact from dense structures limits evaluation.\nComparison: 2023-03-21.\nPulmonary parenchyma: No focal consolidation or suspicious pulmonary nodules. No pneumothorax.\nMediastinum: Cardiomediastinal contours within normal limits.\nPleura/Pleural spaces: No pleural effusion or pleural thickening.\nGreat vessels/Aorta: No thoracic aortic aneurysm or dissection. mild aortic atherosclerosis.\nLiver: No focal hepatic lesions. Normal attenuation. simple cyst. no hepatic mass.\nSpleen: Normal in size and attenuation. No focal splenic lesion.\nPancreas: Normal pancreatic contour and enhancement. No focal mass.\nAdrenal glands: Adrenal glands are normal without nodules. no adrenal nodule.\nKidneys: No hydronephrosis. No enhancing renal mass. Bosniak I cyst. kidneys are normal.\nGI tract/Bowel: No obstructive process. No focal bowel wall mass identified.\nMesentery/Omentum: No ascites. No omental caking. no peritoneal nodularity.\nMesenteric vessels (SMA/SMV): SMA/SMV are patent without thrombosis.\nUrinary bladder: Unremarkable.\nReproductive organs: 89 mm smooth mass within the prostate gland, peripheral zone. No adnexal mass. Uterus/prostate within expected size for age.\nLymph nodes: Enlarged celiac lymph node, short axis 20 mm. Enlarged obturator lymph node, short axis 10 mm. No pathologically enlarged lymph nodes by size criteria.\nBones/Osseous structures: No aggressive osseous lesion. No acute fracture. no destructive osseous lesion.\n\nIMPRESSION:\n- Prostate primary malignancy at prostate gland, peripheral zone measuring approximately 89 mm.\n- Findings concerning for nodal involvement.\n- No definite distant metastases identified.\n- RECIST 1.1 Summary:\n- Target lesions (n=2; ≤2 per organ rule applied).\n  • T1: Primary — 79→89 mm (longest diameter).\n  • T2: Lymph node — 18→20 mm (short axis).\n- SLD baseline: 97 mm.\n- SLD current: 109 mm (+12.4% change).\n- New lesions: absent (unequivocal).\n- - RECIST 1.1 overall response category: SD.\n"}
{"patient_id": "PID000006", "study_date": "2023-07-11", "timepoint": 2, "recist": {"baseline_sld_mm": 97, "current_sld_mm": 132, "nadir_sld_mm": 97, "overall_response": "PD"}, "lesions": [{"lesion_id": "primary:prostate", "kind": "primary", "organ": "prostate", "location": "prostate gland, peripheral zone", "rule": "longest", "baseline_mm": 79, "follow_mm": 109, "size_mm_current": 109, "margin": "smooth", "enhancement": "hyperenhancing", "suspicious": true, "target": true}, {"lesion_id": "ln:celiac", "kind": "ln", "organ": "lymph", "station": "celiac", "rule": "short_axis", "baseline_mm": 18, "follow_mm": 23, "size_mm_current": 23, "necrosis": false, "suspicious": true, "target": true}, {"lesion_id": "ln:obturator", "kind": "ln", "organ": "lymph", "station": "obturator", "rule": "short_axis", "baseline_mm": null, "follow_mm": null, "size_mm_current": 10, "necrosis": false, "suspicious": true, "target": false}], "complexity_profile": {"level": 2, "level_name": "C2", "artifact": null}, "staging_relevance": 29.0, "incidentals": [{"organ": "pleura", "text": "trace effusion"}, {"organ": "kidneys", "text": "Bosniak I cyst"}, {"organ": "kidneys", "text": "Bosniak I cyst"}], "negatives": [{"organ": "pleura", "text": "no pleural nodularity"}, {"organ": "pancreas", "text": "no pancreatic mass"}, {"organ": "bladder", "text": "no focal bladder wall thickening"}, {"organ": "liver", "text": "no hepatic mass"}, {"organ": "mesentery_peritoneum", "text": "no ascites"}], "post_treatment": [], "report_text": "FINDINGS:\nComparison: 2023-05-11.\nLungs: No focal consolidation or suspicious pulmonary nodules. No pneumothorax.\nMediastinum: Cardiomediastinal contours within normal limits.\nPleura/Pleural spaces: No pleural effusion or pleural thickening. trace effusion. no pleural nodularity.\nGreat vessels/Aorta: No thoracic aortic aneurysm or dissection.\nLiver: No focal hepatic lesions. Normal attenuation. no hepatic mass.\nSpleen: Normal in size and attenuation. No focal splenic lesion.\nPancreas: Normal pancreatic contour and enhancement. No focal mass. no pancreatic mass.\nAdrenal glands: Adrenal glands are normal without nodules.\nKidneys: No hydronephrosis. No enhancing renal mass. Bosniak I cyst.\nGI tract/Bowel: No obstructive process. No focal bowel wall mass identified.\nMesentery/Omentum: No ascites. No omental caking.\nMesenteric vessels (SMA/SMV): SMA/SMV are patent without thrombosis.\nUrinary bladder: Unremarkable. no focal bladder wall thickening.\nReproductive organs: 10.9 cm smooth mass within the prostate gland, peripheral zone. No adnexal mass. Uterus/prostate within expected size for age.\nLymph nodes: Enlarged celiac lymph node, short axis 23 mm. Enlarged obturator lymph node, short axis 10 mm. No pathologically enlarged lymph nodes by size criteria.\nBones/Osseous structures: No aggressive osseous lesion. No acute fracture.\n\nIMPRESSION:\n- Prostate primary malignancy at prostate gland, peripheral zone measuring approximately 109 mm.\n- Findings concerning for nodal involvement.\n- No definite distant metastases identified.\n- RECIST 1.1 Summary:\n- Target lesions (n=2; ≤2 per organ rule applied).\n  • T1: Primary — 79→109 mm (longest diameter).\n  • T2: Lymph node — 18→23 mm (short axis).\n- SLD baseline: 97 mm.\n- SLD current: 132 mm (+36.1% change).\n- New lesions: present (unequivocal).\n- - RECIST 1.1 overall response category: PD.\n"}
{"patient_id": "PID000006", "study_date": "2023-09-08", "timepoint": 3, "recist": {"baseline_sld_mm": 97, "current_sld_mm": 139, "nadir_sld_mm": 97, "overall_response": "PD"}, "lesions": [{"lesion_id": "primary:prostate", "kind": "primary", "organ": "prostate", "location": "prostate gland, peripheral zone", "rule": "longest", "baseline_mm": 79, "follow_mm": 114, "size_mm_current": 114, "margin": "smooth", "enhancement": "hyperenhancing", "suspicious": true, "target": true}, {"lesion_id": "ln:celiac", "kind": "ln", "organ": "lymph", "station": "celiac", "rule": "short_axis", "baseline_mm": 18, "follow_mm": 25, "size_mm_current": 25, "necrosis": false, "suspicious": true, "target": true}, {"lesion_id": "ln:obturator", "kind": "ln", "organ": "lymph", "station": "obturator", "rule": "short_axis", "baseline_mm": null, "follow_mm": null, "size_mm_current": 10, "necrosis": false, "suspicious": true, "target": false}], "complexity_profile": {"level": 2, "level_name": "C2", "artifact": null}, "staging_relevance": 29.0, "incidentals": [{"organ": "spleen", "text": "tiny cyst"}, {"organ": "adrenals", "text": "lipid-rich adenoma"}], "negatives": [{"organ": "reproductive", "text": "prostate is normal / no prostatic mass"}, {"organ": "liver", "text": "no hepatic mass"}, {"organ": "mesentery_peritoneum", "text": "no peritoneal nodularity"}, {"organ": "aorta_great_vessels", "text": "no aneurysm or dissection"}, {"organ": "adrenals", "text": "no adrenal nodule"}], "post_treatment": [], "report_text": "FINDINGS:\nComparison: 2023-07-11.\nPulmonary parenchyma: No focal consolidation or suspicious pulmonary nodules. No pneumothorax.\nMediastinum: Cardiomediastinal contours within normal limits.\nPleura/Pleural spaces: No pleural effusion or pleural thickening.\nGreat vessels/Aorta: No thoracic aortic aneurysm or dissection. no aneurysm or dissection.\nLiver: No focal hepatic lesions. Normal attenuation. no hepatic mass.\nSpleen: Normal in size and attenuation. No focal splenic lesion. tiny cyst.\nPancreas: Normal pancreatic contour and enhancement. No focal mass.\nAdrenal glands: Adrenal glands are normal without nodules. lipid-rich adenoma. no adrenal nodule.\nKidneys: No hydronephrosis. No enhancing renal mass.\nGI tract/Bowel: No obstructive process. No focal bowel wall mass identified.\nMesentery/Omentum: No ascites. No omental caking. no peritoneal nodularity.\nMesenteric vessels (SMA/SMV): SMA/SMV are patent without thrombosis.\nUrinary bladder: Unremarkable.\nReproductive organs: 114 mm smooth mass within the prostate gland, peripheral zone. No adnexal mass. Uterus/prostate within expected size for age. prostate is normal / no prostatic mass.\nLymph nodes: Enlarged celiac lymph node, short axis 25 mm. Enlarged obturator lymph node, short axis 1.0 cm. No pathologically enlarged lymph nodes by size criteria.\nBones/Osseous structures: No aggressive osseous lesion. No acute fracture.\n\nIMPRESSION:\n- Prostate primary malignancy at prostate gland, peripheral zone measuring approximately 114 mm.\n- Findings concerning for nodal involvement.\n- No definite distant metastases identified.\n- RECIST 1.1 Summary:\n- Target lesions (n=2; ≤2 per organ rule applied).\n  • T1: Primary — 79→114 mm (longest diameter).\n  • T2: Lymph node — 18→25 mm (short axis).\n- SLD baseline: 97 mm.\n- SLD current: 139 mm (+43.3% change).\n- New lesions: present (unequivocal).\n- - RECIST 1.1 overall response category: PD.\n"}
{"patient_id": "PID000006", "study_date": "2023-10-22", "timepoint": 4, "recist": {"baseline_sld_mm": 97, "current_sld_mm": 134, "nadir_sld_mm": 97, "overall_response": "PD"}, "lesions": [{"lesion_id": "primary:prostate", "kind": "primary", "organ": "prostate", "location": "prostate gland, peripheral zone", "rule": "longest", "baseline_mm": 79, "follow_mm": 110, "size_mm_current": 110, "margin": "smooth", "enhancement": "hyperenhancing", "suspicious": true, "target": true}, {"lesion_id": "ln:celiac", "kind": "ln", "organ": "lymph", "station": "celiac", "rule": "short_axis", "baseline_mm": 18, "follow_mm": 24, "size_mm_current": 24, "necrosis": false, "suspicious": true, "target": true}, {"lesion_id": "ln:obturator", "kind": "ln", "organ": "lymph", "station": "obturator", "rule": "short_axis", "baseline_mm": null, "follow_mm": null, "size_mm_current": 10, "necrosis": false, "suspicious": true, "target": false}], "complexity_profile": {"level": 2, "level_name": "C2", "artifact": {"key": "beam_hardening", "impact": 2, "report_phrase": "Beam-hardening streak artifact from dense structures limits evaluation.", "severity_rank": 3}}, "staging_relevance": 26.0, "incidentals": [{"organ": "spleen", "text": "tiny cyst"}], "negatives": [{"organ": "kidneys", "text": "no renal mass"}, {"organ": "mesentery_peritoneum", "text": "no ascites"}, {"organ": "reproductive", "text": "ovaries are normal / no adnexal abnormality"}, {"organ": "lung", "text": "no suspicious pulmonary nodule"}, {"organ": "pleura", "text": "no pleural nodularity"}], "post_treatment": [], "report_text": "FINDINGS:\nBeam-hardening streak artifact from dense structures limits evaluation.\nComparison: 2023-09-08.\nLungs: Clear lungs without focal mass. No suspicious nodules identified. no suspicious pulmonary nodule.\nMediastinum: Cardiomediastinal contours within normal limits.\nPleura/Pleural spaces: No pleural effusion or pleural thickening. no pleural nodularity.\nGreat vessels/Aorta: No thoracic aortic aneurysm or dissection.\nLiver: No focal hepatic lesions. Normal attenuation.\nSpleen: Normal in size and attenuation. No focal splenic lesion. tiny cyst.\nPancreas: Normal pancreatic contour and enhancement. No focal mass.\nAdrenal glands: Adrenal glands are normal without nodules.\nKidneys: No hydronephrosis. No enhancing renal mass. no renal mass.\nGI tract/Bowel: No obstructive process. No focal bowel wall mass identified.\nMesentery/Omentum: No ascites. No omental caking.\nMesenteric vessels (SMA/SMV): SMA/SMV are patent without thrombosis.\nUrinary bladder: Unremarkable.\nReproductive organs: 11.0 cm smooth mass within the prostate gland, peripheral zone. No adnexal mass. Uterus/prostate within expected size for age. ovaries are normal / no adnexal abnormality.\nLymph nodes: Enlarged celiac lymph node, short axis 24 mm. Enlarged obturator lymph node, short axis 10 mm. No pathologically enlarged lymph nodes by size criteria.\nBones/Osseous structures: No aggressive osseous lesion. No acute fracture.\n\nIMPRESSION:\n- Prostate primary neoplasm (indeterminate) at prostate gland, peripheral zone measuring approximately 110 mm.\n- Findings concerning for nodal involvement.\n- No definite distant metastases identified.\n- RECIST 1.1 Summary:\n- Target lesions (n=2; ≤2 per organ rule applied).\n  • T1: Primary — 79→110 mm (longest diameter).\n  • T2: Lymph node — 18→24 mm (short axis).\n- SLD baseline: 97 mm.\n- SLD current: 134 mm (+38.1% change).\n- New lesions: present (unequivocal).\n- - RECIST 1.1 overall response category: PD.\n\nComment: Some features are favored to represent; short-interval follow-up or problem-solving imaging may be considered.\n"}
{"patient_id": "PID000007", "study_date": "2023-04-05", "timepoint": 0, "recist": {"baseline_sld_mm": 118, "current_sld_mm": null, "nadir_sld_mm": null, "overall_response": "Baseline (no category)"}, "lesions": [{"lesion_id": "primary:liver", "kind": "primary", "organ": "liver", "location": "segment 7 of the liver", "rule": "longest", "baseline_mm": 61, "follow_mm": null, "size_mm_current": 61, "margin": "lobulated", "enhancement": "hyperenhancing", "suspicious": true, "target": true}, {"lesion_id": "ln:paratracheal", "kind": "ln", "organ": "lymph", "station": "paratracheal", "rule": "short_axis", "baseline_mm": 29, "follow_mm": null, "size_mm_current": 29, "necrosis": false, "suspicious": true, "target": true}, {"lesion_id": "met:bone", "kind": "met", "organ": "bone", "rule": "longest", "baseline_mm": 28, "follow_mm": null, "size_mm_current": 28, "suspicious": true, "target": true}], "complexity_profile": {"level": 2, "level_name": "C2", "artifact": null}, "staging_relevance": 0.0, "incidentals": [{"organ": "reproductive.ovary", "text": "simple physiologic cyst"}, {"organ": "liver", "text": "hemangioma (peripheral nodular enhancement with centripetal fill-in)"}, {"organ": "spleen", "text": "accessory spleen"}], "negatives": [{"organ": "gi", "text": "no colonic mass"}, {"organ": "reproductive", "text": "prostate is normal / no prostatic mass"}, {"organ": "bladder", "text": "urinary bladder normal"}, {"organ": "mediastinum", "text": "no mediastinal mass"}, {"organ": "kidneys", "text": "kidneys are normal"}], "post_treatment": [], "report_text": "FINDINGS:\nLungs: Clear lungs without focal mass. No suspicious nodules identified.\nMediastinum: Enlarged paratracheal lymph node, short axis 29 mm. Cardiomediastinal contours within normal limits. no mediastinal mass.\nPleura/Pleural spaces: No pleural effusion or pleural thickening.\nGreat vessels/Aorta: No thoracic aortic aneurysm or dissection.\nLiver: 61 mm lobulated hepatic mass in segment 7 of the liver (hyperenhancing). No focal hepatic lesions. Normal attenuation. hemangioma (peripheral nodular enhancement with centripetal fill-in).\nSpleen: Normal in size and attenuation. No focal splenic lesion. accessory spleen.\nPancreas: Normal pancreatic contour and enhancement. No focal mass.\nAdrenal glands: Adrenal glands are normal without nodules.\nKidneys: No hydronephrosis. No enhancing renal mass. kidneys are normal.\nGI tract/Bowel: No obstructive process. No focal bowel wall mass identified. no colonic mass.\nMesentery/Omentum: No ascites. No omental caking.\nMesenteric vessels (SMA/SMV): SMA/SMV are patent without thrombosis.\nUrinary bladder: Unremarkable. urinary bladder normal.\nReproductive organs: No adnexal mass. Uterus/prostate within expected size for age. simple physiologic cyst. prostate is normal / no prostatic mass.\nLymph nodes: No pathologically enlarged lymph nodes by size criteria.\nBones/Osseous structures: 2.8 cm lesion in the bone, suspicious for metastasis. No aggressive osseous lesion. No acute fracture.\n\nIMPRESSION:\n- Liver primary malignancy at segment 7 of the liver measuring approximately 61 mm.\n- Findings concerning for nodal involvement.\n- Findings compatible with distant metastases involving: bone.\n- RECIST 1.1 Summary:\n- Target lesions (n=3; ≤2 per organ rule applied).\n  • T1: Primary — 61 mm (longest diameter) at baseline.\n  • T2: Metastasis — 28 mm (longest diameter) at baseline.\n  • T3: Lymph node — 29 mm (short axis) at baseline.\n- SLD baseline: 118 mm.\n- New lesions: absent (unequivocal).\n- - RECIST 1.1 overall response category: Baseline (no category).\n"}
{"patient_id": "PID000007", "study_date": "2023-06-01", "timepoint": 1, "recist": {"baseline_sld_mm": 118, "current_sld_mm": 75, "nadir_sld_mm": 75, "overall_response": "PR"}, "lesions": [{"lesion_id": "primary:liver", "kind": "primary", "organ": "liver", "location": "segment 7 of the liver", "rule": "longest", "baseline_mm": 61, "follow_mm": 39, "size_mm_current": 39, "margin": "lobulated", "enhancement": "hyperenhancing", "suspicious": true, "target": true}, {"lesion_id": "ln:paratracheal", "kind": "ln", "organ": "lymph", "station": "paratracheal", "rule": "short_axis", "baseline_mm": 29, "follow_mm": 18, "size_mm_current": 18, "necrosis": false, "suspicious": true, "target": true}, {"lesion_id": "met:bone", "kind": "met", "organ": "bone", "rule": "longest", "baseline_mm": 28, "follow_mm": 18, "size_mm_current": 18, "suspicious": true, "target": true}], "complexity_profile": {"level": 2, "level_name": "C2", "artifact": {"key": "partial_volume", "impact": 1, "report_phrase": "Partial volume averaging may obscure small foci.", "severity_rank": 1}}, "staging_relevance": 5.0, "incidentals": [{"organ": "bones", "text": "bone islands"}, {"organ": "gi.stomach", "text": "small benign polyp"}], "negatives": [{"organ": "pancreas", "text": "pancreas is normal"}, {"organ": "mediastinum", "text": "no pathologic mediastinal lymphadenopathy"}, {"organ": "gi", "text": "stomach is normal"}, {"organ": "mesentery_peritoneum", "text": "no ascites"}, {"organ": "kidneys", "text": "no renal mass"}], "post_treatment": ["Post-ablation/embolization change: non-enhancing ablation zone with peripheral halo; contraction over time"], "report_text": "FINDINGS:\nPartial volume averaging may obscure small foci.\nComparison: 2023-04-05.\nPulmonary parenchyma: No focal consolidation or suspicious pulmonary nodules. No pneumothorax.\nMediastinum: Enlarged paratracheal lymph node, short axis 18 mm. Cardiomediastinal contours within normal limits. no pathologic mediastinal lymphadenopathy.\nPleura/Pleural spaces: No pleural effusion or pleural thickening.\nGreat vessels/Aorta: No thoracic aortic aneurysm or dissection.\nLiver: 39 mm lobulated hepatic mass in segment 7 of the liver (hyperenhancing). No focal hepatic lesions. Normal attenuation. Post-ablation/embolization change: non-enhancing ablation zone with peripheral halo; contraction over time.\nSpleen: Normal in size and attenuation. No focal splenic lesion.\nPancreas: Normal pancreatic contour and enhancement. No focal mass. pancreas is normal.\nAdrenal glands: Adrenal glands are normal without nodules.\nKidneys: No hydronephrosis. No enhancing renal mass. no renal mass.\nGI tract/Bowel: No obstructive process. No focal bowel wall mass identified. small benign polyp. stomach is normal.\nMesentery/Omentum: No ascites. No omental caking.\nMesenteric vessels (SMA/SMV): SMA/SMV are patent without thrombosis.\nUrinary bladder: Unremarkable.\nReproductive organs: No adnexal mass. Uterus/prostate within expected size for age.\nLymph nodes: No pathologically enlarged lymph nodes by size criteria.\nBones/Osseous structures: Sclerotic osseous metastasis—nonmeasurable by RECIST (blastic). No aggressive osseous lesion. No acute fracture. bone islands.\n\nIMPRESSION:\n- Liver primary malignancy at segment 7 of the liver measuring approximately 39 mm.\n- Findings concerning for nodal involvement.\n- Findings compatible with distant metastases involving: bone.\n- RECIST 1.1 Summary:\n- Target lesions (n=3; ≤2 per organ rule applied).\n  • T1: Primary — 61→39 mm (longest diameter).\n  • T2: Metastasis — 28→18 mm (longest diameter).\n  • T3: Lymph node — 29→18 mm (short axis).\n- SLD baseline: 118 mm.\n- SLD current: 75 mm (-36.4% change).\n- New lesions: absent (unequivocal).\n- - RECIST 1.1 overall response category: PR.\n"}
{"patient_id": "PID000007", "study_date": "2023-07-17", "timepoint": 2, "recist": {"baseline_sld_mm": 118, "current_sld_mm": 129, "nadir_sld_mm": 75, "overall_response": "PD"}, "lesions": [{"lesion_id": "primary:liver", "kind": "primary", "organ": "liver", "location": "segment 7 of the liver", "rule": "longest", "baseline_mm": 61, "follow_mm": 67, "size_mm_current": 67, "margin": "lobulated", "enhancement": "hyperenhancing", "suspicious": true, "target": true}, {"lesion_id": "ln:paratracheal", "kind": "ln", "organ": "lymph", "station": "paratracheal", "rule": "short_axis", "baseline_mm": 29, "follow_mm": 31, "size_mm_current": 31, "necrosis": false, "suspicious": true, "target": true}, {"lesion_id": "met:bone", "kind": "met", "organ": "bone", "rule": "longest", "baseline_mm": 28, "follow_mm": 31, "size_mm_current": 31, "suspicious": true, "target": true}], "complexity_profile": {"level": 2, "level_name": "C2", "artifact": null}, "staging_relevance": 19.0, "incidentals": [{"organ": "bladder", "text": "under-distension wall thickening"}], "negatives": [{"organ": "gi", "text": "no bowel obstruction"}, {"organ": "bones", "text": "no destructive osseous lesion"}, {"organ": "pancreas", "text": "no pancreatic mass"}, {"organ": "kidneys", "text": "kidneys are normal"}, {"organ": "spleen", "text": "no focal splenic lesion"}], "post_treatment": [], "report_text": "FINDINGS:\nComparison: 2023-06-01.\nPulmonary parenchyma: No focal consolidation or suspicious pulmonary nodules. No pneumothorax.\nMediastinum: Enlarged paratracheal lymph node, short axis 31 mm. Cardiomediastinal contours within normal limits.\nPleura/Pleural spaces: No pleural effusion or pleural thickening.\nGreat vessels/Aorta: No thoracic aortic aneurysm or dissection.\nLiver: 67 mm lobulated hepatic mass in segment 7 of the liver (hyperenhancing). No focal hepatic lesions. Normal attenuation.\nSpleen: Normal in size and attenuation. No focal splenic lesion.\nPancreas: Normal pancreatic contour and enhancement. No focal mass. no pancreatic mass.\nAdrenal glands: Adrenal glands are normal without nodules.\nKidneys: No hydronephrosis. No enhancing renal mass. kidneys are normal.\nGI tract/Bowel: No obstructive process. No focal bowel wall mass identified. no bowel obstruction.\nMesentery/Omentum: No ascites. No omental caking.\nMesenteric vessels (SMA/SMV): SMA/SMV are patent without thrombosis.\nUrinary bladder: Unremarkable. under-distension wall thickening.\nReproductive organs: No adnexal mass. Uterus/prostate within expected size for age.\nLymph nodes: No pathologically enlarged lymph nodes by size criteria.\nBones/Osseous structures: 31 mm lesion in the bone, suspicious for metastasis. No aggressive osseous lesion. No acute fracture. no destructive osseous lesion.\n\nIMPRESSION:\n- Liver primary malignancy at segment 7 of the liver measuring approximately 67 mm.\n- Findings concerning for nodal involvement.\n- Findings compatible with distant metastases involving: bone.\n- RECIST 1.1 Summary:\n- Target lesions (n=3; ≤2 per organ rule applied).\n  • T1: Primary — 61→67 mm (longest diameter).\n  • T2: Metastasis — 28→31 mm (longest diameter).\n  • T3: Lymph node — 29→31 mm (short axis).\n- SLD baseline: 118 mm.\n- SLD current: 129 mm (+9.3% change).\n- New lesions: absent (unequivocal).\n- - RECIST 1.1 overall response category: PD.\n"}
{"patient_id": "PID000007", "study_date": "2023-09-11", "timepoint": 3, "recist": {"baseline_sld_mm": 118, "current_sld_mm": 164, "nadir_sld_mm": 75, "overall_response": "PD"}, "lesions": [{"lesion_id": "primary:liver", "kind": "primary", "organ": "liver", "location": "segment 7 of the liver", "rule": "longest", "baseline_mm": 61, "follow_mm": 84, "size_mm_current": 84, "margin": "lobulated", "enhancement": "hyperenhancing", "suspicious": true, "target": true}, {"lesion_id": "ln:paratracheal", "kind": "ln", "organ": "lymph", "station": "paratracheal", "rule": "short_axis", "baseline_mm": 29, "follow_mm": 41, "size_mm_current": 41, "necrosis": false, "suspicious": true, "target": true}, {"lesion_id": "met:bone", "kind": "met", "organ": "bone", "rule": "longest", "baseline_mm": 28, "follow_mm": 39, "size_mm_current": 39, "suspicious": true, "target": true}], "complexity_profile": {"level": 2, "level_name": "C2", "artifact": null}, "staging_relevance": 29.0, "incidentals": [{"organ": "reproductive.prostate", "text": "BPH"}, {"organ": "bones", "text": "degenerative changes"}, {"organ": "mediastinum", "text": "small thymic remnant"}], "negatives": [{"organ": "reproductive", "text": "prostate is normal / no prostatic mass"}, {"organ": "mesentery_peritoneum", "text": "no peritoneal nodularity"}, {"organ": "adrenals", "text": "no adrenal nodule"}, {"organ": "spleen", "text": "spleen normal size"}, {"organ": "aorta_great_vessels", "text": "aorta normal caliber"}], "post_treatment": ["Radiation change: stricture formation"], "report_text": "FINDINGS:\nComparison: 2023-07-17.\nPulmonary parenchyma: Clear lungs without focal mass. No suspicious nodules identified.\nMediastinum: Enlarged paratracheal lymph node, short axis 41 mm. Cardiomediastinal contours within normal limits. small thymic remnant.\nPleura/Pleural spaces: No pleural effusion or pleural thickening.\nGreat vessels/Aorta: No thoracic aortic aneurysm or dissection. aorta normal caliber.\nLiver: 84 mm lobulated hepatic mass in segment 7 of the liver (hyperenhancing). No focal hepatic lesions. Normal attenuation.\nSpleen: Normal in size and attenuation. No focal splenic lesion. spleen normal size.\nPancreas: Normal pancreatic contour and enhancement. No focal mass.\nAdrenal glands: Adrenal glands are normal without nodules. no adrenal nodule.\nKidneys: No hydronephrosis. No enhancing renal mass.\nGI tract/Bowel: No obstructive process. No focal bowel wall mass identified.\nMesentery/Omentum: No ascites. No omental caking. no peritoneal nodularity.\nMesenteric vessels (SMA/SMV): SMA/SMV are patent without thrombosis.\nUrinary bladder: Unremarkable.\nReproductive organs: No adnexal mass. Uterus/prostate within expected size for age. BPH. prostate is normal / no prostatic mass.\nLymph nodes: No pathologically enlarged lymph nodes by size criteria.\nBones/Osseous structures: Sclerotic osseous metastasis—nonmeasurable by RECIST (blastic). No aggressive osseous lesion. No acute fracture. degenerative changes.\n\nIMPRESSION:\n- Liver primary malignancy at segment 7 of the liver measuring approximately 84 mm.\n- Findings concerning for nodal involvement.\n- Findings compatible with distant metastases involving: bone.\n- RECIST 1.1 Summary:\n- Target lesions (n=3; ≤2 per organ rule applied).\n  • T1: Primary — 61→84 mm (longest diameter).\n  • T2: Metastasis — 28→39 mm (longest diameter).\n  • T3: Lymph node — 29→41 mm (short axis).\n- SLD baseline: 118 mm.\n- SLD current: 164 mm (+39.0% change).\n- New lesions: present (unequivocal).\n- - RECIST 1.1 overall response category: PD.\n"}
{"patient_id": "PID000008", "study_date": "2023-05-22", "timepoint": 0, "recist": {"baseline_sld_mm": 65, "current_sld_mm": null, "nadir_sld_mm": null, "overall_response": "Baseline (no category)"}, "lesions": [{"lesion_id": "primary:colon", "kind": "primary", "organ": "colon", "location": "transverse colon", "rule": "longest", "baseline_mm": 27, "follow_mm": null, "size_mm_current": 27, "margin": "lobulated", "enhancement": "hyperenhancing", "suspicious": true, "target": true}, {"lesion_id": "ln:retroperitoneal", "kind": "ln", "organ": "lymph", "station": "retroperitoneal", "rule": "short_axis", "baseline_mm": 16, "follow_mm": null, "size_mm_current": 16, "necrosis": false, "suspicious": true, "target": true}, {"lesion_id": "ln:inguinal", "kind": "ln", "organ": "lymph", "station": "inguinal", "rule": "short_axis", "baseline_mm": 22, "follow_mm": null, "size_mm_current": 22, "necrosis": false, "suspicious": true, "target": true}], "complexity_profile": {"level": 2, "level_name": "C2", "artifact": null}, "staging_relevance": 0.0, "incidentals": [{"organ": "gi.stomach", "text": "small benign polyp"}, {"organ": "reproductive.ovary", "text": "simple physiologic cyst"}], "negatives": [{"organ": "lung", "text": "no suspicious pulmonary nodule"}, {"organ": "gi", "text": "no colonic mass"}, {"organ": "bones", "text": "no destructive osseous lesion"}, {"organ": "pleura", "text": "no pleural effusion"}, {"organ": "mediastinum", "text": "no mediastinal mass"}], "post_treatment": [], "report_text": "FINDINGS:\nPulmonary parenchyma: No focal consolidation or suspicious pulmonary nodules. No pneumothorax.\nMediastinum: Cardiomediastinal contours within normal limits. no mediastinal mass.\nPleura/Pleural spaces: No pleural effusion or pleural thickening.\nGreat vessels/Aorta: No thoracic aortic aneurysm or dissection.\nLiver: No focal hepatic lesions. Normal attenuation.\nSpleen: Normal in size and attenuation. No focal splenic lesion.\nPancreas: Normal pancreatic contour and enhancement. No focal mass.\nAdrenal glands: Adrenal glands are normal without nodules.\nKidneys: No hydronephrosis. No enhancing renal mass.\nGI tract/Bowel: 27 mm lobulated mass involving the transverse colon with focal wall thickening (hyperenhancing). No obstructive process. No focal bowel wall mass identified. small benign polyp. no colonic mass.\nMesentery/Omentum: No ascites. No omental caking.\nMesenteric vessels (SMA/SMV): SMA/SMV are patent without thrombosis.\nUrinary bladder: Unremarkable.\nReproductive organs: No adnexal mass. Uterus/prostate within expected size for age. simple physiologic cyst.\nLymph nodes: Enlarged retroperitoneal lymph node, short axis 16 mm. Enlarged inguinal lymph node, short axis 2.2 cm. No pathologically enlarged lymph nodes by size criteria.\nBones/Osseous structures: No aggressive osseous lesion. No acute fracture. no destructive osseous lesion.\n\nIMPRESSION:\n- Colon primary malignancy at transverse colon measuring approximately 27 mm.\n- Findings concerning for nodal involvement.\n- No definite distant metastases identified.\n- RECIST 1.1 Summary:\n- Target lesions (n=3; ≤2 per organ rule applied).\n  • T1: Primary — 27 mm (longest diameter) at baseline.\n  • T2: Lymph node — 16 mm (short axis) at baseline.\n  • T3: Lymph node — 22 mm (short axis) at baseline.\n- SLD baseline: 65 mm.\n- New lesions: absent (unequivocal).\n- - RECIST 1.1 overall response category: Baseline (no category).\n"}
{"patient_id": "PID000008", "study_date": "2023-07-29", "timepoint": 1, "recist": {"baseline_sld_mm": 65, "current_sld_mm": 39, "nadir_sld_mm": 39, "overall_response": "PR"}, "lesions": [{"lesion_id": "primary:colon", "kind": "primary", "organ": "colon", "location": "transverse colon", "rule": "longest", "baseline_mm": 27, "follow_mm": 16, "size_mm_current": 16, "margin": "lobulated", "enhancement": "hyperenhancing", "suspicious": true, "target": true}, {"lesion_id": "ln:retroperitoneal", "kind": "ln", "organ": "lymph", "station": "retroperitoneal", "rule": "short_axis", "baseline_mm": 16, "follow_mm": 10, "size_mm_current": 10, "necrosis": false, "suspicious": true, "target": true}, {"lesion_id": "ln:inguinal", "kind": "ln", "organ": "lymph", "station": "inguinal", "rule": "short_axis", "baseline_mm": 22, "follow_mm": 13, "size_mm_current": 13, "necrosis": false, "suspicious": true, "target": true}], "complexity_profile": {"level": 2, "level_name": "C2", "artifact": null}, "staging_relevance": 0.0, "incidentals": [{"organ": "gi.small_bowel", "text": "nonspecific fluid levels"}, {"organ": "aorta_great_vessels", "text": "tortuosity"}], "negatives": [{"organ": "gi", "text": "no bowel obstruction"}, {"organ": "bladder", "text": "no focal bladder wall thickening"}, {"organ": "bones", "text": "no destructive osseous lesion"}, {"organ": "pancreas", "text": "pancreas is normal"}, {"organ": "mediastinum", "text": "no mediastinal mass"}], "post_treatment": [], "report_text": "FINDINGS:\nComparison: 2023-05-22.\nLungs: No focal consolidation or suspicious pulmonary nodules. No pneumothorax.\nMediastinum: Cardiomediastinal contours within normal limits. no mediastinal mass.\nPleura/Pleural spaces: No pleural effusion or pleural thickening.\nGreat vessels/Aorta: No thoracic aortic aneurysm or dissection. tortuosity.\nLiver: No focal hepatic lesions. Normal attenuation.\nSpleen: Normal in size and attenuation. No focal splenic lesion.\nPancreas: Normal pancreatic contour and enhancement. No focal mass. pancreas is normal.\nAdrenal glands: Adrenal glands are normal without nodules.\nKidneys: No hydronephrosis. No enhancing renal mass.\nGI tract/Bowel: 1.6 cm lobulated mass involving the transverse colon with focal wall thickening (hyperenhancing). No obstructive process. No focal bowel wall mass identified. nonspecific fluid levels. no bowel obstruction.\nMesentery/Omentum: No ascites. No omental caking.\nMesenteric vessels (SMA/SMV): SMA/SMV are patent without thrombosis.\nUrinary bladder: Unremarkable. no focal bladder wall thickening.\nReproductive organs: No adnexal mass. Uterus/prostate within expected size for age.\nLymph nodes: Enlarged retroperitoneal lymph node, short axis 10 mm. Enlarged inguinal lymph node, short axis 13 mm. No pathologically enlarged lymph nodes by size criteria.\nBones/Osseous structures: No aggressive osseous lesion. No acute fracture. no destructive osseous lesion.\n\nIMPRESSION:\n- Colon primary malignancy at transverse colon measuring approximately 16 mm.\n- Findings concerning for nodal involvement.\n- No definite distant metastases identified.\n- RECIST 1.1 Summary:\n- Target lesions (n=3; ≤2 per organ rule applied).\n  • T1: Primary — 27→16 mm (longest diameter).\n  • T2: Lymph node — 16→10 mm (short axis).\n  • T3: Lymph node — 22→13 mm (short axis).\n- SLD baseline: 65 mm.\n- SLD current: 39 mm (-40.0% change).\n- New lesions: absent (unequivocal).\n- - RECIST 1.1 overall response category: PR.\n"}
{"patient_id": "PID000008", "study_date": "2023-10-06", "timepoint": 2, "recist": {"baseline_sld_mm": 65, "current_sld_mm": 43, "nadir_sld_mm": 39, "overall_response": "PR"}, "lesions": [{"lesion_id": "primary:colon", "kind": "primary", "organ": "colon", "location": "transverse colon", "rule": "longest", "baseline_mm": 27, "follow_mm": 18, "size_mm_current": 18, "margin": "lobulated", "enhancement": "hyperenhancing", "suspicious": true, "target": true}, {"lesion_id": "ln:retroperitoneal", "kind": "ln", "organ": "lymph", "station": "retroperitoneal", "rule": "short_axis", "baseline_mm": 16, "follow_mm": 11, "size_mm_current": 11, "necrosis": false, "suspicious": true, "target": true}, {"lesion_id": "ln:inguinal", "kind": "ln", "organ": "lymph", "station": "inguinal", "rule": "short_axis", "baseline_mm": 22, "follow_mm": 14, "size_mm_current": 14, "necrosis": false, "suspicious": true, "target": true}], "complexity_profile": {"level": 2, "level_name": "C2", "artifact": null}, "staging_relevance": 0.0, "incidentals": [{"organ": "reproductive.prostate", "text": "BPH"}], "negatives": [{"organ": "bladder", "text": "urinary bladder normal"}, {"organ": "bones", "text": "no destructive osseous lesion"}, {"organ": "aorta_great_vessels", "text": "aorta normal caliber"}, {"organ": "adrenals", "text": "no adrenal nodule"}, {"organ": "mediastinum", "text": "no pathologic mediastinal lymphadenopathy"}], "post_treatment": [], "report_text": "FINDINGS:\nComparison: 2023-07-29.\nPulmonary parenchyma: No focal consolidation or suspicious pulmonary nodules. No pneumothorax.\nMediastinum: Cardiomediastinal contours within normal limits. no pathologic mediastinal lymphadenopathy.\nPleura/Pleural spaces: No pleural effusion or pleural thickening.\nGreat vessels/Aorta: No thoracic aortic aneurysm or dissection. aorta normal caliber.\nLiver: No focal hepatic lesions. Normal attenuation.\nSpleen: Normal in size and attenuation. No focal splenic lesion.\nPancreas: Normal pancreatic contour and enhancement. No focal mass.\nAdrenal glands: Adrenal glands are normal without nodules. no adrenal nodule.\nKidneys: No hydronephrosis. No enhancing renal mass.\nGI tract/Bowel: 1.8 cm lobulated mass involving the transverse colon with focal wall thickening (hyperenhancing). No obstructive process. No focal bowel wall mass identified.\nMesentery/Omentum: No ascites. No omental caking.\nMesenteric vessels (SMA/SMV): SMA/SMV are patent without thrombosis.\nUrinary bladder: Unremarkable. urinary bladder normal.\nReproductive organs: No adnexal mass. Uterus/prostate within expected size for age. BPH.\nLymph nodes: Enlarged retroperitoneal lymph node, short axis 11 mm. Enlarged inguinal lymph node, short axis 14 mm. No pathologically enlarged lymph nodes by size criteria.\nBones/Osseous structures: No aggressive osseous lesion. No acute fracture. no destructive osseous lesion.\n\nIMPRESSION:\n- Colon primary malignancy at transverse colon measuring approximately 18 mm.\n- Findings concerning for nodal involvement.\n- No definite distant metastases identified.\n- RECIST 1.1 Summary:\n- Target lesions (n=3; ≤2 per organ rule applied).\n  • T1: Primary — 27→18 mm (longest diameter).\n  • T2: Lymph node — 16→11 mm (short axis).\n  • T3: Lymph node — 22→14 mm (short axis).\n- SLD baseline: 65 mm.\n- SLD current: 43 mm (-33.8% change).\n- New lesions: absent (unequivocal).\n- - RECIST 1.1 overall response category: PR.\n"}
{"patient_id": "PID000008", "study_date": "2023-11-19", "timepoint": 3, "recist": {"baseline_sld_mm": 65, "current_sld_mm": 73, "nadir_sld_mm": 39, "overall_response": "PD"}, "lesions": [{"lesion_id": "primary:colon", "kind": "primary", "organ": "colon", "location": "transverse colon", "rule": "longest", "baseline_mm": 27, "follow_mm": 30, "size_mm_current": 30, "margin": "lobulated", "enhancement": "hyperenhancing", "suspicious": true, "target": true}, {"lesion_id": "ln:retroperitoneal", "kind": "ln", "organ": "lymph", "station": "retroperitoneal", "rule": "short_axis", "baseline_mm": 16, "follow_mm": 19, "size_mm_current": 19, "necrosis": false, "suspicious": true, "target": true}, {"lesion_id": "ln:inguinal", "kind": "ln", "organ": "lymph", "station": "inguinal", "rule": "short_axis", "baseline_mm": 22, "follow_mm": 24, "size_mm_current": 24, "necrosis": false, "suspicious": true, "target": true}], "complexity_profile": {"level": 2, "level_name": "C2", "artifact": {"key": "partial_volume", "impact": 1, "report_phrase": "Partial volume averaging may obscure small foci.", "severity_rank": 1}}, "staging_relevance": 18.0, "incidentals": [{"organ": "gi.colon", "text": "diverticulosis"}, {"organ": "reproductive.prostate", "text": "calcifications"}], "negatives": [{"organ": "bones", "text": "no destructive osseous lesion"}, {"organ": "mesentery_peritoneum", "text": "no ascites"}, {"organ": "pancreas", "text": "pancreas is normal"}, {"organ": "kidneys", "text": "kidneys are normal"}, {"organ": "lung", "text": "no pleural effusion"}], "post_treatment": [], "report_text": "FINDINGS:\nPartial volume averaging may obscure small foci.\nComparison: 2023-10-06.\nLungs: No focal consolidation or suspicious pulmonary nodules. No pneumothorax. no pleural effusion.\nMediastinum: Cardiomediastinal contours within normal limits.\nPleura/Pleural spaces: No pleural effusion or pleural thickening.\nGreat vessels/Aorta: No thoracic aortic aneurysm or dissection.\nLiver: No focal hepatic lesions. Normal attenuation.\nSpleen: Normal in size and attenuation. No focal splenic lesion.\nPancreas: Normal pancreatic contour and enhancement. No focal mass. pancreas is normal.\nAdrenal glands: Adrenal glands are normal without nodules.\nKidneys: No hydronephrosis. No enhancing renal mass. kidneys are normal.\nGI tract/Bowel: 30 mm lobulated mass involving the transverse colon with focal wall thickening (hyperenhancing). No obstructive process. No focal bowel wall mass identified. diverticulosis.\nMesentery/Omentum: No ascites. No omental caking.\nMesenteric vessels (SMA/SMV): SMA/SMV are patent without thrombosis.\nUrinary bladder: Unremarkable.\nReproductive organs: No adnexal mass. Uterus/prostate within expected size for age. calcifications.\nLymph nodes: Enlarged retroperitoneal lymph node, short axis 19 mm. Enlarged inguinal lymph node, short axis 2.4 cm. No pathologically enlarged lymph nodes by size criteria.\nBones/Osseous structures: No aggressive osseous lesion. No acute fracture. no destructive osseous lesion.\n\nIMPRESSION:\n- Colon primary malignancy at transverse colon measuring approximately 30 mm.\n- Findings concerning for nodal involvement.\n- No definite distant metastases identified.\n- RECIST 1.1 Summary:\n- Target lesions (n=3; ≤2 per organ rule applied).\n  • T1: Primary — 27→30 mm (longest diameter).\n  • T2: Lymph node — 16→19 mm (short axis).\n  • T3: Lymph node — 22→24 mm (short axis).\n- SLD baseline: 65 mm.\n- SLD current: 73 mm (+12.3% change).\n- New lesions: absent (unequivocal).\n- - RECIST 1.1 overall response category: PD.\n"}
{"patient_id": "PID000009", "study_date": "2023-12-07", "timepoint": 0, "recist": {"baseline_sld_mm": 64, "current_sld_mm": null, "nadir_sld_mm": null, "overall_response": "Baseline (no category)"}, "lesions": [{"lesion_id": "primary:kidney", "kind": "primary", "organ": "kidney", "location": "left kidney, interpolar", "rule": "longest", "baseline_mm": 37, "follow_mm": null, "size_mm_current": 37, "margin": "lobulated", "enhancement": "isoenhancing", "suspicious": true, "target": true}, {"lesion_id": "ln:left hilar", "kind": "ln", "organ": "lymph", "station": "left hilar", "rule": "short_axis", "baseline_mm": null, "follow_mm": null, "size_mm_current": 13, "necrosis": false, "suspicious": true, "target": false}, {"lesion_id": "ln:porta hepatis", "kind": "ln", "organ": "lymph", "station": "porta hepatis", "rule": "short_axis", "baseline_mm": 27, "follow_mm": null, "size_mm_current": 27, "necrosis": false, "suspicious": true, "target": true}], "complexity_profile": {"level": 2, "level_name": "C2", "artifact": null}, "staging_relevance": 0.0, "incidentals": [{"organ": "aorta_great_vessels", "text": "tortuosity"}, {"organ": "gi.stomach", "text": "physiologic under-distension thickening"}, {"organ": "kidneys", "text": "Bosniak I cyst"}], "negatives": [{"organ": "aorta_great_vessels", "text": "no aneurysm or dissection"}, {"organ": "adrenals", "text": "no adrenal nodule"}, {"organ": "mediastinum", "text": "no pathologic mediastinal lymphadenopathy"}, {"organ": "liver", "text": "liver is normal"}, {"organ": "reproductive", "text": "prostate is normal / no prostatic mass"}], "post_treatment": [], "report_text": "FINDINGS:\nLungs: No focal consolidation or suspicious pulmonary nodules. No pneumothorax.\nMediastinum: Enlarged left hilar lymph node, short axis 13 mm. Cardiomediastinal contours within normal limits. no pathologic mediastinal lymphadenopathy.\nPleura/Pleural spaces: No pleural effusion or pleural thickening.\nGreat vessels/Aorta: No thoracic aortic aneurysm or dissection. tortuosity. no aneurysm or dissection.\nLiver: No focal hepatic lesions. Normal attenuation. liver is normal.\nSpleen: Normal in size and attenuation. No focal splenic lesion.\nPancreas: Normal pancreatic contour and enhancement. No focal mass.\nAdrenal glands: Adrenal glands are normal without nodules. no adrenal nodule.\nKidneys: 37 mm lobulated enhancing renal mass in the left kidney, interpolar. No hydronephrosis. No enhancing renal mass. Bosniak I cyst.\nGI tract/Bowel: No obstructive process. No focal bowel wall mass identified. physiologic under-distension thickening.\nMesentery/Omentum: No ascites. No omental caking.\nMesenteric vessels (SMA/SMV): SMA/SMV are patent without thrombosis.\nUrinary bladder: Unremarkable.\nReproductive organs: No adnexal mass. Uterus/prostate within expected size for age. prostate is normal / no prostatic mass.\nLymph nodes: Enlarged porta hepatis lymph node, short axis 2.7 cm. No pathologically enlarged lymph nodes by size criteria.\nBones/Osseous structures: No aggressive osseous lesion. No acute fracture.\n\nIMPRESSION:\n- Kidney primary malignancy at left kidney, interpolar measuring approximately 37 mm.\n- Findings concerning for nodal involvement.\n- No definite distant metastases identified.\n- RECIST 1.1 Summary:\n- Target lesions (n=2; ≤2 per organ rule applied).\n  • T1: Primary — 37 mm (longest diameter) at baseline.\n  • T2: Lymph node — 27 mm (short axis) at baseline.\n- SLD baseline: 64 mm.\n- New lesions: absent (unequivocal).\n- - RECIST 1.1 overall response category: Baseline (no category).\n"}
{"patient_id": "PID000009", "study_date": "2024-01-24", "timepoint": 1, "recist": {"baseline_sld_mm": 64, "current_sld_mm": 40, "nadir_sld_mm": 40, "overall_response": "PR"}, "lesions": [{"lesion_id": "primary:kidney", "kind": "primary", "organ": "kidney", "location": "left kidney, interpolar", "rule": "longest", "baseline_mm": 37, "follow_mm": 23, "size_mm_current": 23, "margin": "lobulated", "enhancement": "isoenhancing", "suspicious": true, "target": true}, {"lesion_id": "ln:left hilar", "kind": "ln", "organ": "lymph", "station": "left hilar", "rule": "short_axis", "baseline_mm": null, "follow_mm": null, "size_mm_current": 13, "necrosis": false, "suspicious": true, "target": false}, {"lesion_id": "ln:porta hepatis", "kind": "ln", "organ": "lymph", "station": "porta hepatis", "rule": "short_axis", "baseline_mm": 27, "follow_mm": 17, "size_mm_current": 17, "necrosis": false, "suspicious": true, "target": true}], "complexity_profile": {"level": 2, "level_name": "C2", "artifact": {"key": "motion_mild", "impact": 1, "report_phrase": "Respiratory motion artifact partially limits assessment.", "severity_rank": 2}}, "staging_relevance": 5.0, "incidentals": [{"organ": "reproductive.prostate", "text": "BPH"}, {"organ": "aorta_great_vessels", "text": "mild aortic atherosclerosis"}], "negatives": [{"organ": "mediastinum", "text": "no mediastinal mass"}, {"organ": "bladder", "text": "no focal bladder wall thickening"}, {"organ": "lung", "text": "no pulmonary abnormality"}, {"organ": "aorta_great_vessels", "text": "no aneurysm or dissection"}, {"organ": "liver", "text": "liver is normal"}], "post_treatment": [], "report_text": "FINDINGS:\nRespiratory motion artifact partially limits assessment.\nComparison: 2023-12-07.\nPulmonary parenchyma: No focal consolidation or suspicious pulmonary nodules. No pneumothorax.\nMediastinum: Enlarged left hilar lymph node, short axis 13 mm. Cardiomediastinal contours within normal limits. no mediastinal mass.\nPleura/Pleural spaces: No pleural effusion or pleural thickening.\nGreat vessels/Aorta: No thoracic aortic aneurysm or dissection. mild aortic atherosclerosis. no aneurysm or dissection.\nLiver: No focal hepatic lesions. Normal attenuation. liver is normal.\nSpleen: Normal in size and attenuation. No focal splenic lesion.\nPancreas: Normal pancreatic contour and enhancement. No focal mass.\nAdrenal glands: Adrenal glands are normal without nodules.\nKidneys: 2.3 cm lobulated enhancing renal mass in the left kidney, interpolar. No hydronephrosis. No enhancing renal mass.\nGI tract/Bowel: No obstructive process. No focal bowel wall mass identified.\nMesentery/Omentum: No ascites. No omental caking.\nMesenteric vessels (SMA/SMV): SMA/SMV are patent without thrombosis.\nUrinary bladder: Unremarkable. no focal bladder wall thickening.\nReproductive organs: No adnexal mass. Uterus/prostate within expected size for age. BPH.\nLymph nodes: Enlarged porta hepatis lymph node, short axis 17 mm. No pathologically enlarged lymph nodes by size criteria.\nBones/Osseous structures: No aggressive osseous lesion. No acute fracture.\n\nIMPRESSION:\n- Kidney primary malignancy at left kidney, interpolar measuring approximately 23 mm.\n- Findings concerning for nodal involvement.\n- No definite distant metastases identified.\n- RECIST 1.1 Summary:\n- Target lesions (n=2; ≤2 per organ rule applied).\n  • T1: Primary — 37→23 mm (longest diameter).\n  • T2: Lymph node — 27→17 mm (short axis).\n- SLD baseline: 64 mm.\n- SLD current: 40 mm (-37.5% change).\n- New lesions: absent (unequivocal).\n- - RECIST 1.1 overall response category: PR.\n"}
{"patient_id": "PID000009", "study_date": "2024-03-14", "timepoint": 2, "recist": {"baseline_sld_mm": 64, "current_sld_mm": 39, "nadir_sld_mm": 39, "overall_response": "PR"}, "lesions": [{"lesion_id": "primary:kidney", "kind": "primary", "organ": "kidney", "location": "left kidney, interpolar", "rule": "longest", "baseline_mm": 37, "follow_mm": 23, "size_mm_current": 23, "margin": "lobulated", "enhancement": "isoenhancing", "suspicious": true, "target": true}, {"lesion_id": "ln:left hilar", "kind": "ln", "organ": "lymph", "station": "left hilar", "rule": "short_axis", "baseline_mm": null, "follow_mm": null, "size_mm_current": 13, "necrosis": false, "suspicious": true, "target": false}, {"lesion_id": "ln:porta hepatis", "kind": "ln", "organ": "lymph", "station": "porta hepatis", "rule": "short_axis", "baseline_mm": 27, "follow_mm": 16, "size_mm_current": 16, "necrosis": false, "suspicious": true, "target": true}], "complexity_profile": {"level": 2, "level_name": "C2", "artifact": {"key": "partial_volume", "impact": 1, "report_phrase": "Partial volume averaging may obscure small foci.", "severity_rank": 1}}, "staging_relevance": 5.0, "incidentals": [{"organ": "pleura", "text": "trace effusion"}, {"organ": "pleura", "text": "trace effusion"}, {"organ": "spleen", "text": "accessory spleen"}], "negatives": [{"organ": "pleura", "text": "no pleural nodularity"}, {"organ": "mesentery_peritoneum", "text": "no ascites"}, {"organ": "spleen", "text": "no focal splenic lesion"}, {"organ": "aorta_great_vessels", "text": "no aneurysm or dissection"}, {"organ": "pancreas", "text": "no pancreatic mass"}], "post_treatment": [], "report_text": "FINDINGS:\nPartial volume averaging may obscure small foci.\nComparison: 2024-01-24.\nLungs: Clear lungs without focal mass. No suspicious nodules identified.\nMediastinum: Enlarged left hilar lymph node, short axis 1.3 cm. Cardiomediastinal contours within normal limits.\nPleura/Pleural spaces: No pleural effusion or pleural thickening. trace effusion. no pleural nodularity.\nGreat vessels/Aorta: No thoracic aortic aneurysm or dissection. no aneurysm or dissection.\nLiver: No focal hepatic lesions. Normal attenuation.\nSpleen: Normal in size and attenuation. No focal splenic lesion. accessory spleen.\nPancreas: Normal pancreatic contour and enhancement. No focal mass. no pancreatic mass.\nAdrenal glands: Adrenal glands are normal without nodules.\nKidneys: 23 mm lobulated enhancing renal mass in the left kidney, interpolar. No hydronephrosis. No enhancing renal mass.\nGI tract/Bowel: No obstructive process. No focal bowel wall mass identified.\nMesentery/Omentum: No ascites. No omental caking.\nMesenteric vessels (SMA/SMV): SMA/SMV are patent without thrombosis.\nUrinary bladder: Unremarkable.\nReproductive organs: No adnexal mass. Uterus/prostate within expected size for age.\nLymph nodes: Enlarged porta hepatis lymph node, short axis 1.6 cm. No pathologically enlarged lymph nodes by size criteria.\nBones/Osseous structures: No aggressive osseous lesion. No acute fracture.\n\nIMPRESSION:\n- Kidney primary malignancy at left kidney, interpolar measuring approximately 23 mm.\n- Findings concerning for nodal involvement.\n- No definite distant metastases identified.\n- RECIST 1.1 Summary:\n- Target lesions (n=2; ≤2 per organ rule applied).\n  • T1: Primary — 37→23 mm (longest diameter).\n  • T2: Lymph node — 27→16 mm (short axis).\n- SLD baseline: 64 mm.\n- SLD current: 39 mm (-39.1% change).\n- New lesions: absent (unequivocal).\n- - RECIST 1.1 overall response category: PR.\n"}
{"patient_id": "PID000010", "study_date": "2023-01-01", "timepoint": 0, "recist": {"baseline_sld_mm": 103, "current_sld_mm": null, "nadir_sld_mm": null, "overall_response": "Baseline (no category)"}, "lesions": [{"lesion_id": "primary:pancreas", "kind": "primary", "organ": "pancreas", "location": "body of the pancreas", "rule": "longest", "baseline_mm": 50, "follow_mm": null, "size_mm_current": 50, "margin": "smooth", "enhancement": "hypoenhancing", "suspicious": true, "target": true}, {"lesion_id": "ln:left hilar", "kind": "ln", "organ": "lymph", "station": "left hilar", "rule": "short_axis", "baseline_mm": null, "follow_mm": null, "size_mm_current": 9, "necrosis": false, "suspicious": false, "target": false}, {"lesion_id": "ln:celiac", "kind": "ln", "organ": "lymph", "station": "celiac", "rule": "short_axis", "baseline_mm": 21, "follow_mm": null, "size_mm_current": 21, "necrosis": false, "suspicious": true, "target": true}, {"lesion_id": "met:liver", "kind": "met", "organ": "liver", "rule": "longest", "baseline_mm": 13, "follow_mm": null, "size_mm_current": 13, "suspicious": true, "target": true}, {"lesion_id": "met:peritoneum", "kind": "met", "organ": "peritoneum", "rule": "longest", "baseline_mm": 19, "follow_mm": null, "size_mm_current": 19, "suspicious": true, "target": true}], "complexity_profile": {"level": 2, "level_name": "C2", "artifact": null}, "staging_relevance": 0.0, "incidentals": [{"organ": "lung", "text": "subpleural reticulation"}, {"organ": "spleen", "text": "tiny cyst"}], "negatives": [{"organ": "pancreas", "text": "no pancreatic mass"}, {"organ": "mediastinum", "text": "no pathologic mediastinal lymphadenopathy"}, {"organ": "mesentery_peritoneum", "text": "no peritoneal nodularity"}, {"organ": "reproductive", "text": "ovaries are normal / no adnexal abnormality"}, {"organ": "gi", "text": "no colonic mass"}], "post_treatment": [], "report_text": "FINDINGS:\nLungs: No focal consolidation or suspicious pulmonary nodules. No pneumothorax. subpleural reticulation.\nMediastinum: Enlarged left hilar lymph node, short axis 9 mm. Cardiomediastinal contours within normal limits. no pathologic mediastinal lymphadenopathy.\nPleura/Pleural spaces: No pleural effusion or pleural thickening.\nGreat vessels/Aorta: No thoracic aortic aneurysm or dissection.\nLiver: 1.3 cm lesion in the liver, suspicious for metastasis. No focal hepatic lesions. Normal attenuation.\nSpleen: Normal in size and attenuation. No focal splenic lesion. tiny cyst.\nPancreas: 5.0 cm smooth pancreatic mass in the body of the pancreas (hypoenhancing). Normal pancreatic contour and enhancement. No focal mass. no pancreatic mass.\nAdrenal glands: Adrenal glands are normal without nodules.\nKidneys: No hydronephrosis. No enhancing renal mass.\nGI tract/Bowel: No obstructive process. No focal bowel wall mass identified. no colonic mass.\nMesentery/Omentum: 1.9 cm lesion in the peritoneum, suspicious for metastasis. No ascites. No omental caking. no peritoneal nodularity.\nMesenteric vessels (SMA/SMV): SMA/SMV are patent without thrombosis.\nUrinary bladder: Unremarkable.\nReproductive organs: No adnexal mass. Uterus/prostate within expected size for age. ovaries are normal / no adnexal abnormality.\nLymph nodes: Enlarged celiac lymph node, short axis 21 mm. No pathologically enlarged lymph nodes by size criteria.\nBones/Osseous structures: No aggressive osseous lesion. No acute fracture.\n\nIMPRESSION:\n- Pancreas primary malignancy at body of the pancreas measuring approximately 50 mm.\n- Findings concerning for nodal involvement.\n- Findings compatible with distant metastases involving: liver, peritoneum.\n- RECIST 1.1 Summary:\n- Target lesions (n=4; ≤2 per organ rule applied).\n  • T1: Primary — 50 mm (longest diameter) at baseline.\n  • T2: Metastasis — 13 mm (longest diameter) at baseline.\n  • T3: Metastasis — 19 mm (longest diameter) at baseline.\n  • T4: Lymph node — 21 mm (short axis) at baseline.\n- SLD baseline: 103 mm.\n- New lesions: absent (unequivocal).\n- - RECIST 1.1 overall response category: Baseline (no category).\n"}
{"patient_id": "PID000010", "study_date": "2023-03-06", "timepoint": 1, "recist": {"baseline_sld_mm": 103, "current_sld_mm": 112, "nadir_sld_mm": 103, "overall_response": "SD"}, "lesions": [{"lesion_id": "primary:pancreas", "kind": "primary", "organ": "pancreas", "location": "body of the pancreas", "rule": "longest", "baseline_mm": 50, "follow_mm": 55, "size_mm_current": 55, "margin": "smooth", "enhancement": "hypoenhancing", "suspicious": true, "target": true}, {"lesion_id": "ln:left hilar", "kind": "ln", "organ": "lymph", "station": "left hilar", "rule": "short_axis", "baseline_mm": null, "follow_mm": null, "size_mm_current": 9, "necrosis": false, "suspicious": false, "target": false}, {"lesion_id": "ln:celiac", "kind": "ln", "organ": "lymph", "station": "celiac", "rule": "short_axis", "baseline_mm": 21, "follow_mm": 23, "size_mm_current": 23, "necrosis": false, "suspicious": true, "target": true}, {"lesion_id": "met:liver", "kind": "met", "organ": "liver", "rule": "longest", "baseline_mm": 13, "follow_mm": 14, "size_mm_current": 14, "suspicious": true, "target": true}, {"lesion_id": "met:peritoneum", "kind": "met", "organ": "peritoneum", "rule": "longest", "baseline_mm": 19, "follow_mm": 20, "size_mm_current": 20, "suspicious": true, "target": true}], "complexity_profile": {"level": 2, "level_name": "C2", "artifact": {"key": "partial_volume", "impact": 1, "report_phrase": "Partial volume averaging may obscure small foci.", "severity_rank": 1}}, "staging_relevance": 5.0, "incidentals": [{"organ": "pleura", "text": "trace effusion"}, {"organ": "gi.stomach", "text": "small benign polyp"}], "negatives": [{"organ": "bones", "text": "no destructive osseous lesion"}, {"organ": "bladder", "text": "no focal bladder wall thickening"}, {"organ": "pancreas", "text": "pancreas is normal"}, {"organ": "spleen", "text": "spleen normal size"}, {"organ": "kidneys", "text": "kidneys are normal"}], "post_treatment": ["Radiation change: ground-glass opacities within field"], "report_text": "FINDINGS:\nPartial volume averaging may obscure small foci.\nComparison: 2023-01-01.\nPulmonary parenchyma: No focal consolidation or suspicious pulmonary nodules. No pneumothorax.\nMediastinum: Enlarged left hilar lymph node, short axis 9 mm. Cardiomediastinal contours within normal limits.\nPleura/Pleural spaces: No pleural effusion or pleural thickening. trace effusion.\nGreat vessels/Aorta: No thoracic aortic aneurysm or dissection.\nLiver: 14 mm lesion in the liver, suspicious for metastasis. No focal hepatic lesions. Normal attenuation.\nSpleen: Normal in size and attenuation. No focal splenic lesion. spleen normal size.\nPancreas: 55 mm smooth pancreatic mass in the body of the pancreas (hypoenhancing). Normal pancreatic contour and enhancement. No focal mass. pancreas is normal.\nAdrenal glands: Adrenal glands are normal without nodules.\nKidneys: No hydronephrosis. No enhancing renal mass. kidneys are normal.\nGI tract/Bowel: No obstructive process. No focal bowel wall mass identified. small benign polyp.\nMesentery/Omentum: 2.0 cm lesion in the peritoneum, suspicious for metastasis. No ascites. No omental caking.\nMesenteric vessels (SMA/SMV): SMA/SMV are patent without thrombosis.\nUrinary bladder: Unremarkable. no focal bladder wall thickening.\nReproductive organs: No adnexal mass. Uterus/prostate within expected size for age.\nLymph nodes: Enlarged celiac lymph node, short axis 2.3 cm. No pathologically enlarged lymph nodes by size criteria.\nBones/Osseous structures: No aggressive osseous lesion. No acute fracture. no destructive osseous lesion.\n\nIMPRESSION:\n- Pancreas primary malignancy at body of the pancreas measuring approximately 55 mm.\n- Findings concerning for nodal involvement.\n- Findings compatible with distant metastases involving: liver, peritoneum.\n- RECIST 1.1 Summary:\n- Target lesions (n=4; ≤2 per organ rule applied).\n  • T1: Primary — 50→55 mm (longest diameter).\n  • T2: Metastasis — 13→14 mm (longest diameter).\n  • T3: Metastasis — 19→20 mm (longest diameter).\n  • T4: Lymph node — 21→23 mm (short axis).\n- SLD baseline: 103 mm.\n- SLD current: 112 mm (+8.7% change).\n- New lesions: absent (unequivocal).\n- - RECIST 1.1 overall response category: SD.\n"}
{"patient_id": "PID000010", "study_date": "2023-04-27", "timepoint": 2, "recist": {"baseline_sld_mm": 103, "current_sld_mm": 94, "nadir_sld_mm": 94, "overall_response": "SD"}, "lesions": [{"lesion_id": "primary:pancreas", "kind": "primary", "organ": "pancreas", "location": "body of the pancreas", "rule": "longest", "baseline_mm": 50, "follow_mm": 46, "size_mm_current": 46, "margin": "smooth", "enhancement": "hypoenhancing", "suspicious": true, "target": true}, {"lesion_id": "ln:left hilar", "kind": "ln", "organ": "lymph", "station": "left hilar", "rule": "short_axis", "baseline_mm": null, "follow_mm": null, "size_mm_current": 9, "necrosis": false, "suspicious": false, "target": false}, {"lesion_id": "ln:celiac", "kind": "ln", "organ": "lymph", "station": "celiac", "rule": "short_axis", "baseline_mm": 21, "follow_mm": 19, "size_mm_current": 19, "necrosis": false, "suspicious": true, "target": true}, {"lesion_id": "met:liver", "kind": "met", "organ": "liver", "rule": "longest", "baseline_mm": 13, "follow_mm": 11, "size_mm_current": 11, "suspicious": true, "target": true}, {"lesion_id": "met:peritoneum", "kind": "met", "organ": "peritoneum", "rule": "longest", "baseline_mm": 19, "follow_mm": 18, "size_mm_current": 18, "suspicious": true, "target": true}], "complexity_profile": {"level": 2, "level_name": "C2", "artifact": {"key": "motion_mild", "impact": 1, "report_phrase": "Respiratory motion artifact partially limits assessment.", "severity_rank": 2}}, "staging_relevance": 5.0, "incidentals": [{"organ": "lung", "text": "subpleural reticulation"}, {"organ": "pancreas", "text": "simple cyst (<2 cm)"}], "negatives": [{"organ": "mesentery_peritoneum", "text": "no peritoneal nodularity"}, {"organ": "bladder", "text": "no focal bladder wall thickening"}, {"organ": "gi", "text": "stomach is normal"}, {"organ": "mediastinum", "text": "no pathologic mediastinal lymphadenopathy"}, {"organ": "adrenals", "text": "adrenal glands normal"}], "post_treatment": [], "report_text": "FINDINGS:\nRespiratory motion artifact partially limits assessment.\nComparison: 2023-03-06.\nLungs: Clear lungs without focal mass. No suspicious nodules identified. subpleural reticulation.\nMediastinum: Enlarged left hilar lymph node, short axis 9 mm. Cardiomediastinal contours within normal limits. no pathologic mediastinal lymphadenopathy.\nPleura/Pleural spaces: No pleural effusion or pleural thickening.\nGreat vessels/Aorta: No thoracic aortic aneurysm or dissection.\nLiver: 1.1 cm lesion in the liver, suspicious for metastasis. No focal hepatic lesions. Normal attenuation.\nSpleen: Normal in size and attenuation. No focal splenic lesion.\nPancreas: 46 mm smooth pancreatic mass in the body of the pancreas (hypoenhancing). Normal pancreatic contour and enhancement. No focal mass. simple cyst (<2 cm).\nAdrenal glands: Adrenal glands are normal without nodules. adrenal glands normal.\nKidneys: No hydronephrosis. No enhancing renal mass.\nGI tract/Bowel: No obstructive process. No focal bowel wall mass identified. stomach is normal.\nMesentery/Omentum: 1.8 cm lesion in the peritoneum, suspicious for metastasis. No ascites. No omental caking. no peritoneal nodularity.\nMesenteric vessels (SMA/SMV): SMA/SMV are patent without thrombosis.\nUrinary bladder: Unremarkable. no focal bladder wall thickening.\nReproductive organs: No adnexal mass. Uterus/prostate within expected size for age.\nLymph nodes: Enlarged celiac lymph node, short axis 19 mm. No pathologically enlarged lymph nodes by size criteria.\nBones/Osseous structures: No aggressive osseous lesion. No acute fracture.\n\nIMPRESSION:\n- Pancreas primary malignancy at body of the pancreas measuring approximately 46 mm.\n- Findings concerning for nodal involvement.\n- Findings compatible with distant metastases involving: liver, peritoneum.\n- RECIST 1.1 Summary:\n- Target lesions (n=4; ≤2 per organ rule applied).\n  • T1: Primary — 50→46 mm (longest diameter).\n  • T2: Metastasis — 13→11 mm (longest diameter).\n  • T3: Metastasis — 19→18 mm (longest diameter).\n  • T4: Lymph node — 21→19 mm (short axis).\n- SLD baseline: 103 mm.\n- SLD current: 94 mm (-8.7% change).\n- New lesions: absent (unequivocal).\n- - RECIST 1.1 overall response category: SD.\n"}
{"patient_id": "PID000010", "study_date": "2023-07-04", "timepoint": 3, "recist": {"baseline_sld_mm": 103, "current_sld_mm": 101, "nadir_sld_mm": 94, "overall_response": "SD"}, "lesions": [{"lesion_id": "primary:pancreas", "kind": "primary", "organ": "pancreas", "location": "body of the pancreas", "rule": "longest", "baseline_mm": 50, "follow_mm": 48, "size_mm_current": 48, "margin": "smooth", "enhancement": "hypoenhancing", "suspicious": true, "target": true}, {"lesion_id": "ln:left hilar", "kind": "ln", "organ": "lymph", "station": "left hilar", "rule": "short_axis", "baseline_mm": null, "follow_mm": null, "size_mm_current": 9, "necrosis": false, "suspicious": false, "target": false}, {"lesion_id": "ln:celiac", "kind": "ln", "organ": "lymph", "station": "celiac", "rule": "short_axis", "baseline_mm": 21, "follow_mm": 20, "size_mm_current": 20, "necrosis": false, "suspicious": true, "target": true}, {"lesion_id": "met:liver", "kind": "met", "organ": "liver", "rule": "longest", "baseline_mm": 13, "follow_mm": 14, "size_mm_current": 14, "suspicious": true, "target": true}, {"lesion_id": "met:peritoneum", "kind": "met", "organ": "peritoneum", "rule": "longest", "baseline_mm": 19, "follow_mm": 19, "size_mm_current": 19, "suspicious": true, "target": true}], "complexity_profile": {"level": 2, "level_name": "C2", "artifact": null}, "staging_relevance": 6.0, "incidentals": [{"organ": "liver", "text": "simple cyst"}, {"organ": "spleen", "text": "accessory spleen"}], "negatives": [{"organ": "pleura", "text": "no pleural nodularity"}, {"organ": "lung", "text": "lungs are normal"}, {"organ": "pancreas", "text": "no pancreatic mass"}, {"organ": "reproductive", "text": "ovaries are normal / no adnexal abnormality"}, {"organ": "aorta_great_vessels", "text": "no aneurysm or dissection"}], "post_treatment": [], "report_text": "FINDINGS:\nComparison: 2023-04-27.\nPulmonary parenchyma: Clear lungs without focal mass. No suspicious nodules identified.\nMediastinum: Enlarged left hilar lymph node, short axis 9 mm. Cardiomediastinal contours within normal limits.\nPleura/Pleural spaces: No pleural effusion or pleural thickening. no pleural nodularity.\nGreat vessels/Aorta: No thoracic aortic aneurysm or dissection. no aneurysm or dissection.\nLiver: 14 mm lesion in the liver, suspicious for metastasis. No focal hepatic lesions. Normal attenuation. simple cyst.\nSpleen: Normal in size and attenuation. No focal splenic lesion. accessory spleen.\nPancreas: 4.8 cm smooth pancreatic mass in the body of the pancreas (hypoenhancing). Normal pancreatic contour and enhancement. No focal mass. no pancreatic mass.\nAdrenal glands: Adrenal glands are normal without nodules.\nKidneys: No hydronephrosis. No enhancing renal mass.\nGI tract/Bowel: No obstructive process. No focal bowel wall mass identified.\nMesentery/Omentum: 19 mm lesion in the peritoneum, suspicious for metastasis. No ascites. No omental caking.\nMesenteric vessels (SMA/SMV): SMA/SMV are patent without thrombosis.\nUrinary bladder: Unremarkable.\nReproductive organs: No adnexal mass. Uterus/prostate within expected size for age. ovaries are normal / no adnexal abnormality.\nLymph nodes: Enlarged celiac lymph node, short axis 20 mm. No pathologically enlarged lymph nodes by size criteria.\nBones/Osseous structures: No aggressive osseous lesion. No acute fracture.\n\nIMPRESSION:\n- Pancreas primary malignancy at body of the pancreas measuring approximately 48 mm.\n- Findings concerning for nodal involvement.\n- Findings compatible with distant metastases involving: liver, peritoneum.\n- RECIST 1.1 Summary:\n- Target lesions (n=4; ≤2 per organ rule applied).\n  • T1: Primary — 50→48 mm (longest diameter).\n  • T2: Metastasis — 13→14 mm (longest diameter).\n  • T3: Metastasis — 19→19 mm (longest diameter).\n  • T4: Lymph node — 21→20 mm (short axis).\n- SLD baseline: 103 mm.\n- SLD current: 101 mm (-1.9% change).\n- New lesions: absent (unequivocal).\n- - RECIST 1.1 overall response category: SD.\n"}
{"patient_id": "PID000010", "study_date": "2023-08-18", "timepoint": 4, "recist": {"baseline_sld_mm": 103, "current_sld_mm": 95, "nadir_sld_mm": 94, "overall_response": "SD"}, "lesions": [{"lesion_id": "primary:pancreas", "kind": "primary", "organ": "pancreas", "location": "body of the pancreas", "rule": "longest", "baseline_mm": 50, "follow_mm": 47, "size_mm_current": 47, "margin": "smooth", "enhancement": "hypoenhancing", "suspicious": true, "target": true}, {"lesion_id": "ln:left hilar", "kind": "ln", "organ": "lymph", "station": "left hilar", "rule": "short_axis", "baseline_mm": null, "follow_mm": null, "size_mm_current": 9, "necrosis": false, "suspicious": false, "target": false}, {"lesion_id": "ln:celiac", "kind": "ln", "organ": "lymph", "station": "celiac", "rule": "short_axis", "baseline_mm": 21, "follow_mm": 19, "size_mm_current": 19, "necrosis": false, "suspicious": true, "target": true}, {"lesion_id": "met:liver", "kind": "met", "organ": "liver", "rule": "longest", "baseline_mm": 13, "follow_mm": 12, "size_mm_current": 12, "suspicious": true, "target": true}, {"lesion_id": "met:peritoneum", "kind": "met", "organ": "peritoneum", "rule": "longest", "baseline_mm": 19, "follow_mm": 17, "size_mm_current": 17, "suspicious": true, "target": true}], "complexity_profile": {"level": 2, "level_name": "C2", "artifact": null}, "staging_relevance": 6.0, "incidentals": [{"organ": "lung", "text": "dependent atelectasis"}], "negatives": [{"organ": "pleura", "text": "no pleural effusion"}, {"organ": "reproductive", "text": "ovaries are normal / no adnexal abnormality"}, {"organ": "gi", "text": "no colonic mass"}, {"organ": "liver", "text": "liver is normal"}, {"organ": "bladder", "text": "urinary bladder normal"}], "post_treatment": ["Post-ablation/embolization change: non-enhancing ablation cavity with peripheral rim; SBRT field with altered enhancement"], "report_text": "FINDINGS:\nComparison: 2023-07-04.\nLungs: No focal consolidation or suspicious pulmonary nodules. No pneumothorax. dependent atelectasis.\nMediastinum: Enlarged left hilar lymph node, short axis 9 mm. Cardiomediastinal contours within normal limits.\nPleura/Pleural spaces: No pleural effusion or pleural thickening.\nGreat vessels/Aorta: No thoracic aortic aneurysm or dissection.\nLiver: 12 mm lesion in the liver, suspicious for metastasis. No focal hepatic lesions. Normal attenuation. liver is normal. Post-ablation/embolization change: non-enhancing ablation cavity with peripheral rim; SBRT field with altered enhancement.\nSpleen: Normal in size and attenuation. No focal splenic lesion.\nPancreas: 4.7 cm smooth pancreatic mass in the body of the pancreas (hypoenhancing). Normal pancreatic contour and enhancement. No focal mass.\nAdrenal glands: Adrenal glands are normal without nodules.\nKidneys: No hydronephrosis. No enhancing renal mass.\nGI tract/Bowel: No obstructive process. No focal bowel wall mass identified. no colonic mass.\nMesentery/Omentum: 17 mm lesion in the peritoneum, suspicious for metastasis. No ascites. No omental caking.\nMesenteric vessels (SMA/SMV): SMA/SMV are patent without thrombosis.\nUrinary bladder: Unremarkable. urinary bladder normal.\nReproductive organs: No adnexal mass. Uterus/prostate within expected size for age. ovaries are normal / no adnexal abnormality.\nLymph nodes: Enlarged celiac lymph node, short axis 19 mm. No pathologically enlarged lymph nodes by size criteria.\nBones/Osseous structures: No aggressive osseous lesion. No acute fracture.\n\nIMPRESSION:\n- Pancreas primary malignancy at body of the pancreas measuring approximately 47 mm.\n- Findings concerning for nodal involvement.\n- Findings compatible with distant metastases involving: liver, peritoneum.\n- RECIST 1.1 Summary:\n- Target lesions (n=4; ≤2 per organ rule applied).\n  • T1: Primary — 50→47 mm (longest diameter).\n  • T2: Metastasis — 13→12 mm (longest diameter).\n  • T3: Metastasis — 19→17 mm (longest diameter).\n  • T4: Lymph node — 21→19 mm (short axis).\n- SLD baseline: 103 mm.\n- SLD current: 95 mm (-7.8% change).\n- New lesions: absent (unequivocal).\n- - RECIST 1.1 overall response category: SD.\n"}
{"patient_id": "PID000010", "study_date": "2023-10-26", "timepoint": 5, "recist": {"baseline_sld_mm": 103, "current_sld_mm": 115, "nadir_sld_mm": 94, "overall_response": "PD"}, "lesions": [{"lesion_id": "primary:pancreas", "kind": "primary", "organ": "pancreas", "location": "body of the pancreas", "rule": "longest", "baseline_mm": 50, "follow_mm": 56, "size_mm_current": 56, "margin": "smooth", "enhancement": "hypoenhancing", "suspicious": true, "target": true}, {"lesion_id": "ln:left hilar", "kind": "ln", "organ": "lymph", "station": "left hilar", "rule": "short_axis", "baseline_mm": null, "follow_mm": null, "size_mm_current": 9, "necrosis": false, "suspicious": false, "target": false}, {"lesion_id": "ln:celiac", "kind": "ln", "organ": "lymph", "station": "celiac", "rule": "short_axis", "baseline_mm": 21, "follow_mm": 23, "size_mm_current": 23, "necrosis": false, "suspicious": true, "target": true}, {"lesion_id": "met:liver", "kind": "met", "organ": "liver", "rule": "longest", "baseline_mm": 13, "follow_mm": 15, "size_mm_current": 15, "suspicious": true, "target": true}, {"lesion_id": "met:peritoneum", "kind": "met", "organ": "peritoneum", "rule": "longest", "baseline_mm": 19, "follow_mm": 21, "size_mm_current": 21, "suspicious": true, "target": true}], "complexity_profile": {"level": 2, "level_name": "C2", "artifact": {"key": "beam_hardening", "impact": 2, "report_phrase": "Beam-hardening streak artifact from dense structures limits evaluation.", "severity_rank": 3}}, "staging_relevance": 17.0, "incidentals": [{"organ": "spleen", "text": "accessory spleen"}], "negatives": [{"organ": "gi", "text": "no colonic mass"}, {"organ": "liver", "text": "liver is normal"}, {"organ": "adrenals", "text": "adrenal glands normal"}, {"organ": "pancreas", "text": "no pancreatic mass"}, {"organ": "kidneys", "text": "no renal mass"}], "post_treatment": [], "report_text": "FINDINGS:\nBeam-hardening streak artifact from dense structures limits evaluation.\nComparison: 2023-08-18.\nPulmonary parenchyma: Clear lungs without focal mass. No suspicious nodules identified.\nMediastinum: Enlarged left hilar lymph node, short axis 0.9 cm. Cardiomediastinal contours within normal limits.\nPleura/Pleural spaces: No pleural effusion or pleural thickening.\nGreat vessels/Aorta: No thoracic aortic aneurysm or dissection.\nLiver: 15 mm lesion in the liver, suspicious for metastasis. No focal hepatic lesions. Normal attenuation. liver is normal.\nSpleen: Normal in size and attenuation. No focal splenic lesion. accessory spleen.\nPancreas: 56 mm smooth pancreatic mass in the body of the pancreas (hypoenhancing). Normal pancreatic contour and enhancement. No focal mass. no pancreatic mass.\nAdrenal glands: Adrenal glands are normal without nodules. adrenal glands normal.\nKidneys: No hydronephrosis. No enhancing renal mass. no renal mass.\nGI tract/Bowel: No obstructive process. No focal bowel wall mass identified. no colonic mass.\nMesentery/Omentum: 21 mm lesion in the peritoneum, suspicious for metastasis. No ascites. No omental caking.\nMesenteric vessels (SMA/SMV): SMA/SMV are patent without thrombosis.\nUrinary bladder: Unremarkable.\nReproductive organs: No adnexal mass. Uterus/prostate within expected size for age.\nLymph nodes: Enlarged celiac lymph node, short axis 2.3 cm. No pathologically enlarged lymph nodes by size criteria.\nBones/Osseous structures: No aggressive osseous lesion. No acute fracture.\n\nIMPRESSION:\n- Pancreas primary malignancy at body of the pancreas measuring approximately 56 mm.\n- Findings concerning for nodal involvement.\n- Findings compatible with distant metastases involving: liver, peritoneum.\n- RECIST 1.1 Summary:\n- Target lesions (n=4; ≤2 per organ rule applied).\n  • T1: Primary — 50→56 mm (longest diameter).\n  • T2: Metastasis — 13→15 mm (longest diameter).\n  • T3: Metastasis — 19→21 mm (longest diameter).\n  • T4: Lymph node — 21→23 mm (short axis).\n- SLD baseline: 103 mm.\n- SLD current: 115 mm (+11.7% change).\n- New lesions: absent (unequivocal).\n- - RECIST 1.1 overall response category: PD.\n"}
{"patient_id": "PID000011", "study_date": "2023-12-06", "timepoint": 0, "recist": {"baseline_sld_mm": 37, "current_sld_mm": null, "nadir_sld_mm": null, "overall_response": "Baseline (no category)"}, "lesions": [{"lesion_id": "primary:liver", "kind": "primary", "organ": "liver", "location": "segment 2 of the liver", "rule": "longest", "baseline_mm": 37, "follow_mm": null, "size_mm_current": 37, "margin": "spiculated", "enhancement": "hyperenhancing", "suspicious": true, "target": true}, {"lesion_id": "ln:mesenteric", "kind": "ln", "organ": "lymph", "station": "mesenteric", "rule": "short_axis", "baseline_mm": null, "follow_mm": null, "size_mm_current": 8, "necrosis": false, "suspicious": false, "target": false}], "complexity_profile": {"level": 2, "level_name": "C2", "artifact": null}, "staging_relevance": 0.0, "incidentals": [{"organ": "pleura", "text": "pleural calcifications"}, {"organ": "mediastinum", "text": "prominent but subthreshold lymph nodes"}, {"organ": "gi.stomach", "text": "physiologic under-distension thickening"}], "negatives": [{"organ": "mediastinum", "text": "no mediastinal mass"}, {"organ": "spleen", "text": "no focal splenic lesion"}, {"organ": "mesentery_peritoneum", "text": "no peritoneal nodularity"}, {"organ": "gi", "text": "no colonic mass"}, {"organ": "pancreas", "text": "pancreas is normal"}], "post_treatment": [], "report_text": "FINDINGS:\nLungs: Clear lungs without focal mass. No suspicious nodules identified.\nMediastinum: Cardiomediastinal contours within normal limits. prominent but subthreshold lymph nodes. no mediastinal mass.\nPleura/Pleural spaces: No pleural effusion or pleural thickening. pleural calcifications.\nGreat vessels/Aorta: No thoracic aortic aneurysm or dissection.\nLiver: 37 mm spiculated hepatic mass in segment 2 of the liver (hyperenhancing). No focal hepatic lesions. Normal attenuation.\nSpleen: Normal in size and attenuation. No focal splenic lesion.\nPancreas: Normal pancreatic contour and enhancement. No focal mass. pancreas is normal.\nAdrenal glands: Adrenal glands are normal without nodules.\nKidneys: No hydronephrosis. No enhancing renal mass.\nGI tract/Bowel: No obstructive process. No focal bowel wall mass identified. physiologic under-distension thickening. no colonic mass.\nMesentery/Omentum: No ascites. No omental caking. no peritoneal nodularity.\nMesenteric vessels (SMA/SMV): SMA/SMV are patent without thrombosis.\nUrinary bladder: Unremarkable.\nReproductive organs: No adnexal mass. Uterus/prostate within expected size for age.\nLymph nodes: Enlarged mesenteric lymph node, short axis 8 mm. No pathologically enlarged lymph nodes by size criteria.\nBones/Osseous structures: No aggressive osseous lesion. No acute fracture.\n\nIMPRESSION:\n- Liver primary malignancy at segment 2 of the liver measuring approximately 37 mm.\n- Findings concerning for nodal involvement.\n- No definite distant metastases identified.\n- RECIST 1.1 Summary:\n- Target lesions (n=1; ≤2 per organ rule applied).\n  • T1: Primary — 37 mm (longest diameter) at baseline.\n- SLD baseline: 37 mm.\n- New lesions: absent (unequivocal).\n- - RECIST 1.1 overall response category: Baseline (no category).\n"}
{"patient_id": "PID000011", "study_date": "2024-02-11", "timepoint": 1, "recist": {"baseline_sld_mm": 37, "current_sld_mm": 23, "nadir_sld_mm": 23, "overall_response": "PR"}, "lesions": [{"lesion_id": "primary:liver", "kind": "primary", "organ": "liver", "location": "segment 2 of the liver", "rule": "longest", "baseline_mm": 37, "follow_mm": 23, "size_mm_current": 23, "margin": "spiculated", "enhancement": "hyperenhancing", "suspicious": true, "target": true}, {"lesion_id": "ln:mesenteric", "kind": "ln", "organ": "lymph", "station": "mesenteric", "rule": "short_axis", "baseline_mm": null, "follow_mm": null, "size_mm_current": 8, "necrosis": false, "suspicious": false, "target": false}], "complexity_profile": {"level": 2, "level_name": "C2", "artifact": {"key": "motion_mild", "impact": 1, "report_phrase": "Respiratory motion artifact partially limits assessment.", "severity_rank": 2}}, "staging_relevance": -1.0, "incidentals": [{"organ": "gi.stomach", "text": "small benign polyp"}], "negatives": [{"organ": "adrenals", "text": "no adrenal nodule"}, {"organ": "mesentery_peritoneum", "text": "no peritoneal nodularity"}, {"organ": "pancreas", "text": "no pancreatic mass"}, {"organ": "pleura", "text": "no pleural nodularity"}, {"organ": "reproductive", "text": "ovaries are normal / no adnexal abnormality"}], "post_treatment": [], "report_text": "FINDINGS:\nRespiratory motion artifact partially limits assessment.\nComparison: 2023-12-06.\nPulmonary parenchyma: No focal consolidation or suspicious pulmonary nodules. No pneumothorax.\nMediastinum: Cardiomediastinal contours within normal limits.\nPleura/Pleural spaces: No pleural effusion or pleural thickening. no pleural nodularity.\nGreat vessels/Aorta: No thoracic aortic aneurysm or dissection.\nLiver: 23 mm spiculated hepatic mass in segment 2 of the liver (hyperenhancing). No focal hepatic lesions. Normal attenuation.\nSpleen: Normal in size and attenuation. No focal splenic lesion.\nPancreas: Normal pancreatic contour and enhancement. No focal mass. no pancreatic mass.\nAdrenal glands: Adrenal glands are normal without nodules. no adrenal nodule.\nKidneys: No hydronephrosis. No enhancing renal mass.\nGI tract/Bowel: No obstructive process. No focal bowel wall mass identified. small benign polyp.\nMesentery/Omentum: No ascites. No omental caking. no peritoneal nodularity.\nMesenteric vessels (SMA/SMV): SMA/SMV are patent without thrombosis.\nUrinary bladder: Unremarkable.\nReproductive organs: No adnexal mass. Uterus/prostate within expected size for age. ovaries are normal / no adnexal abnormality.\nLymph nodes: Enlarged mesenteric lymph node, short axis 8 mm. No pathologically enlarged lymph nodes by size criteria.\nBones/Osseous structures: No aggressive osseous lesion. No acute fracture.\n\nIMPRESSION:\n- Liver primary malignancy at segment 2 of the liver measuring approximately 23 mm.\n- Findings concerning for nodal involvement.\n- No definite distant metastases identified.\n- RECIST 1.1 Summary:\n- Target lesions (n=1; ≤2 per organ rule applied).\n  • T1: Primary — 37→23 mm (longest diameter).\n- SLD baseline: 37 mm.\n- SLD current: 23 mm (-37.8% change).\n- New lesions: absent (unequivocal).\n- - RECIST 1.1 overall response category: PR.\n"}
{"patient_id": "PID000011", "study_date": "2024-04-20", "timepoint": 2, "recist": {"baseline_sld_mm": 37, "current_sld_mm": 24, "nadir_sld_mm": 23, "overall_response": "PR"}, "lesions": [{"lesion_id": "primary:liver", "kind": "primary", "organ": "liver", "location": "segment 2 of the liver", "rule": "longest", "baseline_mm": 37, "follow_mm": 24, "size_mm_current": 24, "margin": "spiculated", "enhancement": "hyperenhancing", "suspicious": true, "target": true}, {"lesion_id": "ln:mesenteric", "kind": "ln", "organ": "lymph", "station": "mesenteric", "rule": "short_axis", "baseline_mm": null, "follow_mm": null, "size_mm_current": 8, "necrosis": false, "suspicious": false, "target": false}], "complexity_profile": {"level": 2, "level_name": "C2", "artifact": null}, "staging_relevance": 0.0, "incidentals": [{"organ": "pancreas", "text": "serous cystadenoma"}], "negatives": [{"organ": "bones", "text": "no destructive osseous lesion"}, {"organ": "gi", "text": "stomach is normal"}, {"organ": "reproductive", "text": "ovaries are normal / no adnexal abnormality"}, {"organ": "bladder", "text": "urinary bladder normal"}, {"organ": "adrenals", "text": "adrenal glands normal"}], "post_treatment": [], "report_text": "FINDINGS:\nComparison: 2024-02-11.\nLungs: Clear lungs without focal mass. No suspicious nodules identified.\nMediastinum: Cardiomediastinal contours within normal limits.\nPleura/Pleural spaces: No pleural effusion or pleural thickening.\nGreat vessels/Aorta: No thoracic aortic aneurysm or dissection.\nLiver: 24 mm spiculated hepatic mass in segment 2 of the liver (hyperenhancing). No focal hepatic lesions. Normal attenuation.\nSpleen: Normal in size and attenuation. No focal splenic lesion.\nPancreas: Normal pancreatic contour and enhancement. No focal mass. serous cystadenoma.\nAdrenal glands: Adrenal glands are normal without nodules. adrenal glands normal.\nKidneys: No hydronephrosis. No enhancing renal mass.\nGI tract/Bowel: No obstructive process. No focal bowel wall mass identified. stomach is normal.\nMesentery/Omentum: No ascites. No omental caking.\nMesenteric vessels (SMA/SMV): SMA/SMV are patent without thrombosis.\nUrinary bladder: Unremarkable. urinary bladder normal.\nReproductive organs: No adnexal mass. Uterus/prostate within expected size for age. ovaries are normal / no adnexal abnormality.\nLymph nodes: Enlarged mesenteric lymph node, short axis 0.8 cm. No pathologically enlarged lymph nodes by size criteria.\nBones/Osseous structures: No aggressive osseous lesion. No acute fracture. no destructive osseous lesion.\n\nIMPRESSION:\n- Liver primary malignancy at segment 2 of the liver measuring approximately 24 mm.\n- Findings concerning for nodal involvement.\n- No definite distant metastases identified.\n- RECIST 1.1 Summary:\n- Target lesions (n=1; ≤2 per organ rule applied).\n  • T1: Primary — 37→24 mm (longest diameter).\n- SLD baseline: 37 mm.\n- SLD current: 24 mm (-35.1% change).\n- New lesions: absent (unequivocal).\n- - RECIST 1.1 overall response category: PR.\n"}
{"patient_id": "PID000011", "study_date": "2024-06-28", "timepoint": 3, "recist": {"baseline_sld_mm": 37, "current_sld_mm": 39, "nadir_sld_mm": 23, "overall_response": "PD"}, "lesions": [{"lesion_id": "primary:liver", "kind": "primary", "organ": "liver", "location": "segment 2 of the liver", "rule": "longest", "baseline_mm": 37, "follow_mm": 39, "size_mm_current": 39, "margin": "spiculated", "enhancement": "hyperenhancing", "suspicious": true, "target": true}, {"lesion_id": "ln:mesenteric", "kind": "ln", "organ": "lymph", "station": "mesenteric", "rule": "short_axis", "baseline_mm": null, "follow_mm": null, "size_mm_current": 8, "necrosis": false, "suspicious": false, "target": false}], "complexity_profile": {"level": 2, "level_name": "C2", "artifact": null}, "staging_relevance": 13.0, "incidentals": [{"organ": "liver", "text": "hemangioma (peripheral nodular enhancement with centripetal fill-in)"}], "negatives": [{"organ": "reproductive", "text": "ovaries are normal / no adnexal abnormality"}, {"organ": "aorta_great_vessels", "text": "no aneurysm or dissection"}, {"organ": "pleura", "text": "no pleural effusion"}, {"organ": "lung", "text": "no pulmonary abnormality"}, {"organ": "pancreas", "text": "no pancreatic mass"}], "post_treatment": [], "report_text": "FINDINGS:\nComparison: 2024-04-20.\nPulmonary parenchyma: No focal consolidation or suspicious pulmonary nodules. No pneumothorax.\nMediastinum: Cardiomediastinal contours within normal limits.\nPleura/Pleural spaces: No pleural effusion or pleural thickening.\nGreat vessels/Aorta: No thoracic aortic aneurysm or dissection. no aneurysm or dissection.\nLiver: 39 mm spiculated hepatic mass in segment 2 of the liver (hyperenhancing). No focal hepatic lesions. Normal attenuation. hemangioma (peripheral nodular enhancement with centripetal fill-in).\nSpleen: Normal in size and attenuation. No focal splenic lesion.\nPancreas: Normal pancreatic contour and enhancement. No focal mass. no pancreatic mass.\nAdrenal glands: Adrenal glands are normal without nodules.\nKidneys: No hydronephrosis. No enhancing renal mass.\nGI tract/Bowel: No obstructive process. No focal bowel wall mass identified.\nMesentery/Omentum: No ascites. No omental caking.\nMesenteric vessels (SMA/SMV): SMA/SMV are patent without thrombosis.\nUrinary bladder: Unremarkable.\nReproductive organs: No adnexal mass. Uterus/prostate within expected size for age. ovaries are normal / no adnexal abnormality.\nLymph nodes: Enlarged mesenteric lymph node, short axis 0.8 cm. No pathologically enlarged lymph nodes by size criteria.\nBones/Osseous structures: No aggressive osseous lesion. No acute fracture.\n\nIMPRESSION:\n- Liver primary malignancy at segment 2 of the liver measuring approximately 39 mm.\n- Findings concerning for nodal involvement.\n- No definite distant metastases identified.\n- RECIST 1.1 Summary:\n- Target lesions (n=1; ≤2 per organ rule applied).\n  • T1: Primary — 37→39 mm (longest diameter).\n- SLD baseline: 37 mm.\n- SLD current: 39 mm (+5.4% change).\n- New lesions: absent (unequivocal).\n- - RECIST 1.1 overall response category: PD.\n"}
{"patient_id": "PID000011", "study_date": "2024-08-19", "timepoint": 4, "recist": {"baseline_sld_mm": 37, "current_sld_mm": 41, "nadir_sld_mm": 23, "overall_response": "PD"}, "lesions": [{"lesion_id": "primary:liver", "kind": "primary", "organ": "liver", "location": "segment 2 of the liver", "rule": "longest", "baseline_mm": 37, "follow_mm": 41, "size_mm_current": 41, "margin": "spiculated", "enhancement": "hyperenhancing", "suspicious": true, "target": true}, {"lesion_id": "ln:mesenteric", "kind": "ln", "organ": "lymph", "station": "mesenteric", "rule": "short_axis", "baseline_mm": null, "follow_mm": null, "size_mm_current": 8, "necrosis": false, "suspicious": false, "target": false}], "complexity_profile": {"level": 2, "level_name": "C2", "artifact": null}, "staging_relevance": 13.0, "incidentals": [{"organ": "mediastinum", "text": "small thymic remnant"}, {"organ": "spleen", "text": "tiny cyst"}], "negatives": [{"organ": "pleura", "text": "no pleural nodularity"}, {"organ": "liver", "text": "no hepatic mass"}, {"organ": "mesentery_peritoneum", "text": "no ascites"}, {"organ": "adrenals", "text": "adrenal glands normal"}, {"organ": "spleen", "text": "no focal splenic lesion"}], "post_treatment": [], "report_text": "FINDINGS:\nComparison: 2024-06-28.\nPulmonary parenchyma: Clear lungs without focal mass. No suspicious nodules identified.\nMediastinum: Cardiomediastinal contours within normal limits. small thymic remnant.\nPleura/Pleural spaces: No pleural effusion or pleural thickening. no pleural nodularity.\nGreat vessels/Aorta: No thoracic aortic aneurysm or dissection.\nLiver: 41 mm spiculated hepatic mass in segment 2 of the liver (hyperenhancing). No focal hepatic lesions. Normal attenuation. no hepatic mass.\nSpleen: Normal in size and attenuation. No focal splenic lesion. tiny cyst.\nPancreas: Normal pancreatic contour and enhancement. No focal mass.\nAdrenal glands: Adrenal glands are normal without nodules. adrenal glands normal.\nKidneys: No hydronephrosis. No enhancing renal mass.\nGI tract/Bowel: No obstructive process. No focal bowel wall mass identified.\nMesentery/Omentum: No ascites. No omental caking.\nMesenteric vessels (SMA/SMV): SMA/SMV are patent without thrombosis.\nUrinary bladder: Unremarkable.\nReproductive organs: No adnexal mass. Uterus/prostate within expected size for age.\nLymph nodes: Enlarged mesenteric lymph node, short axis 0.8 cm. No pathologically enlarged lymph nodes by size criteria.\nBones/Osseous structures: No aggressive osseous lesion. No acute fracture.\n\nIMPRESSION:\n- Liver primary malignancy at segment 2 of the liver measuring approximately 41 mm.\n- Findings concerning for nodal involvement.\n- No definite distant metastases identified.\n- RECIST 1.1 Summary:\n- Target lesions (n=1; ≤2 per organ rule applied).\n  • T1: Primary — 37→41 mm (longest diameter).\n- SLD baseline: 37 mm.\n- SLD current: 41 mm (+10.8% change).\n- New lesions: absent (unequivocal).\n- - RECIST 1.1 overall response category: PD.\n"}
{"patient_id": "PID000012", "study_date": "2023-08-05", "timepoint": 0, "recist": {"baseline_sld_mm": 59, "current_sld_mm": null, "nadir_sld_mm": null, "overall_response": "Baseline (no category)"}, "lesions": [{"lesion_id": "primary:lung", "kind": "primary", "organ": "lung", "location": "right lower lobe", "rule": "longest", "baseline_mm": 35, "follow_mm": null, "size_mm_current": 35, "margin": "lobulated", "enhancement": "hyperenhancing", "suspicious": true, "target": true}, {"lesion_id": "ln:paratracheal", "kind": "ln", "organ": "lymph", "station": "paratracheal", "rule": "short_axis", "baseline_mm": 24, "follow_mm": null, "size_mm_current": 24, "necrosis": true, "suspicious": true, "target": true}], "complexity_profile": {"level": 2, "level_name": "C2", "artifact": null}, "staging_relevance": 0.0, "incidentals": [{"organ": "adrenals", "text": "lipid-rich adenoma"}, {"organ": "pancreas", "text": "side-branch IPMN (no worrisome features)"}, {"organ": "gi.small_bowel", "text": "nonspecific fluid levels"}], "negatives": [{"organ": "pancreas", "text": "no pancreatic mass"}, {"organ": "spleen", "text": "no focal splenic lesion"}, {"organ": "adrenals", "text": "no adrenal nodule"}, {"organ": "liver", "text": "liver is normal"}, {"organ": "aorta_great_vessels", "text": "aorta normal caliber"}], "post_treatment": [], "report_text": "FINDINGS:\nLungs: 35 mm lobulated mass in the right lower lobe (hyperenhancing). Clear lungs without focal mass. No suspicious nodules identified.\nMediastinum: Enlarged paratracheal lymph node, short axis 24 mm with central necrosis. Cardiomediastinal contours within normal limits.\nPleura/Pleural spaces: No pleural effusion or pleural thickening.\nGreat vessels/Aorta: No thoracic aortic aneurysm or dissection. aorta normal caliber.\nLiver: No focal hepatic lesions. Normal attenuation. liver is normal.\nSpleen: Normal in size and attenuation. No focal splenic lesion.\nPancreas: Normal pancreatic contour and enhancement. No focal mass. side-branch IPMN (no worrisome features). no pancreatic mass.\nAdrenal glands: Adrenal glands are normal without nodules. lipid-rich adenoma. no adrenal nodule.\nKidneys: No hydronephrosis. No enhancing renal mass.\nGI tract/Bowel: No obstructive process. No focal bowel wall mass identified. nonspecific fluid levels.\nMesentery/Omentum: No ascites. No omental caking.\nMesenteric vessels (SMA/SMV): SMA/SMV are patent without thrombosis.\nUrinary bladder: Unremarkable.\nReproductive organs: No adnexal mass. Uterus/prostate within expected size for age.\nLymph nodes: No pathologically enlarged lymph nodes by size criteria.\nBones/Osseous structures: No aggressive osseous lesion. No acute fracture.\n\nIMPRESSION:\n- Lung primary malignancy at right lower lobe measuring approximately 35 mm.\n- Findings concerning for nodal involvement.\n- No definite distant metastases identified.\n- RECIST 1.1 Summary:\n- Target lesions (n=2; ≤2 per organ rule applied).\n  • T1: Primary — 35 mm (longest diameter) at baseline.\n  • T2: Lymph node — 24 mm (short axis) at baseline.\n- SLD baseline: 59 mm.\n- New lesions: absent (unequivocal).\n- - RECIST 1.1 overall response category: Baseline (no category).\n"}
{"patient_id": "PID000012", "study_date": "2023-10-06", "timepoint": 1, "recist": {"baseline_sld_mm": 59, "current_sld_mm": 33, "nadir_sld_mm": 33, "overall_response": "PR"}, "lesions": [{"lesion_id": "primary:lung", "kind": "primary", "organ": "lung", "location": "right lower lobe", "rule": "longest", "baseline_mm": 35, "follow_mm": 19, "size_mm_current": 19, "margin": "lobulated", "enhancement": "hyperenhancing", "suspicious": true, "target": true}, {"lesion_id": "ln:paratracheal", "kind": "ln", "organ": "lymph", "station": "paratracheal", "rule": "short_axis", "baseline_mm": 24, "follow_mm": 14, "size_mm_current": 14, "necrosis": true, "suspicious": true, "target": true}], "complexity_profile": {"level": 2, "level_name": "C2", "artifact": null}, "staging_relevance": 0.0, "incidentals": [{"organ": "pancreas", "text": "simple cyst (<2 cm)"}], "negatives": [{"organ": "mesentery_peritoneum", "text": "no ascites"}, {"organ": "reproductive", "text": "ovaries are normal / no adnexal abnormality"}, {"organ": "kidneys", "text": "no renal mass"}, {"organ": "pleura", "text": "no pleural effusion"}, {"organ": "spleen", "text": "no focal splenic lesion"}], "post_treatment": [], "report_text": "FINDINGS:\nComparison: 2023-08-05.\nLungs: 19 mm lobulated mass in the right lower lobe (hyperenhancing). Clear lungs without focal mass. No suspicious nodules identified.\nMediastinum: Enlarged paratracheal lymph node, short axis 14 mm with central necrosis. Cardiomediastinal contours within normal limits.\nPleura/Pleural spaces: No pleural effusion or pleural thickening.\nGreat vessels/Aorta: No thoracic aortic aneurysm or dissection.\nLiver: No focal hepatic lesions. Normal attenuation.\nSpleen: Normal in size and attenuation. No focal splenic lesion.\nPancreas: Normal pancreatic contour and enhancement. No focal mass. simple cyst (<2 cm).\nAdrenal glands: Adrenal glands are normal without nodules.\nKidneys: No hydronephrosis. No enhancing renal mass. no renal mass.\nGI tract/Bowel: No obstructive process. No focal bowel wall mass identified.\nMesentery/Omentum: No ascites. No omental caking.\nMesenteric vessels (SMA/SMV): SMA/SMV are patent without thrombosis.\nUrinary bladder: Unremarkable.\nReproductive organs: No adnexal mass. Uterus/prostate within expected size for age. ovaries are normal / no adnexal abnormality.\nLymph nodes: No pathologically enlarged lymph nodes by size criteria.\nBones/Osseous structures: No aggressive osseous lesion. No acute fracture.\n\nIMPRESSION:\n- Lung primary malignancy at right lower lobe measuring approximately 19 mm.\n- Findings concerning for nodal involvement.\n- No definite distant metastases identified.\n- RECIST 1.1 Summary:\n- Target lesions (n=2; ≤2 per organ rule applied).\n  • T1: Primary — 35→19 mm (longest diameter).\n  • T2: Lymph node — 24→14 mm (short axis).\n- SLD baseline: 59 mm.\n- SLD current: 33 mm (-44.1% change).\n- New lesions: absent (unequivocal).\n- - RECIST 1.1 overall response category: PR.\n"}
{"patient_id": "PID000012", "study_date": "2023-11-22", "timepoint": 2, "recist": {"baseline_sld_mm": 59, "current_sld_mm": 34, "nadir_sld_mm": 33, "overall_response": "PR"}, "lesions": [{"lesion_id": "primary:lung", "kind": "primary", "organ": "lung", "location": "right lower lobe", "rule": "longest", "baseline_mm": 35, "follow_mm": 20, "size_mm_current": 20, "margin": "lobulated", "enhancement": "hyperenhancing", "suspicious": true, "target": true}, {"lesion_id": "ln:paratracheal", "kind": "ln", "organ": "lymph", "station": "paratracheal", "rule": "short_axis", "baseline_mm": 24, "follow_mm": 14, "size_mm_current": 14, "necrosis": true, "suspicious": true, "target": true}], "complexity_profile": {"level": 2, "level_name": "C2", "artifact": null}, "staging_relevance": 0.0, "incidentals": [{"organ": "gi.stomach", "text": "small benign polyp"}, {"organ": "lung", "text": "<6 mm well-circumscribed nodule"}], "negatives": [{"organ": "lung", "text": "no pleural effusion"}, {"organ": "kidneys", "text": "kidneys are normal"}, {"organ": "aorta_great_vessels", "text": "aorta normal caliber"}, {"organ": "spleen", "text": "spleen normal size"}, {"organ": "bones", "text": "no destructive osseous lesion"}], "post_treatment": [], "report_text": "FINDINGS:\nComparison: 2023-10-06.\nPulmonary parenchyma: 20 mm lobulated mass in the right lower lobe (hyperenhancing). Clear lungs without focal mass. No suspicious nodules identified.\nMediastinum: Enlarged paratracheal lymph node, short axis 1.4 cm with central necrosis. Cardiomediastinal contours within normal limits.\nPleura/Pleural spaces: No pleural effusion or pleural thickening.\nGreat vessels/Aorta: No thoracic aortic aneurysm or dissection. aorta normal caliber.\nLiver: No focal hepatic lesions. Normal attenuation.\nSpleen: Normal in size and attenuation. No focal splenic lesion. spleen normal size.\nPancreas: Normal pancreatic contour and enhancement. No focal mass.\nAdrenal glands: Adrenal glands are normal without nodules.\nKidneys: No hydronephrosis. No enhancing renal mass. kidneys are normal.\nGI tract/Bowel: No obstructive process. No focal bowel wall mass identified. small benign polyp.\nMesentery/Omentum: No ascites. No omental caking.\nMesenteric vessels (SMA/SMV): SMA/SMV are patent without thrombosis.\nUrinary bladder: Unremarkable.\nReproductive organs: No adnexal mass. Uterus/prostate within expected size for age.\nLymph nodes: No pathologically enlarged lymph nodes by size criteria.\nBones/Osseous structures: No aggressive osseous lesion. No acute fracture. no destructive osseous lesion.\n\nIMPRESSION:\n- Lung primary malignancy at right lower lobe measuring approximately 20 mm.\n- Findings concerning for nodal involvement.\n- No definite distant metastases identified.\n- RECIST 1.1 Summary:\n- Target lesions (n=2; ≤2 per organ rule applied).\n  • T1: Primary — 35→20 mm (longest diameter).\n  • T2: Lymph node — 24→14 mm (short axis).\n- SLD baseline: 59 mm.\n- SLD current: 34 mm (-42.4% change).\n- New lesions: absent (unequivocal).\n- - RECIST 1.1 overall response category: PR.\n"}
{"patient_id": "PID000013", "study_date": "2023-08-07", "timepoint": 0, "recist": {"baseline_sld_mm": 67, "current_sld_mm": null, "nadir_sld_mm": null, "overall_response": "Baseline (no category)"}, "lesions": [{"lesion_id": "primary:stomach", "kind": "primary", "organ": "stomach", "location": "antrum of the stomach", "rule": "longest", "baseline_mm": 34, "follow_mm": null, "size_mm_current": 34, "margin": "lobulated", "enhancement": "hypoenhancing", "suspicious": true, "target": true}, {"lesion_id": "ln:internal iliac", "kind": "ln", "organ": "lymph", "station": "internal iliac", "rule": "short_axis", "baseline_mm": 21, "follow_mm": null, "size_mm_current": 21, "necrosis": false, "suspicious": true, "target": true}, {"lesion_id": "met:bone", "kind": "met", "organ": "bone", "rule": "longest", "baseline_mm": 12, "follow_mm": null, "size_mm_current": 12, "suspicious": true, "target": true}], "complexity_profile": {"level": 2, "level_name": "C2", "artifact": {"key": "motion_mild", "impact": 1, "report_phrase": "Respiratory motion artifact partially limits assessment.", "severity_rank": 2}}, "staging_relevance": -2.0, "incidentals": [{"organ": "bladder", "text": "under-distension wall thickening"}], "negatives": [{"organ": "mesentery_peritoneum", "text": "no peritoneal nodularity"}, {"organ": "pancreas", "text": "pancreas is normal"}, {"organ": "liver", "text": "no hepatic mass"}, {"organ": "pleura", "text": "no pleural nodularity"}, {"organ": "lung", "text": "no pulmonary abnormality"}], "post_treatment": ["Radiation change: ground-glass opacities within field"], "report_text": "FINDINGS:\nRespiratory motion artifact partially limits assessment.\nPulmonary parenchyma: No focal consolidation or suspicious pulmonary nodules. No pneumothorax.\nMediastinum: Cardiomediastinal contours within normal limits.\nPleura/Pleural spaces: No pleural effusion or pleural thickening. no pleural nodularity.\nGreat vessels/Aorta: No thoracic aortic aneurysm or dissection.\nLiver: No focal hepatic lesions. Normal attenuation. no hepatic mass.\nSpleen: Normal in size and attenuation. No focal splenic lesion.\nPancreas: Normal pancreatic contour and enhancement. No focal mass. pancreas is normal.\nAdrenal glands: Adrenal glands are normal without nodules.\nKidneys: No hydronephrosis. No enhancing renal mass.\nGI tract/Bowel: 34 mm lobulated gastric mass at the antrum of the stomach (hypoenhancing). No obstructive process. No focal bowel wall mass identified.\nMesentery/Omentum: No ascites. No omental caking. no peritoneal nodularity.\nMesenteric vessels (SMA/SMV): SMA/SMV are patent without thrombosis.\nUrinary bladder: Unremarkable. under-distension wall thickening.\nReproductive organs: No adnexal mass. Uterus/prostate within expected size for age.\nLymph nodes: Enlarged internal iliac lymph node, short axis 21 mm. No pathologically enlarged lymph nodes by size criteria.\nBones/Osseous structures: Sclerotic osseous metastasis—nonmeasurable by RECIST (blastic). No aggressive osseous lesion. No acute fracture.\n\nIMPRESSION:\n- Stomach primary neoplasm (indeterminate) at antrum of the stomach measuring approximately 34 mm.\n- Findings concerning for nodal involvement.\n- Findings compatible with distant metastases involving: bone.\n- RECIST 1.1 Summary:\n- Target lesions (n=3; ≤2 per organ rule applied).\n  • T1: Primary — 34 mm (longest diameter) at baseline.\n  • T2: Metastasis — 12 mm (longest diameter) at baseline.\n  • T3: Lymph node — 21 mm (short axis) at baseline.\n- SLD baseline: 67 mm.\n- New lesions: absent (unequivocal).\n- - RECIST 1.1 overall response category: Baseline (no category).\n\nComment: Some features are less likely; short-interval follow-up or problem-solving imaging may be considered.\n"}
{"patient_id": "PID000013", "study_date": "2023-10-07", "timepoint": 1, "recist": {"baseline_sld_mm": 67, "current_sld_mm": 46, "nadir_sld_mm": 46, "overall_response": "PR"}, "lesions": [{"lesion_id": "primary:stomach", "kind": "primary", "organ": "stomach", "location": "antrum of the stomach", "rule": "longest", "baseline_mm": 34, "follow_mm": 23, "size_mm_current": 23, "margin": "lobulated", "enhancement": "hypoenhancing", "suspicious": true, "target": true}, {"lesion_id": "ln:internal iliac", "kind": "ln", "organ": "lymph", "station": "internal iliac", "rule": "short_axis", "baseline_mm": 21, "follow_mm": 15, "size_mm_current": 15, "necrosis": false, "suspicious": true, "target": true}, {"lesion_id": "met:bone", "kind": "met", "organ": "bone", "rule": "longest", "baseline_mm": 12, "follow_mm": 8, "size_mm_current": 8, "suspicious": true, "target": true}], "complexity_profile": {"level": 2, "level_name": "C2", "artifact": {"key": "motion_mild", "impact": 1, "report_phrase": "Respiratory motion artifact partially limits assessment.", "severity_rank": 2}}, "staging_relevance": 5.0, "incidentals": [{"organ": "aorta_great_vessels", "text": "mild aortic atherosclerosis"}, {"organ": "mediastinum", "text": "prominent but subthreshold lymph nodes"}, {"organ": "pleura", "text": "trace effusion"}], "negatives": [{"organ": "mesentery_peritoneum", "text": "no peritoneal nodularity"}, {"organ": "bones", "text": "no destructive osseous lesion"}, {"organ": "lung", "text": "no suspicious pulmonary nodule"}, {"organ": "pleura", "text": "no pleural effusion"}, {"organ": "mediastinum", "text": "no pathologic mediastinal lymphadenopathy"}], "post_treatment": [], "report_text": "FINDINGS:\nRespiratory motion artifact partially limits assessment.\nComparison: 2023-08-07.\nPulmonary parenchyma: No focal consolidation or suspicious pulmonary nodules. No pneumothorax.\nMediastinum: Cardiomediastinal contours within normal limits. prominent but subthreshold lymph nodes. no pathologic mediastinal lymphadenopathy.\nPleura/Pleural spaces: No pleural effusion or pleural thickening. trace effusion.\nGreat vessels/Aorta: No thoracic aortic aneurysm or dissection. mild aortic atherosclerosis.\nLiver: No focal hepatic lesions. Normal attenuation.\nSpleen: Normal in size and attenuation. No focal splenic lesion.\nPancreas: Normal pancreatic contour and enhancement. No focal mass.\nAdrenal glands: Adrenal glands are normal without nodules.\nKidneys: No hydronephrosis. No enhancing renal mass.\nGI tract/Bowel: 2.3 cm lobulated gastric mass at the antrum of the stomach (hypoenhancing). No obstructive process. No focal bowel wall mass identified.\nMesentery/Omentum: No ascites. No omental caking. no peritoneal nodularity.\nMesenteric vessels (SMA/SMV): SMA/SMV are patent without thrombosis.\nUrinary bladder: Unremarkable.\nReproductive organs: No adnexal mass. Uterus/prostate within expected size for age.\nLymph nodes: Enlarged internal iliac lymph node, short axis 1.5 cm. No pathologically enlarged lymph nodes by size criteria.\nBones/Osseous structures: Sclerotic osseous metastasis—nonmeasurable by RECIST (blastic). No aggressive osseous lesion. No acute fracture. no destructive osseous lesion.\n\nIMPRESSION:\n- Stomach primary malignancy at antrum of the stomach measuring approximately 23 mm.\n- Findings concerning for nodal involvement.\n- Findings compatible with distant metastases involving: bone.\n- RECIST 1.1 Summary:\n- Target lesions (n=3; ≤2 per organ rule applied).\n  • T1: Primary — 34→23 mm (longest diameter).\n  • T2: Metastasis — 12→8 mm (longest diameter).\n  • T3: Lymph node — 21→15 mm (short axis).\n- SLD baseline: 67 mm.\n- SLD current: 46 mm (-31.3% change).\n- New lesions: absent (unequivocal).\n- - RECIST 1.1 overall response category: PR.\n"}
{"patient_id": "PID000013", "study_date": "2023-11-24", "timepoint": 2, "recist": {"baseline_sld_mm": 67, "current_sld_mm": 70, "nadir_sld_mm": 46, "overall_response": "PD"}, "lesions": [{"lesion_id": "primary:stomach", "kind": "primary", "organ": "stomach", "location": "antrum of the stomach", "rule": "longest", "baseline_mm": 34, "follow_mm": 35, "size_mm_current": 35, "margin": "lobulated", "enhancement": "hypoenhancing", "suspicious": true, "target": true}, {"lesion_id": "ln:internal iliac", "kind": "ln", "organ": "lymph", "station": "internal iliac", "rule": "short_axis", "baseline_mm": 21, "follow_mm": 23, "size_mm_current": 23, "necrosis": false, "suspicious": true, "target": true}, {"lesion_id": "met:bone", "kind": "met", "organ": "bone", "rule": "longest", "baseline_mm": 12, "follow_mm": 12, "size_mm_current": 12, "suspicious": true, "target": true}], "complexity_profile": {"level": 2, "level_name": "C2", "artifact": {"key": "beam_hardening", "impact": 2, "report_phrase": "Beam-hardening streak artifact from dense structures limits evaluation.", "severity_rank": 3}}, "staging_relevance": 17.0, "incidentals": [{"organ": "kidneys", "text": "Bosniak I cyst"}, {"organ": "mediastinum", "text": "prominent but subthreshold lymph nodes"}], "negatives": [{"organ": "adrenals", "text": "no adrenal nodule"}, {"organ": "mesentery_peritoneum", "text": "no peritoneal nodularity"}, {"organ": "gi", "text": "stomach is normal"}, {"organ": "lung", "text": "lungs are normal"}, {"organ": "mediastinum", "text": "no mediastinal mass"}], "post_treatment": [], "report_text": "FINDINGS:\nBeam-hardening streak artifact from dense structures limits evaluation.\nComparison: 2023-10-07.\nPulmonary parenchyma: Clear lungs without focal mass. No suspicious nodules identified.\nMediastinum: Cardiomediastinal contours within normal limits. prominent but subthreshold lymph nodes. no mediastinal mass.\nPleura/Pleural spaces: No pleural effusion or pleural thickening.\nGreat vessels/Aorta: No thoracic aortic aneurysm or dissection.\nLiver: No focal hepatic lesions. Normal attenuation.\nSpleen: Normal in size and attenuation. No focal splenic lesion.\nPancreas: Normal pancreatic contour and enhancement. No focal mass.\nAdrenal glands: Adrenal glands are normal without nodules. no adrenal nodule.\nKidneys: No hydronephrosis. No enhancing renal mass. Bosniak I cyst.\nGI tract/Bowel: 3.5 cm lobulated gastric mass at the antrum of the stomach (hypoenhancing). No obstructive process. No focal bowel wall mass identified. stomach is normal.\nMesentery/Omentum: No ascites. No omental caking. no peritoneal nodularity.\nMesenteric vessels (SMA/SMV): SMA/SMV are patent without thrombosis.\nUrinary bladder: Unremarkable.\nReproductive organs: No adnexal mass. Uterus/prostate within expected size for age.\nLymph nodes: Enlarged internal iliac lymph node, short axis 2.3 cm. No pathologically enlarged lymph nodes by size criteria.\nBones/Osseous structures: Sclerotic osseous metastasis—nonmeasurable by RECIST (blastic). No aggressive osseous lesion. No acute fracture.\n\nIMPRESSION:\n- Stomach primary malignancy at antrum of the stomach measuring approximately 35 mm.\n- Findings concerning for nodal involvement.\n- Findings compatible with distant metastases involving: bone.\n- RECIST 1.1 Summary:\n- Target lesions (n=3; ≤2 per organ rule applied).\n  • T1: Primary — 34→35 mm (longest diameter).\n  • T2: Metastasis — 12→12 mm (longest diameter).\n  • T3: Lymph node — 21→23 mm (short axis).\n- SLD baseline: 67 mm.\n- SLD current: 70 mm (+4.5% change).\n- New lesions: absent (unequivocal).\n- - RECIST 1.1 overall response category: PD.\n"}
{"patient_id": "PID000014", "study_date": "2023-12-19", "timepoint": 0, "recist": {"baseline_sld_mm": 105, "current_sld_mm": null, "nadir_sld_mm": null, "overall_response": "Baseline (no category)"}, "lesions": [{"lesion_id": "primary:stomach", "kind": "primary", "organ": "stomach", "location": "antrum of the stomach", "rule": "longest", "baseline_mm": 79, "follow_mm": null, "size_mm_current": 79, "margin": "lobulated", "enhancement": "isoenhancing", "suspicious": true, "target": true}, {"lesion_id": "ln:mesenteric", "kind": "ln", "organ": "lymph", "station": "mesenteric", "rule": "short_axis", "baseline_mm": 26, "follow_mm": null, "size_mm_current": 26, "necrosis": false, "suspicious": true, "target": true}], "complexity_profile": {"level": 2, "level_name": "C2", "artifact": null}, "staging_relevance": 0.0, "incidentals": [{"organ": "kidneys", "text": "Bosniak I cyst"}, {"organ": "reproductive.prostate", "text": "calcifications"}, {"organ": "gi.stomach", "text": "small benign polyp"}], "negatives": [{"organ": "pancreas", "text": "no pancreatic mass"}, {"organ": "bladder", "text": "no focal bladder wall thickening"}, {"organ": "mesentery_peritoneum", "text": "no peritoneal nodularity"}, {"organ": "aorta_great_vessels", "text": "no aneurysm or dissection"}, {"organ": "liver", "text": "liver is normal"}], "post_treatment": [], "report_text": "FINDINGS:\nLungs: Clear lungs without focal mass. No suspicious nodules identified.\nMediastinum: Cardiomediastinal contours within normal limits.\nPleura/Pleural spaces: No pleural effusion or pleural thickening.\nGreat vessels/Aorta: No thoracic aortic aneurysm or dissection. no aneurysm or dissection.\nLiver: No focal hepatic lesions. Normal attenuation. liver is normal.\nSpleen: Normal in size and attenuation. No focal splenic lesion.\nPancreas: Normal pancreatic contour and enhancement. No focal mass. no pancreatic mass.\nAdrenal glands: Adrenal glands are normal without nodules.\nKidneys: No hydronephrosis. No enhancing renal mass. Bosniak I cyst.\nGI tract/Bowel: 79 mm lobulated gastric mass at the antrum of the stomach (isoenhancing). No obstructive process. No focal bowel wall mass identified. small benign polyp.\nMesentery/Omentum: No ascites. No omental caking. no peritoneal nodularity.\nMesenteric vessels (SMA/SMV): SMA/SMV are patent without thrombosis.\nUrinary bladder: Unremarkable. no focal bladder wall thickening.\nReproductive organs: No adnexal mass. Uterus/prostate within expected size for age. calcifications.\nLymph nodes: Enlarged mesenteric lymph node, short axis 26 mm. No pathologically enlarged lymph nodes by size criteria.\nBones/Osseous structures: No aggressive osseous lesion. No acute fracture.\n\nIMPRESSION:\n- Stomach primary malignancy at antrum of the stomach measuring approximately 79 mm.\n- Findings concerning for nodal involvement.\n- No definite distant metastases identified.\n- RECIST 1.1 Summary:\n- Target lesions (n=2; ≤2 per organ rule applied).\n  • T1: Primary — 79 mm (longest diameter) at baseline.\n  • T2: Lymph node — 26 mm (short axis) at baseline.\n- SLD baseline: 105 mm.\n- New lesions: absent (unequivocal).\n- - RECIST 1.1 overall response category: Baseline (no category).\n"}
{"patient_id": "PID000014", "study_date": "2024-02-04", "timepoint": 1, "recist": {"baseline_sld_mm": 105, "current_sld_mm": 121, "nadir_sld_mm": 105, "overall_response": "SD"}, "lesions": [{"lesion_id": "primary:stomach", "kind": "primary", "organ": "stomach", "location": "antrum of the stomach", "rule": "longest", "baseline_mm": 79, "follow_mm": 91, "size_mm_current": 91, "margin": "lobulated", "enhancement": "isoenhancing", "suspicious": true, "target": true}, {"lesion_id": "ln:mesenteric", "kind": "ln", "organ": "lymph", "station": "mesenteric", "rule": "short_axis", "baseline_mm": 26, "follow_mm": 30, "size_mm_current": 30, "necrosis": false, "suspicious": true, "target": true}], "complexity_profile": {"level": 2, "level_name": "C2", "artifact": null}, "staging_relevance": 6.0, "incidentals": [{"organ": "spleen", "text": "tiny cyst"}, {"organ": "gi.stomach", "text": "small benign polyp"}, {"organ": "spleen", "text": "accessory spleen"}], "negatives": [{"organ": "kidneys", "text": "no renal mass"}, {"organ": "reproductive", "text": "prostate is normal / no prostatic mass"}, {"organ": "mesentery_peritoneum", "text": "no peritoneal nodularity"}, {"organ": "liver", "text": "no hepatic mass"}, {"organ": "lung", "text": "lungs are normal"}], "post_treatment": ["Radiation change: volume loss"], "report_text": "FINDINGS:\nComparison: 2023-12-19.\nLungs: No focal consolidation or suspicious pulmonary nodules. No pneumothorax. lungs are normal. Post-treatment change: volume loss.\nMediastinum: Cardiomediastinal contours within normal limits.\nPleura/Pleural spaces: No pleural effusion or pleural thickening.\nGreat vessels/Aorta: No thoracic aortic aneurysm or dissection.\nLiver: No focal hepatic lesions. Normal attenuation. no hepatic mass.\nSpleen: Normal in size and attenuation. No focal splenic lesion. tiny cyst. accessory spleen.\nPancreas: Normal pancreatic contour and enhancement. No focal mass.\nAdrenal glands: Adrenal glands are normal without nodules.\nKidneys: No hydronephrosis. No enhancing renal mass. no renal mass.\nGI tract/Bowel: 91 mm lobulated gastric mass at the antrum of the stomach (isoenhancing). No obstructive process. No focal bowel wall mass identified. small benign polyp.\nMesentery/Omentum: No ascites. No omental caking. no peritoneal nodularity.\nMesenteric vessels (SMA/SMV): SMA/SMV are patent without thrombosis.\nUrinary bladder: Unremarkable.\nReproductive organs: No adnexal mass. Uterus/prostate within expected size for age. prostate is normal / no prostatic mass.\nLymph nodes: Enlarged mesenteric lymph node, short axis 30 mm. No pathologically enlarged lymph nodes by size criteria.\nBones/Osseous structures: No aggressive osseous lesion. No acute fracture.\n\nIMPRESSION:\n- Stomach primary malignancy at antrum of the stomach measuring approximately 91 mm.\n- Findings concerning for nodal involvement.\n- No definite distant metastases identified.\n- RECIST 1.1 Summary:\n- Target lesions (n=2; ≤2 per organ rule applied).\n  • T1: Primary — 79→91 mm (longest diameter).\n  • T2: Lymph node — 26→30 mm (short axis).\n- SLD baseline: 105 mm.\n- SLD current: 121 mm (+15.2% change).\n- New lesions: absent (unequivocal).\n- - RECIST 1.1 overall response category: SD.\n"}
{"patient_id": "PID000014", "study_date": "2024-04-09", "timepoint": 2, "recist": {"baseline_sld_mm": 105, "current_sld_mm": 131, "nadir_sld_mm": 105, "overall_response": "PD"}, "lesions": [{"lesion_id": "primary:stomach", "kind": "primary", "organ": "stomach", "location": "antrum of the stomach", "rule": "longest", "baseline_mm": 79, "follow_mm": 97, "size_mm_current": 97, "margin": "lobulated", "enhancement": "isoenhancing", "suspicious": true, "target": true}, {"lesion_id": "ln:mesenteric", "kind": "ln", "organ": "lymph", "station": "mesenteric", "rule": "short_axis", "baseline_mm": 26, "follow_mm": 34, "size_mm_current": 34, "necrosis": false, "suspicious": true, "target": true}], "complexity_profile": {"level": 2, "level_name": "C2", "artifact": null}, "staging_relevance": 29.0, "incidentals": [{"organ": "lung", "text": "dependent atelectasis"}, {"organ": "bladder", "text": "under-distension wall thickening"}], "negatives": [{"organ": "aorta_great_vessels", "text": "no aneurysm or dissection"}, {"organ": "bones", "text": "no destructive osseous lesion"}, {"organ": "gi", "text": "stomach is normal"}, {"organ": "spleen", "text": "no focal splenic lesion"}, {"organ": "mesentery_peritoneum", "text": "no ascites"}], "post_treatment": [], "report_text": "FINDINGS:\nComparison: 2024-02-04.\nPulmonary parenchyma: No focal consolidation or suspicious pulmonary nodules. No pneumothorax.\nMediastinum: Cardiomediastinal contours within normal limits.\nPleura/Pleural spaces: No pleural effusion or pleural thickening.\nGreat vessels/Aorta: No thoracic aortic aneurysm or dissection. no aneurysm or dissection.\nLiver: No focal hepatic lesions. Normal attenuation.\nSpleen: Normal in size and attenuation. No focal splenic lesion.\nPancreas: Normal pancreatic contour and enhancement. No focal mass.\nAdrenal glands: Adrenal glands are normal without nodules.\nKidneys: No hydronephrosis. No enhancing renal mass.\nGI tract/Bowel: 97 mm lobulated gastric mass at the antrum of the stomach (isoenhancing). No obstructive process. No focal bowel wall mass identified. stomach is normal.\nMesentery/Omentum: No ascites. No omental caking.\nMesenteric vessels (SMA/SMV): SMA/SMV are patent without thrombosis.\nUrinary bladder: Unremarkable. under-distension wall thickening.\nReproductive organs: No adnexal mass. Uterus/prostate within expected size for age.\nLymph nodes: Enlarged mesenteric lymph node, short axis 34 mm. No pathologically enlarged lymph nodes by size criteria.\nBones/Osseous structures: No aggressive osseous lesion. No acute fracture. no destructive osseous lesion.\n\nIMPRESSION:\n- Stomach primary malignancy at antrum of the stomach measuring approximately 97 mm.\n- Findings concerning for nodal involvement.\n- No definite distant metastases identified.\n- RECIST 1.1 Summary:\n- Target lesions (n=2; ≤2 per organ rule applied).\n  • T1: Primary — 79→97 mm (longest diameter).\n  • T2: Lymph node — 26→34 mm (short axis).\n- SLD baseline: 105 mm.\n- SLD current: 131 mm (+24.8% change).\n- New lesions: present (unequivocal).\n- - RECIST 1.1 overall response category: PD.\n"}
{"patient_id": "PID000014", "study_date": "2024-06-16", "timepoint": 3, "recist": {"baseline_sld_mm": 105, "current_sld_mm": 132, "nadir_sld_mm": 105, "overall_response": "PD"}, "lesions": [{"lesion_id": "primary:stomach", "kind": "primary", "organ": "stomach", "location": "antrum of the stomach", "rule": "longest", "baseline_mm": 79, "follow_mm": 101, "size_mm_current": 101, "margin": "lobulated", "enhancement": "isoenhancing", "suspicious": true, "target": true}, {"lesion_id": "ln:mesenteric", "kind": "ln", "organ": "lymph", "station": "mesenteric", "rule": "short_axis", "baseline_mm": 26, "follow_mm": 31, "size_mm_current": 31, "necrosis": false, "suspicious": true, "target": true}], "complexity_profile": {"level": 2, "level_name": "C2", "artifact": null}, "staging_relevance": 19.0, "incidentals": [{"organ": "spleen", "text": "tiny cyst"}, {"organ": "pancreas", "text": "simple cyst (<2 cm)"}, {"organ": "gi.colon", "text": "small benign polyp"}], "negatives": [{"organ": "pancreas", "text": "no pancreatic mass"}, {"organ": "adrenals", "text": "adrenal glands normal"}, {"organ": "gi", "text": "no colonic mass"}, {"organ": "bones", "text": "no destructive osseous lesion"}, {"organ": "mesentery_peritoneum", "text": "no ascites"}], "post_treatment": [], "report_text": "FINDINGS:\nComparison: 2024-04-09.\nPulmonary parenchyma: No focal consolidation or suspicious pulmonary nodules. No pneumothorax.\nMediastinum: Cardiomediastinal contours within normal limits.\nPleura/Pleural spaces: No pleural effusion or pleural thickening.\nGreat vessels/Aorta: No thoracic aortic aneurysm or dissection.\nLiver: No focal hepatic lesions. Normal attenuation.\nSpleen: Normal in size and attenuation. No focal splenic lesion. tiny cyst.\nPancreas: Normal pancreatic contour and enhancement. No focal mass. simple cyst (<2 cm). no pancreatic mass.\nAdrenal glands: Adrenal glands are normal without nodules. adrenal glands normal.\nKidneys: No hydronephrosis. No enhancing renal mass.\nGI tract/Bowel: 101 mm lobulated gastric mass at the antrum of the stomach (isoenhancing). No obstructive process. No focal bowel wall mass identified. small benign polyp. no colonic mass.\nMesentery/Omentum: No ascites. No omental caking.\nMesenteric vessels (SMA/SMV): SMA/SMV are patent without thrombosis.\nUrinary bladder: Unremarkable.\nReproductive organs: No adnexal mass. Uterus/prostate within expected size for age.\nLymph nodes: Enlarged mesenteric lymph node, short axis 31 mm. No pathologically enlarged lymph nodes by size criteria.\nBones/Osseous structures: No aggressive osseous lesion. No acute fracture. no destructive osseous lesion.\n\nIMPRESSION:\n- Stomach primary malignancy at antrum of the stomach measuring approximately 101 mm.\n- Findings concerning for nodal involvement.\n- No definite distant metastases identified.\n- RECIST 1.1 Summary:\n- Target lesions (n=2; ≤2 per organ rule applied).\n  • T1: Primary — 79→101 mm (longest diameter).\n  • T2: Lymph node — 26→31 mm (short axis).\n- SLD baseline: 105 mm.\n- SLD current: 132 mm (+25.7% change).\n- New lesions: absent (unequivocal).\n- - RECIST 1.1 overall response category: PD.\n"}
{"patient_id": "PID000015", "study_date": "2023-08-11", "timepoint": 0, "recist": {"baseline_sld_mm": 117, "current_sld_mm": null, "nadir_sld_mm": null, "overall_response": "Baseline (no category)"}, "lesions": [{"lesion_id": "primary:lung", "kind": "primary", "organ": "lung", "location": "right middle lobe", "rule": "longest", "baseline_mm": 74, "follow_mm": null, "size_mm_current": 74, "margin": "smooth", "enhancement": "isoenhancing", "suspicious": true, "target": true}, {"lesion_id": "ln:paratracheal", "kind": "ln", "organ": "lymph", "station": "paratracheal", "rule": "short_axis", "baseline_mm": 18, "follow_mm": null, "size_mm_current": 18, "necrosis": false, "suspicious": true, "target": true}, {"lesion_id": "met:peritoneum", "kind": "met", "organ": "peritoneum", "rule": "longest", "baseline_mm": null, "follow_mm": null, "size_mm_current": 9, "suspicious": true, "target": false}, {"lesion_id": "met:adrenal", "kind": "met", "organ": "adrenal", "rule": "longest", "baseline_mm": 25, "follow_mm": null, "size_mm_current": 25, "suspicious": true, "target": true}], "complexity_profile": {"level": 2, "level_name": "C2", "artifact": null}, "staging_relevance": 0.0, "incidentals": [{"organ": "kidneys", "text": "Bosniak I cyst"}, {"organ": "gi.small_bowel", "text": "nonspecific fluid levels"}], "negatives": [{"organ": "pleura", "text": "no pleural nodularity"}, {"organ": "lung", "text": "no pleural effusion"}, {"organ": "spleen", "text": "no focal splenic lesion"}, {"organ": "aorta_great_vessels", "text": "aorta normal caliber"}, {"organ": "gi", "text": "no bowel obstruction"}], "post_treatment": [], "report_text": "FINDINGS:\nLungs: 74 mm smooth mass in the right middle lobe (isoenhancing). No focal consolidation or suspicious pulmonary nodules. No pneumothorax. no pleural effusion.\nMediastinum: Enlarged paratracheal lymph node, short axis 1.8 cm. Cardiomediastinal contours within normal limits.\nPleura/Pleural spaces: No pleural effusion or pleural thickening. no pleural nodularity.\nGreat vessels/Aorta: No thoracic aortic aneurysm or dissection. aorta normal caliber.\nLiver: No focal hepatic lesions. Normal attenuation.\nSpleen: Normal in size and attenuation. No focal splenic lesion.\nPancreas: Normal pancreatic contour and enhancement. No focal mass.\nAdrenal glands: 25 mm lesion in the adrenal, suspicious for metastasis. Adrenal glands are normal without nodules.\nKidneys: No hydronephrosis. No enhancing renal mass. Bosniak I cyst.\nGI tract/Bowel: No obstructive process. No focal bowel wall mass identified. nonspecific fluid levels. no bowel obstruction.\nMesentery/Omentum: 9 mm lesion in the peritoneum, suspicious for metastasis. No ascites. No omental caking.\nMesenteric vessels (SMA/SMV): SMA/SMV are patent without thrombosis.\nUrinary bladder: Unremarkable.\nReproductive organs: No adnexal mass. Uterus/prostate within expected size for age.\nLymph nodes: No pathologically enlarged lymph nodes by size criteria.\nBones/Osseous structures: No aggressive osseous lesion. No acute fracture.\n\nIMPRESSION:\n- Lung primary malignancy at right middle lobe measuring approximately 74 mm.\n- Findings concerning for nodal involvement.\n- Findings compatible with distant metastases involving: adrenal, peritoneum.\n- RECIST 1.1 Summary:\n- Target lesions (n=3; ≤2 per organ rule applied).\n  • T1: Primary — 74 mm (longest diameter) at baseline.\n  • T2: Metastasis — 25 mm (longest diameter) at baseline.\n  • T3: Lymph node — 18 mm (short axis) at baseline.\n- SLD baseline: 117 mm.\n- New lesions: absent (unequivocal).\n- - RECIST 1.1 overall response category: Baseline (no category).\n"}
{"patient_id": "PID000015", "study_date": "2023-10-11", "timepoint": 1, "recist": {"baseline_sld_mm": 117, "current_sld_mm": 121, "nadir_sld_mm": 117, "overall_response": "SD"}, "lesions": [{"lesion_id": "primary:lung", "kind": "primary", "organ": "lung", "location": "right middle lobe", "rule": "longest", "baseline_mm": 74, "follow_mm": 77, "size_mm_current": 77, "margin": "smooth", "enhancement": "isoenhancing", "suspicious": true, "target": true}, {"lesion_id": "ln:paratracheal", "kind": "ln", "organ": "lymph", "station": "paratracheal", "rule": "short_axis", "baseline_mm": 18, "follow_mm": 18, "size_mm_current": 18, "necrosis": false, "suspicious": true, "target": true}, {"lesion_id": "met:peritoneum", "kind": "met", "organ": "peritoneum", "rule": "longest", "baseline_mm": null, "follow_mm": null, "size_mm_current": 9, "suspicious": true, "target": false}, {"lesion_id": "met:adrenal", "kind": "met", "organ": "adrenal", "rule": "longest", "baseline_mm": 25, "follow_mm": 26, "size_mm_current": 26, "suspicious": true, "target": true}], "complexity_profile": {"level": 2, "level_name": "C2", "artifact": {"key": "beam_hardening", "impact": 2, "report_phrase": "Beam-hardening streak artifact from dense structures limits evaluation.", "severity_rank": 3}}, "staging_relevance": 4.0, "incidentals": [{"organ": "spleen", "text": "tiny cyst"}], "negatives": [{"organ": "reproductive", "text": "prostate is normal / no prostatic mass"}, {"organ": "adrenals", "text": "adrenal glands normal"}, {"organ": "aorta_great_vessels", "text": "aorta normal caliber"}, {"organ": "mediastinum", "text": "no mediastinal mass"}, {"organ": "liver", "text": "no hepatic mass"}], "post_treatment": ["Post-ablation/embolization change: non-enhancing ablation cavity with peripheral rim; SBRT field with altered enhancement"], "report_text": "FINDINGS:\nBeam-hardening streak artifact from dense structures limits evaluation.\nComparison: 2023-08-11.\nPulmonary parenchyma: 77 mm smooth mass in the right middle lobe (isoenhancing). Clear lungs without focal mass. No suspicious nodules identified.\nMediastinum: Enlarged paratracheal lymph node, short axis 18 mm. Cardiomediastinal contours within normal limits. no mediastinal mass.\nPleura/Pleural spaces: No pleural effusion or pleural thickening.\nGreat vessels/Aorta: No thoracic aortic aneurysm or dissection. aorta normal caliber.\nLiver: No focal hepatic lesions. Normal attenuation. no hepatic mass. Post-ablation/embolization change: non-enhancing ablation cavity with peripheral rim; SBRT field with altered enhancement.\nSpleen: Normal in size and attenuation. No focal splenic lesion. tiny cyst.\nPancreas: Normal pancreatic contour and enhancement. No focal mass.\nAdrenal glands: 26 mm lesion in the adrenal, suspicious for metastasis. Adrenal glands are normal without nodules. adrenal glands normal.\nKidneys: No hydronephrosis. No enhancing renal mass.\nGI tract/Bowel: No obstructive process. No focal bowel wall mass identified.\nMesentery/Omentum: 9 mm lesion in the peritoneum, suspicious for metastasis. No ascites. No omental caking.\nMesenteric vessels (SMA/SMV): SMA/SMV are patent without thrombosis.\nUrinary bladder: Unremarkable.\nReproductive organs: No adnexal mass. Uterus/prostate within expected size for age. prostate is normal / no prostatic mass.\nLymph nodes: No pathologically enlarged lymph nodes by size criteria.\nBones/Osseous structures: No aggressive osseous lesion. No acute fracture.\n\nIMPRESSION:\n- Lung primary malignancy at right middle lobe measuring approximately 77 mm.\n- Findings concerning for nodal involvement.\n- Findings compatible with distant metastases involving: adrenal, peritoneum.\n- RECIST 1.1 Summary:\n- Target lesions (n=3; ≤2 per organ rule applied).\n  • T1: Primary — 74→77 mm (longest diameter).\n  • T2: Metastasis — 25→26 mm (longest diameter).\n  • T3: Lymph node — 18→18 mm (short axis).\n- SLD baseline: 117 mm.\n- SLD current: 121 mm (+3.4% change).\n- New lesions: absent (unequivocal).\n- - RECIST 1.1 overall response category: SD.\n"}
{"patient_id": "PID000015", "study_date": "2023-12-13", "timepoint": 2, "recist": {"baseline_sld_mm": 117, "current_sld_mm": 163, "nadir_sld_mm": 117, "overall_response": "PD"}, "lesions": [{"lesion_id": "primary:lung", "kind": "primary", "organ": "lung", "location": "right middle lobe", "rule": "longest", "baseline_mm": 74, "follow_mm": 104, "size_mm_current": 104, "margin": "smooth", "enhancement": "isoenhancing", "suspicious": true, "target": true}, {"lesion_id": "ln:paratracheal", "kind": "ln", "organ": "lymph", "station": "paratracheal", "rule": "short_axis", "baseline_mm": 18, "follow_mm": 24, "size_mm_current": 24, "necrosis": false, "suspicious": true, "target": true}, {"lesion_id": "met:peritoneum", "kind": "met", "organ": "peritoneum", "rule": "longest", "baseline_mm": null, "follow_mm": null, "size_mm_current": 9, "suspicious": true, "target": false}, {"lesion_id": "met:adrenal", "kind": "met", "organ": "adrenal", "rule": "longest", "baseline_mm": 25, "follow_mm": 35, "size_mm_current": 35, "suspicious": true, "target": true}], "complexity_profile": {"level": 2, "level_name": "C2", "artifact": null}, "staging_relevance": 29.0, "incidentals": [{"organ": "aorta_great_vessels", "text": "mild aortic atherosclerosis"}], "negatives": [{"organ": "pleura", "text": "no pleural effusion"}, {"organ": "gi", "text": "stomach is normal"}, {"organ": "kidneys", "text": "kidneys are normal"}, {"organ": "lung", "text": "no pleural effusion"}, {"organ": "bladder", "text": "urinary bladder normal"}], "post_treatment": [], "report_text": "FINDINGS:\nComparison: 2023-10-11.\nLungs: 104 mm smooth mass in the right middle lobe (isoenhancing). Clear lungs without focal mass. No suspicious nodules identified. no pleural effusion.\nMediastinum: Enlarged paratracheal lymph node, short axis 24 mm. Cardiomediastinal contours within normal limits.\nPleura/Pleural spaces: No pleural effusion or pleural thickening.\nGreat vessels/Aorta: No thoracic aortic aneurysm or dissection. mild aortic atherosclerosis.\nLiver: No focal hepatic lesions. Normal attenuation.\nSpleen: Normal in size and attenuation. No focal splenic lesion.\nPancreas: Normal pancreatic contour and enhancement. No focal mass.\nAdrenal glands: 35 mm lesion in the adrenal, suspicious for metastasis. Adrenal glands are normal without nodules.\nKidneys: No hydronephrosis. No enhancing renal mass. kidneys are normal.\nGI tract/Bowel: No obstructive process. No focal bowel wall mass identified. stomach is normal.\nMesentery/Omentum: 0.9 cm lesion in the peritoneum, suspicious for metastasis. No ascites. No omental caking.\nMesenteric vessels (SMA/SMV): SMA/SMV are patent without thrombosis.\nUrinary bladder: Unremarkable. urinary bladder normal.\nReproductive organs: No adnexal mass. Uterus/prostate within expected size for age.\nLymph nodes: No pathologically enlarged lymph nodes by size criteria.\nBones/Osseous structures: No aggressive osseous lesion. No acute fracture.\n\nIMPRESSION:\n- Lung primary malignancy at right middle lobe measuring approximately 104 mm.\n- Findings concerning for nodal involvement.\n- Findings compatible with distant metastases involving: adrenal, peritoneum.\n- RECIST 1.1 Summary:\n- Target lesions (n=3; ≤2 per organ rule applied).\n  • T1: Primary — 74→104 mm (longest diameter).\n  • T2: Metastasis — 25→35 mm (longest diameter).\n  • T3: Lymph node — 18→24 mm (short axis).\n- SLD baseline: 117 mm.\n- SLD current: 163 mm (+39.3% change).\n- New lesions: present (unequivocal).\n- - RECIST 1.1 overall response category: PD.\n"}
{"patient_id": "PID000015", "study_date": "2024-02-02", "timepoint": 3, "recist": {"baseline_sld_mm": 117, "current_sld_mm": 150, "nadir_sld_mm": 117, "overall_response": "PD"}, "lesions": [{"lesion_id": "primary:lung", "kind": "primary", "organ": "lung", "location": "right middle lobe", "rule": "longest", "baseline_mm": 74, "follow_mm": 94, "size_mm_current": 94, "margin": "smooth", "enhancement": "isoenhancing", "suspicious": true, "target": true}, {"lesion_id": "ln:paratracheal", "kind": "ln", "organ": "lymph", "station": "paratracheal", "rule": "short_axis", "baseline_mm": 18, "follow_mm": 24, "size_mm_current": 24, "necrosis": false, "suspicious": true, "target": true}, {"lesion_id": "met:peritoneum", "kind": "met", "organ": "peritoneum", "rule": "longest", "baseline_mm": null, "follow_mm": null, "size_mm_current": 9, "suspicious": true, "target": false}, {"lesion_id": "met:adrenal", "kind": "met", "organ": "adrenal", "rule": "longest", "baseline_mm": 25, "follow_mm": 32, "size_mm_current": 32, "suspicious": true, "target": true}], "complexity_profile": {"level": 2, "level_name": "C2", "artifact": {"key": "beam_hardening", "impact": 2, "report_phrase": "Beam-hardening streak artifact from dense structures limits evaluation.", "severity_rank": 3}}, "staging_relevance": 27.0, "incidentals": [{"organ": "gi.stomach", "text": "small benign polyp"}, {"organ": "bladder", "text": "under-distension wall thickening"}], "negatives": [{"organ": "bladder", "text": "no focal bladder wall thickening"}, {"organ": "reproductive", "text": "ovaries are normal / no adnexal abnormality"}, {"organ": "mesentery_peritoneum", "text": "no peritoneal nodularity"}, {"organ": "bones", "text": "no destructive osseous lesion"}, {"organ": "mediastinum", "text": "no mediastinal mass"}], "post_treatment": ["Radiation change: stricture formation"], "report_text": "FINDINGS:\nBeam-hardening streak artifact from dense structures limits evaluation.\nComparison: 2023-12-13.\nLungs: 94 mm smooth mass in the right middle lobe (isoenhancing). Clear lungs without focal mass. No suspicious nodules identified. Post-treatment change: stricture formation.\nMediastinum: Enlarged paratracheal lymph node, short axis 24 mm. Cardiomediastinal contours within normal limits. no mediastinal mass.\nPleura/Pleural spaces: No pleural effusion or pleural thickening.\nGreat vessels/Aorta: No thoracic aortic aneurysm or dissection.\nLiver: No focal hepatic lesions. Normal attenuation.\nSpleen: Normal in size and attenuation. No focal splenic lesion.\nPancreas: Normal pancreatic contour and enhancement. No focal mass.\nAdrenal glands: 32 mm lesion in the adrenal, suspicious for metastasis. Adrenal glands are normal without nodules.\nKidneys: No hydronephrosis. No enhancing renal mass.\nGI tract/Bowel: No obstructive process. No focal bowel wall mass identified. small benign polyp.\nMesentery/Omentum: 9 mm lesion in the peritoneum, suspicious for metastasis. No ascites. No omental caking. no peritoneal nodularity.\nMesenteric vessels (SMA/SMV): SMA/SMV are patent without thrombosis.\nUrinary bladder: Unremarkable. under-distension wall thickening. no focal bladder wall thickening.\nReproductive organs: No adnexal mass. Uterus/prostate within expected size for age. ovaries are normal / no adnexal abnormality.\nLymph nodes: No pathologically enlarged lymph nodes by size criteria.\nBones/Osseous structures: No aggressive osseous lesion. No acute fracture. no destructive osseous lesion.\n\nIMPRESSION:\n- Lung primary malignancy at right middle lobe measuring approximately 94 mm.\n- Findings concerning for nodal involvement.\n- Findings compatible with distant metastases involving: adrenal, peritoneum.\n- RECIST 1.1 Summary:\n- Target lesions (n=3; ≤2 per organ rule applied).\n  • T1: Primary — 74→94 mm (longest diameter).\n  • T2: Metastasis — 25→32 mm (longest diameter).\n  • T3: Lymph node — 18→24 mm (short axis).\n- SLD baseline: 117 mm.\n- SLD current: 150 mm (+28.2% change).\n- New lesions: present (unequivocal).\n- - RECIST 1.1 overall response category: PD.\n"}
{"patient_id": "PID000015", "study_date": "2024-04-06", "timepoint": 4, "recist": {"baseline_sld_mm": 117, "current_sld_mm": 158, "nadir_sld_mm": 117, "overall_response": "PD"}, "lesions": [{"lesion_id": "primary:lung", "kind": "primary", "organ": "lung", "location": "right middle lobe", "rule": "longest", "baseline_mm": 74, "follow_mm": 102, "size_mm_current": 102, "margin": "smooth", "enhancement": "isoenhancing", "suspicious": true, "target": true}, {"lesion_id": "ln:paratracheal", "kind": "ln", "organ": "lymph", "station": "paratracheal", "rule": "short_axis", "baseline_mm": 18, "follow_mm": 23, "size_mm_current": 23, "necrosis": false, "suspicious": true, "target": true}, {"lesion_id": "met:peritoneum", "kind": "met", "organ": "peritoneum", "rule": "longest", "baseline_mm": null, "follow_mm": null, "size_mm_current": 9, "suspicious": true, "target": false}, {"lesion_id": "met:adrenal", "kind": "met", "organ": "adrenal", "rule": "longest", "baseline_mm": 25, "follow_mm": 33, "size_mm_current": 33, "suspicious": true, "target": true}], "complexity_profile": {"level": 2, "level_name": "C2", "artifact": {"key": "beam_hardening", "impact": 2, "report_phrase": "Beam-hardening streak artifact from dense structures limits evaluation.", "severity_rank": 3}}, "staging_relevance": 27.0, "incidentals": [{"organ": "lung", "text": "dependent atelectasis"}, {"organ": "lung", "text": "subpleural reticulation"}], "negatives": [{"organ": "liver", "text": "liver is normal"}, {"organ": "aorta_great_vessels", "text": "no aneurysm or dissection"}, {"organ": "spleen", "text": "no focal splenic lesion"}, {"organ": "mediastinum", "text": "no pathologic mediastinal lymphadenopathy"}, {"organ": "bladder", "text": "urinary bladder normal"}], "post_treatment": [], "report_text": "FINDINGS:\nBeam-hardening streak artifact from dense structures limits evaluation.\nComparison: 2024-02-02.\nLungs: 102 mm smooth mass in the right middle lobe (isoenhancing). No focal consolidation or suspicious pulmonary nodules. No pneumothorax. dependent atelectasis. subpleural reticulation.\nMediastinum: Enlarged paratracheal lymph node, short axis 23 mm. Cardiomediastinal contours within normal limits. no pathologic mediastinal lymphadenopathy.\nPleura/Pleural spaces: No pleural effusion or pleural thickening.\nGreat vessels/Aorta: No thoracic aortic aneurysm or dissection. no aneurysm or dissection.\nLiver: No focal hepatic lesions. Normal attenuation. liver is normal.\nSpleen: Normal in size and attenuation. No focal splenic lesion.\nPancreas: Normal pancreatic contour and enhancement. No focal mass.\nAdrenal glands: 3.3 cm lesion in the adrenal, suspicious for metastasis. Adrenal glands are normal without nodules.\nKidneys: No hydronephrosis. No enhancing renal mass.\nGI tract/Bowel: No obstructive process. No focal bowel wall mass identified.\nMesentery/Omentum: 9 mm lesion in the peritoneum, suspicious for metastasis. No ascites. No omental caking.\nMesenteric vessels (SMA/SMV): SMA/SMV are patent without thrombosis.\nUrinary bladder: Unremarkable. urinary bladder normal.\nReproductive organs: No adnexal mass. Uterus/prostate within expected size for age.\nLymph nodes: No pathologically enlarged lymph nodes by size criteria.\nBones/Osseous structures: No aggressive osseous lesion. No acute fracture.\n\nIMPRESSION:\n- Lung primary malignancy at right middle lobe measuring approximately 102 mm.\n- Findings concerning for nodal involvement.\n- Findings compatible with distant metastases involving: adrenal, peritoneum.\n- RECIST 1.1 Summary:\n- Target lesions (n=3; ≤2 per organ rule applied).\n  • T1: Primary — 74→102 mm (longest diameter).\n  • T2: Metastasis — 25→33 mm (longest diameter).\n  • T3: Lymph node — 18→23 mm (short axis).\n- SLD baseline: 117 mm.\n- SLD current: 158 mm (+35.0% change).\n- New lesions: present (unequivocal).\n- - RECIST 1.1 overall response category: PD.\n"}
{"patient_id": "PID000015", "study_date": "2024-06-05", "timepoint": 5, "recist": {"baseline_sld_mm": 117, "current_sld_mm": 159, "nadir_sld_mm": 117, "overall_response": "PD"}, "lesions": [{"lesion_id": "primary:lung", "kind": "primary", "organ": "lung", "location": "right middle lobe", "rule": "longest", "baseline_mm": 74, "follow_mm": 100, "size_mm_current": 100, "margin": "smooth", "enhancement": "isoenhancing", "suspicious": true, "target": true}, {"lesion_id": "ln:paratracheal", "kind": "ln", "organ": "lymph", "station": "paratracheal", "rule": "short_axis", "baseline_mm": 18, "follow_mm": 25, "size_mm_current": 25, "necrosis": false, "suspicious": true, "target": true}, {"lesion_id": "met:peritoneum", "kind": "met", "organ": "peritoneum", "rule": "longest", "baseline_mm": null, "follow_mm": null, "size_mm_current": 9, "suspicious": true, "target": false}, {"lesion_id": "met:adrenal", "kind": "met", "organ": "adrenal", "rule": "longest", "baseline_mm": 25, "follow_mm": 34, "size_mm_current": 34, "suspicious": true, "target": true}], "complexity_profile": {"level": 2, "level_name": "C2", "artifact": {"key": "motion_mild", "impact": 1, "report_phrase": "Respiratory motion artifact partially limits assessment.", "severity_rank": 2}}, "staging_relevance": 18.0, "incidentals": [{"organ": "pancreas", "text": "simple cyst (<2 cm)"}, {"organ": "bones", "text": "bone islands"}], "negatives": [{"organ": "pancreas", "text": "no pancreatic mass"}, {"organ": "bladder", "text": "no focal bladder wall thickening"}, {"organ": "adrenals", "text": "adrenal glands normal"}, {"organ": "aorta_great_vessels", "text": "no aneurysm or dissection"}, {"organ": "spleen", "text": "spleen normal size"}], "post_treatment": [], "report_text": "FINDINGS:\nRespiratory motion artifact partially limits assessment.\nComparison: 2024-04-06.\nPulmonary parenchyma: 100 mm smooth mass in the right middle lobe (isoenhancing). Clear lungs without focal mass. No suspicious nodules identified.\nMediastinum: Enlarged paratracheal lymph node, short axis 25 mm. Cardiomediastinal contours within normal limits.\nPleura/Pleural spaces: No pleural effusion or pleural thickening.\nGreat vessels/Aorta: No thoracic aortic aneurysm or dissection. no aneurysm or dissection.\nLiver: No focal hepatic lesions. Normal attenuation.\nSpleen: Normal in size and attenuation. No focal splenic lesion. spleen normal size.\nPancreas: Normal pancreatic contour and enhancement. No focal mass. simple cyst (<2 cm). no pancreatic mass.\nAdrenal glands: 3.4 cm lesion in the adrenal, suspicious for metastasis. Adrenal glands are normal without nodules. adrenal glands normal.\nKidneys: No hydronephrosis. No enhancing renal mass.\nGI tract/Bowel: No obstructive process. No focal bowel wall mass identified.\nMesentery/Omentum: 0.9 cm lesion in the peritoneum, suspicious for metastasis. No ascites. No omental caking.\nMesenteric vessels (SMA/SMV): SMA/SMV are patent without thrombosis.\nUrinary bladder: Unremarkable. no focal bladder wall thickening.\nReproductive organs: No adnexal mass. Uterus/prostate within expected size for age.\nLymph nodes: No pathologically enlarged lymph nodes by size criteria.\nBones/Osseous structures: No aggressive osseous lesion. No acute fracture. bone islands.\n\nIMPRESSION:\n- Lung primary malignancy at right middle lobe measuring approximately 100 mm.\n- Findings concerning for nodal involvement.\n- Findings compatible with distant metastases involving: adrenal, peritoneum.\n- RECIST 1.1 Summary:\n- Target lesions (n=3; ≤2 per organ rule applied).\n  • T1: Primary — 74→100 mm (longest diameter).\n  • T2: Metastasis — 25→34 mm (longest diameter).\n  • T3: Lymph node — 18→25 mm (short axis).\n- SLD baseline: 117 mm.\n- SLD current: 159 mm (+35.9% change).\n- New lesions: absent (unequivocal).\n- - RECIST 1.1 overall response category: PD.\n"}
{"patient_id": "PID000016", "study_date": "2023-02-23", "timepoint": 0, "recist": {"baseline_sld_mm": 89, "current_sld_mm": null, "nadir_sld_mm": null, "overall_response": "Baseline (no category)"}, "lesions": [{"lesion_id": "primary:liver", "kind": "primary", "organ": "liver", "location": "segment 3 of the liver", "rule": "longest", "baseline_mm": 65, "follow_mm": null, "size_mm_current": 65, "margin": "lobulated", "enhancement": "hypoenhancing", "suspicious": true, "target": true}, {"lesion_id": "ln:porta hepatis", "kind": "ln", "organ": "lymph", "station": "porta hepatis", "rule": "short_axis", "baseline_mm": 24, "follow_mm": null, "size_mm_current": 24, "necrosis": false, "suspicious": true, "target": true}], "complexity_profile": {"level": 2, "level_name": "C2", "artifact": null}, "staging_relevance": 0.0, "incidentals": [{"organ": "mediastinum", "text": "small thymic remnant"}, {"organ": "kidneys", "text": "Bosniak I cyst"}], "negatives": [{"organ": "spleen", "text": "no focal splenic lesion"}, {"organ": "bladder", "text": "urinary bladder normal"}, {"organ": "liver", "text": "no hepatic mass"}, {"organ": "pleura", "text": "no pleural nodularity"}, {"organ": "kidneys", "text": "no renal mass"}], "post_treatment": [], "report_text": "FINDINGS:\nPulmonary parenchyma: Clear lungs without focal mass. No suspicious nodules identified.\nMediastinum: Cardiomediastinal contours within normal limits. small thymic remnant.\nPleura/Pleural spaces: No pleural effusion or pleural thickening. no pleural nodularity.\nGreat vessels/Aorta: No thoracic aortic aneurysm or dissection.\nLiver: 6.5 cm lobulated hepatic mass in segment 3 of the liver (hypoenhancing). No focal hepatic lesions. Normal attenuation. no hepatic mass.\nSpleen: Normal in size and attenuation. No focal splenic lesion.\nPancreas: Normal pancreatic contour and enhancement. No focal mass.\nAdrenal glands: Adrenal glands are normal without nodules.\nKidneys: No hydronephrosis. No enhancing renal mass. Bosniak I cyst. no renal mass.\nGI tract/Bowel: No obstructive process. No focal bowel wall mass identified.\nMesentery/Omentum: No ascites. No omental caking.\nMesenteric vessels (SMA/SMV): SMA/SMV are patent without thrombosis.\nUrinary bladder: Unremarkable. urinary bladder normal.\nReproductive organs: No adnexal mass. Uterus/prostate within expected size for age.\nLymph nodes: Enlarged porta hepatis lymph node, short axis 24 mm. No pathologically enlarged lymph nodes by size criteria.\nBones/Osseous structures: No aggressive osseous lesion. No acute fracture.\n\nIMPRESSION:\n- Liver primary malignancy at segment 3 of the liver measuring approximately 65 mm.\n- Findings concerning for nodal involvement.\n- No definite distant metastases identified.\n- RECIST 1.1 Summary:\n- Target lesions (n=2; ≤2 per organ rule applied).\n  • T1: Primary — 65 mm (longest diameter) at baseline.\n  • T2: Lymph node — 24 mm (short axis) at baseline.\n- SLD baseline: 89 mm.\n- New lesions: absent (unequivocal).\n- - RECIST 1.1 overall response category: Baseline (no category).\n"}
{"patient_id": "PID000016", "study_date": "2023-04-22", "timepoint": 1, "recist": {"baseline_sld_mm": 89, "current_sld_mm": 53, "nadir_sld_mm": 53, "overall_response": "PR"}, "lesions": [{"lesion_id": "primary:liver", "kind": "primary", "organ": "liver", "location": "segment 3 of the liver", "rule": "longest", "baseline_mm": 65, "follow_mm": 38, "size_mm_current": 38, "margin": "lobulated", "enhancement": "hypoenhancing", "suspicious": true, "target": true}, {"lesion_id": "ln:porta hepatis", "kind": "ln", "organ": "lymph", "station": "porta hepatis", "rule": "short_axis", "baseline_mm": 24, "follow_mm": 15, "size_mm_current": 15, "necrosis": false, "suspicious": true, "target": true}], "complexity_profile": {"level": 2, "level_name": "C2", "artifact": {"key": "motion_mild", "impact": 1, "report_phrase": "Respiratory motion artifact partially limits assessment.", "severity_rank": 2}}, "staging_relevance": 5.0, "incidentals": [{"organ": "gi.stomach", "text": "physiologic under-distension thickening"}, {"organ": "gi.stomach", "text": "physiologic under-distension thickening"}], "negatives": [{"organ": "kidneys", "text": "no renal mass"}, {"organ": "bones", "text": "no destructive osseous lesion"}, {"organ": "liver", "text": "no hepatic mass"}, {"organ": "spleen", "text": "spleen normal size"}, {"organ": "lung", "text": "no pulmonary abnormality"}], "post_treatment": [], "report_text": "FINDINGS:\nRespiratory motion artifact partially limits assessment.\nComparison: 2023-02-23.\nLungs: No focal consolidation or suspicious pulmonary nodules. No pneumothorax. no pulmonary abnormality.\nMediastinum: Cardiomediastinal contours within normal limits.\nPleura/Pleural spaces: No pleural effusion or pleural thickening.\nGreat vessels/Aorta: No thoracic aortic aneurysm or dissection.\nLiver: 38 mm lobulated hepatic mass in segment 3 of the liver (hypoenhancing). No focal hepatic lesions. Normal attenuation. no hepatic mass.\nSpleen: Normal in size and attenuation. No focal splenic lesion. spleen normal size.\nPancreas: Normal pancreatic contour and enhancement. No focal mass.\nAdrenal glands: Adrenal glands are normal without nodules.\nKidneys: No hydronephrosis. No enhancing renal mass. no renal mass.\nGI tract/Bowel: No obstructive process. No focal bowel wall mass identified. physiologic under-distension thickening.\nMesentery/Omentum: No ascites. No omental caking.\nMesenteric vessels (SMA/SMV): SMA/SMV are patent without thrombosis.\nUrinary bladder: Unremarkable.\nReproductive organs: No adnexal mass. Uterus/prostate within expected size for age.\nLymph nodes: Enlarged porta hepatis lymph node, short axis 15 mm. No pathologically enlarged lymph nodes by size criteria.\nBones/Osseous structures: No aggressive osseous lesion. No acute fracture. no destructive osseous lesion.\n\nIMPRESSION:\n- Liver primary malignancy at segment 3 of the liver measuring approximately 38 mm.\n- Findings concerning for nodal involvement.\n- No definite distant metastases identified.\n- RECIST 1.1 Summary:\n- Target lesions (n=2; ≤2 per organ rule applied).\n  • T1: Primary — 65→38 mm (longest diameter).\n  • T2: Lymph node — 24→15 mm (short axis).\n- SLD baseline: 89 mm.\n- SLD current: 53 mm (-40.4% change).\n- New lesions: absent (unequivocal).\n- - RECIST 1.1 overall response category: PR.\n"}
{"patient_id": "PID000016", "study_date": "2023-06-17", "timepoint": 2, "recist": {"baseline_sld_mm": 89, "current_sld_mm": 60, "nadir_sld_mm": 53, "overall_response": "PR"}, "lesions": [{"lesion_id": "primary:liver", "kind": "primary", "organ": "liver", "location": "segment 3 of the liver", "rule": "longest", "baseline_mm": 65, "follow_mm": 43, "size_mm_current": 43, "margin": "lobulated", "enhancement": "hypoenhancing", "suspicious": true, "target": true}, {"lesion_id": "ln:porta hepatis", "kind": "ln", "organ": "lymph", "station": "porta hepatis", "rule": "short_axis", "baseline_mm": 24, "follow_mm": 17, "size_mm_current": 17, "necrosis": false, "suspicious": true, "target": true}], "complexity_profile": {"level": 2, "level_name": "C2", "artifact": {"key": "motion_mild", "impact": 1, "report_phrase": "Respiratory motion artifact partially limits assessment.", "severity_rank": 2}}, "staging_relevance": 4.0, "incidentals": [{"organ": "lung", "text": "dependent atelectasis"}, {"organ": "mediastinum", "text": "small thymic remnant"}, {"organ": "pancreas", "text": "simple cyst (<2 cm)"}], "negatives": [{"organ": "bladder", "text": "no focal bladder wall thickening"}, {"organ": "pleura", "text": "no pleural effusion"}, {"organ": "mediastinum", "text": "no mediastinal mass"}, {"organ": "gi", "text": "no bowel obstruction"}, {"organ": "pancreas", "text": "no pancreatic mass"}], "post_treatment": [], "report_text": "FINDINGS:\nRespiratory motion artifact partially limits assessment.\nComparison: 2023-04-22.\nLungs: Clear lungs without focal mass. No suspicious nodules identified. dependent atelectasis.\nMediastinum: Cardiomediastinal contours within normal limits. small thymic remnant. no mediastinal mass.\nPleura/Pleural spaces: No pleural effusion or pleural thickening.\nGreat vessels/Aorta: No thoracic aortic aneurysm or dissection.\nLiver: 43 mm lobulated hepatic mass in segment 3 of the liver (hypoenhancing). No focal hepatic lesions. Normal attenuation.\nSpleen: Normal in size and attenuation. No focal splenic lesion.\nPancreas: Normal pancreatic contour and enhancement. No focal mass. simple cyst (<2 cm). no pancreatic mass.\nAdrenal glands: Adrenal glands are normal without nodules.\nKidneys: No hydronephrosis. No enhancing renal mass.\nGI tract/Bowel: No obstructive process. No focal bowel wall mass identified. no bowel obstruction.\nMesentery/Omentum: No ascites. No omental caking.\nMesenteric vessels (SMA/SMV): SMA/SMV are patent without thrombosis.\nUrinary bladder: Unremarkable. no focal bladder wall thickening.\nReproductive organs: No adnexal mass. Uterus/prostate within expected size for age.\nLymph nodes: Enlarged porta hepatis lymph node, short axis 1.7 cm. No pathologically enlarged lymph nodes by size criteria.\nBones/Osseous structures: No aggressive osseous lesion. No acute fracture.\n\nIMPRESSION:\n- Liver primary neoplasm (indeterminate) at segment 3 of the liver measuring approximately 43 mm.\n- Findings concerning for nodal involvement.\n- No definite distant metastases identified.\n- RECIST 1.1 Summary:\n- Target lesions (n=2; ≤2 per organ rule applied).\n  • T1: Primary — 65→43 mm (longest diameter).\n  • T2: Lymph node — 24→17 mm (short axis).\n- SLD baseline: 89 mm.\n- SLD current: 60 mm (-32.6% change).\n- New lesions: absent (unequivocal).\n- - RECIST 1.1 overall response category: PR.\n\nComment: Some features are most likely; short-interval follow-up or problem-solving imaging may be considered.\n"}
{"patient_id": "PID000016", "study_date": "2023-08-08", "timepoint": 3, "recist": {"baseline_sld_mm": 89, "current_sld_mm": 83, "nadir_sld_mm": 53, "overall_response": "PD"}, "lesions": [{"lesion_id": "primary:liver", "kind": "primary", "organ": "liver", "location": "segment 3 of the liver", "rule": "longest", "baseline_mm": 65, "follow_mm": 61, "size_mm_current": 61, "margin": "lobulated", "enhancement": "hypoenhancing", "suspicious": true, "target": true}, {"lesion_id": "ln:porta hepatis", "kind": "ln", "organ": "lymph", "station": "porta hepatis", "rule": "short_axis", "baseline_mm": 24, "follow_mm": 22, "size_mm_current": 22, "necrosis": false, "suspicious": true, "target": true}], "complexity_profile": {"level": 2, "level_name": "C2", "artifact": null}, "staging_relevance": 19.0, "incidentals": [{"organ": "gi.small_bowel", "text": "nonspecific fluid levels"}, {"organ": "gi.colon", "text": "diverticulosis"}, {"organ": "spleen", "text": "accessory spleen"}], "negatives": [{"organ": "pleura", "text": "no pleural nodularity"}, {"organ": "mesentery_peritoneum", "text": "no ascites"}, {"organ": "reproductive", "text": "prostate is normal / no prostatic mass"}, {"organ": "gi", "text": "stomach is normal"}, {"organ": "pancreas", "text": "no pancreatic mass"}], "post_treatment": [], "report_text": "FINDINGS:\nComparison: 2023-06-17.\nLungs: No focal consolidation or suspicious pulmonary nodules. No pneumothorax.\nMediastinum: Cardiomediastinal contours within normal limits.\nPleura/Pleural spaces: No pleural effusion or pleural thickening. no pleural nodularity.\nGreat vessels/Aorta: No thoracic aortic aneurysm or dissection.\nLiver: 61 mm lobulated hepatic mass in segment 3 of the liver (hypoenhancing). No focal hepatic lesions. Normal attenuation.\nSpleen: Normal in size and attenuation. No focal splenic lesion. accessory spleen.\nPancreas: Normal pancreatic contour and enhancement. No focal mass. no pancreatic mass.\nAdrenal glands: Adrenal glands are normal without nodules.\nKidneys: No hydronephrosis. No enhancing renal mass.\nGI tract/Bowel: No obstructive process. No focal bowel wall mass identified. nonspecific fluid levels. diverticulosis. stomach is normal.\nMesentery/Omentum: No ascites. No omental caking.\nMesenteric vessels (SMA/SMV): SMA/SMV are patent without thrombosis.\nUrinary bladder: Unremarkable.\nReproductive organs: No adnexal mass. Uterus/prostate within expected size for age. prostate is normal / no prostatic mass.\nLymph nodes: Enlarged porta hepatis lymph node, short axis 22 mm. No pathologically enlarged lymph nodes by size criteria.\nBones/Osseous structures: No aggressive osseous lesion. No acute fracture.\n\nIMPRESSION:\n- Liver primary malignancy at segment 3 of the liver measuring approximately 61 mm.\n- Findings concerning for nodal involvement.\n- No definite distant metastases identified.\n- RECIST 1.1 Summary:\n- Target lesions (n=2; ≤2 per organ rule applied).\n  • T1: Primary — 65→61 mm (longest diameter).\n  • T2: Lymph node — 24→22 mm (short axis).\n- SLD baseline: 89 mm.\n- SLD current: 83 mm (-6.7% change).\n- New lesions: absent (unequivocal).\n- - RECIST 1.1 overall response category: PD.\n"}
{"patient_id": "PID000016", "study_date": "2023-10-11", "timepoint": 4, "recist": {"baseline_sld_mm": 89, "current_sld_mm": 87, "nadir_sld_mm": 53, "overall_response": "PD"}, "lesions": [{"lesion_id": "primary:liver", "kind": "primary", "organ": "liver", "location": "segment 3 of the liver", "rule": "longest", "baseline_mm": 65, "follow_mm": 65, "size_mm_current": 65, "margin": "lobulated", "enhancement": "hypoenhancing", "suspicious": true, "target": true}, {"lesion_id": "ln:porta hepatis", "kind": "ln", "organ": "lymph", "station": "porta hepatis", "rule": "short_axis", "baseline_mm": 24, "follow_mm": 22, "size_mm_current": 22, "necrosis": false, "suspicious": true, "target": true}], "complexity_profile": {"level": 2, "level_name": "C2", "artifact": null}, "staging_relevance": 19.0, "incidentals": [{"organ": "kidneys", "text": "angiomyolipoma (macroscopic fat)"}], "negatives": [{"organ": "mediastinum", "text": "no pathologic mediastinal lymphadenopathy"}, {"organ": "reproductive", "text": "ovaries are normal / no adnexal abnormality"}, {"organ": "pleura", "text": "no pleural nodularity"}, {"organ": "lung", "text": "no pulmonary abnormality"}, {"organ": "liver", "text": "liver is normal"}], "post_treatment": ["Post-ablation/embolization change: non-enhancing ablation zone with peripheral halo; contraction over time"], "report_text": "FINDINGS:\nComparison: 2023-08-08.\nLungs: No focal consolidation or suspicious pulmonary nodules. No pneumothorax. no pulmonary abnormality.\nMediastinum: Cardiomediastinal contours within normal limits. no pathologic mediastinal lymphadenopathy.\nPleura/Pleural spaces: No pleural effusion or pleural thickening. no pleural nodularity.\nGreat vessels/Aorta: No thoracic aortic aneurysm or dissection.\nLiver: 6.5 cm lobulated hepatic mass in segment 3 of the liver (hypoenhancing). No focal hepatic lesions. Normal attenuation. liver is normal. Post-ablation/embolization change: non-enhancing ablation zone with peripheral halo; contraction over time.\nSpleen: Normal in size and attenuation. No focal splenic lesion.\nPancreas: Normal pancreatic contour and enhancement. No focal mass.\nAdrenal glands: Adrenal glands are normal without nodules.\nKidneys: No hydronephrosis. No enhancing renal mass. angiomyolipoma (macroscopic fat).\nGI tract/Bowel: No obstructive process. No focal bowel wall mass identified.\nMesentery/Omentum: No ascites. No omental caking.\nMesenteric vessels (SMA/SMV): SMA/SMV are patent without thrombosis.\nUrinary bladder: Unremarkable.\nReproductive organs: No adnexal mass. Uterus/prostate within expected size for age. ovaries are normal / no adnexal abnormality.\nLymph nodes: Enlarged porta hepatis lymph node, short axis 22 mm. No pathologically enlarged lymph nodes by size criteria.\nBones/Osseous structures: No aggressive osseous lesion. No acute fracture.\n\nIMPRESSION:\n- Liver primary malignancy at segment 3 of the liver measuring approximately 65 mm.\n- Findings concerning for nodal involvement.\n- No definite distant metastases identified.\n- RECIST 1.1 Summary:\n- Target lesions (n=2; ≤2 per organ rule applied).\n  • T1: Primary — 65→65 mm (longest diameter).\n  • T2: Lymph node — 24→22 mm (short axis).\n- SLD baseline: 89 mm.\n- SLD current: 87 mm (-2.2% change).\n- New lesions: absent (unequivocal).\n- - RECIST 1.1 overall response category: PD.\n"}
{"patient_id": "PID000016", "study_date": "2023-11-22", "timepoint": 5, "recist": {"baseline_sld_mm": 89, "current_sld_mm": 86, "nadir_sld_mm": 53, "overall_response": "PD"}, "lesions": [{"lesion_id": "primary:liver", "kind": "primary", "organ": "liver", "location": "segment 3 of the liver", "rule": "longest", "baseline_mm": 65, "follow_mm": 62, "size_mm_current": 62, "margin": "lobulated", "enhancement": "hypoenhancing", "suspicious": true, "target": true}, {"lesion_id": "ln:porta hepatis", "kind": "ln", "organ": "lymph", "station": "porta hepatis", "rule": "short_axis", "baseline_mm": 24, "follow_mm": 24, "size_mm_current": 24, "necrosis": false, "suspicious": true, "target": true}], "complexity_profile": {"level": 2, "level_name": "C2", "artifact": null}, "staging_relevance": 19.0, "incidentals": [{"organ": "lung", "text": "dependent atelectasis"}, {"organ": "kidneys", "text": "angiomyolipoma (macroscopic fat)"}], "negatives": [{"organ": "reproductive", "text": "ovaries are normal / no adnexal abnormality"}, {"organ": "gi", "text": "no bowel obstruction"}, {"organ": "lung", "text": "lungs are normal"}, {"organ": "mesentery_peritoneum", "text": "no ascites"}, {"organ": "spleen", "text": "no focal splenic lesion"}], "post_treatment": [], "report_text": "FINDINGS:\nComparison: 2023-10-11.\nPulmonary parenchyma: No focal consolidation or suspicious pulmonary nodules. No pneumothorax.\nMediastinum: Cardiomediastinal contours within normal limits.\nPleura/Pleural spaces: No pleural effusion or pleural thickening.\nGreat vessels/Aorta: No thoracic aortic aneurysm or dissection.\nLiver: 62 mm lobulated hepatic mass in segment 3 of the liver (hypoenhancing). No focal hepatic lesions. Normal attenuation.\nSpleen: Normal in size and attenuation. No focal splenic lesion.\nPancreas: Normal pancreatic contour and enhancement. No focal mass.\nAdrenal glands: Adrenal glands are normal without nodules.\nKidneys: No hydronephrosis. No enhancing renal mass. angiomyolipoma (macroscopic fat).\nGI tract/Bowel: No obstructive process. No focal bowel wall mass identified. no bowel obstruction.\nMesentery/Omentum: No ascites. No omental caking.\nMesenteric vessels (SMA/SMV): SMA/SMV are patent without thrombosis.\nUrinary bladder: Unremarkable.\nReproductive organs: No adnexal mass. Uterus/prostate within expected size for age. ovaries are normal / no adnexal abnormality.\nLymph nodes: Enlarged porta hepatis lymph node, short axis 24 mm. No pathologically enlarged lymph nodes by size criteria.\nBones/Osseous structures: No aggressive osseous lesion. No acute fracture.\n\nIMPRESSION:\n- Liver primary malignancy at segment 3 of the liver measuring approximately 62 mm.\n- Findings concerning for nodal involvement.\n- No definite distant metastases identified.\n- RECIST 1.1 Summary:\n- Target lesions (n=2; ≤2 per organ rule applied).\n  • T1: Primary — 65→62 mm (longest diameter).\n  • T2: Lymph node — 24→24 mm (short axis).\n- SLD baseline: 89 mm.\n- SLD current: 86 mm (-3.4% change).\n- New lesions: absent (unequivocal).\n- - RECIST 1.1 overall response category: PD.\n"}
{"patient_id": "PID000017", "study_date": "2023-09-20", "timepoint": 0, "recist": {"baseline_sld_mm": 82, "current_sld_mm": null, "nadir_sld_mm": null, "overall_response": "Baseline (no category)"}, "lesions": [{"lesion_id": "primary:liver", "kind": "primary", "organ": "liver", "location": "segment 4 of the liver", "rule": "longest", "baseline_mm": 56, "follow_mm": null, "size_mm_current": 56, "margin": "spiculated", "enhancement": "hypoenhancing", "suspicious": true, "target": true}, {"lesion_id": "ln:right hilar", "kind": "ln", "organ": "lymph", "station": "right hilar", "rule": "short_axis", "baseline_mm": null, "follow_mm": null, "size_mm_current": 9, "necrosis": false, "suspicious": false, "target": false}, {"lesion_id": "ln:porta hepatis", "kind": "ln", "organ": "lymph", "station": "porta hepatis", "rule": "short_axis", "baseline_mm": null, "follow_mm": null, "size_mm_current": 14, "necrosis": true, "suspicious": true, "target": false}, {"lesion_id": "ln:external iliac", "kind": "ln", "organ": "lymph", "station": "external iliac", "rule": "short_axis", "baseline_mm": 26, "follow_mm": null, "size_mm_current": 26, "necrosis": false, "suspicious": true, "target": true}], "complexity_profile": {"level": 2, "level_name": "C2", "artifact": null}, "staging_relevance": 0.0, "incidentals": [{"organ": "lung", "text": "<6 mm well-circumscribed nodule"}], "negatives": [{"organ": "aorta_great_vessels", "text": "aorta normal caliber"}, {"organ": "gi", "text": "no colonic mass"}, {"organ": "adrenals", "text": "no adrenal nodule"}, {"organ": "mediastinum", "text": "no pathologic mediastinal lymphadenopathy"}, {"organ": "mesentery_peritoneum", "text": "no ascites"}], "post_treatment": ["Postsurgical change: resection margin changes"], "report_text": "FINDINGS:\nLungs: No focal consolidation or suspicious pulmonary nodules. No pneumothorax. <6 mm well-circumscribed nodule.\nMediastinum: Enlarged right hilar lymph node, short axis 0.9 cm. Cardiomediastinal contours within normal limits. no pathologic mediastinal lymphadenopathy.\nPleura/Pleural spaces: No pleural effusion or pleural thickening.\nGreat vessels/Aorta: No thoracic aortic aneurysm or dissection. aorta normal caliber.\nLiver: 5.6 cm spiculated hepatic mass in segment 4 of the liver (hypoenhancing). No focal hepatic lesions. Normal attenuation. Postsurgical change: resection margin changes.\nSpleen: Normal in size and attenuation. No focal splenic lesion.\nPancreas: Normal pancreatic contour and enhancement. No focal mass.\nAdrenal glands: Adrenal glands are normal without nodules. no adrenal nodule.\nKidneys: No hydronephrosis. No enhancing renal mass.\nGI tract/Bowel: No obstructive process. No focal bowel wall mass identified. no colonic mass.\nMesentery/Omentum: No ascites. No omental caking.\nMesenteric vessels (SMA/SMV): SMA/SMV are patent without thrombosis.\nUrinary bladder: Unremarkable.\nReproductive organs: No adnexal mass. Uterus/prostate within expected size for age.\nLymph nodes: Enlarged porta hepatis lymph node, short axis 1.4 cm with central necrosis. Enlarged external iliac lymph node, short axis 2.6 cm. No pathologically enlarged lymph nodes by size criteria.\nBones/Osseous structures: No aggressive osseous lesion. No acute fracture.\n\nIMPRESSION:\n- Liver primary malignancy at segment 4 of the liver measuring approximately 56 mm.\n- Findings concerning for nodal involvement.\n- No definite distant metastases identified.\n- RECIST 1.1 Summary:\n- Target lesions (n=2; ≤2 per organ rule applied).\n  • T1: Primary — 56 mm (longest diameter) at baseline.\n  • T2: Lymph node — 26 mm (short axis) at baseline.\n- SLD baseline: 82 mm.\n- New lesions: absent (unequivocal).\n- - RECIST 1.1 overall response category: Baseline (no category).\n"}
{"patient_id": "PID000017", "study_date": "2023-11-23", "timepoint": 1, "recist": {"baseline_sld_mm": 82, "current_sld_mm": 71, "nadir_sld_mm": 71, "overall_response": "SD"}, "lesions": [{"lesion_id": "primary:liver", "kind": "primary", "organ": "liver", "location": "segment 4 of the liver", "rule": "longest", "baseline_mm": 56, "follow_mm": 49, "size_mm_current": 49, "margin": "spiculated", "enhancement": "hypoenhancing", "suspicious": true, "target": true}, {"lesion_id": "ln:right hilar", "kind": "ln", "organ": "lymph", "station": "right hilar", "rule": "short_axis", "baseline_mm": null, "follow_mm": null, "size_mm_current": 9, "necrosis": false, "suspicious": false, "target": false}, {"lesion_id": "ln:porta hepatis", "kind": "ln", "organ": "lymph", "station": "porta hepatis", "rule": "short_axis", "baseline_mm": null, "follow_mm": null, "size_mm_current": 14, "necrosis": true, "suspicious": true, "target": false}, {"lesion_id": "ln:external iliac", "kind": "ln", "organ": "lymph", "station": "external iliac", "rule": "short_axis", "baseline_mm": 26, "follow_mm": 22, "size_mm_current": 22, "necrosis": false, "suspicious": true, "target": true}], "complexity_profile": {"level": 2, "level_name": "C2", "artifact": {"key": "partial_volume", "impact": 1, "report_phrase": "Partial volume averaging may obscure small foci.", "severity_rank": 1}}, "staging_relevance": 5.0, "incidentals": [{"organ": "lung", "text": "bronchial wall thickening"}], "negatives": [{"organ": "liver", "text": "no hepatic mass"}, {"organ": "bladder", "text": "urinary bladder normal"}, {"organ": "lung", "text": "no pleural effusion"}, {"organ": "kidneys", "text": "kidneys are normal"}, {"organ": "pleura", "text": "no pleural effusion"}], "post_treatment": ["Radiation change: fat stranding"], "report_text": "FINDINGS:\nPartial volume averaging may obscure small foci.\nComparison: 2023-09-20.\nLungs: No focal consolidation or suspicious pulmonary nodules. No pneumothorax. bronchial wall thickening. no pleural effusion. Post-treatment change: fat stranding.\nMediastinum: Enlarged right hilar lymph node, short axis 9 mm. Cardiomediastinal contours within normal limits.\nPleura/Pleural spaces: No pleural effusion or pleural thickening.\nGreat vessels/Aorta: No thoracic aortic aneurysm or dissection.\nLiver: 4.9 cm spiculated hepatic mass in segment 4 of the liver (hypoenhancing). No focal hepatic lesions. Normal attenuation. no hepatic mass.\nSpleen: Normal in size and attenuation. No focal splenic lesion.\nPancreas: Normal pancreatic contour and enhancement. No focal mass.\nAdrenal glands: Adrenal glands are normal without nodules.\nKidneys: No hydronephrosis. No enhancing renal mass. kidneys are normal.\nGI tract/Bowel: No obstructive process. No focal bowel wall mass identified.\nMesentery/Omentum: No ascites. No omental caking.\nMesenteric vessels (SMA/SMV): SMA/SMV are patent without thrombosis.\nUrinary bladder: Unremarkable. urinary bladder normal.\nReproductive organs: No adnexal mass. Uterus/prostate within expected size for age.\nLymph nodes: Enlarged porta hepatis lymph node, short axis 14 mm with central necrosis. Enlarged external iliac lymph node, short axis 22 mm. No pathologically enlarged lymph nodes by size criteria.\nBones/Osseous structures: No aggressive osseous lesion. No acute fracture.\n\nIMPRESSION:\n- Liver primary malignancy at segment 4 of the liver measuring approximately 49 mm.\n- Findings concerning for nodal involvement.\n- No definite distant metastases identified.\n- RECIST 1.1 Summary:\n- Target lesions (n=2; ≤2 per organ rule applied).\n  • T1: Primary — 56→49 mm (longest diameter).\n  • T2: Lymph node — 26→22 mm (short axis).\n- SLD baseline: 82 mm.\n- SLD current: 71 mm (-13.4% change).\n- New lesions: absent (unequivocal).\n- - RECIST 1.1 overall response category: SD.\n"}
{"patient_id": "PID000017", "study_date": "2024-01-22", "timepoint": 2, "recist": {"baseline_sld_mm": 82, "current_sld_mm": 107, "nadir_sld_mm": 71, "overall_response": "PD"}, "lesions": [{"lesion_id": "primary:liver", "kind": "primary", "organ": "liver", "location": "segment 4 of the liver", "rule": "longest", "baseline_mm": 56, "follow_mm": 74, "size_mm_current": 74, "margin": "spiculated", "enhancement": "hypoenhancing", "suspicious": true, "target": true}, {"lesion_id": "ln:right hilar", "kind": "ln", "organ": "lymph", "station": "right hilar", "rule": "short_axis", "baseline_mm": null, "follow_mm": null, "size_mm_current": 9, "necrosis": false, "suspicious": false, "target": false}, {"lesion_id": "ln:porta hepatis", "kind": "ln", "organ": "lymph", "station": "porta hepatis", "rule": "short_axis", "baseline_mm": null, "follow_mm": null, "size_mm_current": 14, "necrosis": true, "suspicious": true, "target": false}, {"lesion_id": "ln:external iliac", "kind": "ln", "organ": "lymph", "station": "external iliac", "rule": "short_axis", "baseline_mm": 26, "follow_mm": 33, "size_mm_current": 33, "necrosis": false, "suspicious": true, "target": true}], "complexity_profile": {"level": 2, "level_name": "C2", "artifact": {"key": "partial_volume", "impact": 1, "report_phrase": "Partial volume averaging may obscure small foci.", "severity_rank": 1}}, "staging_relevance": 28.0, "incidentals": [{"organ": "reproductive.prostate", "text": "calcifications"}, {"organ": "lung", "text": "dependent atelectasis"}, {"organ": "spleen", "text": "tiny cyst"}], "negatives": [{"organ": "pancreas", "text": "no pancreatic mass"}, {"organ": "liver", "text": "liver is normal"}, {"organ": "bones", "text": "no destructive osseous lesion"}, {"organ": "pleura", "text": "no pleural effusion"}, {"organ": "gi", "text": "no bowel obstruction"}], "post_treatment": ["Radiation change: fat stranding"], "report_text": "FINDINGS:\nPartial volume averaging may obscure small foci.\nComparison: 2023-11-23.\nLungs: No focal consolidation or suspicious pulmonary nodules. No pneumothorax. dependent atelectasis. Post-treatment change: fat stranding.\nMediastinum: Enlarged right hilar lymph node, short axis 9 mm. Cardiomediastinal contours within normal limits.\nPleura/Pleural spaces: No pleural effusion or pleural thickening.\nGreat vessels/Aorta: No thoracic aortic aneurysm or dissection.\nLiver: 74 mm spiculated hepatic mass in segment 4 of the liver (hypoenhancing). No focal hepatic lesions. Normal attenuation. liver is normal.\nSpleen: Normal in size and attenuation. No focal splenic lesion. tiny cyst.\nPancreas: Normal pancreatic contour and enhancement. No focal mass. no pancreatic mass.\nAdrenal glands: Adrenal glands are normal without nodules.\nKidneys: No hydronephrosis. No enhancing renal mass.\nGI tract/Bowel: No obstructive process. No focal bowel wall mass identified. no bowel obstruction.\nMesentery/Omentum: No ascites. No omental caking.\nMesenteric vessels (SMA/SMV): SMA/SMV are patent without thrombosis.\nUrinary bladder: Unremarkable.\nReproductive organs: No adnexal mass. Uterus/prostate within expected size for age. calcifications.\nLymph nodes: Enlarged porta hepatis lymph node, short axis 1.4 cm with central necrosis. Enlarged external iliac lymph node, short axis 3.3 cm. No pathologically enlarged lymph nodes by size criteria.\nBones/Osseous structures: No aggressive osseous lesion. No acute fracture. no destructive osseous lesion.\n\nIMPRESSION:\n- Liver primary malignancy at segment 4 of the liver measuring approximately 74 mm.\n- Findings concerning for nodal involvement.\n- No definite distant metastases identified.\n- RECIST 1.1 Summary:\n- Target lesions (n=2; ≤2 per organ rule applied).\n  • T1: Primary — 56→74 mm (longest diameter).\n  • T2: Lymph node — 26→33 mm (short axis).\n- SLD baseline: 82 mm.\n- SLD current: 107 mm (+30.5% change).\n- New lesions: present (unequivocal).\n- - RECIST 1.1 overall response category: PD.\n"}
{"patient_id": "PID000017", "study_date": "2024-03-12", "timepoint": 3, "recist": {"baseline_sld_mm": 82, "current_sld_mm": 105, "nadir_sld_mm": 71, "overall_response": "PD"}, "lesions": [{"lesion_id": "primary:liver", "kind": "primary", "organ": "liver", "location": "segment 4 of the liver", "rule": "longest", "baseline_mm": 56, "follow_mm": 71, "size_mm_current": 71, "margin": "spiculated", "enhancement": "hypoenhancing", "suspicious": true, "target": true}, {"lesion_id": "ln:right hilar", "kind": "ln", "organ": "lymph", "station": "right hilar", "rule": "short_axis", "baseline_mm": null, "follow_mm": null, "size_mm_current": 9, "necrosis": false, "suspicious": false, "target": false}, {"lesion_id": "ln:porta hepatis", "kind": "ln", "organ": "lymph", "station": "porta hepatis", "rule": "short_axis", "baseline_mm": null, "follow_mm": null, "size_mm_current": 14, "necrosis": true, "suspicious": true, "target": false}, {"lesion_id": "ln:external iliac", "kind": "ln", "organ": "lymph", "station": "external iliac", "rule": "short_axis", "baseline_mm": 26, "follow_mm": 34, "size_mm_current": 34, "necrosis": false, "suspicious": true, "target": true}], "complexity_profile": {"level": 2, "level_name": "C2", "artifact": null}, "staging_relevance": 29.0, "incidentals": [{"organ": "kidneys", "text": "angiomyolipoma (macroscopic fat)"}], "negatives": [{"organ": "aorta_great_vessels", "text": "no aneurysm or dissection"}, {"organ": "mesentery_peritoneum", "text": "no peritoneal nodularity"}, {"organ": "kidneys", "text": "kidneys are normal"}, {"organ": "bones", "text": "no destructive osseous lesion"}, {"organ": "gi", "text": "no colonic mass"}], "post_treatment": ["Postsurgical change: resection margin changes"], "report_text": "FINDINGS:\nComparison: 2024-01-22.\nPulmonary parenchyma: Clear lungs without focal mass. No suspicious nodules identified.\nMediastinum: Enlarged right hilar lymph node, short axis 0.9 cm. Cardiomediastinal contours within normal limits.\nPleura/Pleural spaces: No pleural effusion or pleural thickening.\nGreat vessels/Aorta: No thoracic aortic aneurysm or dissection. no aneurysm or dissection.\nLiver: 7.1 cm spiculated hepatic mass in segment 4 of the liver (hypoenhancing). No focal hepatic lesions. Normal attenuation. Postsurgical change: resection margin changes.\nSpleen: Normal in size and attenuation. No focal splenic lesion.\nPancreas: Normal pancreatic contour and enhancement. No focal mass.\nAdrenal glands: Adrenal glands are normal without nodules.\nKidneys: No hydronephrosis. No enhancing renal mass. angiomyolipoma (macroscopic fat). kidneys are normal.\nGI tract/Bowel: No obstructive process. No focal bowel wall mass identified. no colonic mass.\nMesentery/Omentum: No ascites. No omental caking. no peritoneal nodularity.\nMesenteric vessels (SMA/SMV): SMA/SMV are patent without thrombosis.\nUrinary bladder: Unremarkable.\nReproductive organs: No adnexal mass. Uterus/prostate within expected size for age.\nLymph nodes: Enlarged porta hepatis lymph node, short axis 1.4 cm with central necrosis. Enlarged external iliac lymph node, short axis 34 mm. No pathologically enlarged lymph nodes by size criteria.\nBones/Osseous structures: No aggressive osseous lesion. No acute fracture. no destructive osseous lesion.\n\nIMPRESSION:\n- Liver primary malignancy at segment 4 of the liver measuring approximately 71 mm.\n- Findings concerning for nodal involvement.\n- No definite distant metastases identified.\n- RECIST 1.1 Summary:\n- Target lesions (n=2; ≤2 per organ rule applied).\n  • T1: Primary — 56→71 mm (longest diameter).\n  • T2: Lymph node — 26→34 mm (short axis).\n- SLD baseline: 82 mm.\n- SLD current: 105 mm (+28.0% change).\n- New lesions: present (unequivocal).\n- - RECIST 1.1 overall response category: PD.\n"}
{"patient_id": "PID000017", "study_date": "2024-04-24", "timepoint": 4, "recist": {"baseline_sld_mm": 82, "current_sld_mm": 111, "nadir_sld_mm": 71, "overall_response": "PD"}, "lesions": [{"lesion_id": "primary:liver", "kind": "primary", "organ": "liver", "location": "segment 4 of the liver", "rule": "longest", "baseline_mm": 56, "follow_mm": 76, "size_mm_current": 76, "margin": "spiculated", "enhancement": "hypoenhancing", "suspicious": true, "target": true}, {"lesion_id": "ln:right hilar", "kind": "ln", "organ": "lymph", "station": "right hilar", "rule": "short_axis", "baseline_mm": null, "follow_mm": null, "size_mm_current": 9, "necrosis": false, "suspicious": false, "target": false}, {"lesion_id": "ln:porta hepatis", "kind": "ln", "organ": "lymph", "station": "porta hepatis", "rule": "short_axis", "baseline_mm": null, "follow_mm": null, "size_mm_current": 14, "necrosis": true, "suspicious": true, "target": false}, {"lesion_id": "ln:external iliac", "kind": "ln", "organ": "lymph", "station": "external iliac", "rule": "short_axis", "baseline_mm": 26, "follow_mm": 35, "size_mm_current": 35, "necrosis": false, "suspicious": true, "target": true}], "complexity_profile": {"level": 2, "level_name": "C2", "artifact": null}, "staging_relevance": 29.0, "incidentals": [{"organ": "pleura", "text": "trace effusion"}, {"organ": "lung", "text": "dependent atelectasis"}], "negatives": [{"organ": "mesentery_peritoneum", "text": "no ascites"}, {"organ": "pancreas", "text": "no pancreatic mass"}, {"organ": "kidneys", "text": "kidneys are normal"}, {"organ": "gi", "text": "no bowel obstruction"}, {"organ": "bladder", "text": "urinary bladder normal"}], "post_treatment": [], "report_text": "FINDINGS:\nComparison: 2024-03-12.\nPulmonary parenchyma: No focal consolidation or suspicious pulmonary nodules. No pneumothorax.\nMediastinum: Enlarged right hilar lymph node, short axis 9 mm. Cardiomediastinal contours within normal limits.\nPleura/Pleural spaces: No pleural effusion or pleural thickening. trace effusion.\nGreat vessels/Aorta: No thoracic aortic aneurysm or dissection.\nLiver: 76 mm spiculated hepatic mass in segment 4 of the liver (hypoenhancing). No focal hepatic lesions. Normal attenuation.\nSpleen: Normal in size and attenuation. No focal splenic lesion.\nPancreas: Normal pancreatic contour and enhancement. No focal mass. no pancreatic mass.\nAdrenal glands: Adrenal glands are normal without nodules.\nKidneys: No hydronephrosis. No enhancing renal mass. kidneys are normal.\nGI tract/Bowel: No obstructive process. No focal bowel wall mass identified. no bowel obstruction.\nMesentery/Omentum: No ascites. No omental caking.\nMesenteric vessels (SMA/SMV): SMA/SMV are patent without thrombosis.\nUrinary bladder: Unremarkable. urinary bladder normal.\nReproductive organs: No adnexal mass. Uterus/prostate within expected size for age.\nLymph nodes: Enlarged porta hepatis lymph node, short axis 14 mm with central necrosis. Enlarged external iliac lymph node, short axis 35 mm. No pathologically enlarged lymph nodes by size criteria.\nBones/Osseous structures: No aggressive osseous lesion. No acute fracture.\n\nIMPRESSION:\n- Liver primary malignancy at segment 4 of the liver measuring approximately 76 mm.\n- Findings concerning for nodal involvement.\n- No definite distant metastases identified.\n- RECIST 1.1 Summary:\n- Target lesions (n=2; ≤2 per organ rule applied).\n  • T1: Primary — 56→76 mm (longest diameter).\n  • T2: Lymph node — 26→35 mm (short axis).\n- SLD baseline: 82 mm.\n- SLD current: 111 mm (+35.4% change).\n- New lesions: present (unequivocal).\n- - RECIST 1.1 overall response category: PD.\n"}
{"patient_id": "PID000017", "study_date": "2024-06-16", "timepoint": 5, "recist": {"baseline_sld_mm": 82, "current_sld_mm": 105, "nadir_sld_mm": 71, "overall_response": "PD"}, "lesions": [{"lesion_id": "primary:liver", "kind": "primary", "organ": "liver", "location": "segment 4 of the liver", "rule": "longest", "baseline_mm": 56, "follow_mm": 73, "size_mm_current": 73, "margin": "spiculated", "enhancement": "hypoenhancing", "suspicious": true, "target": true}, {"lesion_id": "ln:right hilar", "kind": "ln", "organ": "lymph", "station": "right hilar", "rule": "short_axis", "baseline_mm": null, "follow_mm": null, "size_mm_current": 9, "necrosis": false, "suspicious": false, "target": false}, {"lesion_id": "ln:porta hepatis", "kind": "ln", "organ": "lymph", "station": "porta hepatis", "rule": "short_axis", "baseline_mm": null, "follow_mm": null, "size_mm_current": 14, "necrosis": true, "suspicious": true, "target": false}, {"lesion_id": "ln:external iliac", "kind": "ln", "organ": "lymph", "station": "external iliac", "rule": "short_axis", "baseline_mm": 26, "follow_mm": 32, "size_mm_current": 32, "necrosis": false, "suspicious": true, "target": true}], "complexity_profile": {"level": 2, "level_name": "C2", "artifact": {"key": "motion_mild", "impact": 1, "report_phrase": "Respiratory motion artifact partially limits assessment.", "severity_rank": 2}}, "staging_relevance": 28.0, "incidentals": [{"organ": "aorta_great_vessels", "text": "tortuosity"}, {"organ": "gi.stomach", "text": "small benign polyp"}], "negatives": [{"organ": "adrenals", "text": "adrenal glands normal"}, {"organ": "bones", "text": "no destructive osseous lesion"}, {"organ": "pleura", "text": "no pleural nodularity"}, {"organ": "mesentery_peritoneum", "text": "no ascites"}, {"organ": "aorta_great_vessels", "text": "no aneurysm or dissection"}], "post_treatment": [], "report_text": "FINDINGS:\nRespiratory motion artifact partially limits assessment.\nComparison: 2024-04-24.\nPulmonary parenchyma: Clear lungs without focal mass. No suspicious nodules identified.\nMediastinum: Enlarged right hilar lymph node, short axis 0.9 cm. Cardiomediastinal contours within normal limits.\nPleura/Pleural spaces: No pleural effusion or pleural thickening. no pleural nodularity.\nGreat vessels/Aorta: No thoracic aortic aneurysm or dissection. tortuosity. no aneurysm or dissection.\nLiver: 73 mm spiculated hepatic mass in segment 4 of the liver (hypoenhancing). No focal hepatic lesions. Normal attenuation.\nSpleen: Normal in size and attenuation. No focal splenic lesion.\nPancreas: Normal pancreatic contour and enhancement. No focal mass.\nAdrenal glands: Adrenal glands are normal without nodules. adrenal glands normal.\nKidneys: No hydronephrosis. No enhancing renal mass.\nGI tract/Bowel: No obstructive process. No focal bowel wall mass identified. small benign polyp.\nMesentery/Omentum: No ascites. No omental caking.\nMesenteric vessels (SMA/SMV): SMA/SMV are patent without thrombosis.\nUrinary bladder: Unremarkable.\nReproductive organs: No adnexal mass. Uterus/prostate within expected size for age.\nLymph nodes: Enlarged porta hepatis lymph node, short axis 14 mm with central necrosis. Enlarged external iliac lymph node, short axis 32 mm. No pathologically enlarged lymph nodes by size criteria.\nBones/Osseous structures: No aggressive osseous lesion. No acute fracture. no destructive osseous lesion.\n\nIMPRESSION:\n- Liver primary malignancy at segment 4 of the liver measuring approximately 73 mm.\n- Findings concerning for nodal involvement.\n- No definite distant metastases identified.\n- RECIST 1.1 Summary:\n- Target lesions (n=2; ≤2 per organ rule applied).\n  • T1: Primary — 56→73 mm (longest diameter).\n  • T2: Lymph node — 26→32 mm (short axis).\n- SLD baseline: 82 mm.\n- SLD current: 105 mm (+28.0% change).\n- New lesions: present (unequivocal).\n- - RECIST 1.1 overall response category: PD.\n"}
{"patient_id": "PID000018", "study_date": "2023-11-12", "timepoint": 0, "recist": {"baseline_sld_mm": 88, "current_sld_mm": null, "nadir_sld_mm": null, "overall_response": "Baseline (no category)"}, "lesions": [{"lesion_id": "primary:colon", "kind": "primary", "organ": "colon", "location": "sigmoid colon", "rule": "longest", "baseline_mm": 38, "follow_mm": null, "size_mm_current": 38, "margin": "lobulated", "enhancement": "isoenhancing", "suspicious": true, "target": true}, {"lesion_id": "ln:paratracheal", "kind": "ln", "organ": "lymph", "station": "paratracheal", "rule": "short_axis", "baseline_mm": 26, "follow_mm": null, "size_mm_current": 26, "necrosis": false, "suspicious": true, "target": true}, {"lesion_id": "met:adrenal", "kind": "met", "organ": "adrenal", "rule": "longest", "baseline_mm": 12, "follow_mm": null, "size_mm_current": 12, "suspicious": true, "target": true}, {"lesion_id": "met:liver", "kind": "met", "organ": "liver", "rule": "longest", "baseline_mm": 12, "follow_mm": null, "size_mm_current": 12, "suspicious": true, "target": true}], "complexity_profile": {"level": 2, "level_name": "C2", "artifact": null}, "staging_relevance": 0.0, "incidentals": [{"organ": "lung", "text": "bronchial wall thickening"}, {"organ": "aorta_great_vessels", "text": "mild aortic atherosclerosis"}], "negatives": [{"organ": "spleen", "text": "spleen normal size"}, {"organ": "bladder", "text": "urinary bladder normal"}, {"organ": "gi", "text": "no bowel obstruction"}, {"organ": "pleura", "text": "no pleural effusion"}, {"organ": "mesentery_peritoneum", "text": "no peritoneal nodularity"}], "post_treatment": [], "report_text": "FINDINGS:\nLungs: No focal consolidation or suspicious pulmonary nodules. No pneumothorax. bronchial wall thickening.\nMediastinum: Enlarged paratracheal lymph node, short axis 26 mm. Cardiomediastinal contours within normal limits.\nPleura/Pleural spaces: No pleural effusion or pleural thickening.\nGreat vessels/Aorta: No thoracic aortic aneurysm or dissection. mild aortic atherosclerosis.\nLiver: 12 mm lesion in the liver, suspicious for metastasis. No focal hepatic lesions. Normal attenuation.\nSpleen: Normal in size and attenuation. No focal splenic lesion. spleen normal size.\nPancreas: Normal pancreatic contour and enhancement. No focal mass.\nAdrenal glands: 12 mm lesion in the adrenal, suspicious for metastasis. Adrenal glands are normal without nodules.\nKidneys: No hydronephrosis. No enhancing renal mass.\nGI tract/Bowel: 38 mm lobulated mass involving the sigmoid colon with focal wall thickening (isoenhancing). No obstructive process. No focal bowel wall mass identified. no bowel obstruction.\nMesentery/Omentum: No ascites. No omental caking. no peritoneal nodularity.\nMesenteric vessels (SMA/SMV): SMA/SMV are patent without thrombosis.\nUrinary bladder: Unremarkable. urinary bladder normal.\nReproductive organs: No adnexal mass. Uterus/prostate within expected size for age.\nLymph nodes: No pathologically enlarged lymph nodes by size criteria.\nBones/Osseous structures: No aggressive osseous lesion. No acute fracture.\n\nIMPRESSION:\n- Colon primary malignancy at sigmoid colon measuring approximately 38 mm.\n- Findings concerning for nodal involvement.\n- Findings compatible with distant metastases involving: adrenal, liver.\n- RECIST 1.1 Summary:\n- Target lesions (n=4; ≤2 per organ rule applied).\n  • T1: Primary — 38 mm (longest diameter) at baseline.\n  • T2: Metastasis — 12 mm (longest diameter) at baseline.\n  • T3: Metastasis — 12 mm (longest diameter) at baseline.\n  • T4: Lymph node — 26 mm (short axis) at baseline.\n- SLD baseline: 88 mm.\n- New lesions: absent (unequivocal).\n- - RECIST 1.1 overall response category: Baseline (no category).\n"}
{"patient_id": "PID000018", "study_date": "2023-12-26", "timepoint": 1, "recist": {"baseline_sld_mm": 88, "current_sld_mm": 80, "nadir_sld_mm": 80, "overall_response": "SD"}, "lesions": [{"lesion_id": "primary:colon", "kind": "primary", "organ": "colon", "location": "sigmoid colon", "rule": "longest", "baseline_mm": 38, "follow_mm": 34, "size_mm_current": 34, "margin": "lobulated", "enhancement": "isoenhancing", "suspicious": true, "target": true}, {"lesion_id": "ln:paratracheal", "kind": "ln", "organ": "lymph", "station": "paratracheal", "rule": "short_axis", "baseline_mm": 26, "follow_mm": 25, "size_mm_current": 25, "necrosis": false, "suspicious": true, "target": true}, {"lesion_id": "met:adrenal", "kind": "met", "organ": "adrenal", "rule": "longest", "baseline_mm": 12, "follow_mm": 10, "size_mm_current": 10, "suspicious": true, "target": true}, {"lesion_id": "met:liver", "kind": "met", "organ": "liver", "rule": "longest", "baseline_mm": 12, "follow_mm": 11, "size_mm_current": 11, "suspicious": true, "target": true}], "complexity_profile": {"level": 2, "level_name": "C2", "artifact": null}, "staging_relevance": 6.0, "incidentals": [{"organ": "aorta_great_vessels", "text": "tortuosity"}, {"organ": "bones", "text": "degenerative changes"}, {"organ": "gi.stomach", "text": "physiologic under-distension thickening"}], "negatives": [{"organ": "lung", "text": "no suspicious pulmonary nodule"}, {"organ": "mediastinum", "text": "no mediastinal mass"}, {"organ": "liver", "text": "no hepatic mass"}, {"organ": "spleen", "text": "spleen normal size"}, {"organ": "gi", "text": "no colonic mass"}], "post_treatment": [], "report_text": "FINDINGS:\nComparison: 2023-11-12.\nPulmonary parenchyma: No focal consolidation or suspicious pulmonary nodules. No pneumothorax.\nMediastinum: Enlarged paratracheal lymph node, short axis 2.5 cm. Cardiomediastinal contours within normal limits. no mediastinal mass.\nPleura/Pleural spaces: No pleural effusion or pleural thickening.\nGreat vessels/Aorta: No thoracic aortic aneurysm or dissection. tortuosity.\nLiver: 11 mm lesion in the liver, suspicious for metastasis. No focal hepatic lesions. Normal attenuation. no hepatic mass.\nSpleen: Normal in size and attenuation. No focal splenic lesion. spleen normal size.\nPancreas: Normal pancreatic contour and enhancement. No focal mass.\nAdrenal glands: 1.0 cm lesion in the adrenal, suspicious for metastasis. Adrenal glands are normal without nodules.\nKidneys: No hydronephrosis. No enhancing renal mass.\nGI tract/Bowel: 34 mm lobulated mass involving the sigmoid colon with focal wall thickening (isoenhancing). No obstructive process. No focal bowel wall mass identified. physiologic under-distension thickening. no colonic mass.\nMesentery/Omentum: No ascites. No omental caking.\nMesenteric vessels (SMA/SMV): SMA/SMV are patent without thrombosis.\nUrinary bladder: Unremarkable.\nReproductive organs: No adnexal mass. Uterus/prostate within expected size for age.\nLymph nodes: No pathologically enlarged lymph nodes by size criteria.\nBones/Osseous structures: No aggressive osseous lesion. No acute fracture. degenerative changes.\n\nIMPRESSION:\n- Colon primary malignancy at sigmoid colon measuring approximately 34 mm.\n- Findings concerning for nodal involvement.\n- Findings compatible with distant metastases involving: adrenal, liver.\n- RECIST 1.1 Summary:\n- Target lesions (n=4; ≤2 per organ rule applied).\n  • T1: Primary — 38→34 mm (longest diameter).\n  • T2: Metastasis — 12→10 mm (longest diameter).\n  • T3: Metastasis — 12→11 mm (longest diameter).\n  • T4: Lymph node — 26→25 mm (short axis).\n- SLD baseline: 88 mm.\n- SLD current: 80 mm (-9.1% change).\n- New lesions: absent (unequivocal).\n- - RECIST 1.1 overall response category: SD.\n"}
{"patient_id": "PID000018", "study_date": "2024-02-22", "timepoint": 2, "recist": {"baseline_sld_mm": 88, "current_sld_mm": 110, "nadir_sld_mm": 80, "overall_response": "PD"}, "lesions": [{"lesion_id": "primary:colon", "kind": "primary", "organ": "colon", "location": "sigmoid colon", "rule": "longest", "baseline_mm": 38, "follow_mm": 48, "size_mm_current": 48, "margin": "lobulated", "enhancement": "isoenhancing", "suspicious": true, "target": true}, {"lesion_id": "ln:paratracheal", "kind": "ln", "organ": "lymph", "station": "paratracheal", "rule": "short_axis", "baseline_mm": 26, "follow_mm": 32, "size_mm_current": 32, "necrosis": false, "suspicious": true, "target": true}, {"lesion_id": "met:adrenal", "kind": "met", "organ": "adrenal", "rule": "longest", "baseline_mm": 12, "follow_mm": 15, "size_mm_current": 15, "suspicious": true, "target": true}, {"lesion_id": "met:liver", "kind": "met", "organ": "liver", "rule": "longest", "baseline_mm": 12, "follow_mm": 15, "size_mm_current": 15, "suspicious": true, "target": true}], "complexity_profile": {"level": 2, "level_name": "C2", "artifact": null}, "staging_relevance": 18.0, "incidentals": [{"organ": "kidneys", "text": "Bosniak I cyst"}, {"organ": "lung", "text": "<6 mm well-circumscribed nodule"}, {"organ": "mediastinum", "text": "prominent but subthreshold lymph nodes"}], "negatives": [{"organ": "gi", "text": "no bowel obstruction"}, {"organ": "spleen", "text": "spleen normal size"}, {"organ": "reproductive", "text": "ovaries are normal / no adnexal abnormality"}, {"organ": "pancreas", "text": "pancreas is normal"}, {"organ": "bladder", "text": "no focal bladder wall thickening"}], "post_treatment": [], "report_text": "FINDINGS:\nComparison: 2023-12-26.\nPulmonary parenchyma: No focal consolidation or suspicious pulmonary nodules. No pneumothorax.\nMediastinum: Enlarged paratracheal lymph node, short axis 32 mm. Cardiomediastinal contours within normal limits. prominent but subthreshold lymph nodes.\nPleura/Pleural spaces: No pleural effusion or pleural thickening.\nGreat vessels/Aorta: No thoracic aortic aneurysm or dissection.\nLiver: 1.5 cm lesion in the liver, suspicious for metastasis. No focal hepatic lesions. Normal attenuation.\nSpleen: Normal in size and attenuation. No focal splenic lesion. spleen normal size.\nPancreas: Normal pancreatic contour and enhancement. No focal mass. pancreas is normal.\nAdrenal glands: 15 mm lesion in the adrenal, suspicious for metastasis. Adrenal glands are normal without nodules.\nKidneys: No hydronephrosis. No enhancing renal mass. Bosniak I cyst.\nGI tract/Bowel: 48 mm lobulated mass involving the sigmoid colon with focal wall thickening (isoenhancing). No obstructive process. No focal bowel wall mass identified. no bowel obstruction.\nMesentery/Omentum: No ascites. No omental caking.\nMesenteric vessels (SMA/SMV): SMA/SMV are patent without thrombosis.\nUrinary bladder: Unremarkable. no focal bladder wall thickening.\nReproductive organs: No adnexal mass. Uterus/prostate within expected size for age. ovaries are normal / no adnexal abnormality.\nLymph nodes: No pathologically enlarged lymph nodes by size criteria.\nBones/Osseous structures: No aggressive osseous lesion. No acute fracture.\n\nIMPRESSION:\n- Colon primary neoplasm (indeterminate) at sigmoid colon measuring approximately 48 mm.\n- Findings concerning for nodal involvement.\n- Findings compatible with distant metastases involving: adrenal, liver.\n- RECIST 1.1 Summary:\n- Target lesions (n=4; ≤2 per organ rule applied).\n  • T1: Primary — 38→48 mm (longest diameter).\n  • T2: Metastasis — 12→15 mm (longest diameter).\n  • T3: Metastasis — 12→15 mm (longest diameter).\n  • T4: Lymph node — 26→32 mm (short axis).\n- SLD baseline: 88 mm.\n- SLD current: 110 mm (+25.0% change).\n- New lesions: absent (unequivocal).\n- - RECIST 1.1 overall response category: PD.\n\nComment: Some features are indeterminate for; short-interval follow-up or problem-solving imaging may be considered.\n"}
{"patient_id": "PID000018", "study_date": "2024-04-26", "timepoint": 3, "recist": {"baseline_sld_mm": 88, "current_sld_mm": 110, "nadir_sld_mm": 80, "overall_response": "PD"}, "lesions": [{"lesion_id": "primary:colon", "kind": "primary", "organ": "colon", "location": "sigmoid colon", "rule": "longest", "baseline_mm": 38, "follow_mm": 48, "size_mm_current": 48, "margin": "lobulated", "enhancement": "isoenhancing", "suspicious": true, "target": true}, {"lesion_id": "ln:paratracheal", "kind": "ln", "organ": "lymph", "station": "paratracheal", "rule": "short_axis", "baseline_mm": 26, "follow_mm": 33, "size_mm_current": 33, "necrosis": false, "suspicious": true, "target": true}, {"lesion_id": "met:adrenal", "kind": "met", "organ": "adrenal", "rule": "longest", "baseline_mm": 12, "follow_mm": 15, "size_mm_current": 15, "suspicious": true, "target": true}, {"lesion_id": "met:liver", "kind": "met", "organ": "liver", "rule": "longest", "baseline_mm": 12, "follow_mm": 14, "size_mm_current": 14, "suspicious": true, "target": true}], "complexity_profile": {"level": 2, "level_name": "C2", "artifact": null}, "staging_relevance": 29.0, "incidentals": [{"organ": "reproductive.ovary", "text": "simple physiologic cyst"}], "negatives": [{"organ": "kidneys", "text": "no renal mass"}, {"organ": "pleura", "text": "no pleural nodularity"}, {"organ": "aorta_great_vessels", "text": "aorta normal caliber"}, {"organ": "spleen", "text": "spleen normal size"}, {"organ": "adrenals", "text": "adrenal glands normal"}], "post_treatment": ["Radiation change: fat stranding"], "report_text": "FINDINGS:\nComparison: 2024-02-22.\nLungs: Clear lungs without focal mass. No suspicious nodules identified. Post-treatment change: fat stranding.\nMediastinum: Enlarged paratracheal lymph node, short axis 33 mm. Cardiomediastinal contours within normal limits.\nPleura/Pleural spaces: No pleural effusion or pleural thickening. no pleural nodularity.\nGreat vessels/Aorta: No thoracic aortic aneurysm or dissection. aorta normal caliber.\nLiver: 14 mm lesion in the liver, suspicious for metastasis. No focal hepatic lesions. Normal attenuation.\nSpleen: Normal in size and attenuation. No focal splenic lesion. spleen normal size.\nPancreas: Normal pancreatic contour and enhancement. No focal mass.\nAdrenal glands: 15 mm lesion in the adrenal, suspicious for metastasis. Adrenal glands are normal without nodules. adrenal glands normal.\nKidneys: No hydronephrosis. No enhancing renal mass. no renal mass.\nGI tract/Bowel: 48 mm lobulated mass involving the sigmoid colon with focal wall thickening (isoenhancing). No obstructive process. No focal bowel wall mass identified.\nMesentery/Omentum: No ascites. No omental caking.\nMesenteric vessels (SMA/SMV): SMA/SMV are patent without thrombosis.\nUrinary bladder: Unremarkable.\nReproductive organs: No adnexal mass. Uterus/prostate within expected size for age. simple physiologic cyst.\nLymph nodes: No pathologically enlarged lymph nodes by size criteria.\nBones/Osseous structures: No aggressive osseous lesion. No acute fracture.\n\nIMPRESSION:\n- Colon primary malignancy at sigmoid colon measuring approximately 48 mm.\n- Findings concerning for nodal involvement.\n- Findings compatible with distant metastases involving: adrenal, liver.\n- RECIST 1.1 Summary:\n- Target lesions (n=4; ≤2 per organ rule applied).\n  • T1: Primary — 38→48 mm (longest diameter).\n  • T2: Metastasis — 12→15 mm (longest diameter).\n  • T3: Metastasis — 12→14 mm (longest diameter).\n  • T4: Lymph node — 26→33 mm (short axis).\n- SLD baseline: 88 mm.\n- SLD current: 110 mm (+25.0% change).\n- New lesions: present (unequivocal).\n- - RECIST 1.1 overall response category: PD.\n"}
{"patient_id": "PID000018", "study_date": "2024-06-19", "timepoint": 4, "recist": {"baseline_sld_mm": 88, "current_sld_mm": 114, "nadir_sld_mm": 80, "overall_response": "PD"}, "lesions": [{"lesion_id": "primary:colon", "kind": "primary", "organ": "colon", "location": "sigmoid colon", "rule": "longest", "baseline_mm": 38, "follow_mm": 48, "size_mm_current": 48, "margin": "lobulated", "enhancement": "isoenhancing", "suspicious": true, "target": true}, {"lesion_id": "ln:paratracheal", "kind": "ln", "organ": "lymph", "station": "paratracheal", "rule": "short_axis", "baseline_mm": 26, "follow_mm": 34, "size_mm_current": 34, "necrosis": false, "suspicious": true, "target": true}, {"lesion_id": "met:adrenal", "kind": "met", "organ": "adrenal", "rule": "longest", "baseline_mm": 12, "follow_mm": 16, "size_mm_current": 16, "suspicious": true, "target": true}, {"lesion_id": "met:liver", "kind": "met", "organ": "liver", "rule": "longest", "baseline_mm": 12, "follow_mm": 16, "size_mm_current": 16, "suspicious": true, "target": true}], "complexity_profile": {"level": 2, "level_name": "C2", "artifact": null}, "staging_relevance": 29.0, "incidentals": [{"organ": "lung", "text": "dependent atelectasis"}], "negatives": [{"organ": "pancreas", "text": "no pancreatic mass"}, {"organ": "bones", "text": "no destructive osseous lesion"}, {"organ": "pleura", "text": "no pleural nodularity"}, {"organ": "bladder", "text": "no focal bladder wall thickening"}, {"organ": "gi", "text": "stomach is normal"}], "post_treatment": [], "report_text": "FINDINGS:\nComparison: 2024-04-26.\nPulmonary parenchyma: Clear lungs without focal mass. No suspicious nodules identified.\nMediastinum: Enlarged paratracheal lymph node, short axis 34 mm. Cardiomediastinal contours within normal limits.\nPleura/Pleural spaces: No pleural effusion or pleural thickening. no pleural nodularity.\nGreat vessels/Aorta: No thoracic aortic aneurysm or dissection.\nLiver: 16 mm lesion in the liver, suspicious for metastasis. No focal hepatic lesions. Normal attenuation.\nSpleen: Normal in size and attenuation. No focal splenic lesion.\nPancreas: Normal pancreatic contour and enhancement. No focal mass. no pancreatic mass.\nAdrenal glands: 16 mm lesion in the adrenal, suspicious for metastasis. Adrenal glands are normal without nodules.\nKidneys: No hydronephrosis. No enhancing renal mass.\nGI tract/Bowel: 48 mm lobulated mass involving the sigmoid colon with focal wall thickening (isoenhancing). No obstructive process. No focal bowel wall mass identified. stomach is normal.\nMesentery/Omentum: No ascites. No omental caking.\nMesenteric vessels (SMA/SMV): SMA/SMV are patent without thrombosis.\nUrinary bladder: Unremarkable. no focal bladder wall thickening.\nReproductive organs: No adnexal mass. Uterus/prostate within expected size for age.\nLymph nodes: No pathologically enlarged lymph nodes by size criteria.\nBones/Osseous structures: No aggressive osseous lesion. No acute fracture. no destructive osseous lesion.\n\nIMPRESSION:\n- Colon primary malignancy at sigmoid colon measuring approximately 48 mm.\n- Findings concerning for nodal involvement.\n- Findings compatible with distant metastases involving: adrenal, liver.\n- RECIST 1.1 Summary:\n- Target lesions (n=4; ≤2 per organ rule applied).\n  • T1: Primary — 38→48 mm (longest diameter).\n  • T2: Metastasis — 12→16 mm (longest diameter).\n  • T3: Metastasis — 12→16 mm (longest diameter).\n  • T4: Lymph node — 26→34 mm (short axis).\n- SLD baseline: 88 mm.\n- SLD current: 114 mm (+29.5% change).\n- New lesions: present (unequivocal).\n- - RECIST 1.1 overall response category: PD.\n"}
{"patient_id": "PID000018", "study_date": "2024-08-23", "timepoint": 5, "recist": {"baseline_sld_mm": 88, "current_sld_mm": 117, "nadir_sld_mm": 80, "overall_response": "PD"}, "lesions": [{"lesion_id": "primary:colon", "kind": "primary", "organ": "colon", "location": "sigmoid colon", "rule": "longest", "baseline_mm": 38, "follow_mm": 52, "size_mm_current": 52, "margin": "lobulated", "enhancement": "isoenhancing", "suspicious": true, "target": true}, {"lesion_id": "ln:paratracheal", "kind": "ln", "organ": "lymph", "station": "paratracheal", "rule": "short_axis", "baseline_mm": 26, "follow_mm": 33, "size_mm_current": 33, "necrosis": false, "suspicious": true, "target": true}, {"lesion_id": "met:adrenal", "kind": "met", "organ": "adrenal", "rule": "longest", "baseline_mm": 12, "follow_mm": 15, "size_mm_current": 15, "suspicious": true, "target": true}, {"lesion_id": "met:liver", "kind": "met", "organ": "liver", "rule": "longest", "baseline_mm": 12, "follow_mm": 17, "size_mm_current": 17, "suspicious": true, "target": true}], "complexity_profile": {"level": 2, "level_name": "C2", "artifact": {"key": "partial_volume", "impact": 1, "report_phrase": "Partial volume averaging may obscure small foci.", "severity_rank": 1}}, "staging_relevance": 28.0, "incidentals": [{"organ": "lung", "text": "subpleural reticulation"}, {"organ": "kidneys", "text": "angiomyolipoma (macroscopic fat)"}], "negatives": [{"organ": "aorta_great_vessels", "text": "no aneurysm or dissection"}, {"organ": "mesentery_peritoneum", "text": "no ascites"}, {"organ": "bladder", "text": "urinary bladder normal"}, {"organ": "pancreas", "text": "pancreas is normal"}, {"organ": "gi", "text": "no bowel obstruction"}], "post_treatment": [], "report_text": "FINDINGS:\nPartial volume averaging may obscure small foci.\nComparison: 2024-06-19.\nPulmonary parenchyma: Clear lungs without focal mass. No suspicious nodules identified.\nMediastinum: Enlarged paratracheal lymph node, short axis 33 mm. Cardiomediastinal contours within normal limits.\nPleura/Pleural spaces: No pleural effusion or pleural thickening.\nGreat vessels/Aorta: No thoracic aortic aneurysm or dissection. no aneurysm or dissection.\nLiver: 17 mm lesion in the liver, suspicious for metastasis. No focal hepatic lesions. Normal attenuation.\nSpleen: Normal in size and attenuation. No focal splenic lesion.\nPancreas: Normal pancreatic contour and enhancement. No focal mass. pancreas is normal.\nAdrenal glands: 15 mm lesion in the adrenal, suspicious for metastasis. Adrenal glands are normal without nodules.\nKidneys: No hydronephrosis. No enhancing renal mass. angiomyolipoma (macroscopic fat).\nGI tract/Bowel: 5.2 cm lobulated mass involving the sigmoid colon with focal wall thickening (isoenhancing). No obstructive process. No focal bowel wall mass identified. no bowel obstruction.\nMesentery/Omentum: No ascites. No omental caking.\nMesenteric vessels (SMA/SMV): SMA/SMV are patent without thrombosis.\nUrinary bladder: Unremarkable. urinary bladder normal.\nReproductive organs: No adnexal mass. Uterus/prostate within expected size for age.\nLymph nodes: No pathologically enlarged lymph nodes by size criteria.\nBones/Osseous structures: No aggressive osseous lesion. No acute fracture.\n\nIMPRESSION:\n- Colon primary malignancy at sigmoid colon measuring approximately 52 mm.\n- Findings concerning for nodal involvement.\n- Findings compatible with distant metastases involving: adrenal, liver.\n- RECIST 1.1 Summary:\n- Target lesions (n=4; ≤2 per organ rule applied).\n  • T1: Primary — 38→52 mm (longest diameter).\n  • T2: Metastasis — 12→15 mm (longest diameter).\n  • T3: Metastasis — 12→17 mm (longest diameter).\n  • T4: Lymph node — 26→33 mm (short axis).\n- SLD baseline: 88 mm.\n- SLD current: 117 mm (+33.0% change).\n- New lesions: present (unequivocal).\n- - RECIST 1.1 overall response category: PD.\n"}
{"patient_id": "PID000019", "study_date": "2023-12-16", "timepoint": 0, "recist": {"baseline_sld_mm": 118, "current_sld_mm": null, "nadir_sld_mm": null, "overall_response": "Baseline (no category)"}, "lesions": [{"lesion_id": "primary:kidney", "kind": "primary", "organ": "kidney", "location": "left kidney, lower pole", "rule": "longest", "baseline_mm": 70, "follow_mm": null, "size_mm_current": 70, "margin": "spiculated", "enhancement": "hypoenhancing", "suspicious": true, "target": true}, {"lesion_id": "ln:left hilar", "kind": "ln", "organ": "lymph", "station": "left hilar", "rule": "short_axis", "baseline_mm": 29, "follow_mm": null, "size_mm_current": 29, "necrosis": true, "suspicious": true, "target": true}, {"lesion_id": "ln:mesenteric", "kind": "ln", "organ": "lymph", "station": "mesenteric", "rule": "short_axis", "baseline_mm": 19, "follow_mm": null, "size_mm_current": 19, "necrosis": false, "suspicious": true, "target": true}, {"lesion_id": "ln:internal iliac", "kind": "ln", "organ": "lymph", "station": "internal iliac", "rule": "short_axis", "baseline_mm": null, "follow_mm": null, "size_mm_current": 12, "necrosis": true, "suspicious": true, "target": false}], "complexity_profile": {"level": 2, "level_name": "C2", "artifact": null}, "staging_relevance": 0.0, "incidentals": [{"organ": "bones", "text": "degenerative changes"}, {"organ": "gi.small_bowel", "text": "nonspecific fluid levels"}], "negatives": [{"organ": "bladder", "text": "no focal bladder wall thickening"}, {"organ": "pleura", "text": "no pleural nodularity"}, {"organ": "adrenals", "text": "no adrenal nodule"}, {"organ": "kidneys", "text": "kidneys are normal"}, {"organ": "pancreas", "text": "pancreas is normal"}], "post_treatment": ["Radiation change: fat stranding"], "report_text": "FINDINGS:\nLungs: Clear lungs without focal mass. No suspicious nodules identified. Post-treatment change: fat stranding.\nMediastinum: Enlarged left hilar lymph node, short axis 2.9 cm with central necrosis. Cardiomediastinal contours within normal limits.\nPleura/Pleural spaces: No pleural effusion or pleural thickening. no pleural nodularity.\nGreat vessels/Aorta: No thoracic aortic aneurysm or dissection.\nLiver: No focal hepatic lesions. Normal attenuation.\nSpleen: Normal in size and attenuation. No focal splenic lesion.\nPancreas: Normal pancreatic contour and enhancement. No focal mass. pancreas is normal.\nAdrenal glands: Adrenal glands are normal without nodules. no adrenal nodule.\nKidneys: 70 mm spiculated enhancing renal mass in the left kidney, lower pole. No hydronephrosis. No enhancing renal mass. kidneys are normal.\nGI tract/Bowel: No obstructive process. No focal bowel wall mass identified. nonspecific fluid levels.\nMesentery/Omentum: No ascites. No omental caking.\nMesenteric vessels (SMA/SMV): SMA/SMV are patent without thrombosis.\nUrinary bladder: Unremarkable. no focal bladder wall thickening.\nReproductive organs: No adnexal mass. Uterus/prostate within expected size for age.\nLymph nodes: Enlarged mesenteric lymph node, short axis 19 mm. Enlarged internal iliac lymph node, short axis 12 mm with central necrosis. No pathologically enlarged lymph nodes by size criteria.\nBones/Osseous structures: No aggressive osseous lesion. No acute fracture. degenerative changes.\n\nIMPRESSION:\n- Kidney primary malignancy at left kidney, lower pole measuring approximately 70 mm.\n- Findings concerning for nodal involvement.\n- No definite distant metastases identified.\n- RECIST 1.1 Summary:\n- Target lesions (n=3; ≤2 per organ rule applied).\n  • T1: Primary — 70 mm (longest diameter) at baseline.\n  • T2: Lymph node — 29 mm (short axis) at baseline.\n  • T3: Lymph node — 19 mm (short axis) at baseline.\n- SLD baseline: 118 mm.\n- New lesions: absent (unequivocal).\n- - RECIST 1.1 overall response category: Baseline (no category).\n"}
{"patient_id": "PID000019", "study_date": "2024-02-17", "timepoint": 1, "recist": {"baseline_sld_mm": 118, "current_sld_mm": 77, "nadir_sld_mm": 77, "overall_response": "PR"}, "lesions": [{"lesion_id": "primary:kidney", "kind": "primary", "organ": "kidney", "location": "left kidney, lower pole", "rule": "longest", "baseline_mm": 70, "follow_mm": 46, "size_mm_current": 46, "margin": "spiculated", "enhancement": "hypoenhancing", "suspicious": true, "target": true}, {"lesion_id": "ln:left hilar", "kind": "ln", "organ": "lymph", "station": "left hilar", "rule": "short_axis", "baseline_mm": 29, "follow_mm": 19, "size_mm_current": 19, "necrosis": true, "suspicious": true, "target": true}, {"lesion_id": "ln:mesenteric", "kind": "ln", "organ": "lymph", "station": "mesenteric", "rule": "short_axis", "baseline_mm": 19, "follow_mm": 12, "size_mm_current": 12, "necrosis": false, "suspicious": true, "target": true}, {"lesion_id": "ln:internal iliac", "kind": "ln", "organ": "lymph", "station": "internal iliac", "rule": "short_axis", "baseline_mm": null, "follow_mm": null, "size_mm_current": 12, "necrosis": true, "suspicious": true, "target": false}], "complexity_profile": {"level": 2, "level_name": "C2", "artifact": null}, "staging_relevance": 6.0, "incidentals": [{"organ": "lung", "text": "mild bronchiectasis"}, {"organ": "pancreas", "text": "serous cystadenoma"}, {"organ": "lung", "text": "calcified granuloma"}], "negatives": [{"organ": "liver", "text": "liver is normal"}, {"organ": "adrenals", "text": "no adrenal nodule"}, {"organ": "mediastinum", "text": "no pathologic mediastinal lymphadenopathy"}, {"organ": "pleura", "text": "no pleural effusion"}, {"organ": "kidneys", "text": "no renal mass"}], "post_treatment": [], "report_text": "FINDINGS:\nComparison: 2023-12-16.\nPulmonary parenchyma: No focal consolidation or suspicious pulmonary nodules. No pneumothorax.\nMediastinum: Enlarged left hilar lymph node, short axis 19 mm with central necrosis. Cardiomediastinal contours within normal limits. no pathologic mediastinal lymphadenopathy.\nPleura/Pleural spaces: No pleural effusion or pleural thickening.\nGreat vessels/Aorta: No thoracic aortic aneurysm or dissection.\nLiver: No focal hepatic lesions. Normal attenuation. liver is normal.\nSpleen: Normal in size and attenuation. No focal splenic lesion.\nPancreas: Normal pancreatic contour and enhancement. No focal mass. serous cystadenoma.\nAdrenal glands: Adrenal glands are normal without nodules. no adrenal nodule.\nKidneys: 46 mm spiculated enhancing renal mass in the left kidney, lower pole. No hydronephrosis. No enhancing renal mass. no renal mass.\nGI tract/Bowel: No obstructive process. No focal bowel wall mass identified.\nMesentery/Omentum: No ascites. No omental caking.\nMesenteric vessels (SMA/SMV): SMA/SMV are patent without thrombosis.\nUrinary bladder: Unremarkable.\nReproductive organs: No adnexal mass. Uterus/prostate within expected size for age.\nLymph nodes: Enlarged mesenteric lymph node, short axis 12 mm. Enlarged internal iliac lymph node, short axis 12 mm with central necrosis. No pathologically enlarged lymph nodes by size criteria.\nBones/Osseous structures: No aggressive osseous lesion. No acute fracture.\n\nIMPRESSION:\n- Kidney primary malignancy at left kidney, lower pole measuring approximately 46 mm.\n- Findings concerning for nodal involvement.\n- No definite distant metastases identified.\n- RECIST 1.1 Summary:\n- Target lesions (n=3; ≤2 per organ rule applied).\n  • T1: Primary — 70→46 mm (longest diameter).\n  • T2: Lymph node — 29→19 mm (short axis).\n  • T3: Lymph node — 19→12 mm (short axis).\n- SLD baseline: 118 mm.\n- SLD current: 77 mm (-34.7% change).\n- New lesions: absent (unequivocal).\n- - RECIST 1.1 overall response category: PR.\n"}
{"patient_id": "PID000019", "study_date": "2024-04-12", "timepoint": 2, "recist": {"baseline_sld_mm": 118, "current_sld_mm": 77, "nadir_sld_mm": 77, "overall_response": "PR"}, "lesions": [{"lesion_id": "primary:kidney", "kind": "primary", "organ": "kidney", "location": "left kidney, lower pole", "rule": "longest", "baseline_mm": 70, "follow_mm": 46, "size_mm_current": 46, "margin": "spiculated", "enhancement": "hypoenhancing", "suspicious": true, "target": true}, {"lesion_id": "ln:left hilar", "kind": "ln", "organ": "lymph", "station": "left hilar", "rule": "short_axis", "baseline_mm": 29, "follow_mm": 19, "size_mm_current": 19, "necrosis": true, "suspicious": true, "target": true}, {"lesion_id": "ln:mesenteric", "kind": "ln", "organ": "lymph", "station": "mesenteric", "rule": "short_axis", "baseline_mm": 19, "follow_mm": 12, "size_mm_current": 12, "necrosis": false, "suspicious": true, "target": true}, {"lesion_id": "ln:internal iliac", "kind": "ln", "organ": "lymph", "station": "internal iliac", "rule": "short_axis", "baseline_mm": null, "follow_mm": null, "size_mm_current": 12, "necrosis": true, "suspicious": true, "target": false}], "complexity_profile": {"level": 2, "level_name": "C2", "artifact": null}, "staging_relevance": 6.0, "incidentals": [{"organ": "lung", "text": "bronchial wall thickening"}, {"organ": "mediastinum", "text": "small thymic remnant"}], "negatives": [{"organ": "kidneys", "text": "no renal mass"}, {"organ": "gi", "text": "no colonic mass"}, {"organ": "spleen", "text": "no focal splenic lesion"}, {"organ": "pancreas", "text": "no pancreatic mass"}, {"organ": "bladder", "text": "urinary bladder normal"}], "post_treatment": [], "report_text": "FINDINGS:\nComparison: 2024-02-17.\nLungs: Clear lungs without focal mass. No suspicious nodules identified. bronchial wall thickening.\nMediastinum: Enlarged left hilar lymph node, short axis 19 mm with central necrosis. Cardiomediastinal contours within normal limits. small thymic remnant.\nPleura/Pleural spaces: No pleural effusion or pleural thickening.\nGreat vessels/Aorta: No thoracic aortic aneurysm or dissection.\nLiver: No focal hepatic lesions. Normal attenuation.\nSpleen: Normal in size and attenuation. No focal splenic lesion.\nPancreas: Normal pancreatic contour and enhancement. No focal mass. no pancreatic mass.\nAdrenal glands: Adrenal glands are normal without nodules.\nKidneys: 46 mm spiculated enhancing renal mass in the left kidney, lower pole. No hydronephrosis. No enhancing renal mass. no renal mass.\nGI tract/Bowel: No obstructive process. No focal bowel wall mass identified. no colonic mass.\nMesentery/Omentum: No ascites. No omental caking.\nMesenteric vessels (SMA/SMV): SMA/SMV are patent without thrombosis.\nUrinary bladder: Unremarkable. urinary bladder normal.\nReproductive organs: No adnexal mass. Uterus/prostate within expected size for age.\nLymph nodes: Enlarged mesenteric lymph node, short axis 12 mm. Enlarged internal iliac lymph node, short axis 12 mm with central necrosis. No pathologically enlarged lymph nodes by size criteria.\nBones/Osseous structures: No aggressive osseous lesion. No acute fracture.\n\nIMPRESSION:\n- Kidney primary malignancy at left kidney, lower pole measuring approximately 46 mm.\n- Findings concerning for nodal involvement.\n- No definite distant metastases identified.\n- RECIST 1.1 Summary:\n- Target lesions (n=3; ≤2 per organ rule applied).\n  • T1: Primary — 70→46 mm (longest diameter).\n  • T2: Lymph node — 29→19 mm (short axis).\n  • T3: Lymph node — 19→12 mm (short axis).\n- SLD baseline: 118 mm.\n- SLD current: 77 mm (-34.7% change).\n- New lesions: absent (unequivocal).\n- - RECIST 1.1 overall response category: PR.\n"}
{"patient_id": "PID000019", "study_date": "2024-05-28", "timepoint": 3, "recist": {"baseline_sld_mm": 118, "current_sld_mm": 111, "nadir_sld_mm": 77, "overall_response": "PD"}, "lesions": [{"lesion_id": "primary:kidney", "kind": "primary", "organ": "kidney", "location": "left kidney, lower pole", "rule": "longest", "baseline_mm": 70, "follow_mm": 65, "size_mm_current": 65, "margin": "spiculated", "enhancement": "hypoenhancing", "suspicious": true, "target": true}, {"lesion_id": "ln:left hilar", "kind": "ln", "organ": "lymph", "station": "left hilar", "rule": "short_axis", "baseline_mm": 29, "follow_mm": 28, "size_mm_current": 28, "necrosis": true, "suspicious": true, "target": true}, {"lesion_id": "ln:mesenteric", "kind": "ln", "organ": "lymph", "station": "mesenteric", "rule": "short_axis", "baseline_mm": 19, "follow_mm": 18, "size_mm_current": 18, "necrosis": false, "suspicious": true, "target": true}, {"lesion_id": "ln:internal iliac", "kind": "ln", "organ": "lymph", "station": "internal iliac", "rule": "short_axis", "baseline_mm": null, "follow_mm": null, "size_mm_current": 12, "necrosis": true, "suspicious": true, "target": false}], "complexity_profile": {"level": 2, "level_name": "C2", "artifact": null}, "staging_relevance": 19.0, "incidentals": [{"organ": "pancreas", "text": "side-branch IPMN (no worrisome features)"}], "negatives": [{"organ": "reproductive", "text": "ovaries are normal / no adnexal abnormality"}, {"organ": "lung", "text": "no pleural effusion"}, {"organ": "pancreas", "text": "no pancreatic mass"}, {"organ": "mesentery_peritoneum", "text": "no ascites"}, {"organ": "spleen", "text": "no focal splenic lesion"}], "post_treatment": ["Radiation change: consolidation conforming to beam path"], "report_text": "FINDINGS:\nComparison: 2024-04-12.\nLungs: No focal consolidation or suspicious pulmonary nodules. No pneumothorax. no pleural effusion. Post-treatment change: consolidation conforming to beam path.\nMediastinum: Enlarged left hilar lymph node, short axis 28 mm with central necrosis. Cardiomediastinal contours within normal limits.\nPleura/Pleural spaces: No pleural effusion or pleural thickening.\nGreat vessels/Aorta: No thoracic aortic aneurysm or dissection.\nLiver: No focal hepatic lesions. Normal attenuation.\nSpleen: Normal in size and attenuation. No focal splenic lesion.\nPancreas: Normal pancreatic contour and enhancement. No focal mass. side-branch IPMN (no worrisome features). no pancreatic mass.\nAdrenal glands: Adrenal glands are normal without nodules.\nKidneys: 65 mm spiculated enhancing renal mass in the left kidney, lower pole. No hydronephrosis. No enhancing renal mass.\nGI tract/Bowel: No obstructive process. No focal bowel wall mass identified.\nMesentery/Omentum: No ascites. No omental caking.\nMesenteric vessels (SMA/SMV): SMA/SMV are patent without thrombosis.\nUrinary bladder: Unremarkable.\nReproductive organs: No adnexal mass. Uterus/prostate within expected size for age. ovaries are normal / no adnexal abnormality.\nLymph nodes: Enlarged mesenteric lymph node, short axis 18 mm. Enlarged internal iliac lymph node, short axis 1.2 cm with central necrosis. No pathologically enlarged lymph nodes by size criteria.\nBones/Osseous structures: No aggressive osseous lesion. No acute fracture.\n\nIMPRESSION:\n- Kidney primary malignancy at left kidney, lower pole measuring approximately 65 mm.\n- Findings concerning for nodal involvement.\n- No definite distant metastases identified.\n- RECIST 1.1 Summary:\n- Target lesions (n=3; ≤2 per organ rule applied).\n  • T1: Primary — 70→65 mm (longest diameter).\n  • T2: Lymph node — 29→28 mm (short axis).\n  • T3: Lymph node — 19→18 mm (short axis).\n- SLD baseline: 118 mm.\n- SLD current: 111 mm (-5.9% change).\n- New lesions: absent (unequivocal).\n- - RECIST 1.1 overall response category: PD.\n"}
{"patient_id": "PID000020", "study_date": "2023-11-15", "timepoint": 0, "recist": {"baseline_sld_mm": 69, "current_sld_mm": null, "nadir_sld_mm": null, "overall_response": "Baseline (no category)"}, "lesions": [{"lesion_id": "primary:stomach", "kind": "primary", "organ": "stomach", "location": "greater curvature of the stomach", "rule": "longest", "baseline_mm": 52, "follow_mm": null, "size_mm_current": 52, "margin": "lobulated", "enhancement": "hyperenhancing", "suspicious": true, "target": true}, {"lesion_id": "ln:left hilar", "kind": "ln", "organ": "lymph", "station": "left hilar", "rule": "short_axis", "baseline_mm": 17, "follow_mm": null, "size_mm_current": 17, "necrosis": false, "suspicious": true, "target": true}], "complexity_profile": {"level": 2, "level_name": "C2", "artifact": null}, "staging_relevance": 0.0, "incidentals": [{"organ": "spleen", "text": "accessory spleen"}], "negatives": [{"organ": "adrenals", "text": "no adrenal nodule"}, {"organ": "pancreas", "text": "no pancreatic mass"}, {"organ": "mediastinum", "text": "no mediastinal mass"}, {"organ": "kidneys", "text": "kidneys are normal"}, {"organ": "liver", "text": "no hepatic mass"}], "post_treatment": ["Radiation change: consolidation conforming to beam path"], "report_text": "FINDINGS:\nLungs: No focal consolidation or suspicious pulmonary nodules. No pneumothorax. Post-treatment change: consolidation conforming to beam path.\nMediastinum: Enlarged left hilar lymph node, short axis 1.7 cm. Cardiomediastinal contours within normal limits. no mediastinal mass.\nPleura/Pleural spaces: No pleural effusion or pleural thickening.\nGreat vessels/Aorta: No thoracic aortic aneurysm or dissection.\nLiver: No focal hepatic lesions. Normal attenuation. no hepatic mass.\nSpleen: Normal in size and attenuation. No focal splenic lesion. accessory spleen.\nPancreas: Normal pancreatic contour and enhancement. No focal mass. no pancreatic mass.\nAdrenal glands: Adrenal glands are normal without nodules. no adrenal nodule.\nKidneys: No hydronephrosis. No enhancing renal mass. kidneys are normal.\nGI tract/Bowel: 5.2 cm lobulated gastric mass at the greater curvature of the stomach (hyperenhancing). No obstructive process. No focal bowel wall mass identified.\nMesentery/Omentum: No ascites. No omental caking.\nMesenteric vessels (SMA/SMV): SMA/SMV are patent without thrombosis.\nUrinary bladder: Unremarkable.\nReproductive organs: No adnexal mass. Uterus/prostate within expected size for age.\nLymph nodes: No pathologically enlarged lymph nodes by size criteria.\nBones/Osseous structures: No aggressive osseous lesion. No acute fracture.\n\nIMPRESSION:\n- Stomach primary malignancy at greater curvature of the stomach measuring approximately 52 mm.\n- Findings concerning for nodal involvement.\n- No definite distant metastases identified.\n- RECIST 1.1 Summary:\n- Target lesions (n=2; ≤2 per organ rule applied).\n  • T1: Primary — 52 mm (longest diameter) at baseline.\n  • T2: Lymph node — 17 mm (short axis) at baseline.\n- SLD baseline: 69 mm.\n- New lesions: absent (unequivocal).\n- - RECIST 1.1 overall response category: Baseline (no category).\n"}
{"patient_id": "PID000020", "study_date": "2024-01-19", "timepoint": 1, "recist": {"baseline_sld_mm": 69, "current_sld_mm": 73, "nadir_sld_mm": 69, "overall_response": "SD"}, "lesions": [{"lesion_id": "primary:stomach", "kind": "primary", "organ": "stomach", "location": "greater curvature of the stomach", "rule": "longest", "baseline_mm": 52, "follow_mm": 55, "size_mm_current": 55, "margin": "lobulated", "enhancement": "hyperenhancing", "suspicious": true, "target": true}, {"lesion_id": "ln:left hilar", "kind": "ln", "organ": "lymph", "station": "left hilar", "rule": "short_axis", "baseline_mm": 17, "follow_mm": 18, "size_mm_current": 18, "necrosis": false, "suspicious": true, "target": true}], "complexity_profile": {"level": 2, "level_name": "C2", "artifact": {"key": "motion_mild", "impact": 1, "report_phrase": "Respiratory motion artifact partially limits assessment.", "severity_rank": 2}}, "staging_relevance": 5.0, "incidentals": [{"organ": "aorta_great_vessels", "text": "tortuosity"}, {"organ": "kidneys", "text": "angiomyolipoma (macroscopic fat)"}, {"organ": "lung", "text": "subpleural reticulation"}], "negatives": [{"organ": "mediastinum", "text": "no pathologic mediastinal lymphadenopathy"}, {"organ": "liver", "text": "liver is normal"}, {"organ": "pleura", "text": "no pleural nodularity"}, {"organ": "pancreas", "text": "pancreas is normal"}, {"organ": "mesentery_peritoneum", "text": "no ascites"}], "post_treatment": [], "report_text": "FINDINGS:\nRespiratory motion artifact partially limits assessment.\nComparison: 2023-11-15.\nPulmonary parenchyma: Clear lungs without focal mass. No suspicious nodules identified.\nMediastinum: Enlarged left hilar lymph node, short axis 18 mm. Cardiomediastinal contours within normal limits. no pathologic mediastinal lymphadenopathy.\nPleura/Pleural spaces: No pleural effusion or pleural thickening. no pleural nodularity.\nGreat vessels/Aorta: No thoracic aortic aneurysm or dissection. tortuosity.\nLiver: No focal hepatic lesions. Normal attenuation. liver is normal.\nSpleen: Normal in size and attenuation. No focal splenic lesion.\nPancreas: Normal pancreatic contour and enhancement. No focal mass. pancreas is normal.\nAdrenal glands: Adrenal glands are normal without nodules.\nKidneys: No hydronephrosis. No enhancing renal mass. angiomyolipoma (macroscopic fat).\nGI tract/Bowel: 55 mm lobulated gastric mass at the greater curvature of the stomach (hyperenhancing). No obstructive process. No focal bowel wall mass identified.\nMesentery/Omentum: No ascites. No omental caking.\nMesenteric vessels (SMA/SMV): SMA/SMV are patent without thrombosis.\nUrinary bladder: Unremarkable.\nReproductive organs: No adnexal mass. Uterus/prostate within expected size for age.\nLymph nodes: No pathologically enlarged lymph nodes by size criteria.\nBones/Osseous structures: No aggressive osseous lesion. No acute fracture.\n\nIMPRESSION:\n- Stomach primary malignancy at greater curvature of the stomach measuring approximately 55 mm.\n- Findings concerning for nodal involvement.\n- No definite distant metastases identified.\n- RECIST 1.1 Summary:\n- Target lesions (n=2; ≤2 per organ rule applied).\n  • T1: Primary — 52→55 mm (longest diameter).\n  • T2: Lymph node — 17→18 mm (short axis).\n- SLD baseline: 69 mm.\n- SLD current: 73 mm (+5.8% change).\n- New lesions: absent (unequivocal).\n- - RECIST 1.1 overall response category: SD.\n"}
{"patient_id": "PID000020", "study_date": "2024-03-07", "timepoint": 2, "recist": {"baseline_sld_mm": 69, "current_sld_mm": 90, "nadir_sld_mm": 69, "overall_response": "PD"}, "lesions": [{"lesion_id": "primary:stomach", "kind": "primary", "organ": "stomach", "location": "greater curvature of the stomach", "rule": "longest", "baseline_mm": 52, "follow_mm": 68, "size_mm_current": 68, "margin": "lobulated", "enhancement": "hyperenhancing", "suspicious": true, "target": true}, {"lesion_id": "ln:left hilar", "kind": "ln", "organ": "lymph", "station": "left hilar", "rule": "short_axis", "baseline_mm": 17, "follow_mm": 22, "size_mm_current": 22, "necrosis": false, "suspicious": true, "target": true}], "complexity_profile": {"level": 2, "level_name": "C2", "artifact": null}, "staging_relevance": 18.0, "incidentals": [{"organ": "lung", "text": "bronchial wall thickening"}], "negatives": [{"organ": "lung", "text": "no suspicious pulmonary nodule"}, {"organ": "gi", "text": "no colonic mass"}, {"organ": "spleen", "text": "no focal splenic lesion"}, {"organ": "liver", "text": "no hepatic mass"}, {"organ": "aorta_great_vessels", "text": "aorta normal caliber"}], "post_treatment": ["Radiation change: wall thickening and submucosal edema in irradiated bowel"], "report_text": "FINDINGS:\nComparison: 2024-01-19.\nLungs: No focal consolidation or suspicious pulmonary nodules. No pneumothorax. bronchial wall thickening. no suspicious pulmonary nodule. Post-treatment change: wall thickening and submucosal edema in irradiated bowel.\nMediastinum: Enlarged left hilar lymph node, short axis 22 mm. Cardiomediastinal contours within normal limits.\nPleura/Pleural spaces: No pleural effusion or pleural thickening.\nGreat vessels/Aorta: No thoracic aortic aneurysm or dissection. aorta normal caliber.\nLiver: No focal hepatic lesions. Normal attenuation. no hepatic mass.\nSpleen: Normal in size and attenuation. No focal splenic lesion.\nPancreas: Normal pancreatic contour and enhancement. No focal mass.\nAdrenal glands: Adrenal glands are normal without nodules.\nKidneys: No hydronephrosis. No enhancing renal mass.\nGI tract/Bowel: 68 mm lobulated gastric mass at the greater curvature of the stomach (hyperenhancing). No obstructive process. No focal bowel wall mass identified. no colonic mass.\nMesentery/Omentum: No ascites. No omental caking.\nMesenteric vessels (SMA/SMV): SMA/SMV are patent without thrombosis.\nUrinary bladder: Unremarkable.\nReproductive organs: No adnexal mass. Uterus/prostate within expected size for age.\nLymph nodes: No pathologically enlarged lymph nodes by size criteria.\nBones/Osseous structures: No aggressive osseous lesion. No acute fracture.\n\nIMPRESSION:\n- Stomach primary neoplasm (indeterminate) at greater curvature of the stomach measuring approximately 68 mm.\n- Findings concerning for nodal involvement.\n- No definite distant metastases identified.\n- RECIST 1.1 Summary:\n- Target lesions (n=2; ≤2 per organ rule applied).\n  • T1: Primary — 52→68 mm (longest diameter).\n  • T2: Lymph node — 17→22 mm (short axis).\n- SLD baseline: 69 mm.\n- SLD current: 90 mm (+30.4% change).\n- New lesions: absent (unequivocal).\n- - RECIST 1.1 overall response category: PD.\n\nComment: Some features are could reflect; short-interval follow-up or problem-solving imaging may be considered.\n"}
{"patient_id": "PID000021", "study_date": "2023-10-18", "timepoint": 0, "recist": {"baseline_sld_mm": 36, "current_sld_mm": null, "nadir_sld_mm": null, "overall_response": "Baseline (no category)"}, "lesions": [{"lesion_id": "primary:prostate", "kind": "primary", "organ": "prostate", "location": "prostate gland, peripheral zone", "rule": "longest", "baseline_mm": 36, "follow_mm": null, "size_mm_current": 36, "margin": "irregular", "enhancement": "hyperenhancing", "suspicious": true, "target": true}], "complexity_profile": {"level": 2, "level_name": "C2", "artifact": {"key": "beam_hardening", "impact": 2, "report_phrase": "Beam-hardening streak artifact from dense structures limits evaluation.", "severity_rank": 3}}, "staging_relevance": -3.0, "incidentals": [{"organ": "liver", "text": "hemangioma (peripheral nodular enhancement with centripetal fill-in)"}, {"organ": "reproductive.ovary", "text": "simple physiologic cyst"}], "negatives": [{"organ": "bones", "text": "no destructive osseous lesion"}, {"organ": "adrenals", "text": "adrenal glands normal"}, {"organ": "liver", "text": "no hepatic mass"}, {"organ": "lung", "text": "no suspicious pulmonary nodule"}, {"organ": "pancreas", "text": "pancreas is normal"}], "post_treatment": [], "report_text": "FINDINGS:\nBeam-hardening streak artifact from dense structures limits evaluation.\nLungs: Clear lungs without focal mass. No suspicious nodules identified. no suspicious pulmonary nodule.\nMediastinum: Cardiomediastinal contours within normal limits.\nPleura/Pleural spaces: No pleural effusion or pleural thickening.\nGreat vessels/Aorta: No thoracic aortic aneurysm or dissection.\nLiver: No focal hepatic lesions. Normal attenuation. hemangioma (peripheral nodular enhancement with centripetal fill-in). no hepatic mass.\nSpleen: Normal in size and attenuation. No focal splenic lesion.\nPancreas: Normal pancreatic contour and enhancement. No focal mass. pancreas is normal.\nAdrenal glands: Adrenal glands are normal without nodules. adrenal glands normal.\nKidneys: No hydronephrosis. No enhancing renal mass.\nGI tract/Bowel: No obstructive process. No focal bowel wall mass identified.\nMesentery/Omentum: No ascites. No omental caking.\nMesenteric vessels (SMA/SMV): SMA/SMV are patent without thrombosis.\nUrinary bladder: Unremarkable.\nReproductive organs: 3.6 cm irregular mass within the prostate gland, peripheral zone. No adnexal mass. Uterus/prostate within expected size for age. simple physiologic cyst.\nLymph nodes: No pathologically enlarged lymph nodes by size criteria.\nBones/Osseous structures: No aggressive osseous lesion. No acute fracture. no destructive osseous lesion.\n\nIMPRESSION:\n- Prostate primary neoplasm (indeterminate) at prostate gland, peripheral zone measuring approximately 36 mm.\n- No pathologically enlarged lymph nodes by size criteria.\n- No definite distant metastases identified.\n- RECIST 1.1 Summary:\n- Target lesions (n=1; ≤2 per organ rule applied).\n  • T1: Primary — 36 mm (longest diameter) at baseline.\n- SLD baseline: 36 mm.\n- New lesions: absent (unequivocal).\n- - RECIST 1.1 overall response category: Baseline (no category).\n\nComment: Some features are unlikely; short-interval follow-up or problem-solving imaging may be considered.\n"}
{"patient_id": "PID000021", "study_date": "2023-12-26", "timepoint": 1, "recist": {"baseline_sld_mm": 36, "current_sld_mm": 33, "nadir_sld_mm": 33, "overall_response": "SD"}, "lesions": [{"lesion_id": "primary:prostate", "kind": "primary", "organ": "prostate", "location": "prostate gland, peripheral zone", "rule": "longest", "baseline_mm": 36, "follow_mm": 33, "size_mm_current": 33, "margin": "irregular", "enhancement": "hyperenhancing", "suspicious": true, "target": true}], "complexity_profile": {"level": 2, "level_name": "C2", "artifact": null}, "staging_relevance": 0.0, "incidentals": [{"organ": "kidneys", "text": "angiomyolipoma (macroscopic fat)"}, {"organ": "lung", "text": "bronchial wall thickening"}, {"organ": "pancreas", "text": "serous cystadenoma"}], "negatives": [{"organ": "pancreas", "text": "pancreas is normal"}, {"organ": "reproductive", "text": "ovaries are normal / no adnexal abnormality"}, {"organ": "liver", "text": "no hepatic mass"}, {"organ": "bladder", "text": "urinary bladder normal"}, {"organ": "kidneys", "text": "no renal mass"}], "post_treatment": [], "report_text": "FINDINGS:\nComparison: 2023-10-18.\nLungs: No focal consolidation or suspicious pulmonary nodules. No pneumothorax. bronchial wall thickening.\nMediastinum: Cardiomediastinal contours within normal limits.\nPleura/Pleural spaces: No pleural effusion or pleural thickening.\nGreat vessels/Aorta: No thoracic aortic aneurysm or dissection.\nLiver: No focal hepatic lesions. Normal attenuation. no hepatic mass.\nSpleen: Normal in size and attenuation. No focal splenic lesion.\nPancreas: Normal pancreatic contour and enhancement. No focal mass. serous cystadenoma. pancreas is normal.\nAdrenal glands: Adrenal glands are normal without nodules.\nKidneys: No hydronephrosis. No enhancing renal mass. angiomyolipoma (macroscopic fat). no renal mass.\nGI tract/Bowel: No obstructive process. No focal bowel wall mass identified.\nMesentery/Omentum: No ascites. No omental caking.\nMesenteric vessels (SMA/SMV): SMA/SMV are patent without thrombosis.\nUrinary bladder: Unremarkable. urinary bladder normal.\nReproductive organs: 3.3 cm irregular mass within the prostate gland, peripheral zone. No adnexal mass. Uterus/prostate within expected size for age. ovaries are normal / no adnexal abnormality.\nLymph nodes: No pathologically enlarged lymph nodes by size criteria.\nBones/Osseous structures: No aggressive osseous lesion. No acute fracture.\n\nIMPRESSION:\n- Prostate primary malignancy at prostate gland, peripheral zone measuring approximately 33 mm.\n- No pathologically enlarged lymph nodes by size criteria.\n- No definite distant metastases identified.\n- RECIST 1.1 Summary:\n- Target lesions (n=1; ≤2 per organ rule applied).\n  • T1: Primary — 36→33 mm (longest diameter).\n- SLD baseline: 36 mm.\n- SLD current: 33 mm (-8.3% change).\n- New lesions: absent (unequivocal).\n- - RECIST 1.1 overall response category: SD.\n"}
{"patient_id": "PID000021", "study_date": "2024-02-13", "timepoint": 2, "recist": {"baseline_sld_mm": 36, "current_sld_mm": 37, "nadir_sld_mm": 33, "overall_response": "SD"}, "lesions": [{"lesion_id": "primary:prostate", "kind": "primary", "organ": "prostate", "location": "prostate gland, peripheral zone", "rule": "longest", "baseline_mm": 36, "follow_mm": 37, "size_mm_current": 37, "margin": "irregular", "enhancement": "hyperenhancing", "suspicious": true, "target": true}], "complexity_profile": {"level": 2, "level_name": "C2", "artifact": {"key": "partial_volume", "impact": 1, "report_phrase": "Partial volume averaging may obscure small foci.", "severity_rank": 1}}, "staging_relevance": -1.0, "incidentals": [{"organ": "mediastinum", "text": "small thymic remnant"}], "negatives": [{"organ": "pleura", "text": "no pleural effusion"}, {"organ": "liver", "text": "liver is normal"}, {"organ": "mediastinum", "text": "no mediastinal mass"}, {"organ": "bones", "text": "no destructive osseous lesion"}, {"organ": "adrenals", "text": "no adrenal nodule"}], "post_treatment": [], "report_text": "FINDINGS:\nPartial volume averaging may obscure small foci.\nComparison: 2023-12-26.\nPulmonary parenchyma: No focal consolidation or suspicious pulmonary nodules. No pneumothorax.\nMediastinum: Cardiomediastinal contours within normal limits. small thymic remnant. no mediastinal mass.\nPleura/Pleural spaces: No pleural effusion or pleural thickening.\nGreat vessels/Aorta: No thoracic aortic aneurysm or dissection.\nLiver: No focal hepatic lesions. Normal attenuation. liver is normal.\nSpleen: Normal in size and attenuation. No focal splenic lesion.\nPancreas: Normal pancreatic contour and enhancement. No focal mass.\nAdrenal glands: Adrenal glands are normal without nodules. no adrenal nodule.\nKidneys: No hydronephrosis. No enhancing renal mass.\nGI tract/Bowel: No obstructive process. No focal bowel wall mass identified.\nMesentery/Omentum: No ascites. No omental caking.\nMesenteric vessels (SMA/SMV): SMA/SMV are patent without thrombosis.\nUrinary bladder: Unremarkable.\nReproductive organs: 3.7 cm irregular mass within the prostate gland, peripheral zone. No adnexal mass. Uterus/prostate within expected size for age.\nLymph nodes: No pathologically enlarged lymph nodes by size criteria.\nBones/Osseous structures: No aggressive osseous lesion. No acute fracture. no destructive osseous lesion.\n\nIMPRESSION:\n- Prostate primary malignancy at prostate gland, peripheral zone measuring approximately 37 mm.\n- No pathologically enlarged lymph nodes by size criteria.\n- No definite distant metastases identified.\n- RECIST 1.1 Summary:\n- Target lesions (n=1; ≤2 per organ rule applied).\n  • T1: Primary — 36→37 mm (longest diameter).\n- SLD baseline: 36 mm.\n- SLD current: 37 mm (+2.8% change).\n- New lesions: absent (unequivocal).\n- - RECIST 1.1 overall response category: SD.\n"}
{"patient_id": "PID000021", "study_date": "2024-03-28", "timepoint": 3, "recist": {"baseline_sld_mm": 36, "current_sld_mm": 34, "nadir_sld_mm": 33, "overall_response": "SD"}, "lesions": [{"lesion_id": "primary:prostate", "kind": "primary", "organ": "prostate", "location": "prostate gland, peripheral zone", "rule": "longest", "baseline_mm": 36, "follow_mm": 34, "size_mm_current": 34, "margin": "irregular", "enhancement": "hyperenhancing", "suspicious": true, "target": true}], "complexity_profile": {"level": 2, "level_name": "C2", "artifact": null}, "staging_relevance": 0.0, "incidentals": [{"organ": "pancreas", "text": "simple cyst (<2 cm)"}, {"organ": "gi.stomach", "text": "physiologic under-distension thickening"}], "negatives": [{"organ": "pleura", "text": "no pleural nodularity"}, {"organ": "aorta_great_vessels", "text": "aorta normal caliber"}, {"organ": "kidneys", "text": "no renal mass"}, {"organ": "lung", "text": "no suspicious pulmonary nodule"}, {"organ": "spleen", "text": "spleen normal size"}], "post_treatment": ["Postsurgical change: brachytherapy seeds"], "report_text": "FINDINGS:\nComparison: 2024-02-13.\nPulmonary parenchyma: Clear lungs without focal mass. No suspicious nodules identified.\nMediastinum: Cardiomediastinal contours within normal limits.\nPleura/Pleural spaces: No pleural effusion or pleural thickening. no pleural nodularity.\nGreat vessels/Aorta: No thoracic aortic aneurysm or dissection. aorta normal caliber.\nLiver: No focal hepatic lesions. Normal attenuation.\nSpleen: Normal in size and attenuation. No focal splenic lesion. spleen normal size.\nPancreas: Normal pancreatic contour and enhancement. No focal mass. simple cyst (<2 cm).\nAdrenal glands: Adrenal glands are normal without nodules.\nKidneys: No hydronephrosis. No enhancing renal mass. no renal mass.\nGI tract/Bowel: No obstructive process. No focal bowel wall mass identified. physiologic under-distension thickening.\nMesentery/Omentum: No ascites. No omental caking.\nMesenteric vessels (SMA/SMV): SMA/SMV are patent without thrombosis.\nUrinary bladder: Unremarkable.\nReproductive organs: 34 mm irregular mass within the prostate gland, peripheral zone. No adnexal mass. Uterus/prostate within expected size for age. Postsurgical change: brachytherapy seeds.\nLymph nodes: No pathologically enlarged lymph nodes by size criteria.\nBones/Osseous structures: No aggressive osseous lesion. No acute fracture.\n\nIMPRESSION:\n- Prostate primary malignancy at prostate gland, peripheral zone measuring approximately 34 mm.\n- No pathologically enlarged lymph nodes by size criteria.\n- No definite distant metastases identified.\n- RECIST 1.1 Summary:\n- Target lesions (n=1; ≤2 per organ rule applied).\n  • T1: Primary — 36→34 mm (longest diameter).\n- SLD baseline: 36 mm.\n- SLD current: 34 mm (-5.6% change).\n- New lesions: absent (unequivocal).\n- - RECIST 1.1 overall response category: SD.\n"}
{"patient_id": "PID000022", "study_date": "2023-05-06", "timepoint": 0, "recist": {"baseline_sld_mm": 78, "current_sld_mm": null, "nadir_sld_mm": null, "overall_response": "Baseline (no category)"}, "lesions": [{"lesion_id": "primary:lung", "kind": "primary", "organ": "lung", "location": "left middle lobe", "rule": "longest", "baseline_mm": 61, "follow_mm": null, "size_mm_current": 61, "margin": "spiculated", "enhancement": "hyperenhancing", "suspicious": true, "target": true}, {"lesion_id": "ln:right hilar", "kind": "ln", "organ": "lymph", "station": "right hilar", "rule": "short_axis", "baseline_mm": 17, "follow_mm": null, "size_mm_current": 17, "necrosis": false, "suspicious": true, "target": true}, {"lesion_id": "ln:porta hepatis", "kind": "ln", "organ": "lymph", "station": "porta hepatis", "rule": "short_axis", "baseline_mm": null, "follow_mm": null, "size_mm_current": 14, "necrosis": false, "suspicious": true, "target": false}], "complexity_profile": {"level": 2, "level_name": "C2", "artifact": null}, "staging_relevance": 0.0, "incidentals": [{"organ": "lung", "text": "dependent atelectasis"}, {"organ": "pleura", "text": "pleural calcifications"}, {"organ": "liver", "text": "hemangioma (peripheral nodular enhancement with centripetal fill-in)"}], "negatives": [{"organ": "liver", "text": "no hepatic mass"}, {"organ": "adrenals", "text": "adrenal glands normal"}, {"organ": "kidneys", "text": "kidneys are normal"}, {"organ": "spleen", "text": "no focal splenic lesion"}, {"organ": "mediastinum", "text": "no pathologic mediastinal lymphadenopathy"}], "post_treatment": [], "report_text": "FINDINGS:\nPulmonary parenchyma: 61 mm spiculated mass in the left middle lobe (hyperenhancing). Clear lungs without focal mass. No suspicious nodules identified.\nMediastinum: Enlarged right hilar lymph node, short axis 17 mm. Cardiomediastinal contours within normal limits. no pathologic mediastinal lymphadenopathy.\nPleura/Pleural spaces: No pleural effusion or pleural thickening. pleural calcifications.\nGreat vessels/Aorta: No thoracic aortic aneurysm or dissection.\nLiver: No focal hepatic lesions. Normal attenuation. hemangioma (peripheral nodular enhancement with centripetal fill-in). no hepatic mass.\nSpleen: Normal in size and attenuation. No focal splenic lesion.\nPancreas: Normal pancreatic contour and enhancement. No focal mass.\nAdrenal glands: Adrenal glands are normal without nodules. adrenal glands normal.\nKidneys: No hydronephrosis. No enhancing renal mass. kidneys are normal.\nGI tract/Bowel: No obstructive process. No focal bowel wall mass identified.\nMesentery/Omentum: No ascites. No omental caking.\nMesenteric vessels (SMA/SMV): SMA/SMV are patent without thrombosis.\nUrinary bladder: Unremarkable.\nReproductive organs: No adnexal mass. Uterus/prostate within expected size for age.\nLymph nodes: Enlarged porta hepatis lymph node, short axis 1.4 cm. No pathologically enlarged lymph nodes by size criteria.\nBones/Osseous structures: No aggressive osseous lesion. No acute fracture.\n\nIMPRESSION:\n- Lung primary malignancy at left middle lobe measuring approximately 61 mm.\n- Findings concerning for nodal involvement.\n- No definite distant metastases identified.\n- RECIST 1.1 Summary:\n- Target lesions (n=2; ≤2 per organ rule applied).\n  • T1: Primary — 61 mm (longest diameter) at baseline.\n  • T2: Lymph node — 17 mm (short axis) at baseline.\n- SLD baseline: 78 mm.\n- New lesions: absent (unequivocal).\n- - RECIST 1.1 overall response category: Baseline (no category).\n"}
{"patient_id": "PID000022", "study_date": "2023-07-12", "timepoint": 1, "recist": {"baseline_sld_mm": 78, "current_sld_mm": 69, "nadir_sld_mm": 69, "overall_response": "SD"}, "lesions": [{"lesion_id": "primary:lung", "kind": "primary", "organ": "lung", "location": "left middle lobe", "rule": "longest", "baseline_mm": 61, "follow_mm": 53, "size_mm_current": 53, "margin": "spiculated", "enhancement": "hyperenhancing", "suspicious": true, "target": true}, {"lesion_id": "ln:right hilar", "kind": "ln", "organ": "lymph", "station": "right hilar", "rule": "short_axis", "baseline_mm": 17, "follow_mm": 16, "size_mm_current": 16, "necrosis": false, "suspicious": true, "target": true}, {"lesion_id": "ln:porta hepatis", "kind": "ln", "organ": "lymph", "station": "porta hepatis", "rule": "short_axis", "baseline_mm": null, "follow_mm": null, "size_mm_current": 14, "necrosis": false, "suspicious": true, "target": false}], "complexity_profile": {"level": 2, "level_name": "C2", "artifact": {"key": "motion_mild", "impact": 1, "report_phrase": "Respiratory motion artifact partially limits assessment.", "severity_rank": 2}}, "staging_relevance": 5.0, "incidentals": [{"organ": "lung", "text": "mild bronchiectasis"}], "negatives": [{"organ": "pleura", "text": "no pleural effusion"}, {"organ": "spleen", "text": "spleen normal size"}, {"organ": "adrenals", "text": "no adrenal nodule"}, {"organ": "bones", "text": "no destructive osseous lesion"}, {"organ": "reproductive", "text": "prostate is normal / no prostatic mass"}], "post_treatment": ["Postsurgical change: resection margin changes"], "report_text": "FINDINGS:\nRespiratory motion artifact partially limits assessment.\nComparison: 2023-05-06.\nPulmonary parenchyma: 5.3 cm spiculated mass in the left middle lobe (hyperenhancing). Clear lungs without focal mass. No suspicious nodules identified.\nMediastinum: Enlarged right hilar lymph node, short axis 16 mm. Cardiomediastinal contours within normal limits.\nPleura/Pleural spaces: No pleural effusion or pleural thickening.\nGreat vessels/Aorta: No thoracic aortic aneurysm or dissection.\nLiver: No focal hepatic lesions. Normal attenuation.\nSpleen: Normal in size and attenuation. No focal splenic lesion. spleen normal size.\nPancreas: Normal pancreatic contour and enhancement. No focal mass.\nAdrenal glands: Adrenal glands are normal without nodules. no adrenal nodule.\nKidneys: No hydronephrosis. No enhancing renal mass.\nGI tract/Bowel: No obstructive process. No focal bowel wall mass identified.\nMesentery/Omentum: No ascites. No omental caking.\nMesenteric vessels (SMA/SMV): SMA/SMV are patent without thrombosis.\nUrinary bladder: Unremarkable.\nReproductive organs: No adnexal mass. Uterus/prostate within expected size for age. prostate is normal / no prostatic mass.\nLymph nodes: Enlarged porta hepatis lymph node, short axis 14 mm. No pathologically enlarged lymph nodes by size criteria.\nBones/Osseous structures: No aggressive osseous lesion. No acute fracture. no destructive osseous lesion.\n\nIMPRESSION:\n- Lung primary malignancy at left middle lobe measuring approximately 53 mm.\n- Findings concerning for nodal involvement.\n- No definite distant metastases identified.\n- RECIST 1.1 Summary:\n- Target lesions (n=2; ≤2 per organ rule applied).\n  • T1: Primary — 61→53 mm (longest diameter).\n  • T2: Lymph node — 17→16 mm (short axis).\n- SLD baseline: 78 mm.\n- SLD current: 69 mm (-11.5% change).\n- New lesions: absent (unequivocal).\n- - RECIST 1.1 overall response category: SD.\n"}
{"patient_id": "PID000022", "study_date": "2023-09-15", "timepoint": 2, "recist": {"baseline_sld_mm": 78, "current_sld_mm": 84, "nadir_sld_mm": 69, "overall_response": "PD"}, "lesions": [{"lesion_id": "primary:lung", "kind": "primary", "organ": "lung", "location": "left middle lobe", "rule": "longest", "baseline_mm": 61, "follow_mm": 66, "size_mm_current": 66, "margin": "spiculated", "enhancement": "hyperenhancing", "suspicious": true, "target": true}, {"lesion_id": "ln:right hilar", "kind": "ln", "organ": "lymph", "station": "right hilar", "rule": "short_axis", "baseline_mm": 17, "follow_mm": 18, "size_mm_current": 18, "necrosis": false, "suspicious": true, "target": true}, {"lesion_id": "ln:porta hepatis", "kind": "ln", "organ": "lymph", "station": "porta hepatis", "rule": "short_axis", "baseline_mm": null, "follow_mm": null, "size_mm_current": 14, "necrosis": false, "suspicious": true, "target": false}], "complexity_profile": {"level": 2, "level_name": "C2", "artifact": null}, "staging_relevance": 18.0, "incidentals": [{"organ": "lung", "text": "calcified granuloma"}, {"organ": "mediastinum", "text": "prominent but subthreshold lymph nodes"}], "negatives": [{"organ": "aorta_great_vessels", "text": "no aneurysm or dissection"}, {"organ": "pleura", "text": "no pleural effusion"}, {"organ": "mesentery_peritoneum", "text": "no ascites"}, {"organ": "reproductive", "text": "ovaries are normal / no adnexal abnormality"}, {"organ": "bones", "text": "no destructive osseous lesion"}], "post_treatment": ["Post-ablation/embolization change: non-enhancing ablation cavity with peripheral rim; SBRT field with altered enhancement"], "report_text": "FINDINGS:\nComparison: 2023-07-12.\nPulmonary parenchyma: 66 mm spiculated mass in the left middle lobe (hyperenhancing). No focal consolidation or suspicious pulmonary nodules. No pneumothorax.\nMediastinum: Enlarged right hilar lymph node, short axis 18 mm. Cardiomediastinal contours within normal limits. prominent but subthreshold lymph nodes.\nPleura/Pleural spaces: No pleural effusion or pleural thickening.\nGreat vessels/Aorta: No thoracic aortic aneurysm or dissection. no aneurysm or dissection.\nLiver: No focal hepatic lesions. Normal attenuation. Post-ablation/embolization change: non-enhancing ablation cavity with peripheral rim; SBRT field with altered enhancement.\nSpleen: Normal in size and attenuation. No focal splenic lesion.\nPancreas: Normal pancreatic contour and enhancement. No focal mass.\nAdrenal glands: Adrenal glands are normal without nodules.\nKidneys: No hydronephrosis. No enhancing renal mass.\nGI tract/Bowel: No obstructive process. No focal bowel wall mass identified.\nMesentery/Omentum: No ascites. No omental caking.\nMesenteric vessels (SMA/SMV): SMA/SMV are patent without thrombosis.\nUrinary bladder: Unremarkable.\nReproductive organs: No adnexal mass. Uterus/prostate within expected size for age. ovaries are normal / no adnexal abnormality.\nLymph nodes: Enlarged porta hepatis lymph node, short axis 14 mm. No pathologically enlarged lymph nodes by size criteria.\nBones/Osseous structures: No aggressive osseous lesion. No acute fracture. no destructive osseous lesion.\n\nIMPRESSION:\n- Lung primary neoplasm (indeterminate) at left middle lobe measuring approximately 66 mm.\n- Findings concerning for nodal involvement.\n- No definite distant metastases identified.\n- RECIST 1.1 Summary:\n- Target lesions (n=2; ≤2 per organ rule applied).\n  • T1: Primary — 61→66 mm (longest diameter).\n  • T2: Lymph node — 17→18 mm (short axis).\n- SLD baseline: 78 mm.\n- SLD current: 84 mm (+7.7% change).\n- New lesions: absent (unequivocal).\n- - RECIST 1.1 overall response category: PD.\n\nComment: Some features are unlikely; short-interval follow-up or problem-solving imaging may be considered.\n"}
{"patient_id": "PID000022", "study_date": "2023-11-24", "timepoint": 3, "recist": {"baseline_sld_mm": 78, "current_sld_mm": 80, "nadir_sld_mm": 69, "overall_response": "SD"}, "lesions": [{"lesion_id": "primary:lung", "kind": "primary", "organ": "lung", "location": "left middle lobe", "rule": "longest", "baseline_mm": 61, "follow_mm": 62, "size_mm_current": 62, "margin": "spiculated", "enhancement": "hyperenhancing", "suspicious": true, "target": true}, {"lesion_id": "ln:right hilar", "kind": "ln", "organ": "lymph", "station": "right hilar", "rule": "short_axis", "baseline_mm": 17, "follow_mm": 18, "size_mm_current": 18, "necrosis": false, "suspicious": true, "target": true}, {"lesion_id": "ln:porta hepatis", "kind": "ln", "organ": "lymph", "station": "porta hepatis", "rule": "short_axis", "baseline_mm": null, "follow_mm": null, "size_mm_current": 14, "necrosis": false, "suspicious": true, "target": false}], "complexity_profile": {"level": 2, "level_name": "C2", "artifact": {"key": "motion_mild", "impact": 1, "report_phrase": "Respiratory motion artifact partially limits assessment.", "severity_rank": 2}}, "staging_relevance": 4.0, "incidentals": [{"organ": "gi.small_bowel", "text": "nonspecific fluid levels"}, {"organ": "liver", "text": "hemangioma (peripheral nodular enhancement with centripetal fill-in)"}], "negatives": [{"organ": "kidneys", "text": "kidneys are normal"}, {"organ": "aorta_great_vessels", "text": "no aneurysm or dissection"}, {"organ": "pancreas", "text": "pancreas is normal"}, {"organ": "mediastinum", "text": "no mediastinal mass"}, {"organ": "spleen", "text": "no focal splenic lesion"}], "post_treatment": ["Post-ablation/embolization change: non-enhancing ablation cavity with peripheral rim; SBRT field with altered enhancement"], "report_text": "FINDINGS:\nRespiratory motion artifact partially limits assessment.\nComparison: 2023-09-15.\nPulmonary parenchyma: 62 mm spiculated mass in the left middle lobe (hyperenhancing). Clear lungs without focal mass. No suspicious nodules identified.\nMediastinum: Enlarged right hilar lymph node, short axis 18 mm. Cardiomediastinal contours within normal limits. no mediastinal mass.\nPleura/Pleural spaces: No pleural effusion or pleural thickening.\nGreat vessels/Aorta: No thoracic aortic aneurysm or dissection. no aneurysm or dissection.\nLiver: No focal hepatic lesions. Normal attenuation. hemangioma (peripheral nodular enhancement with centripetal fill-in). Post-ablation/embolization change: non-enhancing ablation cavity with peripheral rim; SBRT field with altered enhancement.\nSpleen: Normal in size and attenuation. No focal splenic lesion.\nPancreas: Normal pancreatic contour and enhancement. No focal mass. pancreas is normal.\nAdrenal glands: Adrenal glands are normal without nodules.\nKidneys: No hydronephrosis. No enhancing renal mass. kidneys are normal.\nGI tract/Bowel: No obstructive process. No focal bowel wall mass identified. nonspecific fluid levels.\nMesentery/Omentum: No ascites. No omental caking.\nMesenteric vessels (SMA/SMV): SMA/SMV are patent without thrombosis.\nUrinary bladder: Unremarkable.\nReproductive organs: No adnexal mass. Uterus/prostate within expected size for age.\nLymph nodes: Enlarged porta hepatis lymph node, short axis 14 mm. No pathologically enlarged lymph nodes by size criteria.\nBones/Osseous structures: No aggressive osseous lesion. No acute fracture.\n\nIMPRESSION:\n- Lung primary neoplasm (indeterminate) at left middle lobe measuring approximately 62 mm.\n- Findings concerning for nodal involvement.\n- No definite distant metastases identified.\n- RECIST 1.1 Summary:\n- Target lesions (n=2; ≤2 per organ rule applied).\n  • T1: Primary — 61→62 mm (longest diameter).\n  • T2: Lymph node — 17→18 mm (short axis).\n- SLD baseline: 78 mm.\n- SLD current: 80 mm (+2.6% change).\n- New lesions: absent (unequivocal).\n- - RECIST 1.1 overall response category: SD.\n\nComment: Some features are most likely; short-interval follow-up or problem-solving imaging may be considered.\n"}
{"patient_id": "PID000022", "study_date": "2024-01-18", "timepoint": 4, "recist": {"baseline_sld_mm": 78, "current_sld_mm": 73, "nadir_sld_mm": 69, "overall_response": "SD"}, "lesions": [{"lesion_id": "primary:lung", "kind": "primary", "organ": "lung", "location": "left middle lobe", "rule": "longest", "baseline_mm": 61, "follow_mm": 57, "size_mm_current": 57, "margin": "spiculated", "enhancement": "hyperenhancing", "suspicious": true, "target": true}, {"lesion_id": "ln:right hilar", "kind": "ln", "organ": "lymph", "station": "right hilar", "rule": "short_axis", "baseline_mm": 17, "follow_mm": 16, "size_mm_current": 16, "necrosis": false, "suspicious": true, "target": true}, {"lesion_id": "ln:porta hepatis", "kind": "ln", "organ": "lymph", "station": "porta hepatis", "rule": "short_axis", "baseline_mm": null, "follow_mm": null, "size_mm_current": 14, "necrosis": false, "suspicious": true, "target": false}], "complexity_profile": {"level": 2, "level_name": "C2", "artifact": null}, "staging_relevance": 6.0, "incidentals": [{"organ": "reproductive.prostate", "text": "BPH"}, {"organ": "reproductive.prostate", "text": "calcifications"}], "negatives": [{"organ": "liver", "text": "no hepatic mass"}, {"organ": "pleura", "text": "no pleural nodularity"}, {"organ": "adrenals", "text": "no adrenal nodule"}, {"organ": "mediastinum", "text": "no mediastinal mass"}, {"organ": "gi", "text": "no bowel obstruction"}], "post_treatment": ["Radiation change: wall thickening and submucosal edema in irradiated bowel", "Post-ablation/embolization change: non-enhancing ablation zone with peripheral halo; contraction over time"], "report_text": "FINDINGS:\nComparison: 2023-11-24.\nPulmonary parenchyma: 57 mm spiculated mass in the left middle lobe (hyperenhancing). Clear lungs without focal mass. No suspicious nodules identified.\nMediastinum: Enlarged right hilar lymph node, short axis 16 mm. Cardiomediastinal contours within normal limits. no mediastinal mass.\nPleura/Pleural spaces: No pleural effusion or pleural thickening. no pleural nodularity.\nGreat vessels/Aorta: No thoracic aortic aneurysm or dissection.\nLiver: No focal hepatic lesions. Normal attenuation. no hepatic mass. Post-ablation/embolization change: non-enhancing ablation zone with peripheral halo; contraction over time.\nSpleen: Normal in size and attenuation. No focal splenic lesion.\nPancreas: Normal pancreatic contour and enhancement. No focal mass.\nAdrenal glands: Adrenal glands are normal without nodules. no adrenal nodule.\nKidneys: No hydronephrosis. No enhancing renal mass.\nGI tract/Bowel: No obstructive process. No focal bowel wall mass identified. no bowel obstruction.\nMesentery/Omentum: No ascites. No omental caking.\nMesenteric vessels (SMA/SMV): SMA/SMV are patent without thrombosis.\nUrinary bladder: Unremarkable.\nReproductive organs: No adnexal mass. Uterus/prostate within expected size for age. BPH. calcifications.\nLymph nodes: Enlarged porta hepatis lymph node, short axis 14 mm. No pathologically enlarged lymph nodes by size criteria.\nBones/Osseous structures: No aggressive osseous lesion. No acute fracture.\n\nIMPRESSION:\n- Lung primary malignancy at left middle lobe measuring approximately 57 mm.\n- Findings concerning for nodal involvement.\n- No definite distant metastases identified.\n- RECIST 1.1 Summary:\n- Target lesions (n=2; ≤2 per organ rule applied).\n  • T1: Primary — 61→57 mm (longest diameter).\n  • T2: Lymph node — 17→16 mm (short axis).\n- SLD baseline: 78 mm.\n- SLD current: 73 mm (-6.4% change).\n- New lesions: absent (unequivocal).\n- - RECIST 1.1 overall response category: SD.\n"}
{"patient_id": "PID000022", "study_date": "2024-03-23", "timepoint": 5, "recist": {"baseline_sld_mm": 78, "current_sld_mm": 81, "nadir_sld_mm": 69, "overall_response": "SD"}, "lesions": [{"lesion_id": "primary:lung", "kind": "primary", "organ": "lung", "location": "left middle lobe", "rule": "longest", "baseline_mm": 61, "follow_mm": 63, "size_mm_current": 63, "margin": "spiculated", "enhancement": "hyperenhancing", "suspicious": true, "target": true}, {"lesion_id": "ln:right hilar", "kind": "ln", "organ": "lymph", "station": "right hilar", "rule": "short_axis", "baseline_mm": 17, "follow_mm": 18, "size_mm_current": 18, "necrosis": false, "suspicious": true, "target": true}, {"lesion_id": "ln:porta hepatis", "kind": "ln", "organ": "lymph", "station": "porta hepatis", "rule": "short_axis", "baseline_mm": null, "follow_mm": null, "size_mm_current": 14, "necrosis": false, "suspicious": true, "target": false}], "complexity_profile": {"level": 2, "level_name": "C2", "artifact": null}, "staging_relevance": 6.0, "incidentals": [{"organ": "pancreas", "text": "simple cyst (<2 cm)"}, {"organ": "reproductive.prostate", "text": "BPH"}], "negatives": [{"organ": "bladder", "text": "no focal bladder wall thickening"}, {"organ": "pancreas", "text": "no pancreatic mass"}, {"organ": "bones", "text": "no destructive osseous lesion"}, {"organ": "gi", "text": "stomach is normal"}, {"organ": "spleen", "text": "spleen normal size"}], "post_treatment": [], "report_text": "FINDINGS:\nComparison: 2024-01-18.\nLungs: 63 mm spiculated mass in the left middle lobe (hyperenhancing). No focal consolidation or suspicious pulmonary nodules. No pneumothorax.\nMediastinum: Enlarged right hilar lymph node, short axis 18 mm. Cardiomediastinal contours within normal limits.\nPleura/Pleural spaces: No pleural effusion or pleural thickening.\nGreat vessels/Aorta: No thoracic aortic aneurysm or dissection.\nLiver: No focal hepatic lesions. Normal attenuation.\nSpleen: Normal in size and attenuation. No focal splenic lesion. spleen normal size.\nPancreas: Normal pancreatic contour and enhancement. No focal mass. simple cyst (<2 cm). no pancreatic mass.\nAdrenal glands: Adrenal glands are normal without nodules.\nKidneys: No hydronephrosis. No enhancing renal mass.\nGI tract/Bowel: No obstructive process. No focal bowel wall mass identified. stomach is normal.\nMesentery/Omentum: No ascites. No omental caking.\nMesenteric vessels (SMA/SMV): SMA/SMV are patent without thrombosis.\nUrinary bladder: Unremarkable. no focal bladder wall thickening.\nReproductive organs: No adnexal mass. Uterus/prostate within expected size for age. BPH.\nLymph nodes: Enlarged porta hepatis lymph node, short axis 14 mm. No pathologically enlarged lymph nodes by size criteria.\nBones/Osseous structures: No aggressive osseous lesion. No acute fracture. no destructive osseous lesion.\n\nIMPRESSION:\n- Lung primary malignancy at left middle lobe measuring approximately 63 mm.\n- Findings concerning for nodal involvement.\n- No definite distant metastases identified.\n- RECIST 1.1 Summary:\n- Target lesions (n=2; ≤2 per organ rule applied).\n  • T1: Primary — 61→63 mm (longest diameter).\n  • T2: Lymph node — 17→18 mm (short axis).\n- SLD baseline: 78 mm.\n- SLD current: 81 mm (+3.8% change).\n- New lesions: absent (unequivocal).\n- - RECIST 1.1 overall response category: SD.\n"}
{"patient_id": "PID000023", "study_date": "2023-05-02", "timepoint": 0, "recist": {"baseline_sld_mm": 40, "current_sld_mm": null, "nadir_sld_mm": null, "overall_response": "Baseline (no category)"}, "lesions": [{"lesion_id": "primary:prostate", "kind": "primary", "organ": "prostate", "location": "prostate gland, peripheral zone", "rule": "longest", "baseline_mm": 40, "follow_mm": null, "size_mm_current": 40, "margin": "spiculated", "enhancement": "hypoenhancing", "suspicious": true, "target": true}], "complexity_profile": {"level": 2, "level_name": "C2", "artifact": null}, "staging_relevance": 0.0, "incidentals": [{"organ": "mediastinum", "text": "small thymic remnant"}], "negatives": [{"organ": "bladder", "text": "no focal bladder wall thickening"}, {"organ": "spleen", "text": "no focal splenic lesion"}, {"organ": "liver", "text": "liver is normal"}, {"organ": "mediastinum", "text": "no pathologic mediastinal lymphadenopathy"}, {"organ": "bones", "text": "no destructive osseous lesion"}], "post_treatment": [], "report_text": "FINDINGS:\nPulmonary parenchyma: No focal consolidation or suspicious pulmonary nodules. No pneumothorax.\nMediastinum: Cardiomediastinal contours within normal limits. small thymic remnant. no pathologic mediastinal lymphadenopathy.\nPleura/Pleural spaces: No pleural effusion or pleural thickening.\nGreat vessels/Aorta: No thoracic aortic aneurysm or dissection.\nLiver: No focal hepatic lesions. Normal attenuation. liver is normal.\nSpleen: Normal in size and attenuation. No focal splenic lesion.\nPancreas: Normal pancreatic contour and enhancement. No focal mass.\nAdrenal glands: Adrenal glands are normal without nodules.\nKidneys: No hydronephrosis. No enhancing renal mass.\nGI tract/Bowel: No obstructive process. No focal bowel wall mass identified.\nMesentery/Omentum: No ascites. No omental caking.\nMesenteric vessels (SMA/SMV): SMA/SMV are patent without thrombosis.\nUrinary bladder: Unremarkable. no focal bladder wall thickening.\nReproductive organs: 4.0 cm spiculated mass within the prostate gland, peripheral zone. No adnexal mass. Uterus/prostate within expected size for age.\nLymph nodes: No pathologically enlarged lymph nodes by size criteria.\nBones/Osseous structures: No aggressive osseous lesion. No acute fracture. no destructive osseous lesion.\n\nIMPRESSION:\n- Prostate primary malignancy at prostate gland, peripheral zone measuring approximately 40 mm.\n- No pathologically enlarged lymph nodes by size criteria.\n- No definite distant metastases identified.\n- RECIST 1.1 Summary:\n- Target lesions (n=1; ≤2 per organ rule applied).\n  • T1: Primary — 40 mm (longest diameter) at baseline.\n- SLD baseline: 40 mm.\n- New lesions: absent (unequivocal).\n- - RECIST 1.1 overall response category: Baseline (no category).\n"}
{"patient_id": "PID000023", "study_date": "2023-06-22", "timepoint": 1, "recist": {"baseline_sld_mm": 40, "current_sld_mm": 36, "nadir_sld_mm": 36, "overall_response": "SD"}, "lesions": [{"lesion_id": "primary:prostate", "kind": "primary", "organ": "prostate", "location": "prostate gland, peripheral zone", "rule": "longest", "baseline_mm": 40, "follow_mm": 36, "size_mm_current": 36, "margin": "spiculated", "enhancement": "hypoenhancing", "suspicious": true, "target": true}], "complexity_profile": {"level": 2, "level_name": "C2", "artifact": null}, "staging_relevance": -1.0, "incidentals": [{"organ": "liver", "text": "simple cyst"}], "negatives": [{"organ": "lung", "text": "no suspicious pulmonary nodule"}, {"organ": "aorta_great_vessels", "text": "no aneurysm or dissection"}, {"organ": "liver", "text": "liver is normal"}, {"organ": "adrenals", "text": "adrenal glands normal"}, {"organ": "gi", "text": "stomach is normal"}], "post_treatment": ["Radiation change: fat stranding"], "report_text": "FINDINGS:\nComparison: 2023-05-02.\nLungs: Clear lungs without focal mass. No suspicious nodules identified. no suspicious pulmonary nodule. Post-treatment change: fat stranding.\nMediastinum: Cardiomediastinal contours within normal limits.\nPleura/Pleural spaces: No pleural effusion or pleural thickening.\nGreat vessels/Aorta: No thoracic aortic aneurysm or dissection. no aneurysm or dissection.\nLiver: No focal hepatic lesions. Normal attenuation. simple cyst. liver is normal.\nSpleen: Normal in size and attenuation. No focal splenic lesion.\nPancreas: Normal pancreatic contour and enhancement. No focal mass.\nAdrenal glands: Adrenal glands are normal without nodules. adrenal glands normal.\nKidneys: No hydronephrosis. No enhancing renal mass.\nGI tract/Bowel: No obstructive process. No focal bowel wall mass identified. stomach is normal.\nMesentery/Omentum: No ascites. No omental caking.\nMesenteric vessels (SMA/SMV): SMA/SMV are patent without thrombosis.\nUrinary bladder: Unremarkable.\nReproductive organs: 36 mm spiculated mass within the prostate gland, peripheral zone. No adnexal mass. Uterus/prostate within expected size for age.\nLymph nodes: No pathologically enlarged lymph nodes by size criteria.\nBones/Osseous structures: No aggressive osseous lesion. No acute fracture.\n\nIMPRESSION:\n- Prostate primary neoplasm (indeterminate) at prostate gland, peripheral zone measuring approximately 36 mm.\n- No pathologically enlarged lymph nodes by size criteria.\n- No definite distant metastases identified.\n- RECIST 1.1 Summary:\n- Target lesions (n=1; ≤2 per organ rule applied).\n  • T1: Primary — 40→36 mm (longest diameter).\n- SLD baseline: 40 mm.\n- SLD current: 36 mm (-10.0% change).\n- New lesions: absent (unequivocal).\n- - RECIST 1.1 overall response category: SD.\n\nComment: Some features are diagnostic of; short-interval follow-up or problem-solving imaging may be considered.\n"}
{"patient_id": "PID000023", "study_date": "2023-08-21", "timepoint": 2, "recist": {"baseline_sld_mm": 40, "current_sld_mm": 54, "nadir_sld_mm": 36, "overall_response": "PD"}, "lesions": [{"lesion_id": "primary:prostate", "kind": "primary", "organ": "prostate", "location": "prostate gland, peripheral zone", "rule": "longest", "baseline_mm": 40, "follow_mm": 54, "size_mm_current": 54, "margin": "spiculated", "enhancement": "hypoenhancing", "suspicious": true, "target": true}], "complexity_profile": {"level": 2, "level_name": "C2", "artifact": null}, "staging_relevance": 23.0, "incidentals": [{"organ": "spleen", "text": "accessory spleen"}, {"organ": "pancreas", "text": "side-branch IPMN (no worrisome features)"}], "negatives": [{"organ": "reproductive", "text": "prostate is normal / no prostatic mass"}, {"organ": "pleura", "text": "no pleural effusion"}, {"organ": "spleen", "text": "spleen normal size"}, {"organ": "adrenals", "text": "adrenal glands normal"}, {"organ": "mesentery_peritoneum", "text": "no ascites"}], "post_treatment": [], "report_text": "FINDINGS:\nComparison: 2023-06-22.\nPulmonary parenchyma: Clear lungs without focal mass. No suspicious nodules identified.\nMediastinum: Cardiomediastinal contours within normal limits.\nPleura/Pleural spaces: No pleural effusion or pleural thickening.\nGreat vessels/Aorta: No thoracic aortic aneurysm or dissection.\nLiver: No focal hepatic lesions. Normal attenuation.\nSpleen: Normal in size and attenuation. No focal splenic lesion. accessory spleen. spleen normal size.\nPancreas: Normal pancreatic contour and enhancement. No focal mass. side-branch IPMN (no worrisome features).\nAdrenal glands: Adrenal glands are normal without nodules. adrenal glands normal.\nKidneys: No hydronephrosis. No enhancing renal mass.\nGI tract/Bowel: No obstructive process. No focal bowel wall mass identified.\nMesentery/Omentum: No ascites. No omental caking.\nMesenteric vessels (SMA/SMV): SMA/SMV are patent without thrombosis.\nUrinary bladder: Unremarkable.\nReproductive organs: 54 mm spiculated mass within the prostate gland, peripheral zone. No adnexal mass. Uterus/prostate within expected size for age. prostate is normal / no prostatic mass.\nLymph nodes: No pathologically enlarged lymph nodes by size criteria.\nBones/Osseous structures: No aggressive osseous lesion. No acute fracture.\n\nIMPRESSION:\n- Prostate primary malignancy at prostate gland, peripheral zone measuring approximately 54 mm.\n- No pathologically enlarged lymph nodes by size criteria.\n- No definite distant metastases identified.\n- RECIST 1.1 Summary:\n- Target lesions (n=1; ≤2 per organ rule applied).\n  • T1: Primary — 40→54 mm (longest diameter).\n- SLD baseline: 40 mm.\n- SLD current: 54 mm (+35.0% change).\n- New lesions: present (unequivocal).\n- - RECIST 1.1 overall response category: PD.\n"}
{"patient_id": "PID000023", "study_date": "2023-10-14", "timepoint": 3, "recist": {"baseline_sld_mm": 40, "current_sld_mm": 53, "nadir_sld_mm": 36, "overall_response": "PD"}, "lesions": [{"lesion_id": "primary:prostate", "kind": "primary", "organ": "prostate", "location": "prostate gland, peripheral zone", "rule": "longest", "baseline_mm": 40, "follow_mm": 53, "size_mm_current": 53, "margin": "spiculated", "enhancement": "hypoenhancing", "suspicious": true, "target": true}], "complexity_profile": {"level": 2, "level_name": "C2", "artifact": {"key": "motion_mild", "impact": 1, "report_phrase": "Respiratory motion artifact partially limits assessment.", "severity_rank": 2}}, "staging_relevance": 22.0, "incidentals": [{"organ": "lung", "text": "<6 mm well-circumscribed nodule"}], "negatives": [{"organ": "pancreas", "text": "pancreas is normal"}, {"organ": "aorta_great_vessels", "text": "aorta normal caliber"}, {"organ": "gi", "text": "stomach is normal"}, {"organ": "liver", "text": "liver is normal"}, {"organ": "spleen", "text": "spleen normal size"}], "post_treatment": [], "report_text": "FINDINGS:\nRespiratory motion artifact partially limits assessment.\nComparison: 2023-08-21.\nPulmonary parenchyma: Clear lungs without focal mass. No suspicious nodules identified.\nMediastinum: Cardiomediastinal contours within normal limits.\nPleura/Pleural spaces: No pleural effusion or pleural thickening.\nGreat vessels/Aorta: No thoracic aortic aneurysm or dissection. aorta normal caliber.\nLiver: No focal hepatic lesions. Normal attenuation. liver is normal.\nSpleen: Normal in size and attenuation. No focal splenic lesion. spleen normal size.\nPancreas: Normal pancreatic contour and enhancement. No focal mass. pancreas is normal.\nAdrenal glands: Adrenal glands are normal without nodules.\nKidneys: No hydronephrosis. No enhancing renal mass.\nGI tract/Bowel: No obstructive process. No focal bowel wall mass identified. stomach is normal.\nMesentery/Omentum: No ascites. No omental caking.\nMesenteric vessels (SMA/SMV): SMA/SMV are patent without thrombosis.\nUrinary bladder: Unremarkable.\nReproductive organs: 5.3 cm spiculated mass within the prostate gland, peripheral zone. No adnexal mass. Uterus/prostate within expected size for age.\nLymph nodes: No pathologically enlarged lymph nodes by size criteria.\nBones/Osseous structures: No aggressive osseous lesion. No acute fracture.\n\nIMPRESSION:\n- Prostate primary malignancy at prostate gland, peripheral zone measuring approximately 53 mm.\n- No pathologically enlarged lymph nodes by size criteria.\n- No definite distant metastases identified.\n- RECIST 1.1 Summary:\n- Target lesions (n=1; ≤2 per organ rule applied).\n  • T1: Primary — 40→53 mm (longest diameter).\n- SLD baseline: 40 mm.\n- SLD current: 53 mm (+32.5% change).\n- New lesions: present (unequivocal).\n- - RECIST 1.1 overall response category: PD.\n"}
{"patient_id": "PID000023", "study_date": "2023-12-20", "timepoint": 4, "recist": {"baseline_sld_mm": 40, "current_sld_mm": 53, "nadir_sld_mm": 36, "overall_response": "PD"}, "lesions": [{"lesion_id": "primary:prostate", "kind": "primary", "organ": "prostate", "location": "prostate gland, peripheral zone", "rule": "longest", "baseline_mm": 40, "follow_mm": 53, "size_mm_current": 53, "margin": "spiculated", "enhancement": "hypoenhancing", "suspicious": true, "target": true}], "complexity_profile": {"level": 2, "level_name": "C2", "artifact": null}, "staging_relevance": 23.0, "incidentals": [{"organ": "liver", "text": "simple cyst"}], "negatives": [{"organ": "bones", "text": "no destructive osseous lesion"}, {"organ": "reproductive", "text": "ovaries are normal / no adnexal abnormality"}, {"organ": "liver", "text": "no hepatic mass"}, {"organ": "mesentery_peritoneum", "text": "no ascites"}, {"organ": "adrenals", "text": "adrenal glands normal"}], "post_treatment": [], "report_text": "FINDINGS:\nComparison: 2023-10-14.\nLungs: Clear lungs without focal mass. No suspicious nodules identified.\nMediastinum: Cardiomediastinal contours within normal limits.\nPleura/Pleural spaces: No pleural effusion or pleural thickening.\nGreat vessels/Aorta: No thoracic aortic aneurysm or dissection.\nLiver: No focal hepatic lesions. Normal attenuation. simple cyst. no hepatic mass.\nSpleen: Normal in size and attenuation. No focal splenic lesion.\nPancreas: Normal pancreatic contour and enhancement. No focal mass.\nAdrenal glands: Adrenal glands are normal without nodules. adrenal glands normal.\nKidneys: No hydronephrosis. No enhancing renal mass.\nGI tract/Bowel: No obstructive process. No focal bowel wall mass identified.\nMesentery/Omentum: No ascites. No omental caking.\nMesenteric vessels (SMA/SMV): SMA/SMV are patent without thrombosis.\nUrinary bladder: Unremarkable.\nReproductive organs: 53 mm spiculated mass within the prostate gland, peripheral zone. No adnexal mass. Uterus/prostate within expected size for age. ovaries are normal / no adnexal abnormality.\nLymph nodes: No pathologically enlarged lymph nodes by size criteria.\nBones/Osseous structures: No aggressive osseous lesion. No acute fracture. no destructive osseous lesion.\n\nIMPRESSION:\n- Prostate primary malignancy at prostate gland, peripheral zone measuring approximately 53 mm.\n- No pathologically enlarged lymph nodes by size criteria.\n- No definite distant metastases identified.\n- RECIST 1.1 Summary:\n- Target lesions (n=1; ≤2 per organ rule applied).\n  • T1: Primary — 40→53 mm (longest diameter).\n- SLD baseline: 40 mm.\n- SLD current: 53 mm (+32.5% change).\n- New lesions: present (unequivocal).\n- - RECIST 1.1 overall response category: PD.\n"}
{"patient_id": "PID000024", "study_date": "2023-05-09", "timepoint": 0, "recist": {"baseline_sld_mm": 102, "current_sld_mm": null, "nadir_sld_mm": null, "overall_response": "Baseline (no category)"}, "lesions": [{"lesion_id": "primary:pancreas", "kind": "primary", "organ": "pancreas", "location": "tail of the pancreas", "rule": "longest", "baseline_mm": 79, "follow_mm": null, "size_mm_current": 79, "margin": "spiculated", "enhancement": "isoenhancing", "suspicious": true, "target": true}, {"lesion_id": "ln:paratracheal", "kind": "ln", "organ": "lymph", "station": "paratracheal", "rule": "short_axis", "baseline_mm": null, "follow_mm": null, "size_mm_current": 12, "necrosis": false, "suspicious": true, "target": false}, {"lesion_id": "ln:celiac", "kind": "ln", "organ": "lymph", "station": "celiac", "rule": "short_axis", "baseline_mm": 23, "follow_mm": null, "size_mm_current": 23, "necrosis": false, "suspicious": true, "target": true}], "complexity_profile": {"level": 2, "level_name": "C2", "artifact": null}, "staging_relevance": -1.0, "incidentals": [{"organ": "kidneys", "text": "Bosniak I cyst"}], "negatives": [{"organ": "mesentery_peritoneum", "text": "no ascites"}, {"organ": "adrenals", "text": "adrenal glands normal"}, {"organ": "pleura", "text": "no pleural effusion"}, {"organ": "kidneys", "text": "kidneys are normal"}, {"organ": "reproductive", "text": "ovaries are normal / no adnexal abnormality"}], "post_treatment": [], "report_text": "FINDINGS:\nPulmonary parenchyma: Clear lungs without focal mass. No suspicious nodules identified.\nMediastinum: Enlarged paratracheal lymph node, short axis 1.2 cm. Cardiomediastinal contours within normal limits.\nPleura/Pleural spaces: No pleural effusion or pleural thickening.\nGreat vessels/Aorta: No thoracic aortic aneurysm or dissection.\nLiver: No focal hepatic lesions. Normal attenuation.\nSpleen: Normal in size and attenuation. No focal splenic lesion.\nPancreas: 79 mm spiculated pancreatic mass in the tail of the pancreas (isoenhancing). Normal pancreatic contour and enhancement. No focal mass.\nAdrenal glands: Adrenal glands are normal without nodules. adrenal glands normal.\nKidneys: No hydronephrosis. No enhancing renal mass. Bosniak I cyst. kidneys are normal.\nGI tract/Bowel: No obstructive process. No focal bowel wall mass identified.\nMesentery/Omentum: No ascites. No omental caking.\nMesenteric vessels (SMA/SMV): SMA/SMV are patent without thrombosis.\nUrinary bladder: Unremarkable.\nReproductive organs: No adnexal mass. Uterus/prostate within expected size for age. ovaries are normal / no adnexal abnormality.\nLymph nodes: Enlarged celiac lymph node, short axis 23 mm. No pathologically enlarged lymph nodes by size criteria.\nBones/Osseous structures: No aggressive osseous lesion. No acute fracture.\n\nIMPRESSION:\n- Pancreas primary neoplasm (indeterminate) at tail of the pancreas measuring approximately 79 mm.\n- Findings concerning for nodal involvement.\n- No definite distant metastases identified.\n- RECIST 1.1 Summary:\n- Target lesions (n=2; ≤2 per organ rule applied).\n  • T1: Primary — 79 mm (longest diameter) at baseline.\n  • T2: Lymph node — 23 mm (short axis) at baseline.\n- SLD baseline: 102 mm.\n- New lesions: absent (unequivocal).\n- - RECIST 1.1 overall response category: Baseline (no category).\n\nComment: Some features are diagnostic of; short-interval follow-up or problem-solving imaging may be considered.\n"}
{"patient_id": "PID000024", "study_date": "2023-07-09", "timepoint": 1, "recist": {"baseline_sld_mm": 102, "current_sld_mm": 62, "nadir_sld_mm": 62, "overall_response": "PR"}, "lesions": [{"lesion_id": "primary:pancreas", "kind": "primary", "organ": "pancreas", "location": "tail of the pancreas", "rule": "longest", "baseline_mm": 79, "follow_mm": 48, "size_mm_current": 48, "margin": "spiculated", "enhancement": "isoenhancing", "suspicious": true, "target": true}, {"lesion_id": "ln:paratracheal", "kind": "ln", "organ": "lymph", "station": "paratracheal", "rule": "short_axis", "baseline_mm": null, "follow_mm": null, "size_mm_current": 12, "necrosis": false, "suspicious": true, "target": false}, {"lesion_id": "ln:celiac", "kind": "ln", "organ": "lymph", "station": "celiac", "rule": "short_axis", "baseline_mm": 23, "follow_mm": 14, "size_mm_current": 14, "necrosis": false, "suspicious": true, "target": true}], "complexity_profile": {"level": 2, "level_name": "C2", "artifact": null}, "staging_relevance": 0.0, "incidentals": [{"organ": "reproductive.ovary", "text": "simple physiologic cyst"}, {"organ": "bones", "text": "degenerative changes"}, {"organ": "pancreas", "text": "side-branch IPMN (no worrisome features)"}], "negatives": [{"organ": "bladder", "text": "no focal bladder wall thickening"}, {"organ": "gi", "text": "no colonic mass"}, {"organ": "lung", "text": "no pulmonary abnormality"}, {"organ": "spleen", "text": "spleen normal size"}, {"organ": "mesentery_peritoneum", "text": "no ascites"}], "post_treatment": [], "report_text": "FINDINGS:\nComparison: 2023-05-09.\nLungs: Clear lungs without focal mass. No suspicious nodules identified. no pulmonary abnormality.\nMediastinum: Enlarged paratracheal lymph node, short axis 12 mm. Cardiomediastinal contours within normal limits.\nPleura/Pleural spaces: No pleural effusion or pleural thickening.\nGreat vessels/Aorta: No thoracic aortic aneurysm or dissection.\nLiver: No focal hepatic lesions. Normal attenuation.\nSpleen: Normal in size and attenuation. No focal splenic lesion. spleen normal size.\nPancreas: 4.8 cm spiculated pancreatic mass in the tail of the pancreas (isoenhancing). Normal pancreatic contour and enhancement. No focal mass. side-branch IPMN (no worrisome features).\nAdrenal glands: Adrenal glands are normal without nodules.\nKidneys: No hydronephrosis. No enhancing renal mass.\nGI tract/Bowel: No obstructive process. No focal bowel wall mass identified. no colonic mass.\nMesentery/Omentum: No ascites. No omental caking.\nMesenteric vessels (SMA/SMV): SMA/SMV are patent without thrombosis.\nUrinary bladder: Unremarkable. no focal bladder wall thickening.\nReproductive organs: No adnexal mass. Uterus/prostate within expected size for age. simple physiologic cyst.\nLymph nodes: Enlarged celiac lymph node, short axis 14 mm. No pathologically enlarged lymph nodes by size criteria.\nBones/Osseous structures: No aggressive osseous lesion. No acute fracture. degenerative changes.\n\nIMPRESSION:\n- Pancreas primary malignancy at tail of the pancreas measuring approximately 48 mm.\n- Findings concerning for nodal involvement.\n- No definite distant metastases identified.\n- RECIST 1.1 Summary:\n- Target lesions (n=2; ≤2 per organ rule applied).\n  • T1: Primary — 79→48 mm (longest diameter).\n  • T2: Lymph node — 23→14 mm (short axis).\n- SLD baseline: 102 mm.\n- SLD current: 62 mm (-39.2% change).\n- New lesions: absent (unequivocal).\n- - RECIST 1.1 overall response category: PR.\n"}
{"patient_id": "PID000024", "study_date": "2023-09-15", "timepoint": 2, "recist": {"baseline_sld_mm": 102, "current_sld_mm": 101, "nadir_sld_mm": 62, "overall_response": "PD"}, "lesions": [{"lesion_id": "primary:pancreas", "kind": "primary", "organ": "pancreas", "location": "tail of the pancreas", "rule": "longest", "baseline_mm": 79, "follow_mm": 78, "size_mm_current": 78, "margin": "spiculated", "enhancement": "isoenhancing", "suspicious": true, "target": true}, {"lesion_id": "ln:paratracheal", "kind": "ln", "organ": "lymph", "station": "paratracheal", "rule": "short_axis", "baseline_mm": null, "follow_mm": null, "size_mm_current": 12, "necrosis": false, "suspicious": true, "target": false}, {"lesion_id": "ln:celiac", "kind": "ln", "organ": "lymph", "station": "celiac", "rule": "short_axis", "baseline_mm": 23, "follow_mm": 23, "size_mm_current": 23, "necrosis": false, "suspicious": true, "target": true}], "complexity_profile": {"level": 2, "level_name": "C2", "artifact": {"key": "partial_volume", "impact": 1, "report_phrase": "Partial volume averaging may obscure small foci.", "severity_rank": 1}}, "staging_relevance": 18.0, "incidentals": [{"organ": "spleen", "text": "tiny cyst"}, {"organ": "pleura", "text": "pleural calcifications"}, {"organ": "reproductive.prostate", "text": "BPH"}], "negatives": [{"organ": "kidneys", "text": "no renal mass"}, {"organ": "gi", "text": "no colonic mass"}, {"organ": "reproductive", "text": "prostate is normal / no prostatic mass"}, {"organ": "bones", "text": "no destructive osseous lesion"}, {"organ": "mediastinum", "text": "no pathologic mediastinal lymphadenopathy"}], "post_treatment": [], "report_text": "FINDINGS:\nPartial volume averaging may obscure small foci.\nComparison: 2023-07-09.\nPulmonary parenchyma: No focal consolidation or suspicious pulmonary nodules. No pneumothorax.\nMediastinum: Enlarged paratracheal lymph node, short axis 12 mm. Cardiomediastinal contours within normal limits. no pathologic mediastinal lymphadenopathy.\nPleura/Pleural spaces: No pleural effusion or pleural thickening. pleural calcifications.\nGreat vessels/Aorta: No thoracic aortic aneurysm or dissection.\nLiver: No focal hepatic lesions. Normal attenuation.\nSpleen: Normal in size and attenuation. No focal splenic lesion. tiny cyst.\nPancreas: 7.8 cm spiculated pancreatic mass in the tail of the pancreas (isoenhancing). Normal pancreatic contour and enhancement. No focal mass.\nAdrenal glands: Adrenal glands are normal without nodules.\nKidneys: No hydronephrosis. No enhancing renal mass. no renal mass.\nGI tract/Bowel: No obstructive process. No focal bowel wall mass identified. no colonic mass.\nMesentery/Omentum: No ascites. No omental caking.\nMesenteric vessels (SMA/SMV): SMA/SMV are patent without thrombosis.\nUrinary bladder: Unremarkable.\nReproductive organs: No adnexal mass. Uterus/prostate within expected size for age. BPH. prostate is normal / no prostatic mass.\nLymph nodes: Enlarged celiac lymph node, short axis 23 mm. No pathologically enlarged lymph nodes by size criteria.\nBones/Osseous structures: No aggressive osseous lesion. No acute fracture. no destructive osseous lesion.\n\nIMPRESSION:\n- Pancreas primary malignancy at tail of the pancreas measuring approximately 78 mm.\n- Findings concerning for nodal involvement.\n- No definite distant metastases identified.\n- RECIST 1.1 Summary:\n- Target lesions (n=2; ≤2 per organ rule applied).\n  • T1: Primary — 79→78 mm (longest diameter).\n  • T2: Lymph node — 23→23 mm (short axis).\n- SLD baseline: 102 mm.\n- SLD current: 101 mm (-1.0% change).\n- New lesions: absent (unequivocal).\n- - RECIST 1.1 overall response category: PD.\n"}
{"patient_id": "PID000024", "study_date": "2023-11-20", "timepoint": 3, "recist": {"baseline_sld_mm": 102, "current_sld_mm": 127, "nadir_sld_mm": 62, "overall_response": "PD"}, "lesions": [{"lesion_id": "primary:pancreas", "kind": "primary", "organ": "pancreas", "location": "tail of the pancreas", "rule": "longest", "baseline_mm": 79, "follow_mm": 100, "size_mm_current": 100, "margin": "spiculated", "enhancement": "isoenhancing", "suspicious": true, "target": true}, {"lesion_id": "ln:paratracheal", "kind": "ln", "organ": "lymph", "station": "paratracheal", "rule": "short_axis", "baseline_mm": null, "follow_mm": null, "size_mm_current": 12, "necrosis": false, "suspicious": true, "target": false}, {"lesion_id": "ln:celiac", "kind": "ln", "organ": "lymph", "station": "celiac", "rule": "short_axis", "baseline_mm": 23, "follow_mm": 27, "size_mm_current": 27, "necrosis": false, "suspicious": true, "target": true}], "complexity_profile": {"level": 2, "level_name": "C2", "artifact": null}, "staging_relevance": 29.0, "incidentals": [{"organ": "bones", "text": "degenerative changes"}, {"organ": "gi.colon", "text": "diverticulosis"}], "negatives": [{"organ": "bones", "text": "no destructive osseous lesion"}, {"organ": "gi", "text": "no bowel obstruction"}, {"organ": "mesentery_peritoneum", "text": "no peritoneal nodularity"}, {"organ": "bladder", "text": "no focal bladder wall thickening"}, {"organ": "adrenals", "text": "no adrenal nodule"}], "post_treatment": ["Radiation change: ground-glass opacities within field"], "report_text": "FINDINGS:\nComparison: 2023-09-15.\nLungs: No focal consolidation or suspicious pulmonary nodules. No pneumothorax. Post-treatment change: ground-glass opacities within field.\nMediastinum: Enlarged paratracheal lymph node, short axis 12 mm. Cardiomediastinal contours within normal limits.\nPleura/Pleural spaces: No pleural effusion or pleural thickening.\nGreat vessels/Aorta: No thoracic aortic aneurysm or dissection.\nLiver: No focal hepatic lesions. Normal attenuation.\nSpleen: Normal in size and attenuation. No focal splenic lesion.\nPancreas: 100 mm spiculated pancreatic mass in the tail of the pancreas (isoenhancing). Normal pancreatic contour and enhancement. No focal mass.\nAdrenal glands: Adrenal glands are normal without nodules. no adrenal nodule.\nKidneys: No hydronephrosis. No enhancing renal mass.\nGI tract/Bowel: No obstructive process. No focal bowel wall mass identified. diverticulosis. no bowel obstruction.\nMesentery/Omentum: No ascites. No omental caking. no peritoneal nodularity.\nMesenteric vessels (SMA/SMV): SMA/SMV are patent without thrombosis.\nUrinary bladder: Unremarkable. no focal bladder wall thickening.\nReproductive organs: No adnexal mass. Uterus/prostate within expected size for age.\nLymph nodes: Enlarged celiac lymph node, short axis 27 mm. No pathologically enlarged lymph nodes by size criteria.\nBones/Osseous structures: No aggressive osseous lesion. No acute fracture. degenerative changes. no destructive osseous lesion.\n\nIMPRESSION:\n- Pancreas primary malignancy at tail of the pancreas measuring approximately 100 mm.\n- Findings concerning for nodal involvement.\n- No definite distant metastases identified.\n- RECIST 1.1 Summary:\n- Target lesions (n=2; ≤2 per organ rule applied).\n  • T1: Primary — 79→100 mm (longest diameter).\n  • T2: Lymph node — 23→27 mm (short axis).\n- SLD baseline: 102 mm.\n- SLD current: 127 mm (+24.5% change).\n- New lesions: present (unequivocal).\n- - RECIST 1.1 overall response category: PD.\n"}
{"patient_id": "PID000024", "study_date": "2024-01-09", "timepoint": 4, "recist": {"baseline_sld_mm": 102, "current_sld_mm": 139, "nadir_sld_mm": 62, "overall_response": "PD"}, "lesions": [{"lesion_id": "primary:pancreas", "kind": "primary", "organ": "pancreas", "location": "tail of the pancreas", "rule": "longest", "baseline_mm": 79, "follow_mm": 107, "size_mm_current": 107, "margin": "spiculated", "enhancement": "isoenhancing", "suspicious": true, "target": true}, {"lesion_id": "ln:paratracheal", "kind": "ln", "organ": "lymph", "station": "paratracheal", "rule": "short_axis", "baseline_mm": null, "follow_mm": null, "size_mm_current": 12, "necrosis": false, "suspicious": true, "target": false}, {"lesion_id": "ln:celiac", "kind": "ln", "organ": "lymph", "station": "celiac", "rule": "short_axis", "baseline_mm": 23, "follow_mm": 32, "size_mm_current": 32, "necrosis": false, "suspicious": true, "target": true}], "complexity_profile": {"level": 2, "level_name": "C2", "artifact": null}, "staging_relevance": 19.0, "incidentals": [{"organ": "lung", "text": "subpleural reticulation"}, {"organ": "pancreas", "text": "side-branch IPMN (no worrisome features)"}], "negatives": [{"organ": "gi", "text": "no bowel obstruction"}, {"organ": "pancreas", "text": "no pancreatic mass"}, {"organ": "adrenals", "text": "no adrenal nodule"}, {"organ": "mediastinum", "text": "no pathologic mediastinal lymphadenopathy"}, {"organ": "mesentery_peritoneum", "text": "no ascites"}], "post_treatment": [], "report_text": "FINDINGS:\nComparison: 2023-11-20.\nLungs: Clear lungs without focal mass. No suspicious nodules identified. subpleural reticulation.\nMediastinum: Enlarged paratracheal lymph node, short axis 1.2 cm. Cardiomediastinal contours within normal limits. no pathologic mediastinal lymphadenopathy.\nPleura/Pleural spaces: No pleural effusion or pleural thickening.\nGreat vessels/Aorta: No thoracic aortic aneurysm or dissection.\nLiver: No focal hepatic lesions. Normal attenuation.\nSpleen: Normal in size and attenuation. No focal splenic lesion.\nPancreas: 107 mm spiculated pancreatic mass in the tail of the pancreas (isoenhancing). Normal pancreatic contour and enhancement. No focal mass. side-branch IPMN (no worrisome features). no pancreatic mass.\nAdrenal glands: Adrenal glands are normal without nodules. no adrenal nodule.\nKidneys: No hydronephrosis. No enhancing renal mass.\nGI tract/Bowel: No obstructive process. No focal bowel wall mass identified. no bowel obstruction.\nMesentery/Omentum: No ascites. No omental caking.\nMesenteric vessels (SMA/SMV): SMA/SMV are patent without thrombosis.\nUrinary bladder: Unremarkable.\nReproductive organs: No adnexal mass. Uterus/prostate within expected size for age.\nLymph nodes: Enlarged celiac lymph node, short axis 3.2 cm. No pathologically enlarged lymph nodes by size criteria.\nBones/Osseous structures: No aggressive osseous lesion. No acute fracture.\n\nIMPRESSION:\n- Pancreas primary malignancy at tail of the pancreas measuring approximately 107 mm.\n- Findings concerning for nodal involvement.\n- No definite distant metastases identified.\n- RECIST 1.1 Summary:\n- Target lesions (n=2; ≤2 per organ rule applied).\n  • T1: Primary — 79→107 mm (longest diameter).\n  • T2: Lymph node — 23→32 mm (short axis).\n- SLD baseline: 102 mm.\n- SLD current: 139 mm (+36.3% change).\n- New lesions: absent (unequivocal).\n- - RECIST 1.1 overall response category: PD.\n"}
{"patient_id": "PID000024", "study_date": "2024-03-07", "timepoint": 5, "recist": {"baseline_sld_mm": 102, "current_sld_mm": 138, "nadir_sld_mm": 62, "overall_response": "PD"}, "lesions": [{"lesion_id": "primary:pancreas", "kind": "primary", "organ": "pancreas", "location": "tail of the pancreas", "rule": "longest", "baseline_mm": 79, "follow_mm": 109, "size_mm_current": 109, "margin": "spiculated", "enhancement": "isoenhancing", "suspicious": true, "target": true}, {"lesion_id": "ln:paratracheal", "kind": "ln", "organ": "lymph", "station": "paratracheal", "rule": "short_axis", "baseline_mm": null, "follow_mm": null, "size_mm_current": 12, "necrosis": false, "suspicious": true, "target": false}, {"lesion_id": "ln:celiac", "kind": "ln", "organ": "lymph", "station": "celiac", "rule": "short_axis", "baseline_mm": 23, "follow_mm": 29, "size_mm_current": 29, "necrosis": false, "suspicious": true, "target": true}], "complexity_profile": {"level": 2, "level_name": "C2", "artifact": null}, "staging_relevance": 29.0, "incidentals": [{"organ": "reproductive.prostate", "text": "BPH"}], "negatives": [{"organ": "liver", "text": "no hepatic mass"}, {"organ": "spleen", "text": "spleen normal size"}, {"organ": "reproductive", "text": "ovaries are normal / no adnexal abnormality"}, {"organ": "lung", "text": "lungs are normal"}, {"organ": "kidneys", "text": "no renal mass"}], "post_treatment": [], "report_text": "FINDINGS:\nComparison: 2024-01-09.\nLungs: No focal consolidation or suspicious pulmonary nodules. No pneumothorax. lungs are normal.\nMediastinum: Enlarged paratracheal lymph node, short axis 12 mm. Cardiomediastinal contours within normal limits.\nPleura/Pleural spaces: No pleural effusion or pleural thickening.\nGreat vessels/Aorta: No thoracic aortic aneurysm or dissection.\nLiver: No focal hepatic lesions. Normal attenuation. no hepatic mass.\nSpleen: Normal in size and attenuation. No focal splenic lesion. spleen normal size.\nPancreas: 10.9 cm spiculated pancreatic mass in the tail of the pancreas (isoenhancing). Normal pancreatic contour and enhancement. No focal mass.\nAdrenal glands: Adrenal glands are normal without nodules.\nKidneys: No hydronephrosis. No enhancing renal mass. no renal mass.\nGI tract/Bowel: No obstructive process. No focal bowel wall mass identified.\nMesentery/Omentum: No ascites. No omental caking.\nMesenteric vessels (SMA/SMV): SMA/SMV are patent without thrombosis.\nUrinary bladder: Unremarkable.\nReproductive organs: No adnexal mass. Uterus/prostate within expected size for age. BPH. ovaries are normal / no adnexal abnormality.\nLymph nodes: Enlarged celiac lymph node, short axis 29 mm. No pathologically enlarged lymph nodes by size criteria.\nBones/Osseous structures: No aggressive osseous lesion. No acute fracture.\n\nIMPRESSION:\n- Pancreas primary malignancy at tail of the pancreas measuring approximately 109 mm.\n- Findings concerning for nodal involvement.\n- No definite distant metastases identified.\n- RECIST 1.1 Summary:\n- Target lesions (n=2; ≤2 per organ rule applied).\n  • T1: Primary — 79→109 mm (longest diameter).\n  • T2: Lymph node — 23→29 mm (short axis).\n- SLD baseline: 102 mm.\n- SLD current: 138 mm (+35.3% change).\n- New lesions: present (unequivocal).\n- - RECIST 1.1 overall response category: PD.\n"}
